edid-decode (hex):

00 ff ff ff ff ff ff 00 59 3a 27 00 01 01 01 01
2a 11 01 03 80 46 27 78 0a 33 3b a0 57 4a 9c 25
0f 47 4a af ce 00 01 01 01 01 01 01 01 01 01 01
01 01 01 01 01 c1 fa 1c 00 72 51 d0 1e 20 6e 28
55 00 bc 86 21 00 00 1a 00 00 00 fd 00 32 4d 1f
46 0e 00 0a 20 20 20 20 20 20 00 00 00 ff 00 53
50 42 46 43 48 34 32 31 34 32 35 36 00 00 00 fc
00 56 57 33 32 4c 20 48 44 54 56 32 30 41 01 c4

02 03 1b 71 48 84 01 03 13 05 12 15 14 23 09 07
02 83 01 00 00 65 03 0c 00 20 00 01 1d 00 bc 52
d0 1e 20 b8 28 55 40 bc 86 21 00 00 1e 01 1d 80
d0 72 1c 16 20 10 2c 25 80 bc 86 21 00 00 9e 8c
0a d0 8a 20 e0 2d 10 10 3e 96 00 bc 86 21 00 00
18 01 1d 80 18 71 1c 16 20 58 2c 25 00 bc 86 21
00 00 9e 8c 0a d0 90 20 40 31 20 0c 40 55 00 bc
86 21 00 00 18 00 00 00 00 00 00 00 00 00 00 49

00 ff ff ff ff ff ff 00 59 3a 27 00 01 01 01 01
2a 11 01 03 80 46 27 78 0a 33 3b a0 57 4a 9c 25
0f 47 4a af ce 00 01 01 01 01 01 01 01 01 01 01
01 01 01 01 01 c1 fa 1c 00 72 51 d0 1e 20 6e 28
55 00 bc 86 21 00 00 1a 00 00 00 fd 00 32 4d 1f
46 0e 00 0a 20 20 20 20 20 20 00 00 00 ff 00 53
50 42 46 43 48 34 32 31 34 32 35 36 00 00 00 fc
00 56 57 33 32 4c 20 48 44 54 56 32 30 41 01 c4

02 03 1b 71 48 84 01 03 13 05 12 15 14 23 09 07
02 83 01 00 00 65 03 0c 00 20 00 01 1d 00 bc 52
d0 1e 20 b8 28 55 40 bc 86 21 00 00 1e 01 1d 80
d0 72 1c 16 20 10 2c 25 80 bc 86 21 00 00 9e 8c
0a d0 8a 20 e0 2d 10 10 3e 96 00 bc 86 21 00 00
18 01 1d 80 18 71 1c 16 20 58 2c 25 00 bc 86 21
00 00 9e 8c 0a d0 90 20 40 31 20 0c 40 55 00 bc
86 21 00 00 18 00 00 00 00 00 00 00 00 00 00 49

----------------

Block 0, Base EDID:
  EDID Structure Version & Revision: 1.3
  Vendor & Product Identification:
    Manufacturer: VIZ
    Model: 39
    Serial Number: ...
    Made in: week 42 of 2007
  Basic Display Parameters & Features:
    Digital display
    Maximum image size: 70 cm x 39 cm
    Gamma: 2.20
    RGB color display
    First detailed timing is the preferred timing
  Color Characteristics:
    Red  : 0.6250, 0.3427
    Green: 0.2890, 0.6123
    Blue : 0.1445, 0.0615
    White: 0.2792, 0.2919
  Established Timings I & II:
    IBM     :   720x400    70.081663 Hz   9:5     31.467 kHz     28.320000 MHz
    DMT 0x04:   640x480    59.940476 Hz   4:3     31.469 kHz     25.175000 MHz
    DMT 0x05:   640x480    72.808802 Hz   4:3     37.861 kHz     31.500000 MHz
    DMT 0x06:   640x480    75.000000 Hz   4:3     37.500 kHz     31.500000 MHz
    DMT 0x08:   800x600    56.250000 Hz   4:3     35.156 kHz     36.000000 MHz
    DMT 0x09:   800x600    60.316541 Hz   4:3     37.879 kHz     40.000000 MHz
    DMT 0x0a:   800x600    72.187572 Hz   4:3     48.077 kHz     50.000000 MHz
    DMT 0x0b:   800x600    75.000000 Hz   4:3     46.875 kHz     49.500000 MHz
    DMT 0x10:  1024x768    60.003840 Hz   4:3     48.363 kHz     65.000000 MHz
    DMT 0x11:  1024x768    70.069359 Hz   4:3     56.476 kHz     75.000000 MHz
    DMT 0x12:  1024x768    75.028582 Hz   4:3     60.023 kHz     78.750000 MHz
  Standard Timings:
  Detailed Timing Descriptors:
    DTD 1:  1280x720    59.943434 Hz  16:9     44.958 kHz     74.180000 MHz (700 mm x 390 mm)
                 Hfront  110 Hsync  40 Hback  220 Hpol P
                 Vfront    5 Vsync   5 Vback   20 Vpol N
    Display Range Limits:
      Monitor ranges (GTF): 50-77 Hz V, 31-70 kHz H, max dotclock 140 MHz
    Display Product Serial Number: ...
    Display Product Name: 'VW32L HDTV20A'
  Extension blocks: 1
Checksum: 0xc4

----------------

Block 1, CTA-861 Extension Block:
  Revision: 3
  Basic audio support
  Supports YCbCr 4:4:4
  Supports YCbCr 4:2:2
  Native DTDs: 1
  Video Data Block:
    VIC   4:  1280x720    60.000000 Hz  16:9     45.000 kHz     74.250000 MHz (native)
    VIC   1:   640x480    59.940476 Hz   4:3     31.469 kHz     25.175000 MHz
    VIC   3:   720x480    59.940060 Hz  16:9     31.469 kHz     27.000000 MHz
    VIC  19:  1280x720    50.000000 Hz  16:9     37.500 kHz     74.250000 MHz
    VIC   5:  1920x1080i  60.000000 Hz  16:9     33.750 kHz     74.250000 MHz
    VIC  18:   720x576    50.000000 Hz  16:9     31.250 kHz     27.000000 MHz
    VIC  21:  1440x576i   50.000000 Hz   4:3     15.625 kHz     27.000000 MHz
    VIC  20:  1920x1080i  50.000000 Hz  16:9     28.125 kHz     74.250000 MHz
  Audio Data Block:
    Linear PCM:
      Max channels: 2
      Supported sample rates (kHz): 48 44.1 32
      Supported sample sizes (bits): 20
  Speaker Allocation Data Block:
    FL/FR - Front Left/Right
  Vendor-Specific Data Block (HDMI), OUI 00-0C-03:
    Source physical address: 2.0.0.0
  Detailed Timing Descriptors:
    DTD 2:  1280x720    50.000000 Hz  16:9     37.500 kHz     74.250000 MHz (700 mm x 390 mm)
                 Hfront  440 Hsync  40 Hback  220 Hpol P
                 Vfront    5 Vsync   5 Vback   20 Vpol P
    DTD 3:  1920x1080i  50.000000 Hz  16:9     28.125 kHz     74.250000 MHz (700 mm x 390 mm)
                 Hfront  528 Hsync  44 Hback  148 Hpol P
                 Vfront    2 Vsync   5 Vback   15 Vpol P Vfront +0.5 Odd Field
                 Vfront    2 Vsync   5 Vback   15 Vpol P Vback  +0.5 Even Field
    DTD 4:   720x480    59.940060 Hz   3:2     31.469 kHz     27.000000 MHz (700 mm x 390 mm)
                 Hfront   16 Hsync  62 Hback   60 Hpol N
                 Vfront    9 Vsync   6 Vback   30 Vpol N
    DTD 5:  1920x1080i  60.000000 Hz  16:9     33.750 kHz     74.250000 MHz (700 mm x 390 mm)
                 Hfront   88 Hsync  44 Hback  148 Hpol P
                 Vfront    2 Vsync   5 Vback   15 Vpol P Vfront +0.5 Odd Field
                 Vfront    2 Vsync   5 Vback   15 Vpol P Vback  +0.5 Even Field
    DTD 6:   720x576    50.000000 Hz   5:4     31.250 kHz     27.000000 MHz (700 mm x 390 mm)
                 Hfront   12 Hsync  64 Hback   68 Hpol N
                 Vfront    5 Vsync   5 Vback   39 Vpol N
Checksum: 0x49  Unused space in Extension Block: 10 bytes

----------------

Warnings:

Block 0, Base EDID:
  Vendor & Product Identification: The serial number is one of the known dummy values, it should probably be set to 0.
Block 1, CTA-861 Extension Block:
  IT Video Formats are overscanned by default, but normally this should be underscanned.
  Video Data Block: VIC 4 and the first DTD are not identical. Is this intended?
  Detailed Timing Descriptor #4: Image size is 700x390 mm, but based on the picture AR it should be 585x390 mm.
  Detailed Timing Descriptor #6: Image size is 700x390 mm, but based on the picture AR it should be 487x390 mm.
  Display Product Serial Number is set, so the Serial Number in the Base EDID should be 0.
  Add a Colorimetry Data Block with the sRGB colorimetry bit set to avoid interop issues.
EDID:
  Base EDID: Some timings are out of range of the Monitor Ranges:
    Horizontal Freq: 15.625 - 60.022 kHz (Monitor: 31.000 - 70.000 kHz)

Failures:

Block 0, Base EDID:
  Standard Timings: Use 0x0101 as the invalid Standard Timings code, not 0x01c1.
Block 1, CTA-861 Extension Block:
  Missing VCDB, needed for Set Selectable RGB Quantization to avoid interop issues.
EDID:
  Extension Block 2 started with EDID header, ignoring Extension Blocks >= 2.

EDID conformity: FAIL
