edid-decode (hex):

00 ff ff ff ff ff ff 00 51 b8 60 15 00 00 00 00
19 1f 01 04 a5 22 15 78 07 ee 96 a3 54 4c 99 26
0f 4e 51 00 00 00 01 01 01 01 01 01 01 01 01 01
01 01 01 01 01 01 b4 f5 80 a0 c0 d0 50 70 30 20
75 04 50 d2 10 00 00 1e cd a3 80 a0 c0 d0 50 70
30 20 75 04 50 d2 10 00 00 1e 00 00 00 fd 00 30
5a bc bc 3f 01 0a 20 20 20 20 20 20 00 00 00 fc
00 54 4c 31 35 36 4d 44 4d 50 30 31 2d 31 00 53

----------------

Block 0, Base EDID:
  EDID Structure Version & Revision: 1.4
  Vendor & Product Identification:
    Manufacturer: TMX
    Model: 5472
    Made in: week 25 of 2021
  Basic Display Parameters & Features:
    Digital display
    Bits per primary color channel: 8
    DisplayPort interface
    Maximum image size: 34 cm x 21 cm
    Gamma: 2.20
    Supported color formats: RGB 4:4:4
    Default (sRGB) color space is primary color space
    First detailed timing includes the native pixel format and preferred refresh rate
    Display supports continuous frequencies
  Color Characteristics:
    Red  : 0.6396, 0.3300
    Green: 0.2998, 0.5996
    Blue : 0.1503, 0.0595
    White: 0.3056, 0.3183
  Established Timings I & II: none
  Standard Timings: none
  Detailed Timing Descriptors:
    DTD 1:  3200x2000   90.001145 Hz  16:10   187.202 kHz    629.000000 MHz (336 mm x 210 mm)
                 Hfront   48 Hsync  32 Hback   80 Hpol P
                 Vfront   23 Vsync   5 Vback   52 Vpol P
    DTD 2:  3200x2000   60.000286 Hz  16:10   124.801 kHz    419.330000 MHz (336 mm x 210 mm)
                 Hfront   48 Hsync  32 Hback   80 Hpol P
                 Vfront   23 Vsync   5 Vback   52 Vpol P
    Display Range Limits:
      Monitor ranges (Range Limits Only): 48-90 Hz V, 188-188 kHz H, max dotclock 630 MHz
    Display Product Name: 'TL156MDMP01-1'
Checksum: 0x53

----------------

Warnings:

EDID:
  Base EDID: Some timings are out of range of the Monitor Ranges:
    Horizontal Freq: 124.800 - 187.202 kHz (Monitor: 188.000 - 188.000 kHz)

Failures:

Block 0, Base EDID:
  Basic Display Parameters & Features: sRGB is signaled, but the chromaticities do not match.

EDID conformity: FAIL
