edid-decode (hex):

00 ff ff ff ff ff ff 00 04 72 c8 0b de 04 80 43
26 22 01 03 80 45 27 78 2a 90 73 ad 50 46 aa 27
0f 50 53 bf ef 80 71 4f 81 40 81 80 81 c0 61 7c
95 00 b3 00 d1 c0 4d d0 00 a0 f0 70 3e 80 30 20
35 00 b9 88 21 00 00 1a 00 00 00 ff 00 31 34 33
38 30 30 34 44 45 33 47 30 30 00 00 00 fd 08 30
a5 1e 77 95 00 0a 20 20 20 20 20 20 00 00 00 fc
00 58 5a 33 32 30 51 4b 20 50 33 0a 20 20 01 91

02 03 58 f1 e2 78 02 4d 01 02 03 04 90 11 13 1f
3f 61 5f 5d 76 23 09 07 07 83 01 00 00 e2 00 d5
6c 03 0c 00 10 00 38 44 20 00 40 01 03 6d d8 5d
c4 01 78 88 63 12 30 a5 83 65 1d 6d 1a 00 00 02
01 30 a5 00 00 00 00 00 00 e3 05 c3 01 e3 0f 00
12 e6 06 07 01 52 52 1c f8 e3 00 a0 a0 a0 32 50
08 20 98 04 b9 88 21 00 00 1e 6f c2 00 a0 a0 a0
55 50 30 20 35 00 b9 88 21 00 00 1e 00 00 00 c5

00 ff ff ff ff ff ff 00 04 72 c8 0b de 04 80 43
26 22 01 03 80 45 27 78 2a 90 73 ad 50 46 aa 27
0f 50 53 bf ef 80 71 4f 81 40 81 80 81 c0 61 7c
95 00 b3 00 d1 c0 4d d0 00 a0 f0 70 3e 80 30 20
35 00 b9 88 21 00 00 1a 00 00 00 ff 00 31 34 33
38 30 30 34 44 45 33 47 30 30 00 00 00 fd 08 30
a5 1e 77 95 00 0a 20 20 20 20 20 20 00 00 00 fc
00 58 5a 33 32 30 51 4b 20 50 33 0a 20 20 01 91

02 03 58 f1 e2 78 02 4d 01 02 03 04 90 11 13 1f
3f 61 5f 5d 76 23 09 07 07 83 01 00 00 e2 00 d5
6c 03 0c 00 10 00 38 44 20 00 40 01 03 6d d8 5d
c4 01 78 88 63 12 30 a5 83 65 1d 6d 1a 00 00 02
01 30 a5 00 00 00 00 00 00 e3 05 c3 01 e3 0f 00
12 e6 06 07 01 52 52 1c f8 e3 00 a0 a0 a0 32 50
08 20 98 04 b9 88 21 00 00 1e 6f c2 00 a0 a0 a0
55 50 30 20 35 00 b9 88 21 00 00 1e 00 00 00 c5

----------------

Block 0, Base EDID:
  EDID Structure Version & Revision: 1.3
  Vendor & Product Identification:
    Manufacturer: ACR
    Model: 3016
    Serial Number: ...
    Made in: week 38 of 2024
  Basic Display Parameters & Features:
    Digital display
    Maximum image size: 69 cm x 39 cm
    Gamma: 2.20
    DPMS levels: Off
    RGB color display
    First detailed timing is the preferred timing
  Color Characteristics:
    Red  : 0.6777, 0.3134
    Green: 0.2734, 0.6640
    Blue : 0.1533, 0.0615
    White: 0.3125, 0.3271
  Established Timings I & II:
    IBM     :   720x400    70.081663 Hz   9:5     31.467 kHz     28.320000 MHz
    DMT 0x04:   640x480    59.940476 Hz   4:3     31.469 kHz     25.175000 MHz
    Apple   :   640x480    66.666667 Hz   4:3     35.000 kHz     30.240000 MHz
    DMT 0x05:   640x480    72.808802 Hz   4:3     37.861 kHz     31.500000 MHz
    DMT 0x06:   640x480    75.000000 Hz   4:3     37.500 kHz     31.500000 MHz
    DMT 0x08:   800x600    56.250000 Hz   4:3     35.156 kHz     36.000000 MHz
    DMT 0x09:   800x600    60.316541 Hz   4:3     37.879 kHz     40.000000 MHz
    DMT 0x0a:   800x600    72.187572 Hz   4:3     48.077 kHz     50.000000 MHz
    DMT 0x0b:   800x600    75.000000 Hz   4:3     46.875 kHz     49.500000 MHz
    Apple   :   832x624    74.551266 Hz   4:3     49.726 kHz     57.284000 MHz
    DMT 0x10:  1024x768    60.003840 Hz   4:3     48.363 kHz     65.000000 MHz
    DMT 0x11:  1024x768    70.069359 Hz   4:3     56.476 kHz     75.000000 MHz
    DMT 0x12:  1024x768    75.028582 Hz   4:3     60.023 kHz     78.750000 MHz
    DMT 0x24:  1280x1024   75.024675 Hz   5:4     79.976 kHz    135.000000 MHz
    Apple   :  1152x870    75.061550 Hz 192:145   68.681 kHz    100.000000 MHz
  Standard Timings:
    DMT 0x15:  1152x864    75.000000 Hz   4:3     67.500 kHz    108.000000 MHz
    DMT 0x20:  1280x960    60.000000 Hz   4:3     60.000 kHz    108.000000 MHz
    DMT 0x23:  1280x1024   60.019740 Hz   5:4     63.981 kHz    108.000000 MHz
    DMT 0x55:  1280x720    60.000000 Hz  16:9     45.000 kHz     74.250000 MHz
    GTF     :  1024x768   119.999931 Hz   4:3     98.760 kHz    139.054000 MHz
    DMT 0x2f:  1440x900    59.887445 Hz  16:10    55.935 kHz    106.500000 MHz
    DMT 0x3a:  1680x1050   59.954250 Hz  16:10    65.290 kHz    146.250000 MHz
    DMT 0x52:  1920x1080   60.000000 Hz  16:9     67.500 kHz    148.500000 MHz
  Detailed Timing Descriptors:
    DTD 1:  3840x2160   59.996625 Hz  16:9    133.312 kHz    533.250000 MHz (697 mm x 392 mm)
                 Hfront   48 Hsync  32 Hback   80 Hpol P
                 Vfront    3 Vsync   5 Vback   54 Vpol N
    Display Product Serial Number: ...
    Display Range Limits:
      Monitor ranges (GTF): 48-165 Hz V, 30-119 kHz H, max dotclock 1490 MHz
    Display Product Name: 'XZ320QK P3'
  Extension blocks: 1
Checksum: 0x91

----------------

Block 1, CTA-861 Extension Block:
  Revision: 3
  Underscans IT Video Formats by default
  Basic audio support
  Supports YCbCr 4:4:4
  Supports YCbCr 4:2:2
  Native DTDs: 1
  HDMI Forum EDID Extension Override Data Block:
    EDID Extension Block Count: 2
  Video Data Block:
    VIC   1:   640x480    59.940476 Hz   4:3     31.469 kHz     25.175000 MHz
    VIC   2:   720x480    59.940060 Hz   4:3     31.469 kHz     27.000000 MHz
    VIC   3:   720x480    59.940060 Hz  16:9     31.469 kHz     27.000000 MHz
    VIC   4:  1280x720    60.000000 Hz  16:9     45.000 kHz     74.250000 MHz
    VIC  16:  1920x1080   60.000000 Hz  16:9     67.500 kHz    148.500000 MHz (native)
    VIC  17:   720x576    50.000000 Hz   4:3     31.250 kHz     27.000000 MHz
    VIC  19:  1280x720    50.000000 Hz  16:9     37.500 kHz     74.250000 MHz
    VIC  31:  1920x1080   50.000000 Hz  16:9     56.250 kHz    148.500000 MHz
    VIC  63:  1920x1080  120.000000 Hz  16:9    135.000 kHz    297.000000 MHz
    VIC  97:  3840x2160   60.000000 Hz  16:9    135.000 kHz    594.000000 MHz
    VIC  95:  3840x2160   30.000000 Hz  16:9     67.500 kHz    297.000000 MHz
    VIC  93:  3840x2160   24.000000 Hz  16:9     54.000 kHz    297.000000 MHz
    VIC 118:  3840x2160  120.000000 Hz  16:9    270.000 kHz   1188.000000 MHz
  Audio Data Block:
    Linear PCM:
      Max channels: 2
      Supported sample rates (kHz): 48 44.1 32
      Supported sample sizes (bits): 24 20 16
  Speaker Allocation Data Block:
    FL/FR - Front Left/Right
  Video Capability Data Block:
    YCbCr quantization: Selectable (via AVI YQ)
    RGB quantization: Selectable (via AVI Q)
    PT scan behavior: Always Overscanned
    IT scan behavior: Always Overscanned
    CE scan behavior: Always Overscanned
  Vendor-Specific Data Block (HDMI), OUI 00-0C-03:
    Source physical address: 1.0.0.0
    DC_36bit
    DC_30bit
    DC_Y444
    Maximum TMDS clock: 340 MHz
    Extended HDMI video details:
      HDMI VICs:
        HDMI VIC 1:  3840x2160   30.000000 Hz  16:9     67.500 kHz    297.000000 MHz
        HDMI VIC 3:  3840x2160   24.000000 Hz  16:9     54.000 kHz    297.000000 MHz
  Vendor-Specific Data Block (HDMI Forum), OUI C4-5D-D8:
    Version: 1
    Maximum TMDS Character Rate: 600 MHz
    SCDC Present
    Supports scrambling for <= 340 Mcsc
    Max Fixed Rate Link: 3 and 6 Gbps per lane on 3 lanes, 6, 8, 10 and 12 Gbps on 4 lanes
    Supports 12-bits/component Deep Color 4:2:0 Pixel Encoding
    Supports 10-bits/component Deep Color 4:2:0 Pixel Encoding
    Supports media rates below VRRmin (CinemaVRR, deprecated)
    Supports Auto Low-Latency Mode
    VRRmin: 48 Hz
    VRRmax: 165 Hz
    Supports VESA DSC 1.2a compression
    Supports 12 bpc Compressed Video Transport
    Supports 10 bpc Compressed Video Transport
    DSC Max Slices: up to 8 slices and up to (400 MHz/Ksliceadjust) pixel clock per slice
    DSC Max Fixed Rate Link: 3 and 6 Gbps per lane on 3 lanes, 6, 8, 10 and 12 Gbps on 4 lanes
    Maximum number of bytes in a line of chunks: 30720
  Vendor-Specific Data Block (AMD), OUI 00-00-1A:
    Version: 2
    Flags 1: 0x01
      FreeSync Supported
    Minimum Refresh Rate: 48 Hz
    Maximum Refresh Rate: 165 Hz
    Flags 5: 0x00
  Colorimetry Data Block:
    xvYCC601
    xvYCC709
    BT2020YCC
    BT2020RGB
    Gamut Boundary Description Metadata Profile P0
  YCbCr 4:2:0 Capability Map Data Block:
    VIC  97:  3840x2160   60.000000 Hz  16:9    135.000 kHz    594.000000 MHz
    VIC 118:  3840x2160  120.000000 Hz  16:9    270.000 kHz   1188.000000 MHz
  HDR Static Metadata Data Block:
    Electro optical transfer functions:
      Traditional gamma - SDR luminance range
      Traditional gamma - HDR luminance range
      SMPTE ST2084
    Supported static metadata descriptors:
      Static metadata type 1
    Desired content max luminance: 82 (295.365 cd/m^2)
    Desired content max frame-average luminance: 82 (295.365 cd/m^2)
    Desired content min luminance: 28 (0.036 cd/m^2)
  Detailed Timing Descriptors:
    DTD 2:  2560x1440  143.999210 Hz  16:9    214.559 kHz    583.600000 MHz (697 mm x 392 mm)
                 Hfront    8 Hsync  32 Hback  120 Hpol P
                 Vfront   25 Vsync   8 Vback   17 Vpol P
    DTD 3:  2560x1440  119.997589 Hz  16:9    182.996 kHz    497.750000 MHz (697 mm x 392 mm)
                 Hfront   48 Hsync  32 Hback   80 Hpol P
                 Vfront    3 Vsync   5 Vback   77 Vpol P
Checksum: 0xc5  Unused space in Extension Block: 3 bytes

----------------

Warnings:

Block 1, CTA-861 Extension Block:
  Video Data Block: VIC 1 and the first DTD are not identical. Is this intended?
  Video Capability Data Block: IT scan behavior is expected to support underscanned.
  Video Capability Data Block: S_PT is equal to S_IT and S_CE, so should be set to 0 instead.
  Vendor-Specific Data Block (HDMI Forum), OUI C4-5D-D8: CinemaVRR is deprecated and must be cleared.
  Colorimetry Data Block: Set the sRGB colorimetry bit to avoid interop issues.
  Display Product Serial Number is set, so the Serial Number in the Base EDID should be 0.
EDID:
  Base EDID: Some timings are out of range of the Monitor Ranges:
    Vertical Freq: 24.000 - 143.999 Hz (Monitor: 48.000 - 165.000 Hz)
    Horizontal Freq: 31.250 - 270.000 kHz (Monitor: 30.000 - 119.000 kHz)

Failures:

Block 0, Base EDID:
  Display Descriptor #3: Monitor descriptor block has byte 4 nonzero (0x08).
Block 1, CTA-861 Extension Block:
  Video Capability Data Block: IT video formats are always overscanned, but bit 7 of Byte 3 of the CTA-861 Extension header is set to underscanned.
  Vendor-Specific Data Block (HDMI Forum), OUI C4-5D-D8: HDMI VIC and related CTA VIC codes are present, but the UHD VIC bit is 0.
EDID:
  Extension Block 2 started with EDID header, ignoring Extension Blocks >= 2.
  Base EDID: HDMI Forum EDID Extension Override Data Block specified 2 extension block(s), but found 1 extension block(s).
  CTA-861: Native progressive timings are a mix of several resolutions.

EDID conformity: FAIL
