edid-decode (hex):

00 ff ff ff ff ff ff 00 20 34 90 14 00 00 00 00
2a 19 01 03 81 1e 17 78 ea 40 94 9c 57 52 92 26
1c 50 54 ad cf 10 01 01 01 01 01 01 01 01 01 01
01 01 01 01 01 01 9a 29 a0 d0 51 84 22 30 50 98
36 00 f8 c2 21 00 00 38 00 00 00 fc 00 43 4e 44
4c 43 44 0a 20 20 20 20 20 20 00 00 00 fd 00 3c
4b 1e 5f 16 00 0a 20 20 20 20 20 20 00 00 00 ff
00 30 30 30 30 0a 0a 0a 0a 0a 0a 0a 0a 0a 00 8f

----------------

Block 0, Base EDID:
  EDID Structure Version & Revision: 1.3
  Vendor & Product Identification:
    Manufacturer: HAT
    Model: 5264
    Made in: week 42 of 2015
  Basic Display Parameters & Features:
    Digital display
    DFP 1.x compatible TMDS
    Maximum image size: 30 cm x 23 cm
    Gamma: 2.20
    DPMS levels: Standby Suspend Off
    RGB color display
    First detailed timing is the preferred timing
  Color Characteristics:
    Red  : 0.6103, 0.3398
    Green: 0.3203, 0.5703
    Blue : 0.1503, 0.1103
    White: 0.3134, 0.3281
  Established Timings I & II:
    IBM     :   720x400    70.081663 Hz   9:5     31.467 kHz     28.320000 MHz
    DMT 0x04:   640x480    59.940476 Hz   4:3     31.469 kHz     25.175000 MHz
    DMT 0x05:   640x480    72.808802 Hz   4:3     37.861 kHz     31.500000 MHz
    DMT 0x06:   640x480    75.000000 Hz   4:3     37.500 kHz     31.500000 MHz
    DMT 0x09:   800x600    60.316541 Hz   4:3     37.879 kHz     40.000000 MHz
    DMT 0x0a:   800x600    72.187572 Hz   4:3     48.077 kHz     50.000000 MHz
    DMT 0x0b:   800x600    75.000000 Hz   4:3     46.875 kHz     49.500000 MHz
    DMT 0x10:  1024x768    60.003840 Hz   4:3     48.363 kHz     65.000000 MHz
    DMT 0x11:  1024x768    70.069359 Hz   4:3     56.476 kHz     75.000000 MHz
    DMT 0x12:  1024x768    75.028582 Hz   4:3     60.023 kHz     78.750000 MHz
    DMT 0x24:  1280x1024   75.024675 Hz   5:4     79.976 kHz    135.000000 MHz
  Standard Timings: none
  Detailed Timing Descriptors:
    DTD 1:  1440x900    59.887445 Hz  16:10    55.935 kHz    106.500000 MHz (field sequential L/R, 760 mm x 450 mm)
                 Hfront   80 Hsync 152 Hback  232 Hpol N
                 Vfront    3 Vsync   6 Vback   25 Vpol N
    Display Product Name: 'CNDLCD'
    Display Range Limits:
      Monitor ranges (GTF): 60-75 Hz V, 30-95 kHz H, max dotclock 220 MHz
    Display Product Serial Number: ...
Checksum: 0x8f

----------------

Warnings:

Block 0, Base EDID:
  Detailed Timing Descriptor #1: DTD is similar but not identical to DMT 0x2f.
  Detailed Timing Descriptor #1: Image size is 760x450 mm, but based on the picture AR it should be 760x475 mm.
  Display Product Serial Number: ...

Failures:

Block 0, Base EDID:
  Display Product Serial Number: ...
  Detailed Timing Descriptor #1: Mismatch of image size 760x450 mm vs display size 300x230 mm.
EDID:
  Base EDID: The DTD max image size is 760x450mm, which is larger than the display size 300.0x230.0mm.

EDID conformity: FAIL
