edid-decode (hex):

00 ff ff ff ff ff ff 00 0d ae e9 14 00 00 00 00
12 1c 01 04 95 1f 11 78 02 28 65 97 59 54 8e 27
1e 50 54 00 00 00 01 01 01 01 01 01 01 01 01 01
01 01 01 01 01 01 b4 3b 80 4a 71 38 34 40 50 3c
68 00 35 ad 10 00 00 1a c2 2f 80 4a 71 38 34 40
50 3c 68 00 35 ad 10 00 00 1a 00 00 00 fe 00 36
57 57 35 4b 80 31 34 30 48 43 4e 0a 00 00 00 00
00 00 41 31 96 00 10 00 00 0a 01 0a 20 20 00 0f

----------------

Block 0, Base EDID:
  EDID Structure Version & Revision: 1.4
  Vendor & Product Identification:
    Manufacturer: CMN
    Model: 5353
    Made in: week 18 of 2018
  Basic Display Parameters & Features:
    Digital display
    Bits per primary color channel: 6
    DisplayPort interface
    Maximum image size: 31 cm x 17 cm
    Gamma: 2.20
    Supported color formats: RGB 4:4:4
    First detailed timing includes the native pixel format and preferred refresh rate
  Color Characteristics:
    Red  : 0.5898, 0.3496
    Green: 0.3300, 0.5546
    Blue : 0.1533, 0.1191
    White: 0.3134, 0.3291
  Established Timings I & II: none
  Standard Timings: none
  Detailed Timing Descriptors:
    DTD 1:  1920x1080   60.007852 Hz  16:9     67.929 kHz    152.840000 MHz (309 mm x 173 mm)
                 Hfront   80 Hsync  60 Hback  190 Hpol P
                 Vfront    6 Vsync   8 Vback   38 Vpol N
    DTD 2:  1920x1080   48.001570 Hz  16:9     54.338 kHz    122.260000 MHz (309 mm x 173 mm)
                 Hfront   80 Hsync  60 Hback  190 Hpol P
                 Vfront    6 Vsync   8 Vback   38 Vpol N
    Alphanumeric Data String: '6WW5K.140HCN'
    Manufacturer-Specified Display Descriptor (0x00): 00 00 00 00 41 31 96 00 10 00 00 0a 01 0a 20 20 '....A1........  '
Checksum: 0x0f

----------------

Warnings:

Block 0, Base EDID:
  Alphanumeric Data String: Non-ASCII character 0x80 at position 5, can cause problems.
  Missing Display Product Name.

EDID conformity: PASS
