edid-decode (hex):

00 ff ff ff ff ff ff 00 0d ae d6 14 00 00 00 00
27 1e 01 04 95 1f 11 78 02 8e d5 94 57 53 93 27
21 50 54 00 00 00 01 01 01 01 01 01 01 01 01 01
01 01 01 01 01 01 da 1d 56 e2 50 00 20 30 44 2d
47 00 35 ad 10 00 00 1a e2 17 56 e2 50 00 20 30
44 2d 47 00 35 ad 10 00 00 1a 00 00 00 fe 00 46
52 57 58 36 80 31 34 30 42 47 41 0a 00 00 00 00
00 00 41 31 96 00 10 00 00 09 01 0a 20 20 00 b0

----------------

Block 0, Base EDID:
  EDID Structure Version & Revision: 1.4
  Vendor & Product Identification:
    Manufacturer: CMN
    Model: 5334
    Made in: week 39 of 2020
  Basic Display Parameters & Features:
    Digital display
    Bits per primary color channel: 6
    DisplayPort interface
    Maximum image size: 31 cm x 17 cm
    Gamma: 2.20
    Supported color formats: RGB 4:4:4
    First detailed timing includes the native pixel format and preferred refresh rate
  Color Characteristics:
    Red  : 0.5800, 0.3398
    Green: 0.3271, 0.5761
    Blue : 0.1552, 0.1298
    White: 0.3134, 0.3291
  Established Timings I & II: none
  Standard Timings: none
  Detailed Timing Descriptors:
    DTD 1:  1366x768    60.003141 Hz 683:384   48.003 kHz     76.420000 MHz (309 mm x 173 mm)
                 Hfront   68 Hsync  45 Hback  113 Hpol P
                 Vfront    4 Vsync   7 Vback   21 Vpol N
    DTD 2:  1366x768    48.005653 Hz 683:384   38.405 kHz     61.140000 MHz (309 mm x 173 mm)
                 Hfront   68 Hsync  45 Hback  113 Hpol P
                 Vfront    4 Vsync   7 Vback   21 Vpol N
    Alphanumeric Data String: 'FRWX6.140BGA'
    Manufacturer-Specified Display Descriptor (0x00): 00 00 00 00 41 31 96 00 10 00 00 09 01 0a 20 20 '....A1........  '
Checksum: 0xb0

----------------

Warnings:

Block 0, Base EDID:
  Alphanumeric Data String: Non-ASCII character 0x80 at position 5, can cause problems.
  Missing Display Product Name.

EDID conformity: PASS
