edid-decode (hex):

00 ff ff ff ff ff ff 00 30 e4 92 04 00 00 00 00
00 18 01 04 95 22 13 78 ea 9a d5 94 58 56 91 28
1f 50 54 00 00 00 01 01 01 01 01 01 01 01 01 01
01 01 01 01 01 01 2e 36 80 a0 70 38 1f 40 30 20
35 00 58 c2 10 00 00 1a 52 2b 80 a0 70 38 1f 40
30 20 35 00 58 c2 10 00 00 1a 00 00 00 fe 00 58
58 35 48 36 80 31 35 36 57 46 36 0a 00 00 00 00
00 00 41 31 96 00 10 00 00 0a 01 0a 20 20 00 4e

----------------

Block 0, Base EDID:
  EDID Structure Version & Revision: 1.4
  Vendor & Product Identification:
    Manufacturer: LGD
    Model: 1170
    Made in: 2014
  Basic Display Parameters & Features:
    Digital display
    Bits per primary color channel: 6
    DisplayPort interface
    Maximum image size: 34 cm x 19 cm
    Gamma: 2.20
    DPMS levels: Standby Suspend Off
    Supported color formats: RGB 4:4:4, YCrCb 4:4:4
    First detailed timing includes the native pixel format and preferred refresh rate
  Color Characteristics:
    Red  : 0.5800, 0.3447
    Green: 0.3378, 0.5683
    Blue : 0.1591, 0.1220
    White: 0.3134, 0.3291
  Established Timings I & II: none
  Standard Timings: none
  Detailed Timing Descriptors:
    DTD 1:  1920x1080   60.020425 Hz  16:9     66.683 kHz    138.700000 MHz (344 mm x 194 mm)
                 Hfront   48 Hsync  32 Hback   80 Hpol P
                 Vfront    3 Vsync   5 Vback   23 Vpol N
    DTD 2:  1920x1080   47.990376 Hz  16:9     53.317 kHz    110.900000 MHz (344 mm x 194 mm)
                 Hfront   48 Hsync  32 Hback   80 Hpol P
                 Vfront    3 Vsync   5 Vback   23 Vpol N
    Alphanumeric Data String: 'XX5H6.156WF6'
    Manufacturer-Specified Display Descriptor (0x00): 00 00 00 00 41 31 96 00 10 00 00 0a 01 0a 20 20 '....A1........  '
Checksum: 0x4e

----------------

Warnings:

Block 0, Base EDID:
  Alphanumeric Data String: Non-ASCII character 0x80 at position 5, can cause problems.
  Missing Display Product Name.

EDID conformity: PASS
