edid-decode (hex):

00 ff ff ff ff ff ff 00 09 e5 86 09 00 00 00 00
1c 1e 01 04 a5 22 15 78 03 0f 95 ae 52 43 b0 26
0f 50 54 00 00 00 01 01 01 01 01 01 01 01 01 01
01 01 01 01 01 01 0a 70 00 c8 a0 40 84 60 30 20
36 00 58 d7 10 00 00 18 00 00 00 fd 0c 30 a5 1f
1f 4f 01 0a 20 20 20 20 20 20 00 00 00 fe 00 42
4f 45 20 43 51 0a 20 20 20 20 20 20 00 00 00 fe
00 4e 45 31 36 30 51 44 4d 2d 4e 59 33 0a 01 ec

70 13 79 00 00 03 01 14 1c 34 01 85 ff 09 c7 00
2f 00 1f 00 3f 06 83 00 02 00 05 00 00 00 00 00
00 00 00 00 00 00 00 00 00 00 00 00 00 00 00 00
00 00 00 00 00 00 00 00 00 00 00 00 00 00 00 00
00 00 00 00 00 00 00 00 00 00 00 00 00 00 00 00
00 00 00 00 00 00 00 00 00 00 00 00 00 00 00 00
00 00 00 00 00 00 00 00 00 00 00 00 00 00 00 00
00 00 00 00 00 00 00 00 00 00 00 00 00 00 9a 90

----------------

Block 0, Base EDID:
  EDID Structure Version & Revision: 1.4
  Vendor & Product Identification:
    Manufacturer: BOE
    Model: 2438
    Made in: week 28 of 2020
  Basic Display Parameters & Features:
    Digital display
    Bits per primary color channel: 8
    DisplayPort interface
    Maximum image size: 34 cm x 21 cm
    Gamma: 2.20
    Supported color formats: RGB 4:4:4
    First detailed timing includes the native pixel format and preferred refresh rate
    Display supports continuous frequencies
  Color Characteristics:
    Red  : 0.6796, 0.3203
    Green: 0.2646, 0.6904
    Blue : 0.1503, 0.0595
    White: 0.3134, 0.3291
  Established Timings I & II: none
  Standard Timings: none
  Detailed Timing Descriptors:
    DTD 1:  2560x1600   60.000167 Hz  16:10   103.920 kHz    286.820000 MHz (344 mm x 215 mm)
                 Hfront   48 Hsync  32 Hback  120 Hpol N
                 Vfront    3 Vsync   6 Vback  123 Vpol N
    Display Range Limits:
      Monitor ranges (Range Limits Only): 48-165 Hz V, 286-286 kHz H, max dotclock 790 MHz
    Alphanumeric Data String: 'BOE CQ'
    Alphanumeric Data String: 'NE160QDM-NY3'
  Extension blocks: 1
Checksum: 0xec

----------------

Block 1, DisplayID Extension Block:
  Version: 1.3
  Extension Count: 0
  Display Product Type: Extension Section
  Video Timing Modes Type 1 - Detailed Timings Data Block:
    DTD:  2560x1600  165.003598 Hz  16:10   285.786 kHz    788.770000 MHz (aspect 16:10, no 3D stereo, preferred)
               Hfront   48 Hsync  32 Hback  120 Hpol N
               Vfront    3 Vsync   6 Vback  123 Vpol N
  Checksum: 0x9a
Checksum: 0x90

----------------

Warnings:

Block 0, Base EDID:
  Missing Display Product Name.
EDID:
  Base EDID: Some timings are out of range of the Monitor Ranges:
    Horizontal Freq: 103.920 - 285.786 kHz (Monitor: 286.000 - 286.000 kHz)

Failures:

Block 1, DisplayID Extension Block:
  DisplayID Base Block has no product type.

EDID conformity: FAIL
