edid-decode (hex):

00 ff ff ff ff ff ff 00 2a 59 5a 21 0a 1a 00 00
10 1c 01 03 00 30 1a 78 ea d6 a5 a2 59 4a 95 24
14 50 54 a1 08 00 81 00 81 40 95 00 71 40 81 80
81 c0 95 00 b3 00 02 3a 80 18 71 38 2d 40 58 2c
45 00 70 cf 10 00 00 1e 0e 1f 00 80 51 00 1e 30
30 20 37 00 70 cf 10 00 00 1c 66 21 50 b0 51 00
1b 30 40 70 34 00 c4 fe 10 00 00 1e 00 00 00 fc
00 00 0a 20 20 20 20 20 20 20 20 20 20 20 00 61

00 ff ff ff ff ff ff 00 2a 59 5a 21 0a 1a 00 00
10 1c 01 03 00 30 1a 78 ea d6 a5 a2 59 4a 95 24
14 50 54 a1 08 00 81 00 81 40 95 00 71 40 81 80
81 c0 95 00 b3 00 02 3a 80 18 71 38 2d 40 58 2c
45 00 70 cf 10 00 00 1e 0e 1f 00 80 51 00 1e 30
30 20 37 00 70 cf 10 00 00 1c 66 21 50 b0 51 00
1b 30 40 70 34 00 c4 fe 10 00 00 1e 00 00 00 fc
00 00 0a 20 20 20 20 20 20 20 20 20 20 20 00 61

----------------

Block 0, Base EDID:
  EDID Structure Version & Revision: 1.3
  Vendor & Product Identification:
    Manufacturer: JRY
    Model: 8538
    Serial Number: ...
    Made in: week 16 of 2018
  Basic Display Parameters & Features:
    Analog display
    Signal Level Standard: 0.700 : 0.300 : 1.000 V p-p
    Blank level equals black level
    Maximum image size: 48 cm x 26 cm
    Gamma: 2.20
    DPMS levels: Standby Suspend Off
    RGB color display
    First detailed timing is the preferred timing
  Color Characteristics:
    Red  : 0.6357, 0.3486
    Green: 0.2900, 0.5839
    Blue : 0.1425, 0.0800
    White: 0.3134, 0.3291
  Established Timings I & II:
    IBM     :   720x400    70.081663 Hz   9:5     31.467 kHz     28.320000 MHz
    DMT 0x04:   640x480    59.940476 Hz   4:3     31.469 kHz     25.175000 MHz
    DMT 0x09:   800x600    60.316541 Hz   4:3     37.879 kHz     40.000000 MHz
    DMT 0x10:  1024x768    60.003840 Hz   4:3     48.363 kHz     65.000000 MHz
  Standard Timings:
    DMT 0x1c:  1280x800    59.810326 Hz  16:10    49.702 kHz     83.500000 MHz
    DMT 0x20:  1280x960    60.000000 Hz   4:3     60.000 kHz    108.000000 MHz
    DMT 0x2f:  1440x900    59.887445 Hz  16:10    55.935 kHz    106.500000 MHz
    GTF     :  1152x864    60.000000 Hz   4:3     53.700 kHz     81.624000 MHz
    DMT 0x23:  1280x1024   60.019740 Hz   5:4     63.981 kHz    108.000000 MHz
    DMT 0x55:  1280x720    60.000000 Hz  16:9     45.000 kHz     74.250000 MHz
    DMT 0x2f:  1440x900    59.887445 Hz  16:10    55.935 kHz    106.500000 MHz
    DMT 0x3a:  1680x1050   59.954250 Hz  16:10    65.290 kHz    146.250000 MHz
  Detailed Timing Descriptors:
    DTD 1:  1920x1080   60.000000 Hz  16:9     67.500 kHz    148.500000 MHz (368 mm x 207 mm)
                 Hfront   88 Hsync  44 Hback  148 Hpol P
                 Vfront    4 Vsync   5 Vback   36 Vpol P
    DTD 2:  1280x768    59.870228 Hz   5:3     47.776 kHz     79.500000 MHz (368 mm x 207 mm)
                 Hfront   48 Hsync  32 Hback  304 Hpol N
                 Vfront    3 Vsync   7 Vback   20 Vpol P
    DTD 3:  1360x768    60.015162 Hz  85:48    47.712 kHz     85.500000 MHz (452 mm x 254 mm)
                 Hfront   64 Hsync 112 Hback  256 Hpol P
                 Vfront    3 Vsync   4 Vback   20 Vpol P
    Display Product Name: ''
Checksum: 0x61

----------------

Block 1, Unknown EDID Extension Block 0x00:
  00 ff ff ff ff ff ff 00 2a 59 5a 21 0a 1a 00 00 '........*YZ!....'
  10 1c 01 03 00 30 1a 78 ea d6 a5 a2 59 4a 95 24 '.....0.x....YJ.$'
  14 50 54 a1 08 00 81 00 81 40 95 00 71 40 81 80 '.PT......@..q@..'
  81 c0 95 00 b3 00 02 3a 80 18 71 38 2d 40 58 2c '.......:..q8-@X,'
  45 00 70 cf 10 00 00 1e 0e 1f 00 80 51 00 1e 30 'E.p.........Q..0'
  30 20 37 00 70 cf 10 00 00 1c 66 21 50 b0 51 00 '0 7.p.....f!P.Q.'
  1b 30 40 70 34 00 c4 fe 10 00 00 1e 00 00 00 fc '.0@p4...........'
  00 00 0a 20 20 20 20 20 20 20 20 20 20 20 00 61 '...           .a'
Checksum: 0x61

----------------

Warnings:

Block 0, Base EDID:
  Vendor & Product Identification: The serial number is one of the known dummy values, it should probably be set to 0.
  Detailed Timing Descriptor #2: DTD is similar but not identical to DMT 0x17.
  Detailed Timing Descriptor #2: Image size is 368x207 mm, but based on the picture AR it should be 368x220 mm.
  Detailed Timing Descriptor #3: DTD is similar but not identical to DMT 0x27.

Failures:

Block 0, Base EDID:
  Detailed Timing Descriptor #1: Mismatch of image size 368x207 mm vs display size 480x260 mm.
  Detailed Timing Descriptor #2: Mismatch of image size 368x207 mm vs display size 480x260 mm.
  Display Product Name: NUL byte at position 0.
  Missing Display Range Limits Descriptor.
Block 1, Base EDID:
  Unknown Extension Block.
EDID:
  Base EDID: EDID specified 0 extension block(s), but found 1 extension block(s).

EDID conformity: FAIL
