edid-decode (hex):

00 ff ff ff ff ff ff 00 0c f4 08 00 01 00 00 00
01 0f 01 03 80 00 00 00 ee 00 00 00 00 00 00 00
00 00 00 af ce 00 61 40 01 01 01 01 01 01 01 01
01 01 01 01 01 01 64 19 00 40 41 00 26 30 28 d0
34 00 22 dc 10 00 00 18 00 00 00 10 00 32 78 28
3c 07 00 0a 20 20 20 20 20 20 00 00 00 fe 00 63
6f 6e 67 61 74 65 63 20 41 47 0a 20 00 00 00 0e
00 01 00 00 00 00 00 00 00 00 00 00 00 10 00 87

00 ff ff ff ff ff ff 00 0c f4 08 00 01 00 00 00
01 0f 01 03 80 00 00 00 ee 00 00 00 00 00 00 00
00 00 00 af ce 00 61 40 01 01 01 01 01 01 01 01
01 01 01 01 01 01 64 19 00 40 41 00 26 30 28 d0
34 00 22 dc 10 00 00 18 00 00 00 10 00 32 78 28
3c 07 00 0a 20 20 20 20 20 20 00 00 00 fe 00 63
6f 6e 67 61 74 65 63 20 41 47 0a 20 00 00 00 0e
00 01 00 00 00 00 00 00 00 00 00 00 00 10 00 87

----------------

Block 0, Base EDID:
  EDID Structure Version & Revision: 1.3
  Vendor & Product Identification:
    Manufacturer: CGT
    Model: 8
    Serial Number: ...
    Made in: week 1 of 2005
  Basic Display Parameters & Features:
    Digital display
    Image size is variable
    Gamma: 1.00
    DPMS levels: Standby Suspend Off
    RGB color display
    Default (sRGB) color space is primary color space
    First detailed timing is the preferred timing
  Color Characteristics:
    Red  : 0.0000, 0.0000
    Green: 0.0000, 0.0000
    Blue : 0.0000, 0.0000
    White: 0.0000, 0.0000
  Established Timings I & II:
    IBM     :   720x400    70.081663 Hz   9:5     31.467 kHz     28.320000 MHz
    DMT 0x04:   640x480    59.940476 Hz   4:3     31.469 kHz     25.175000 MHz
    DMT 0x05:   640x480    72.808802 Hz   4:3     37.861 kHz     31.500000 MHz
    DMT 0x06:   640x480    75.000000 Hz   4:3     37.500 kHz     31.500000 MHz
    DMT 0x08:   800x600    56.250000 Hz   4:3     35.156 kHz     36.000000 MHz
    DMT 0x09:   800x600    60.316541 Hz   4:3     37.879 kHz     40.000000 MHz
    DMT 0x0a:   800x600    72.187572 Hz   4:3     48.077 kHz     50.000000 MHz
    DMT 0x0b:   800x600    75.000000 Hz   4:3     46.875 kHz     49.500000 MHz
    DMT 0x10:  1024x768    60.003840 Hz   4:3     48.363 kHz     65.000000 MHz
    DMT 0x11:  1024x768    70.069359 Hz   4:3     56.476 kHz     75.000000 MHz
    DMT 0x12:  1024x768    75.028582 Hz   4:3     60.023 kHz     78.750000 MHz
  Standard Timings:
    DMT 0x10:  1024x768    60.003840 Hz   4:3     48.363 kHz     65.000000 MHz
  Detailed Timing Descriptors:
    DTD 1:  1024x768    60.003840 Hz   4:3     48.363 kHz     65.000000 MHz (290 mm x 220 mm)
                 Hfront   40 Hsync 208 Hback   72 Hpol N
                 Vfront    3 Vsync   4 Vback   31 Vpol N
    Dummy Descriptor:
    Alphanumeric Data String: 'congatec AG'
    EPI Descriptor:
      Bits per pixel: 24
      Pixels per clock: 1
      Data color mapping: conventional
      Interface type: LVDS TFT
      DE polarity: DE high active
      FPSCLK polarity: FPSCLK not inverted
      Vertical display mode: normal
      Horizontal display mode: normal
      Total power on sequencing delay: VGA controller default
      Total power off sequencing delay: VGA controller default
      Contrast power on sequencing delay: VGA controller default
      Contrast power off sequencing delay: VGA controller default
      Backlight brightness control: 0 steps (ignored)
      Backlight enable at boot: on (ignored)
      Backlight control enable: disabled
      Contrast voltable control: 0 steps (ignored)
      Contrast control enable: disabled
      EPI Version: 1.0
Checksum: 0x87

----------------

Warnings:

Block 0, Base EDID:
  Vendor & Product Identification: The serial number is one of the known dummy values, it should probably be set to 0.
  Basic Display Parameters & Features: sRGB is signaled, but the gamma != 2.2.
  Detailed Timing Descriptor #1: DTD is similar but not identical to DMT 0x10.

Failures:

Block 0, Base EDID:
  Basic Display Parameters & Features: sRGB is signaled, but the chromaticities do not match.
  Dummy Descriptor: Dummy block filled with garbage.
  Missing Display Product Name.
  Missing Display Range Limits Descriptor.
EDID:
  Extension Block 1 started with EDID header, ignoring Extension Blocks >= 1.
  Base EDID: The DTD max image size is 290x220mm, but the display size is not specified anywhere.

EDID conformity: FAIL
