edid-decode (hex):

00 ff ff ff ff ff ff 00 26 cd 15 76 01 01 01 01
28 20 01 04 b5 50 21 78 2b 81 95 a3 55 53 9f 25
0a 50 54 bf ef 80 d1 c0 e1 c0 d1 00 b3 00 a9 40
a9 c0 81 80 81 00 4e ab 70 b8 d1 a0 42 50 90 60
64 08 20 4f 31 00 00 1a 00 00 00 ff 00 31 31 37
31 38 32 34 30 31 30 30 32 30 00 00 00 fd 00 30
90 d9 d9 50 01 0a 20 20 20 20 20 20 00 00 00 fc
00 50 4c 33 34 36 31 57 51 0a 20 20 20 20 02 fb

02 03 24 f3 4c 10 1f 04 14 03 12 05 14 07 16 01
3f 23 09 07 07 83 01 00 00 e3 05 e0 00 e6 06 07
01 8b 60 11 4e d4 70 a0 d0 a0 46 50 30 20 34 00
20 4f 31 00 00 1a 56 5e 00 a0 a0 a0 29 50 30 20
35 00 20 4f 31 00 00 1a 86 6f 80 a0 70 38 40 40
30 20 35 00 20 4f 31 00 00 1a 3c 41 b8 a0 60 a0
29 50 30 20 3a 00 20 4f 31 00 00 1a 6f c2 00 a0
a0 a0 55 50 30 20 35 00 20 4f 31 00 00 1a 00 8b

70 12 2b 03 00 03 01 28 66 38 01 88 6f 0d ef 00
2f 80 1f 00 9f 05 45 00 02 00 09 00 ea 05 01 08
6f 0d df 00 8f 80 1f 00 9f 05 54 00 02 00 03 00
c2 00 00 00 00 00 00 00 00 00 00 00 00 00 00 00
00 00 00 00 00 00 00 00 00 00 00 00 00 00 00 00
00 00 00 00 00 00 00 00 00 00 00 00 00 00 00 00
00 00 00 00 00 00 00 00 00 00 00 00 00 00 00 00
00 00 00 00 00 00 00 00 00 00 00 00 00 00 00 90

00 ff ff ff ff ff ff 00 26 cd 15 76 01 01 01 01
28 20 01 04 b5 50 21 78 2b 81 95 a3 55 53 9f 25
0a 50 54 bf ef 80 d1 c0 e1 c0 d1 00 b3 00 a9 40
a9 c0 81 80 81 00 4e ab 70 b8 d1 a0 42 50 90 60
64 08 20 4f 31 00 00 1a 00 00 00 ff 00 31 31 37
31 38 32 34 30 31 30 30 32 30 00 00 00 fd 00 30
90 d9 d9 50 01 0a 20 20 20 20 20 20 00 00 00 fc
00 50 4c 33 34 36 31 57 51 0a 20 20 20 20 02 fb

02 03 24 f3 4c 10 1f 04 14 03 12 05 14 07 16 01
3f 23 09 07 07 83 01 00 00 e3 05 e0 00 e6 06 07
01 8b 60 11 4e d4 70 a0 d0 a0 46 50 30 20 34 00
20 4f 31 00 00 1a 56 5e 00 a0 a0 a0 29 50 30 20
35 00 20 4f 31 00 00 1a 86 6f 80 a0 70 38 40 40
30 20 35 00 20 4f 31 00 00 1a 3c 41 b8 a0 60 a0
29 50 30 20 3a 00 20 4f 31 00 00 1a 6f c2 00 a0
a0 a0 55 50 30 20 35 00 20 4f 31 00 00 1a 00 8b

70 12 2b 03 00 03 01 28 66 38 01 88 6f 0d ef 00
2f 80 1f 00 9f 05 45 00 02 00 09 00 ea 05 01 08
6f 0d df 00 8f 80 1f 00 9f 05 54 00 02 00 03 00
c2 00 00 00 00 00 00 00 00 00 00 00 00 00 00 00
00 00 00 00 00 00 00 00 00 00 00 00 00 00 00 00
00 00 00 00 00 00 00 00 00 00 00 00 00 00 00 00
00 00 00 00 00 00 00 00 00 00 00 00 00 00 00 00
00 00 00 00 00 00 00 00 00 00 00 00 00 00 00 90

----------------

Block 0, Base EDID:
  EDID Structure Version & Revision: 1.4
  Vendor & Product Identification:
    Manufacturer: IVM
    Model: 30229
    Serial Number: ...
    Made in: week 40 of 2022
  Basic Display Parameters & Features:
    Digital display
    Bits per primary color channel: 10
    DisplayPort interface
    Maximum image size: 80 cm x 33 cm
    Gamma: 2.20
    DPMS levels: Off
    Supported color formats: RGB 4:4:4, YCrCb 4:4:4
    First detailed timing includes the native pixel format and preferred refresh rate
    Display supports continuous frequencies
  Color Characteristics:
    Red  : 0.6386, 0.3320
    Green: 0.3242, 0.6220
    Blue : 0.1464, 0.0400
    White: 0.3134, 0.3291
  Established Timings I & II:
    IBM     :   720x400    70.081663 Hz   9:5     31.467 kHz     28.320000 MHz
    DMT 0x04:   640x480    59.940476 Hz   4:3     31.469 kHz     25.175000 MHz
    Apple   :   640x480    66.666667 Hz   4:3     35.000 kHz     30.240000 MHz
    DMT 0x05:   640x480    72.808802 Hz   4:3     37.861 kHz     31.500000 MHz
    DMT 0x06:   640x480    75.000000 Hz   4:3     37.500 kHz     31.500000 MHz
    DMT 0x08:   800x600    56.250000 Hz   4:3     35.156 kHz     36.000000 MHz
    DMT 0x09:   800x600    60.316541 Hz   4:3     37.879 kHz     40.000000 MHz
    DMT 0x0a:   800x600    72.187572 Hz   4:3     48.077 kHz     50.000000 MHz
    DMT 0x0b:   800x600    75.000000 Hz   4:3     46.875 kHz     49.500000 MHz
    Apple   :   832x624    74.551266 Hz   4:3     49.726 kHz     57.284000 MHz
    DMT 0x10:  1024x768    60.003840 Hz   4:3     48.363 kHz     65.000000 MHz
    DMT 0x11:  1024x768    70.069359 Hz   4:3     56.476 kHz     75.000000 MHz
    DMT 0x12:  1024x768    75.028582 Hz   4:3     60.023 kHz     78.750000 MHz
    DMT 0x24:  1280x1024   75.024675 Hz   5:4     79.976 kHz    135.000000 MHz
    Apple   :  1152x870    75.061550 Hz 192:145   68.681 kHz    100.000000 MHz
  Standard Timings:
    DMT 0x52:  1920x1080   60.000000 Hz  16:9     67.500 kHz    148.500000 MHz
    DMT 0x54:  2048x1152   60.000000 Hz  16:9     72.000 kHz    162.000000 MHz (RB)
    DMT 0x45:  1920x1200   59.884600 Hz  16:10    74.556 kHz    193.250000 MHz
    DMT 0x3a:  1680x1050   59.954250 Hz  16:10    65.290 kHz    146.250000 MHz
    DMT 0x33:  1600x1200   60.000000 Hz   4:3     75.000 kHz    162.000000 MHz
    DMT 0x53:  1600x900    60.000000 Hz  16:9     60.000 kHz    108.000000 MHz (RB)
    DMT 0x23:  1280x1024   60.019740 Hz   5:4     63.981 kHz    108.000000 MHz
    DMT 0x1c:  1280x800    59.810326 Hz  16:10    49.702 kHz     83.500000 MHz
  Detailed Timing Descriptors:
    DTD  1:  3440x1440   75.050314 Hz  43:18   113.026 kHz    438.540000 MHz (800 mm x 335 mm)
                  Hfront  144 Hsync  96 Hback  200 Hpol P
                  Vfront   38 Vsync   4 Vback   24 Vpol N
    Display Product Serial Number: ...
    Display Range Limits:
      Monitor ranges (Range Limits Only): 48-144 Hz V, 217-217 kHz H, max dotclock 800 MHz
    Display Product Name: 'PL3461WQ'
  Extension blocks: 2
Checksum: 0xfb

----------------

Block 1, CTA-861 Extension Block:
  Revision: 3
  Underscans IT Video Formats by default
  Basic audio support
  Supports YCbCr 4:4:4
  Supports YCbCr 4:2:2
  Native detailed modes: 3
  Video Data Block:
    VIC  16:  1920x1080   60.000000 Hz  16:9     67.500 kHz    148.500000 MHz
    VIC  31:  1920x1080   50.000000 Hz  16:9     56.250 kHz    148.500000 MHz
    VIC   4:  1280x720    60.000000 Hz  16:9     45.000 kHz     74.250000 MHz
    VIC  20:  1920x1080i  50.000000 Hz  16:9     28.125 kHz     74.250000 MHz
    VIC   3:   720x480    59.940060 Hz  16:9     31.469 kHz     27.000000 MHz
    VIC  18:   720x576    50.000000 Hz  16:9     31.250 kHz     27.000000 MHz
    VIC   5:  1920x1080i  60.000000 Hz  16:9     33.750 kHz     74.250000 MHz
    VIC  20:  1920x1080i  50.000000 Hz  16:9     28.125 kHz     74.250000 MHz
    VIC   7:  1440x480i   59.940060 Hz  16:9     15.734 kHz     27.000000 MHz
    VIC  22:  1440x576i   50.000000 Hz  16:9     15.625 kHz     27.000000 MHz
    VIC   1:   640x480    59.940476 Hz   4:3     31.469 kHz     25.175000 MHz
    VIC  63:  1920x1080  120.000000 Hz  16:9    135.000 kHz    297.000000 MHz
  Audio Data Block:
    Linear PCM:
      Max channels: 2
      Supported sample rates (kHz): 48 44.1 32
      Supported sample sizes (bits): 24 20 16
  Speaker Allocation Data Block:
    FL/FR - Front Left/Right
  Colorimetry Data Block:
    BT2020cYCC
    BT2020YCC
    BT2020RGB
  HDR Static Metadata Data Block:
    Electro optical transfer functions:
      Traditional gamma - SDR luminance range
      Traditional gamma - HDR luminance range
      SMPTE ST2084
    Supported static metadata descriptors:
      Static metadata type 1
    Desired content max luminance: 139 (1015.241 cd/m^2)
    Desired content max frame-average luminance: 96 (400.000 cd/m^2)
    Desired content min luminance: 17 (0.045 cd/m^2)
  Detailed Timing Descriptors:
    DTD  2:  3440x1440   99.981604 Hz  43:18   150.972 kHz    543.500000 MHz (800 mm x 335 mm)
                  Hfront   48 Hsync  32 Hback   80 Hpol P
                  Vfront    3 Vsync   4 Vback   63 Vpol N
    DTD  3:  2560x1440   59.950550 Hz  16:9     88.787 kHz    241.500000 MHz (800 mm x 335 mm)
                  Hfront   48 Hsync  32 Hback   80 Hpol P
                  Vfront    3 Vsync   5 Vback   33 Vpol N
    DTD  4:  1920x1080  119.982181 Hz  16:9    137.260 kHz    285.500000 MHz (800 mm x 335 mm)
                  Hfront   48 Hsync  32 Hback   80 Hpol P
                  Vfront    3 Vsync   5 Vback   56 Vpol N
    DTD  5:  1720x1440   59.979600 Hz  43:36    88.830 kHz    167.000000 MHz (800 mm x 335 mm)
                  Hfront   48 Hsync  32 Hback   80 Hpol P
                  Vfront    3 Vsync  10 Vback   28 Vpol N
    DTD  6:  2560x1440  119.997589 Hz  16:9    182.996 kHz    497.750000 MHz (800 mm x 335 mm)
                  Hfront   48 Hsync  32 Hback   80 Hpol P
                  Vfront    3 Vsync   5 Vback   77 Vpol N
Checksum: 0x8b  Unused space in Extension Block: 1 byte

----------------

Block 2, DisplayID Extension Block:
  Version: 1.2
  Extension Count: 0
  Display Product Type: Standalone display device
  Video Timing Modes Type 1 - Detailed Timings Data Block:
    DTD:  3440x1440  143.922761 Hz   0:0    217.323 kHz    799.750000 MHz (aspect undefined, no 3D stereo, preferred)
               Hfront   48 Hsync  32 Hback  160 Hpol P
               Vfront    3 Vsync  10 Vback   57 Vpol N
    DTD:  3440x1440  119.999642 Hz   0:0    182.999 kHz    670.510000 MHz (aspect undefined, no 3D stereo)
               Hfront  144 Hsync  32 Hback   48 Hpol P
               Vfront    3 Vsync   4 Vback   78 Vpol N
  Checksum: 0xc2
Checksum: 0x90  Unused space in Extension Block: 78 bytes

----------------

Block 3, Unknown EDID Extension Block 0x00:
  00 ff ff ff ff ff ff 00 26 cd 15 76 01 01 01 01 '........&..v....'
  28 20 01 04 b5 50 21 78 2b 81 95 a3 55 53 9f 25 '( ...P!x+...US.%'
  0a 50 54 bf ef 80 d1 c0 e1 c0 d1 00 b3 00 a9 40 '.PT............@'
  a9 c0 81 80 81 00 4e ab 70 b8 d1 a0 42 50 90 60 '......N.p...BP.`'
  64 08 20 4f 31 00 00 1a 00 00 00 ff 00 31 31 37 'd. O1........117'
  31 38 32 34 30 31 30 30 32 30 00 00 00 fd 00 30 '1824010020.....0'
  90 d9 d9 50 01 0a 20 20 20 20 20 20 00 00 00 fc '...P..      ....'
  00 50 4c 33 34 36 31 57 51 0a 20 20 20 20 02 fb '.PL3461WQ.    ..'
Checksum: 0xfb

----------------

Block 4, CTA-861 Extension Block:
  Revision: 3
  Underscans IT Video Formats by default
  Basic audio support
  Supports YCbCr 4:4:4
  Supports YCbCr 4:2:2
  Native detailed modes: 3
  Video Data Block:
    VIC  16:  1920x1080   60.000000 Hz  16:9     67.500 kHz    148.500000 MHz
    VIC  31:  1920x1080   50.000000 Hz  16:9     56.250 kHz    148.500000 MHz
    VIC   4:  1280x720    60.000000 Hz  16:9     45.000 kHz     74.250000 MHz
    VIC  20:  1920x1080i  50.000000 Hz  16:9     28.125 kHz     74.250000 MHz
    VIC   3:   720x480    59.940060 Hz  16:9     31.469 kHz     27.000000 MHz
    VIC  18:   720x576    50.000000 Hz  16:9     31.250 kHz     27.000000 MHz
    VIC   5:  1920x1080i  60.000000 Hz  16:9     33.750 kHz     74.250000 MHz
    VIC  20:  1920x1080i  50.000000 Hz  16:9     28.125 kHz     74.250000 MHz
    VIC   7:  1440x480i   59.940060 Hz  16:9     15.734 kHz     27.000000 MHz
    VIC  22:  1440x576i   50.000000 Hz  16:9     15.625 kHz     27.000000 MHz
    VIC   1:   640x480    59.940476 Hz   4:3     31.469 kHz     25.175000 MHz
    VIC  63:  1920x1080  120.000000 Hz  16:9    135.000 kHz    297.000000 MHz
  Audio Data Block:
    Linear PCM:
      Max channels: 2
      Supported sample rates (kHz): 48 44.1 32
      Supported sample sizes (bits): 24 20 16
  Speaker Allocation Data Block:
    FL/FR - Front Left/Right
  Colorimetry Data Block:
    BT2020cYCC
    BT2020YCC
    BT2020RGB
  HDR Static Metadata Data Block:
    Electro optical transfer functions:
      Traditional gamma - SDR luminance range
      Traditional gamma - HDR luminance range
      SMPTE ST2084
    Supported static metadata descriptors:
      Static metadata type 1
    Desired content max luminance: 139 (1015.241 cd/m^2)
    Desired content max frame-average luminance: 96 (400.000 cd/m^2)
    Desired content min luminance: 17 (0.045 cd/m^2)
  Detailed Timing Descriptors:
    DTD  7:  3440x1440   99.981604 Hz  43:18   150.972 kHz    543.500000 MHz (800 mm x 335 mm)
                  Hfront   48 Hsync  32 Hback   80 Hpol P
                  Vfront    3 Vsync   4 Vback   63 Vpol N
    DTD  8:  2560x1440   59.950550 Hz  16:9     88.787 kHz    241.500000 MHz (800 mm x 335 mm)
                  Hfront   48 Hsync  32 Hback   80 Hpol P
                  Vfront    3 Vsync   5 Vback   33 Vpol N
    DTD  9:  1920x1080  119.982181 Hz  16:9    137.260 kHz    285.500000 MHz (800 mm x 335 mm)
                  Hfront   48 Hsync  32 Hback   80 Hpol P
                  Vfront    3 Vsync   5 Vback   56 Vpol N
    DTD 10:  1720x1440   59.979600 Hz  43:36    88.830 kHz    167.000000 MHz (800 mm x 335 mm)
                  Hfront   48 Hsync  32 Hback   80 Hpol P
                  Vfront    3 Vsync  10 Vback   28 Vpol N
    DTD 11:  2560x1440  119.997589 Hz  16:9    182.996 kHz    497.750000 MHz (800 mm x 335 mm)
                  Hfront   48 Hsync  32 Hback   80 Hpol P
                  Vfront    3 Vsync   5 Vback   77 Vpol N
Checksum: 0x8b  Unused space in Extension Block: 1 byte

----------------

Block 5, DisplayID Extension Block:
  Version: 1.2
  Extension Count: 0
  Video Timing Modes Type 1 - Detailed Timings Data Block:
    DTD:  3440x1440  143.922761 Hz   0:0    217.323 kHz    799.750000 MHz (aspect undefined, no 3D stereo, preferred)
               Hfront   48 Hsync  32 Hback  160 Hpol P
               Vfront    3 Vsync  10 Vback   57 Vpol N
    DTD:  3440x1440  119.999642 Hz   0:0    182.999 kHz    670.510000 MHz (aspect undefined, no 3D stereo)
               Hfront  144 Hsync  32 Hback   48 Hpol P
               Vfront    3 Vsync   4 Vback   78 Vpol N
  Checksum: 0xc2
Checksum: 0x90  Unused space in Extension Block: 78 bytes

----------------

Warnings:

Block 0, Base EDID:
  Vendor & Product Identification: The serial number is one of the known dummy values, it should probably be set to 0.
Block 1, CTA-861 Extension Block:
  Video Data Block: VIC 16 and the first DTD are not identical. Is this intended?
  Colorimetry Data Block: Set the sRGB colorimetry bit to avoid interop issues.
  Detailed Timing Descriptor #3: Image size is 800x335 mm, but based on the picture AR it should be 800x450 mm.
  Detailed Timing Descriptor #4: Image size is 800x335 mm, but based on the picture AR it should be 800x450 mm.
  Detailed Timing Descriptor #5: Image size is 800x335 mm, but based on the picture AR it should be 800x669 mm.
  Detailed Timing Descriptor #6: Image size is 800x335 mm, but based on the picture AR it should be 800x450 mm.
  Display Product Serial Number is set, so the Serial Number in the Base EDID should be 0.
Block 4, CTA-861 Extension Block:
  Colorimetry Data Block: Set the sRGB colorimetry bit to avoid interop issues.
  Detailed Timing Descriptor #8: Image size is 800x335 mm, but based on the picture AR it should be 800x450 mm.
  Detailed Timing Descriptor #9: Image size is 800x335 mm, but based on the picture AR it should be 800x450 mm.
  Detailed Timing Descriptor #10: Image size is 800x335 mm, but based on the picture AR it should be 800x669 mm.
  Detailed Timing Descriptor #11: Image size is 800x335 mm, but based on the picture AR it should be 800x450 mm.
EDID:
  Base EDID: Some timings are out of range of the Monitor Ranges:
    Horizontal Freq: 15.625 - 217.323 kHz (Monitor: 217.000 - 217.000 kHz)

Failures:

Block 1, CTA-861 Extension Block:
  Video Data Block: Duplicate VIC 20.
  Missing VCDB, needed for Set Selectable RGB Quantization to avoid interop issues.
Block 2, DisplayID Extension Block:
  Expected 0 DisplayID Extension Block, but got 1.
Block 3, Base EDID:
  Unknown Extension Block.
Block 4, CTA-861 Extension Block:
  Video Data Block: Duplicate VIC 16.
  Video Data Block: Duplicate VIC 31.
  Video Data Block: Duplicate VIC 4.
  Video Data Block: Duplicate VIC 3.
  Video Data Block: Duplicate VIC 18.
  Video Data Block: Duplicate VIC 5.
  Video Data Block: Duplicate VIC 7.
  Video Data Block: Duplicate VIC 22.
  Video Data Block: Duplicate VIC 1.
  Video Data Block: Duplicate VIC 63.
  Speaker Allocation Data Block: Only one instance of this Data Block is allowed.
  Colorimetry Data Block: Only one instance of this Data Block is allowed.
  HDR Static Metadata Data Block: Only one instance of this Data Block is allowed.
Block 5, DisplayID Extension Block:
  Product Type should be 0 in extension block.
EDID:
  Base EDID: EDID specified 2 extension block(s), but found 5 extension block(s).
  CTA-861: Native progressive timings are a mix of several resolutions.
  DisplayID: Missing DisplayID Display Parameters Data Block.

EDID conformity: FAIL
