edid-decode (hex):

00 ff ff ff ff ff ff 00 0e 14 1f 14 00 00 00 00
34 11 01 03 80 21 15 78 0a 09 2d 9d 56 4f 90 27
21 50 54 00 00 00 01 01 01 01 01 01 01 01 01 01
01 01 01 01 01 01 bc 1b 00 aa 50 20 10 30 30 20
36 00 4b cf 10 00 00 19 00 00 00 0f 00 00 00 00
00 00 00 00 00 20 6e 05 0f 00 00 00 00 fe 00 54
4d 31 32 31 30 31 35 34 57 42 38 20 00 00 00 fe
00 27 36 41 47 64 82 ab ff 01 01 20 20 20 00 be

00 ff ff ff ff ff ff 00 0e 14 1f 14 00 00 00 00
34 11 01 03 80 21 15 78 0a 09 2d 9d 56 4f 90 27
21 50 54 00 00 00 01 01 01 01 01 01 01 01 01 01
01 01 01 01 01 01 bc 1b 00 aa 50 20 10 30 30 20
36 00 4b cf 10 00 00 19 00 00 00 0f 00 00 00 00
00 00 00 00 00 20 6e 05 0f 00 00 00 00 fe 00 54
4d 31 32 31 30 31 35 34 57 42 38 20 00 00 00 fe
00 27 36 41 47 64 82 ab ff 01 01 20 20 20 00 be

----------------

Block 0, Base EDID:
  EDID Structure Version & Revision: 1.3
  Vendor & Product Identification:
    Manufacturer: CPT
    Model: 5151
    Made in: week 52 of 2007
  Basic Display Parameters & Features:
    Digital display
    Maximum image size: 33 cm x 21 cm
    Gamma: 2.20
    RGB color display
    First detailed timing is the preferred timing
  Color Characteristics:
    Red  : 0.6132, 0.3359
    Green: 0.3105, 0.5634
    Blue : 0.1523, 0.1308
    White: 0.3154, 0.3291
  Established Timings I & II: none
  Standard Timings: none
  Detailed Timing Descriptors:
    DTD 1:  1280x800    60.006761 Hz  16:10    48.966 kHz     71.000000 MHz (331 mm x 207 mm)
                 Hfront   48 Hsync  32 Hback   90 Hpol N
                 Vfront    3 Vsync   6 Vback    7 Vpol N
    Manufacturer-Specified Display Descriptor (0x0f): 00 0f 00 00 00 00 00 00 00 00 00 20 6e 05 0f 00 '........... n...'
    Alphanumeric Data String: 'TM1210154WB8 '
    Alphanumeric Data String: ''6AGd..'
Checksum: 0xbe

----------------

Block 1, Unknown EDID Extension Block 0x00:
  00 ff ff ff ff ff ff 00 0e 14 1f 14 00 00 00 00 '................'
  34 11 01 03 80 21 15 78 0a 09 2d 9d 56 4f 90 27 '4....!.x..-.VO.''
  21 50 54 00 00 00 01 01 01 01 01 01 01 01 01 01 '!PT.............'
  01 01 01 01 01 01 bc 1b 00 aa 50 20 10 30 30 20 '..........P .00 '
  36 00 4b cf 10 00 00 19 00 00 00 0f 00 00 00 00 '6.K.............'
  00 00 00 00 00 20 6e 05 0f 00 00 00 00 fe 00 54 '..... n........T'
  4d 31 32 31 30 31 35 34 57 42 38 20 00 00 00 fe 'M1210154WB8 ....'
  00 27 36 41 47 64 82 ab ff 01 01 20 20 20 00 be '.'6AGd.....   ..'
Checksum: 0xbe

----------------

Warnings:

Block 0, Base EDID:
  Alphanumeric Data String: Non-ASCII character 0x82 at position 5, can cause problems.
  Alphanumeric Data String: Non-ASCII character 0xab at position 6, can cause problems.

Failures:

Block 0, Base EDID:
  Alphanumeric Data String: No newline, but one or more trailing spaces.
  Alphanumeric Data String: 0xff byte at position 7.
  Missing Display Product Name.
  Missing Display Range Limits Descriptor.
Block 1, Base EDID:
  Unknown Extension Block.
EDID:
  Base EDID: EDID specified 0 extension block(s), but found 1 extension block(s).

EDID conformity: FAIL
