edid-decode (hex):

00 ff ff ff ff ff ff 00 22 0e 48 36 00 00 00 00
24 1d 01 03 80 50 21 78 2a 47 84 aa 52 4d a0 26
11 50 54 a5 4b 00 d1 c0 a9 c0 81 c0 b3 00 95 00
81 00 81 80 01 01 e7 7c 70 a0 d0 a0 29 50 30 20
3a 00 20 4f 31 00 00 1a 00 00 00 fd 00 1e 4c 1e
5e 22 00 0a 20 20 20 20 20 20 00 00 00 fc 00 48
50 20 45 33 34 34 63 0a 20 20 20 20 00 00 00 ff
00 33 43 51 39 33 36 31 43 5a 32 0a 20 20 01 57

02 03 22 b1 4a 90 1f 04 13 02 03 11 12 01 5a 67
03 0c 00 10 00 00 3c 67 d8 5d c4 01 44 80 00 e2
00 6b 9f 3d 70 a0 d0 a0 15 50 30 20 3a 00 20 4f
31 00 00 1a 56 5e 00 a0 a0 a0 29 50 30 20 35 00
20 4f 31 00 00 1a 48 3f 40 30 62 b0 32 40 40 c0
13 00 20 4f 31 00 00 1e 7d 4b 80 a0 72 b0 2d 40
88 c8 36 00 20 4f 31 00 00 1c 02 3a 80 18 71 38
2d 40 58 2c 45 00 20 4f 31 00 00 1e 00 00 00 9a

00 ff ff ff ff ff ff 00 22 0e 48 36 00 00 00 00
24 1d 01 03 80 50 21 78 2a 47 84 aa 52 4d a0 26
11 50 54 a5 4b 00 d1 c0 a9 c0 81 c0 b3 00 95 00
81 00 81 80 01 01 e7 7c 70 a0 d0 a0 29 50 30 20
3a 00 20 4f 31 00 00 1a 00 00 00 fd 00 1e 4c 1e
5e 22 00 0a 20 20 20 20 20 20 00 00 00 fc 00 48
50 20 45 33 34 34 63 0a 20 20 20 20 00 00 00 ff
00 33 43 51 39 33 36 31 43 5a 32 0a 20 20 01 57

02 03 22 b1 4a 90 1f 04 13 02 03 11 12 01 5a 67
03 0c 00 10 00 00 3c 67 d8 5d c4 01 44 80 00 e2
00 6b 9f 3d 70 a0 d0 a0 15 50 30 20 3a 00 20 4f
31 00 00 1a 56 5e 00 a0 a0 a0 29 50 30 20 35 00
20 4f 31 00 00 1a 48 3f 40 30 62 b0 32 40 40 c0
13 00 20 4f 31 00 00 1e 7d 4b 80 a0 72 b0 2d 40
88 c8 36 00 20 4f 31 00 00 1c 02 3a 80 18 71 38
2d 40 58 2c 45 00 20 4f 31 00 00 1e 00 00 00 9a

----------------

Block 0, Base EDID:
  EDID Structure Version & Revision: 1.3
  Vendor & Product Identification:
    Manufacturer: HPN
    Model: 13896
    Made in: week 36 of 2019
  Basic Display Parameters & Features:
    Digital display
    Maximum image size: 80 cm x 33 cm
    Gamma: 2.20
    DPMS levels: Off
    RGB color display
    First detailed timing is the preferred timing
  Color Characteristics:
    Red  : 0.6650, 0.3203
    Green: 0.3017, 0.6279
    Blue : 0.1503, 0.0664
    White: 0.3134, 0.3281
  Established Timings I & II:
    IBM     :   720x400    70.081663 Hz   9:5     31.467 kHz     28.320000 MHz
    DMT 0x04:   640x480    59.940476 Hz   4:3     31.469 kHz     25.175000 MHz
    DMT 0x06:   640x480    75.000000 Hz   4:3     37.500 kHz     31.500000 MHz
    DMT 0x09:   800x600    60.316541 Hz   4:3     37.879 kHz     40.000000 MHz
    DMT 0x0b:   800x600    75.000000 Hz   4:3     46.875 kHz     49.500000 MHz
    DMT 0x10:  1024x768    60.003840 Hz   4:3     48.363 kHz     65.000000 MHz
    DMT 0x12:  1024x768    75.028582 Hz   4:3     60.023 kHz     78.750000 MHz
    DMT 0x24:  1280x1024   75.024675 Hz   5:4     79.976 kHz    135.000000 MHz
  Standard Timings:
    DMT 0x52:  1920x1080   60.000000 Hz  16:9     67.500 kHz    148.500000 MHz
    DMT 0x53:  1600x900    60.000000 Hz  16:9     60.000 kHz    108.000000 MHz (RB)
    DMT 0x55:  1280x720    60.000000 Hz  16:9     45.000 kHz     74.250000 MHz
    DMT 0x3a:  1680x1050   59.954250 Hz  16:10    65.290 kHz    146.250000 MHz
    DMT 0x2f:  1440x900    59.887445 Hz  16:10    55.935 kHz    106.500000 MHz
    DMT 0x1c:  1280x800    59.810326 Hz  16:10    49.702 kHz     83.500000 MHz
    DMT 0x23:  1280x1024   60.019740 Hz   5:4     63.981 kHz    108.000000 MHz
  Detailed Timing Descriptors:
    DTD 1:  3440x1440   59.972616 Hz  43:18    88.819 kHz    319.750000 MHz (800 mm x 335 mm)
                 Hfront   48 Hsync  32 Hback   80 Hpol P
                 Vfront    3 Vsync  10 Vback   28 Vpol N
    Display Range Limits:
      Monitor ranges (GTF): 30-76 Hz V, 30-94 kHz H, max dotclock 340 MHz
    Display Product Name: 'HP E344c'
    Display Product Serial Number: ...
  Extension blocks: 1
Checksum: 0x57

----------------

Block 1, CTA-861 Extension Block:
  Revision: 3
  Underscans IT Video Formats by default
  Supports YCbCr 4:4:4
  Supports YCbCr 4:2:2
  Native DTDs: 1
  Video Data Block:
    VIC  16:  1920x1080   60.000000 Hz  16:9     67.500 kHz    148.500000 MHz (native)
    VIC  31:  1920x1080   50.000000 Hz  16:9     56.250 kHz    148.500000 MHz
    VIC   4:  1280x720    60.000000 Hz  16:9     45.000 kHz     74.250000 MHz
    VIC  19:  1280x720    50.000000 Hz  16:9     37.500 kHz     74.250000 MHz
    VIC   2:   720x480    59.940060 Hz   4:3     31.469 kHz     27.000000 MHz
    VIC   3:   720x480    59.940060 Hz  16:9     31.469 kHz     27.000000 MHz
    VIC  17:   720x576    50.000000 Hz   4:3     31.250 kHz     27.000000 MHz
    VIC  18:   720x576    50.000000 Hz  16:9     31.250 kHz     27.000000 MHz
    VIC   1:   640x480    59.940476 Hz   4:3     31.469 kHz     25.175000 MHz
    VIC  90:  2560x1080   60.000000 Hz  64:27    66.000 kHz    198.000000 MHz
  Vendor-Specific Data Block (HDMI), OUI 00-0C-03:
    Source physical address: 1.0.0.0
    Maximum TMDS clock: 300 MHz
  Vendor-Specific Data Block (HDMI Forum), OUI C4-5D-D8:
    Version: 1
    Maximum TMDS Character Rate: 340 MHz
    SCDC Present
  Video Capability Data Block:
    YCbCr quantization: No Data
    RGB quantization: Selectable (via AVI Q)
    PT scan behavior: Always Underscanned
    IT scan behavior: Always Underscanned
    CE scan behavior: Supports both over- and underscan
  Detailed Timing Descriptors:
    DTD 2:  3440x1440   29.992775 Hz  43:18    43.819 kHz    157.750000 MHz (800 mm x 335 mm)
                 Hfront   48 Hsync  32 Hback   80 Hpol P
                 Vfront    3 Vsync  10 Vback    8 Vpol N
    DTD 3:  2560x1440   59.950550 Hz  16:9     88.787 kHz    241.500000 MHz (800 mm x 335 mm)
                 Hfront   48 Hsync  32 Hback   80 Hpol P
                 Vfront    3 Vsync   5 Vback   33 Vpol N
    DTD 4:  1600x1200   60.000000 Hz   4:3     75.000 kHz    162.000000 MHz (800 mm x 335 mm)
                 Hfront   64 Hsync 192 Hback  304 Hpol P
                 Vfront    1 Vsync   3 Vback   46 Vpol P
    DTD 5:  1920x1200   59.884600 Hz  16:10    74.556 kHz    193.250000 MHz (800 mm x 335 mm)
                 Hfront  136 Hsync 200 Hback  336 Hpol N
                 Vfront    3 Vsync   6 Vback   36 Vpol P
    DTD 6:  1920x1080   60.000000 Hz  16:9     67.500 kHz    148.500000 MHz (800 mm x 335 mm)
                 Hfront   88 Hsync  44 Hback  148 Hpol P
                 Vfront    4 Vsync   5 Vback   36 Vpol P
Checksum: 0x9a  Unused space in Extension Block: 3 bytes

----------------

Warnings:

Block 1, CTA-861 Extension Block:
  Video Data Block: VIC 16 and the first DTD are not identical. Is this intended?
  Video Capability Data Block: Set Selectable YCbCr Quantization to avoid interop issues.
  Detailed Timing Descriptor #3: Image size is 800x335 mm, but based on the picture AR it should be 595x335 mm.
  Detailed Timing Descriptor #4: Image size is 800x335 mm, but based on the picture AR it should be 446x335 mm.
  Detailed Timing Descriptor #5: Image size is 800x335 mm, but based on the picture AR it should be 536x335 mm.
  Detailed Timing Descriptor #6: Image size is 800x335 mm, but based on the picture AR it should be 595x335 mm.
  Add a Colorimetry Data Block with the sRGB colorimetry bit set to avoid interop issues.

Failures:

Block 1, CTA-861 Extension Block:
  Vendor-Specific Data Block (HDMI Forum), OUI C4-5D-D8: Max TMDS rate is > 0 and <= 340 or > 600.
EDID:
  Extension Block 2 started with EDID header, ignoring Extension Blocks >= 2.
  CTA-861: Native progressive timings are a mix of several resolutions.

EDID conformity: FAIL
