edid-decode (hex):

00 ff ff ff ff ff ff 00 24 62 ff ff 00 00 00 00
20 21 01 03 80 47 28 78 2e b7 d8 a8 54 4e 9d 23
0d 4f 54 a5 cb 00 81 c0 81 80 01 01 a9 c0 01 01
d1 c0 01 01 01 01 58 ce 00 a0 f0 70 29 80 30 20
35 00 c4 8e 21 00 00 1e 00 00 00 fd 00 30 3c 1e
d8 3c 00 0a 20 20 20 20 20 20 00 00 00 fc 00 44
50 0a 20 20 20 20 20 20 20 20 20 20 00 00 00 ff
00 30 30 30 30 30 30 30 30 30 30 30 30 30 01 17

02 03 3f 73 4b 02 03 04 05 90 12 13 14 1f 60 23
20 83 01 00 00 68 03 0c 00 10 00 38 3c 00 67 d8
5d c4 01 78 80 00 6d 1a 00 00 02 03 30 90 ed 04
65 17 5e 1f e3 05 e3 00 e6 06 07 01 62 60 24 2a
ab 00 a0 f0 70 1f 80 20 40 45 00 55 50 21 00 00
1e 38 67 00 a0 f0 70 2a 80 30 20 35 00 55 50 21
00 00 1e 00 00 00 00 00 00 00 00 00 00 00 00 00
00 00 00 00 00 00 00 00 00 00 00 00 00 00 00 03

00 ff ff ff ff ff ff 00 24 62 ff ff 00 00 00 00
20 21 01 03 80 47 28 78 2e b7 d8 a8 54 4e 9d 23
0d 4f 54 a5 cb 00 81 c0 81 80 01 01 a9 c0 01 01
d1 c0 01 01 01 01 58 ce 00 a0 f0 70 29 80 30 20
35 00 c4 8e 21 00 00 1e 00 00 00 fd 00 30 3c 1e
d8 3c 00 0a 20 20 20 20 20 20 00 00 00 fc 00 44
50 0a 20 20 20 20 20 20 20 20 20 20 00 00 00 ff
00 30 30 30 30 30 30 30 30 30 30 30 30 30 01 17

02 03 3f 73 4b 02 03 04 05 90 12 13 14 1f 60 23
20 83 01 00 00 68 03 0c 00 10 00 38 3c 00 67 d8
5d c4 01 78 80 00 6d 1a 00 00 02 03 30 90 ed 04
65 17 5e 1f e3 05 e3 00 e6 06 07 01 62 60 24 2a
ab 00 a0 f0 70 1f 80 20 40 45 00 55 50 21 00 00
1e 38 67 00 a0 f0 70 2a 80 30 20 35 00 55 50 21
00 00 1e 00 00 00 00 00 00 00 00 00 00 00 00 00
00 00 00 00 00 00 00 00 00 00 00 00 00 00 00 03

----------------

Block 0, Base EDID:
  EDID Structure Version & Revision: 1.3
  Vendor & Product Identification:
    Manufacturer: ICB
    Model: 65535
    Made in: week 32 of 2023
  Basic Display Parameters & Features:
    Digital display
    Maximum image size: 71 cm x 40 cm
    Gamma: 2.20
    DPMS levels: Off
    RGB color display
    Default (sRGB) color space is primary color space
    First detailed timing is the preferred timing
  Color Characteristics:
    Red  : 0.6582, 0.3310
    Green: 0.3056, 0.6162
    Blue : 0.1396, 0.0517
    White: 0.3105, 0.3281
  Established Timings I & II:
    IBM     :   720x400    70.081663 Hz   9:5     31.467 kHz     28.320000 MHz
    DMT 0x04:   640x480    59.940476 Hz   4:3     31.469 kHz     25.175000 MHz
    DMT 0x06:   640x480    75.000000 Hz   4:3     37.500 kHz     31.500000 MHz
    DMT 0x09:   800x600    60.316541 Hz   4:3     37.879 kHz     40.000000 MHz
    DMT 0x0a:   800x600    72.187572 Hz   4:3     48.077 kHz     50.000000 MHz
    DMT 0x0b:   800x600    75.000000 Hz   4:3     46.875 kHz     49.500000 MHz
    DMT 0x10:  1024x768    60.003840 Hz   4:3     48.363 kHz     65.000000 MHz
    DMT 0x12:  1024x768    75.028582 Hz   4:3     60.023 kHz     78.750000 MHz
    DMT 0x24:  1280x1024   75.024675 Hz   5:4     79.976 kHz    135.000000 MHz
  Standard Timings:
    DMT 0x55:  1280x720    60.000000 Hz  16:9     45.000 kHz     74.250000 MHz
    DMT 0x23:  1280x1024   60.019740 Hz   5:4     63.981 kHz    108.000000 MHz
    DMT 0x53:  1600x900    60.000000 Hz  16:9     60.000 kHz    108.000000 MHz (RB)
    DMT 0x52:  1920x1080   60.000000 Hz  16:9     67.500 kHz    148.500000 MHz
  Detailed Timing Descriptors:
    DTD 1:  3840x2160   60.000000 Hz  16:9    132.060 kHz    528.240000 MHz (708 mm x 398 mm)
                 Hfront   48 Hsync  32 Hback   80 Hpol P
                 Vfront    3 Vsync   5 Vback   33 Vpol P
    Display Range Limits:
      Monitor ranges (GTF): 48-60 Hz V, 30-216 kHz H, max dotclock 600 MHz
    Display Product Name: 'DP'
    Display Product Serial Number: ...
  Extension blocks: 1
Checksum: 0x17

----------------

Block 1, CTA-861 Extension Block:
  Revision: 3
  Basic audio support
  Supports YCbCr 4:4:4
  Supports YCbCr 4:2:2
  Native DTDs: 3
  Video Data Block:
    VIC   2:   720x480    59.940060 Hz   4:3     31.469 kHz     27.000000 MHz
    VIC   3:   720x480    59.940060 Hz  16:9     31.469 kHz     27.000000 MHz
    VIC   4:  1280x720    60.000000 Hz  16:9     45.000 kHz     74.250000 MHz
    VIC   5:  1920x1080i  60.000000 Hz  16:9     33.750 kHz     74.250000 MHz
    VIC  16:  1920x1080   60.000000 Hz  16:9     67.500 kHz    148.500000 MHz (native)
    VIC  18:   720x576    50.000000 Hz  16:9     31.250 kHz     27.000000 MHz
    VIC  19:  1280x720    50.000000 Hz  16:9     37.500 kHz     74.250000 MHz
    VIC  20:  1920x1080i  50.000000 Hz  16:9     28.125 kHz     74.250000 MHz
    VIC  31:  1920x1080   50.000000 Hz  16:9     56.250 kHz    148.500000 MHz
    VIC  96:  3840x2160   50.000000 Hz  16:9    112.500 kHz    594.000000 MHz
    VIC  35:  2880x480    59.940060 Hz   4:3     31.469 kHz    108.000000 MHz
  Audio Data Block:
  Speaker Allocation Data Block:
    FL/FR - Front Left/Right
  Vendor-Specific Data Block (HDMI), OUI 00-0C-03:
    Source physical address: 1.0.0.0
    DC_36bit
    DC_30bit
    DC_Y444
    Maximum TMDS clock: 300 MHz
  Vendor-Specific Data Block (HDMI Forum), OUI C4-5D-D8:
    Version: 1
    Maximum TMDS Character Rate: 600 MHz
    SCDC Present
  Vendor-Specific Data Block (AMD), OUI 00-00-1A:
    Version: 2
    Feature Caps: 0x03
    Minimum Refresh Rate: 48 Hz
    Maximum Refresh Rate: 144 Hz
    Flags 1.x: 0xed (MCCS)
    Flags 2.x: 0x04
      ST 2084 (PQ) EOTF Supported
      Linear EOTF (Windows scRGB, 0.0 - 125.0) Supported
      Gamma 2.2 EOTF Supported
      BT.2020 Gamut Supported
    Maximum luminance: 101 (445.755 cd/m^2)
    Minimum luminance: 23 (0.036 cd/m^2)
  Colorimetry Data Block:
    xvYCC601
    xvYCC709
    BT2020cYCC
    BT2020YCC
    BT2020RGB
  HDR Static Metadata Data Block:
    Electro optical transfer functions:
      Traditional gamma - SDR luminance range
      Traditional gamma - HDR luminance range
      SMPTE ST2084
    Supported static metadata descriptors:
      Static metadata type 1
    Desired content max luminance: 98 (417.710 cd/m^2)
    Desired content max frame-average luminance: 96 (400.000 cd/m^2)
    Desired content min luminance: 36 (0.083 cd/m^2)
  Detailed Timing Descriptors:
    DTD 2:  3840x2160   49.997718 Hz  16:9    109.545 kHz    438.180000 MHz (597 mm x 336 mm)
                 Hfront   32 Hsync  64 Hback   64 Hpol P
                 Vfront    4 Vsync   5 Vback   22 Vpol P
    DTD 3:  3840x2160   30.000000 Hz  16:9     66.060 kHz    264.240000 MHz (597 mm x 336 mm)
                 Hfront   48 Hsync  32 Hback   80 Hpol P
                 Vfront    3 Vsync   5 Vback   34 Vpol P
Checksum: 0x03  Unused space in Extension Block: 28 bytes

----------------

Warnings:

Block 0, Base EDID:
  Display Product Serial Number: ...
Block 1, CTA-861 Extension Block:
  IT Video Formats are overscanned by default, but normally this should be underscanned.
  Video Data Block: VIC 2 and the first DTD are not identical. Is this intended?
EDID:
  Base EDID: Some timings are out of range of the Monitor Ranges:
    Vertical Freq: 30.000 - 75.029 Hz (Monitor: 48.000 - 60.000 Hz)
    Horizontal Freq: 28.125 - 132.060 kHz (Monitor: 30.000 - 216.000 kHz)

Failures:

Block 0, Base EDID:
  Basic Display Parameters & Features: sRGB is signaled, but the chromaticities do not match.
Block 1, CTA-861 Extension Block:
  Audio Data Block: This Data Block is empty.
  Detailed Timing Descriptor #2: Mismatch of image size 597x336 mm vs display size 710x400 mm.
  Detailed Timing Descriptor #3: Mismatch of image size 597x336 mm vs display size 710x400 mm.
  Missing VCDB, needed for Set Selectable RGB Quantization to avoid interop issues.
EDID:
  Extension Block 2 started with EDID header, ignoring Extension Blocks >= 2.
  CTA-861: Native progressive timings are a mix of several resolutions.

EDID conformity: FAIL
