edid-decode (hex):

00 ff ff ff ff ff ff 00 0e 11 40 13 35 37 39 48
16 09 01 01 68 20 18 8a e8 fb 89 a1 55 4b 97 24
11 48 4c a4 63 80 45 59 61 59 71 4f 31 59 a9 45
01 01 01 01 01 01 d6 09 80 90 20 e0 1d 10 10 60
a2 00 40 f0 10 08 08 18 00 00 00 fd 00 32 a0 1e
55 11 00 0a 20 20 20 20 20 20 00 00 00 ff 00 39
32 32 43 46 30 33 54 48 39 37 35 0a 00 00 00 fc
00 43 4f 4d 50 41 51 20 56 37 30 30 0a 20 00 b8

00 ff ff ff ff ff ff 00 0e 11 40 13 35 37 39 48
16 09 01 01 68 20 18 8a e8 fb 89 a1 55 4b 97 24
11 48 4c a4 63 80 45 59 61 59 71 4f 31 59 a9 45
01 01 01 01 01 01 d6 09 80 90 20 e0 1d 10 10 60
a2 00 40 f0 10 08 08 18 00 00 00 fd 00 32 a0 1e
55 11 00 0a 20 20 20 20 20 20 00 00 00 ff 00 39
32 32 43 46 30 33 54 48 39 37 35 0a 00 00 00 fc
00 43 4f 4d 50 41 51 20 56 37 30 30 0a 20 00 b8

----------------

Block 0, Base EDID:
  EDID Structure Version & Revision: 1.1
  Vendor & Product Identification:
    Manufacturer: CPQ
    Model: 4928
    Serial Number: ...
    Made in: week 22 of 1999
  Basic Display Parameters & Features:
    Analog display
    Signal Level Standard: 0.700 : 0.000 : 0.700 V p-p
    Blank level equals black level
    Sync: Separate
    Maximum image size: 32 cm x 24 cm
    Gamma: 2.38
    DPMS levels: Standby Suspend Off
    RGB color display
  Color Characteristics:
    Red  : 0.6318, 0.3349
    Green: 0.2949, 0.5927
    Blue : 0.1425, 0.0664
    White: 0.2832, 0.2978
  Established Timings I & II:
    IBM     :   720x400    70.081663 Hz   9:5     31.467 kHz     28.320000 MHz
    DMT 0x04:   640x480    59.940476 Hz   4:3     31.469 kHz     25.175000 MHz
    DMT 0x06:   640x480    75.000000 Hz   4:3     37.500 kHz     31.500000 MHz
    DMT 0x0b:   800x600    75.000000 Hz   4:3     46.875 kHz     49.500000 MHz
    Apple   :   832x624    74.551266 Hz   4:3     49.726 kHz     57.284000 MHz
    DMT 0x12:  1024x768    75.028582 Hz   4:3     60.023 kHz     78.750000 MHz
    DMT 0x24:  1280x1024   75.024675 Hz   5:4     79.976 kHz    135.000000 MHz
    Apple   :  1152x870    75.061550 Hz 192:145   68.681 kHz    100.000000 MHz
  Standard Timings:
    DMT 0x0c:   800x600    85.061274 Hz   4:3     53.674 kHz     56.250000 MHz
    DMT 0x13:  1024x768    84.996690 Hz   4:3     68.677 kHz     94.500000 MHz
    DMT 0x15:  1152x864    75.000000 Hz   4:3     67.500 kHz    108.000000 MHz
    DMT 0x07:   640x480    85.008312 Hz   4:3     43.269 kHz     36.000000 MHz
    DMT 0x34:  1600x1200   65.000000 Hz   4:3     81.250 kHz    175.500000 MHz
  Detailed Timing Descriptors:
    DTD 1:   640x480    63.098913 Hz   4:3     32.117 kHz     25.180000 MHz (320 mm x 240 mm)
                 Hfront   16 Hsync  96 Hback   16 Hpol N Hborder 8
                 Vfront   10 Vsync   2 Vback    1 Vpol N Vborder 8
    Display Range Limits:
      Monitor ranges (GTF): 50-160 Hz V, 30-85 kHz H, max dotclock 170 MHz
    Display Product Serial Number: ...
    Display Product Name: 'COMPAQ V700'
Checksum: 0xb8

----------------

Warnings:

Block 0, Base EDID:
  EDID Structure Version & Revision: EDID 1.1 is deprecated, do not use.
  Detailed Timing Descriptor #1: The use of non-zero borders in a DTD is not recommended.
EDID:
  Base EDID: Some timings are out of range of the Monitor Ranges:
    Maximum Clock: 175.500 MHz (Monitor: 170.000 MHz)
    Could be due to a Monitor Range off-by-one rounding issue

Failures:

EDID:
  Extension Block 1 started with EDID header, ignoring Extension Blocks >= 1.

EDID conformity: FAIL
