edid-decode (hex):

00 ff ff ff ff ff ff 00 08 4b 03 17 00 00 00 00
28 0e 01 03 68 23 1d 78 e8 ff ba a1 56 47 98 24
14 48 4b af cf 00 81 40 01 01 01 01 01 01 01 01
01 01 01 01 01 01 30 2a 00 fd 00 3c 55 1f 5b ff
00 0a 20 20 20 20 20 20 00 00 00 ff 00 32 a0 1e
57 ff 00 0a 20 20 20 20 20 20 00 00 00 fc 00 42
42 4b 20 4c 43 44 31 37 30 33 41 20 20 20 20 20
20 20 20 20 20 20 20 20 20 20 20 20 20 20 00 4c

00 ff ff ff ff ff ff 00 08 4b 03 17 00 00 00 00
28 0e 01 03 68 23 1d 78 e8 ff ba a1 56 47 98 24
14 48 4b af cf 00 81 40 01 01 01 01 01 01 01 01
01 01 01 01 01 01 30 2a 00 fd 00 3c 55 1f 5b ff
00 0a 20 20 20 20 20 20 00 00 00 ff 00 32 a0 1e
57 ff 00 0a 20 20 20 20 20 20 00 00 00 fc 00 42
42 4b 20 4c 43 44 31 37 30 33 41 20 20 20 20 20
20 20 20 20 20 20 20 20 20 20 20 20 20 20 00 4c

----------------

Block 0, Base EDID:
  EDID Structure Version & Revision: 1.3
  Vendor & Product Identification:
    Manufacturer: BBK
    Model: 5891
    Made in: week 40 of 2004
  Basic Display Parameters & Features:
    Analog display
    Signal Level Standard: 0.700 : 0.000 : 0.700 V p-p
    Blank level equals black level
    Sync: Separate
    Maximum image size: 35 cm x 29 cm
    Gamma: 2.20
    DPMS levels: Standby Suspend Off
    RGB color display
  Color Characteristics:
    Red  : 0.6318, 0.3388
    Green: 0.2802, 0.5966
    Blue : 0.1425, 0.0810
    White: 0.2832, 0.2949
  Established Timings I & II:
    IBM     :   720x400    70.081663 Hz   9:5     31.467 kHz     28.320000 MHz
    DMT 0x04:   640x480    59.940476 Hz   4:3     31.469 kHz     25.175000 MHz
    DMT 0x05:   640x480    72.808802 Hz   4:3     37.861 kHz     31.500000 MHz
    DMT 0x06:   640x480    75.000000 Hz   4:3     37.500 kHz     31.500000 MHz
    DMT 0x08:   800x600    56.250000 Hz   4:3     35.156 kHz     36.000000 MHz
    DMT 0x09:   800x600    60.316541 Hz   4:3     37.879 kHz     40.000000 MHz
    DMT 0x0a:   800x600    72.187572 Hz   4:3     48.077 kHz     50.000000 MHz
    DMT 0x0b:   800x600    75.000000 Hz   4:3     46.875 kHz     49.500000 MHz
    DMT 0x10:  1024x768    60.003840 Hz   4:3     48.363 kHz     65.000000 MHz
    DMT 0x11:  1024x768    70.069359 Hz   4:3     56.476 kHz     75.000000 MHz
    DMT 0x12:  1024x768    75.028582 Hz   4:3     60.023 kHz     78.750000 MHz
    DMT 0x24:  1280x1024   75.024675 Hz   5:4     79.976 kHz    135.000000 MHz
  Standard Timings:
    DMT 0x20:  1280x960    60.000000 Hz   4:3     60.000 kHz    108.000000 MHz
  Detailed Timing Descriptors:
    DTD 1:     0x316   100.654909 Hz   0:1    426.877 kHz    108.000000 MHz (analog composite, sync-on-green, field sequential L/R, 544 mm x 32 mm)
                 Hfront   91 Hsync 255 Hback -157 Hpol N Hborder 32
                 Vfront   32 Vsync  32 Vback 3797 Vpol N Vborder 32
                   30 2a 00 fd 00 3c 55 1f 5b ff 00 0a 20 20 20 20 20 20 '0*...<U.[...      '
    Display Product Serial Number: ...
    Display Product Name: 'BBK LCD1703A '
    DTD 2:   544x544   247.878086 Hz   1:1    142.778 kHz     82.240000 MHz (analog composite, sync-on-green, field sequential L/R, 544 mm x 32 mm)
                 Hfront   32 Hsync 544 Hback -608 Hpol N Hborder 32
                 Vfront    2 Vsync   0 Vback  -34 Vpol N Vborder 32
                   20 20 20 20 20 20 20 20 20 20 20 20 20 20 20 20 20 20 '                  '
Checksum: 0x4c

----------------

Block 1, Unknown EDID Extension Block 0x00:
  00 ff ff ff ff ff ff 00 08 4b 03 17 00 00 00 00 '.........K......'
  28 0e 01 03 68 23 1d 78 e8 ff ba a1 56 47 98 24 '(...h#.x....VG.$'
  14 48 4b af cf 00 81 40 01 01 01 01 01 01 01 01 '.HK....@........'
  01 01 01 01 01 01 30 2a 00 fd 00 3c 55 1f 5b ff '......0*...<U.[.'
  00 0a 20 20 20 20 20 20 00 00 00 ff 00 32 a0 1e '..      .....2..'
  57 ff 00 0a 20 20 20 20 20 20 00 00 00 fc 00 42 'W...      .....B'
  42 4b 20 4c 43 44 31 37 30 33 41 20 20 20 20 20 'BK LCD1703A     '
  20 20 20 20 20 20 20 20 20 20 20 20 20 20 00 4c '              .L'
Checksum: 0x4c

----------------

Warnings:

Block 0, Base EDID:
  Display Product Serial Number: ...
  Display Product Serial Number: ...
  Detailed Timing Descriptor #1: Dubious image size (544x32 mm is smaller than 100x100 mm).
  Detailed Timing Descriptor #1: The use of non-zero borders in a DTD is not recommended.
  Detailed Timing Descriptor #2: Dubious image size (544x32 mm is smaller than 100x100 mm).
  Detailed Timing Descriptor #2: The use of non-zero borders in a DTD is not recommended.

Failures:

Block 0, Base EDID:
  Display Product Serial Number: ...
  Basic Display Parameters & Features: EDID 1.3 requires that the first detailed timing is the preferred timing.
  Detailed Timing Descriptor #1: 0 values in the video timing:
    Horizontal Active/Blanking 0/253
    Horizontal Frontporch/Sync Width 91/255
    Vertical Active/Blanking 316/3925
    Vertical Frontporch/Sync Width 32/32
  Detailed Timing Descriptor #1: 0 or negative horizontal back porch.
  Detailed Timing Descriptor #1: Mismatch of image size 544x32 mm vs display size 350x290 mm.
  Display Product Name: No newline, but one or more trailing spaces.
  Detailed Timing Descriptor #2: 0 values in the video timing:
    Horizontal Active/Blanking 544/32
    Horizontal Frontporch/Sync Width 32/544
    Vertical Active/Blanking 544/32
    Vertical Frontporch/Sync Width 2/0
  Detailed Timing Descriptor #2: 0 or negative horizontal back porch.
  Detailed Timing Descriptor #2: 0 or negative vertical back porch.
  Detailed Timing Descriptor #2: Mismatch of image size 544x32 mm vs display size 350x290 mm.
  Detailed Timing Descriptor #2: Invalid detailed timing descriptor ordering.
  Missing Display Range Limits Descriptor.
Block 1, Base EDID:
  Unknown Extension Block.
EDID:
  Base EDID: The DTD max image size is 544x32mm, which is larger than the display size 350.0x290.0mm.
  Base EDID: EDID specified 0 extension block(s), but found 1 extension block(s).

EDID conformity: FAIL
