edid-decode (hex):

00 ff ff ff ff ff ff 00 22 64 e9 03 4c 19 00 00
2d 15 01 03 80 16 0d 78 0a 80 36 9a 5e 5d 91 28
20 4f 54 00 00 00 01 01 01 01 01 01 01 01 01 01
01 01 01 01 01 01 ec 13 00 e2 40 58 50 20 5d 23
15 04 dc 81 00 00 00 19 00 00 00 fe 00 00 00 00
00 00 00 00 00 00 00 00 00 00 00 00 00 fc 00 48
53 44 31 30 30 49 46 57 31 41 0a 20 00 00 00 10
00 0a 20 20 20 20 20 20 20 20 20 20 20 20 00 af

00 ff ff ff ff ff ff 00 22 64 e9 03 4c 19 00 00
2d 15 01 03 80 16 0d 78 0a 80 36 9a 5e 5d 91 28
20 4f 54 00 00 00 01 01 01 01 01 01 01 01 01 01
01 01 01 01 01 01 ec 13 00 e2 40 58 50 20 5d 23
15 04 dc 81 00 00 00 19 00 00 00 fe 00 00 00 00
00 00 00 00 00 00 00 00 00 00 00 00 00 fc 00 48
53 44 31 30 30 49 46 57 31 41 0a 20 00 00 00 10
00 0a 20 20 20 20 20 20 20 20 20 20 20 20 00 af

----------------

Block 0, Base EDID:
  EDID Structure Version & Revision: 1.3
  Vendor & Product Identification:
    Manufacturer: HSD
    Model: 1001
    Serial Number: ...
    Made in: week 45 of 2011
  Basic Display Parameters & Features:
    Digital display
    Maximum image size: 22 cm x 13 cm
    Gamma: 2.20
    RGB color display
    First detailed timing is the preferred timing
  Color Characteristics:
    Red  : 0.6035, 0.3671
    Green: 0.3632, 0.5664
    Blue : 0.1562, 0.1279
    White: 0.3095, 0.3300
  Established Timings I & II: none
  Standard Timings: none
  Detailed Timing Descriptors:
    DTD 1:  1024x600    60.000000 Hz 128:75    40.800 kHz     51.000000 MHz (220 mm x 129 mm)
                 Hfront   93 Hsync  35 Hback   98 Hpol N
                 Vfront   17 Vsync   5 Vback   58 Vpol N
    Alphanumeric Data String: ''
    Display Product Name: 'HSD100IFW1A'
    Dummy Descriptor:
Checksum: 0xaf

----------------

Block 1, Unknown EDID Extension Block 0x00:
  00 ff ff ff ff ff ff 00 22 64 e9 03 4c 19 00 00 '........"d..L...'
  2d 15 01 03 80 16 0d 78 0a 80 36 9a 5e 5d 91 28 '-......x..6.^].('
  20 4f 54 00 00 00 01 01 01 01 01 01 01 01 01 01 ' OT.............'
  01 01 01 01 01 01 ec 13 00 e2 40 58 50 20 5d 23 '..........@XP ]#'
  15 04 dc 81 00 00 00 19 00 00 00 fe 00 00 00 00 '................'
  00 00 00 00 00 00 00 00 00 00 00 00 00 fc 00 48 '...............H'
  53 44 31 30 30 49 46 57 31 41 0a 20 00 00 00 10 'SD100IFW1A. ....'
  00 0a 20 20 20 20 20 20 20 20 20 20 20 20 00 af '..            ..'
Checksum: 0xaf

----------------

Failures:

Block 0, Base EDID:
  Alphanumeric Data String: NUL byte at position 0.
  Dummy Descriptor: Dummy block filled with garbage.
  Missing Display Range Limits Descriptor.
Block 1, Base EDID:
  Unknown Extension Block.
EDID:
  Base EDID: EDID specified 0 extension block(s), but found 1 extension block(s).

EDID conformity: FAIL
