edid-decode (hex):

00 ff ff ff ff ff ff 00 04 72 3c 07 6e 32 00 00
14 1e 01 03 68 35 1e 78 2a 07 c5 a3 54 4b 9d 25
11 50 54 b3 0c 00 71 4f 81 80 81 c0 81 00 95 00
b3 00 d1 c0 01 01 2a 44 80 a0 70 38 27 40 08 20
98 04 0f 28 21 00 00 1a 00 00 00 ff 00 54 4a 48
45 45 30 30 31 33 45 30 30 0a 00 00 00 fd 00 30
4b 1e 55 12 00 0a 20 20 20 20 20 20 00 00 00 fc
00 4b 41 32 34 32 59 0a 20 20 20 20 20 20 00 b9

00 ff ff ff ff ff ff 00 04 72 3c 07 6e 32 00 00
14 1e 01 03 68 35 1e 78 2a 07 c5 a3 54 4b 9d 25
11 50 54 b3 0c 00 71 4f 81 80 81 c0 81 00 95 00
b3 00 d1 c0 01 01 2a 44 80 a0 70 38 27 40 08 20
98 04 0f 28 21 00 00 1a 00 00 00 ff 00 54 4a 48
45 45 30 30 31 33 45 30 30 0a 00 00 00 fd 00 30
4b 1e 55 12 00 0a 20 20 20 20 20 20 00 00 00 fc
00 4b 41 32 34 32 59 0a 20 20 20 20 20 20 00 b9

----------------

Block 0, Base EDID:
  EDID Structure Version & Revision: 1.3
  Vendor & Product Identification:
    Manufacturer: ACR
    Model: 1852
    Serial Number: ...
    Made in: week 20 of 2020
  Basic Display Parameters & Features:
    Analog display
    Signal Level Standard: 0.700 : 0.000 : 0.700 V p-p
    Blank level equals black level
    Sync: Separate
    Maximum image size: 53 cm x 30 cm
    Gamma: 2.20
    DPMS levels: Off
    RGB color display
    First detailed timing is the preferred timing
  Color Characteristics:
    Red  : 0.6367, 0.3281
    Green: 0.2939, 0.6162
    Blue : 0.1474, 0.0664
    White: 0.3134, 0.3291
  Established Timings I & II:
    IBM     :   720x400    70.081663 Hz   9:5     31.467 kHz     28.320000 MHz
    DMT 0x04:   640x480    59.940476 Hz   4:3     31.469 kHz     25.175000 MHz
    Apple   :   640x480    66.666667 Hz   4:3     35.000 kHz     30.240000 MHz
    DMT 0x08:   800x600    56.250000 Hz   4:3     35.156 kHz     36.000000 MHz
    DMT 0x09:   800x600    60.316541 Hz   4:3     37.879 kHz     40.000000 MHz
    DMT 0x10:  1024x768    60.003840 Hz   4:3     48.363 kHz     65.000000 MHz
    DMT 0x11:  1024x768    70.069359 Hz   4:3     56.476 kHz     75.000000 MHz
  Standard Timings:
    DMT 0x15:  1152x864    75.000000 Hz   4:3     67.500 kHz    108.000000 MHz
    DMT 0x23:  1280x1024   60.019740 Hz   5:4     63.981 kHz    108.000000 MHz
    DMT 0x55:  1280x720    60.000000 Hz  16:9     45.000 kHz     74.250000 MHz
    DMT 0x1c:  1280x800    59.810326 Hz  16:10    49.702 kHz     83.500000 MHz
    DMT 0x2f:  1440x900    59.887445 Hz  16:10    55.935 kHz    106.500000 MHz
    DMT 0x3a:  1680x1050   59.954250 Hz  16:10    65.290 kHz    146.250000 MHz
    DMT 0x52:  1920x1080   60.000000 Hz  16:9     67.500 kHz    148.500000 MHz
  Detailed Timing Descriptors:
    DTD 1:  1920x1080   74.972503 Hz  16:9     83.894 kHz    174.500000 MHz (527 mm x 296 mm)
                 Hfront    8 Hsync  32 Hback  120 Hpol P
                 Vfront   25 Vsync   8 Vback    6 Vpol N
    Display Product Serial Number: ...
    Display Range Limits:
      Monitor ranges (GTF): 48-75 Hz V, 30-85 kHz H, max dotclock 180 MHz
    Display Product Name: 'KA242Y'
Checksum: 0xb9

----------------

Failures:

EDID:
  Extension Block 1 started with EDID header, ignoring Extension Blocks >= 1.

EDID conformity: FAIL
