edid-decode (hex):

00 ff ff ff ff ff ff 00 38 a3 1d 67 01 01 01 01
19 12 01 03 80 29 1a 78 ee ee d5 a5 55 48 9b 26
12 50 54 bf ef 80 95 00 81 80 71 4f 01 01 01 01
01 01 01 01 01 01 9a 29 a0 d0 51 84 22 30 50 98
36 00 9a 00 11 00 00 1c 01 1d 00 72 51 d0 1e 20
6e 28 55 00 9a 00 11 00 00 1e 00 00 00 fd 00 38
4c 1e 52 0e 00 0a 20 20 20 20 20 20 00 00 00 fc
00 4c 43 44 31 39 57 4d 47 58 0a 20 20 20 01 af

02 03 0f 01 4a 84 03 12 05 10 00 00 00 00 00 8c
0a d0 8a 20 e0 2d 10 10 3e 96 00 9a 00 11 00 00
18 8c 0a d0 90 20 40 31 20 0c 40 55 00 9a 00 11
00 00 18 01 1d 80 18 71 1c 16 20 58 2c 25 00 9a
00 11 00 00 9e 02 3a 80 18 71 38 2d 40 58 2c 45
00 9a 00 11 00 00 1e 00 00 00 01 00 31 30 0a 00
00 00 00 00 00 00 00 00 00 00 00 00 ff 00 38 36
33 30 36 31 31 36 4e 42 0a 20 20 00 00 00 00 49

00 ff ff ff ff ff ff 00 38 a3 1d 67 01 01 01 01
19 12 01 03 80 29 1a 78 ee ee d5 a5 55 48 9b 26
12 50 54 bf ef 80 95 00 81 80 71 4f 01 01 01 01
01 01 01 01 01 01 9a 29 a0 d0 51 84 22 30 50 98
36 00 9a 00 11 00 00 1c 01 1d 00 72 51 d0 1e 20
6e 28 55 00 9a 00 11 00 00 1e 00 00 00 fd 00 38
4c 1e 52 0e 00 0a 20 20 20 20 20 20 00 00 00 fc
00 4c 43 44 31 39 57 4d 47 58 0a 20 20 20 01 af

02 03 0f 01 4a 84 03 12 05 10 00 00 00 00 00 8c
0a d0 8a 20 e0 2d 10 10 3e 96 00 9a 00 11 00 00
18 8c 0a d0 90 20 40 31 20 0c 40 55 00 9a 00 11
00 00 18 01 1d 80 18 71 1c 16 20 58 2c 25 00 9a
00 11 00 00 9e 02 3a 80 18 71 38 2d 40 58 2c 45
00 9a 00 11 00 00 1e 00 00 00 01 00 31 30 0a 00
00 00 00 00 00 00 00 00 00 00 00 00 ff 00 38 36
33 30 36 31 31 36 4e 42 0a 20 20 00 00 00 00 49

----------------

Block 0, Base EDID:
  EDID Structure Version & Revision: 1.3
  Vendor & Product Identification:
    Manufacturer: NEC
    Model: 26397
    Serial Number: ...
    Made in: week 25 of 2008
  Basic Display Parameters & Features:
    Digital display
    Maximum image size: 41 cm x 26 cm
    Gamma: 2.20
    DPMS levels: Standby Suspend Off
    RGB color display
    Default (sRGB) color space is primary color space
    First detailed timing is the preferred timing
  Color Characteristics:
    Red  : 0.6474, 0.3339
    Green: 0.2841, 0.6074
    Blue : 0.1513, 0.0712
    White: 0.3134, 0.3291
  Established Timings I & II:
    IBM     :   720x400    70.081663 Hz   9:5     31.467 kHz     28.320000 MHz
    DMT 0x04:   640x480    59.940476 Hz   4:3     31.469 kHz     25.175000 MHz
    Apple   :   640x480    66.666667 Hz   4:3     35.000 kHz     30.240000 MHz
    DMT 0x05:   640x480    72.808802 Hz   4:3     37.861 kHz     31.500000 MHz
    DMT 0x06:   640x480    75.000000 Hz   4:3     37.500 kHz     31.500000 MHz
    DMT 0x08:   800x600    56.250000 Hz   4:3     35.156 kHz     36.000000 MHz
    DMT 0x09:   800x600    60.316541 Hz   4:3     37.879 kHz     40.000000 MHz
    DMT 0x0a:   800x600    72.187572 Hz   4:3     48.077 kHz     50.000000 MHz
    DMT 0x0b:   800x600    75.000000 Hz   4:3     46.875 kHz     49.500000 MHz
    Apple   :   832x624    74.551266 Hz   4:3     49.726 kHz     57.284000 MHz
    DMT 0x10:  1024x768    60.003840 Hz   4:3     48.363 kHz     65.000000 MHz
    DMT 0x11:  1024x768    70.069359 Hz   4:3     56.476 kHz     75.000000 MHz
    DMT 0x12:  1024x768    75.028582 Hz   4:3     60.023 kHz     78.750000 MHz
    DMT 0x24:  1280x1024   75.024675 Hz   5:4     79.976 kHz    135.000000 MHz
    Apple   :  1152x870    75.061550 Hz 192:145   68.681 kHz    100.000000 MHz
  Standard Timings:
    DMT 0x2f:  1440x900    59.887445 Hz  16:10    55.935 kHz    106.500000 MHz
    DMT 0x23:  1280x1024   60.019740 Hz   5:4     63.981 kHz    108.000000 MHz
    DMT 0x15:  1152x864    75.000000 Hz   4:3     67.500 kHz    108.000000 MHz
  Detailed Timing Descriptors:
    DTD  1:  1440x900    59.887445 Hz  16:10    55.935 kHz    106.500000 MHz (410 mm x 256 mm)
                  Hfront   80 Hsync 152 Hback  232 Hpol N
                  Vfront    3 Vsync   6 Vback   25 Vpol P
    DTD  2:  1280x720    60.000000 Hz  16:9     45.000 kHz     74.250000 MHz (410 mm x 256 mm)
                  Hfront  110 Hsync  40 Hback  220 Hpol P
                  Vfront    5 Vsync   5 Vback   20 Vpol P
    Display Range Limits:
      Monitor ranges (GTF): 56-76 Hz V, 30-82 kHz H, max dotclock 140 MHz
    Display Product Name: 'LCD19WMGX'
  Extension blocks: 1
Checksum: 0xaf

----------------

Block 1, CTA-861 Extension Block:
  Revision: 3
  Native detailed modes: 1
  Video Data Block:
    VIC   4:  1280x720    60.000000 Hz  16:9     45.000 kHz     74.250000 MHz (native)
    VIC   3:   720x480    59.940060 Hz  16:9     31.469 kHz     27.000000 MHz
    VIC  18:   720x576    50.000000 Hz  16:9     31.250 kHz     27.000000 MHz
    VIC   5:  1920x1080i  60.000000 Hz  16:9     33.750 kHz     74.250000 MHz
    VIC  16:  1920x1080   60.000000 Hz  16:9     67.500 kHz    148.500000 MHz
  Detailed Timing Descriptors:
    DTD  3:   720x480    59.940060 Hz   3:2     31.469 kHz     27.000000 MHz (410 mm x 256 mm)
                  Hfront   16 Hsync  62 Hback   60 Hpol N
                  Vfront    9 Vsync   6 Vback   30 Vpol N
    DTD  4:   720x576    50.000000 Hz   5:4     31.250 kHz     27.000000 MHz (410 mm x 256 mm)
                  Hfront   12 Hsync  64 Hback   68 Hpol N
                  Vfront    5 Vsync   5 Vback   39 Vpol N
    DTD  5:  1920x1080i  60.000000 Hz  16:9     33.750 kHz     74.250000 MHz (410 mm x 256 mm)
                  Hfront   88 Hsync  44 Hback  148 Hpol P
                  Vfront    2 Vsync   5 Vback   15 Vpol P Vfront +0.5 Odd Field
                  Vfront    2 Vsync   5 Vback   15 Vpol P Vback  +0.5 Even Field
    DTD  6:  1920x1080   60.000000 Hz  16:9     67.500 kHz    148.500000 MHz (410 mm x 256 mm)
                  Hfront   88 Hsync  44 Hback  148 Hpol P
                  Vfront    4 Vsync   5 Vback   36 Vpol P
    Manufacturer-Specified Display Descriptor (0x01): 00 01 00 31 30 0a 00 00 00 00 00 00 00 00 00 00 '...10...........'
    Display Product Serial Number: ...
Checksum: 0x49  Unused space in Extension Block: 4 bytes

----------------

Block 2, Unknown EDID Extension Block 0x00:
  00 ff ff ff ff ff ff 00 38 a3 1d 67 01 01 01 01 '........8..g....'
  19 12 01 03 80 29 1a 78 ee ee d5 a5 55 48 9b 26 '.....).x....UH.&'
  12 50 54 bf ef 80 95 00 81 80 71 4f 01 01 01 01 '.PT.......qO....'
  01 01 01 01 01 01 9a 29 a0 d0 51 84 22 30 50 98 '.......)..Q."0P.'
  36 00 9a 00 11 00 00 1c 01 1d 00 72 51 d0 1e 20 '6..........rQ.. '
  6e 28 55 00 9a 00 11 00 00 1e 00 00 00 fd 00 38 'n(U............8'
  4c 1e 52 0e 00 0a 20 20 20 20 20 20 00 00 00 fc 'L.R...      ....'
  00 4c 43 44 31 39 57 4d 47 58 0a 20 20 20 01 af '.LCD19WMGX.   ..'
Checksum: 0xaf

----------------

Block 3, CTA-861 Extension Block:
  Revision: 3
  Native detailed modes: 1
  Video Data Block:
    VIC   4:  1280x720    60.000000 Hz  16:9     45.000 kHz     74.250000 MHz (native)
    VIC   3:   720x480    59.940060 Hz  16:9     31.469 kHz     27.000000 MHz
    VIC  18:   720x576    50.000000 Hz  16:9     31.250 kHz     27.000000 MHz
    VIC   5:  1920x1080i  60.000000 Hz  16:9     33.750 kHz     74.250000 MHz
    VIC  16:  1920x1080   60.000000 Hz  16:9     67.500 kHz    148.500000 MHz
  Detailed Timing Descriptors:
    DTD  7:   720x480    59.940060 Hz   3:2     31.469 kHz     27.000000 MHz (410 mm x 256 mm)
                  Hfront   16 Hsync  62 Hback   60 Hpol N
                  Vfront    9 Vsync   6 Vback   30 Vpol N
    DTD  8:   720x576    50.000000 Hz   5:4     31.250 kHz     27.000000 MHz (410 mm x 256 mm)
                  Hfront   12 Hsync  64 Hback   68 Hpol N
                  Vfront    5 Vsync   5 Vback   39 Vpol N
    DTD  9:  1920x1080i  60.000000 Hz  16:9     33.750 kHz     74.250000 MHz (410 mm x 256 mm)
                  Hfront   88 Hsync  44 Hback  148 Hpol P
                  Vfront    2 Vsync   5 Vback   15 Vpol P Vfront +0.5 Odd Field
                  Vfront    2 Vsync   5 Vback   15 Vpol P Vback  +0.5 Even Field
    DTD 10:  1920x1080   60.000000 Hz  16:9     67.500 kHz    148.500000 MHz (410 mm x 256 mm)
                  Hfront   88 Hsync  44 Hback  148 Hpol P
                  Vfront    4 Vsync   5 Vback   36 Vpol P
    Manufacturer-Specified Display Descriptor (0x01): 00 01 00 31 30 0a 00 00 00 00 00 00 00 00 00 00 '...10...........'
    Display Product Serial Number: ...
Checksum: 0x49  Unused space in Extension Block: 4 bytes

----------------

Warnings:

Block 0, Base EDID:
  Vendor & Product Identification: The serial number is one of the known dummy values, it should probably be set to 0.
  Detailed Timing Descriptor #2: Image size is 410x256 mm, but based on the picture AR it should be 410x230 mm.
Block 1, CTA-861 Extension Block:
  IT Video Formats are overscanned by default, but normally this should be underscanned.
  Video Data Block: VIC 4 and the first DTD are not identical. Is this intended?
  Detailed Timing Descriptor #3: Image size is 410x256 mm, but based on the picture AR it should be 410x273 mm.
  Detailed Timing Descriptor #4: Image size is 410x256 mm, but based on the picture AR it should be 410x328 mm.
  Detailed Timing Descriptor #5: Image size is 410x256 mm, but based on the picture AR it should be 410x230 mm.
  Detailed Timing Descriptor #6: Image size is 410x256 mm, but based on the picture AR it should be 410x230 mm.
  Display Product Serial Number is set, so the Serial Number in the Base EDID should be 0.
Block 3, CTA-861 Extension Block:
  IT Video Formats are overscanned by default, but normally this should be underscanned.
  Detailed Timing Descriptor #7: Image size is 410x256 mm, but based on the picture AR it should be 410x273 mm.
  Detailed Timing Descriptor #8: Image size is 410x256 mm, but based on the picture AR it should be 410x328 mm.
  Detailed Timing Descriptor #9: Image size is 410x256 mm, but based on the picture AR it should be 410x230 mm.
  Detailed Timing Descriptor #10: Image size is 410x256 mm, but based on the picture AR it should be 410x230 mm.
EDID:
  Base EDID: Some timings are out of range of the Monitor Ranges:
    Vertical Freq: 50.000 - 75.062 Hz (Monitor: 56.000 - 76.000 Hz)
    Maximum Clock: 148.500 MHz (Monitor: 140.000 MHz)
  Base EDID: Multiple Display Product Serial Numbers are specified, is that intended?

Failures:

Block 0, Base EDID:
  Basic Display Parameters & Features: sRGB is signaled, but the chromaticities do not match.
Block 1, CTA-861 Extension Block:
  Missing VCDB, needed for Set Selectable RGB Quantization to avoid interop issues.
Block 2, Base EDID:
  Unknown Extension Block.
Block 3, CTA-861 Extension Block:
  Video Data Block: Duplicate VIC 4.
  Video Data Block: Duplicate VIC 3.
  Video Data Block: Duplicate VIC 18.
  Video Data Block: Duplicate VIC 5.
  Video Data Block: Duplicate VIC 16.
EDID:
  Base EDID: EDID specified 1 extension block(s), but found 3 extension block(s).
  Base EDID: EDID 1.3 requires a Block Map Extension in Block 1 if there are more than 2 blocks in the EDID.
  CTA-861: Native progressive timings are a mix of several resolutions.

EDID conformity: FAIL
