edid-decode (hex):

00 ff ff ff ff ff ff 00 22 0e 59 36 01 00 00 00
2b 1e 01 03 80 46 28 78 2a 6d a5 a3 55 4f 98 27
0f 50 54 21 08 00 d1 c0 a9 c0 81 c0 b3 00 95 00
81 00 81 80 01 01 02 3a 80 18 71 38 2d 40 58 2c
45 00 bb 89 21 00 00 1e 00 00 00 fd 00 3c 3c 1e
46 0f 00 0a 20 20 20 20 20 20 00 00 00 fc 00 48
50 20 33 32 66 0a 20 20 20 20 20 20 00 00 00 ff
00 33 43 4d 30 34 33 31 37 34 34 20 20 20 01 b3

02 03 13 b1 45 90 04 03 02 01 65 03 0c 00 10 00
e2 00 6b 02 3a 80 18 71 38 2d 40 58 2c 45 00 bb
89 21 00 00 1e 01 1d 00 72 51 d0 1e 20 6e 28 55
00 bb 89 21 00 00 1e 8c 0a d0 8a 20 e0 2d 10 10
3e 96 00 bb 89 21 00 00 18 d6 09 80 a0 20 e0 2d
10 10 60 a2 00 bb 89 21 00 00 18 00 00 00 00 00
00 00 00 00 00 00 00 00 00 00 00 00 00 00 00 00
00 00 00 00 00 00 00 00 00 00 00 00 00 00 00 9b

00 ff ff ff ff ff ff 00 22 0e 59 36 01 00 00 00
2b 1e 01 03 80 46 28 78 2a 6d a5 a3 55 4f 98 27
0f 50 54 21 08 00 d1 c0 a9 c0 81 c0 b3 00 95 00
81 00 81 80 01 01 02 3a 80 18 71 38 2d 40 58 2c
45 00 bb 89 21 00 00 1e 00 00 00 fd 00 3c 3c 1e
46 0f 00 0a 20 20 20 20 20 20 00 00 00 fc 00 48
50 20 33 32 66 0a 20 20 20 20 20 20 00 00 00 ff
00 33 43 4d 30 34 33 31 37 34 34 20 20 20 01 b3

02 03 13 b1 45 90 04 03 02 01 65 03 0c 00 10 00
e2 00 6b 02 3a 80 18 71 38 2d 40 58 2c 45 00 bb
89 21 00 00 1e 01 1d 00 72 51 d0 1e 20 6e 28 55
00 bb 89 21 00 00 1e 8c 0a d0 8a 20 e0 2d 10 10
3e 96 00 bb 89 21 00 00 18 d6 09 80 a0 20 e0 2d
10 10 60 a2 00 bb 89 21 00 00 18 00 00 00 00 00
00 00 00 00 00 00 00 00 00 00 00 00 00 00 00 00
00 00 00 00 00 00 00 00 00 00 00 00 00 00 00 9b

----------------

Block 0, Base EDID:
  EDID Structure Version & Revision: 1.3
  Vendor & Product Identification:
    Manufacturer: HPN
    Model: 13913
    Serial Number: ...
    Made in: week 43 of 2020
  Basic Display Parameters & Features:
    Digital display
    Maximum image size: 70 cm x 40 cm
    Gamma: 2.20
    DPMS levels: Off
    RGB color display
    First detailed timing is the preferred timing
  Color Characteristics:
    Red  : 0.6376, 0.3339
    Green: 0.3115, 0.5947
    Blue : 0.1542, 0.0605
    White: 0.3134, 0.3291
  Established Timings I & II:
    DMT 0x04:   640x480    59.940476 Hz   4:3     31.469 kHz     25.175000 MHz
    DMT 0x09:   800x600    60.316541 Hz   4:3     37.879 kHz     40.000000 MHz
    DMT 0x10:  1024x768    60.003840 Hz   4:3     48.363 kHz     65.000000 MHz
  Standard Timings:
    DMT 0x52:  1920x1080   60.000000 Hz  16:9     67.500 kHz    148.500000 MHz
    DMT 0x53:  1600x900    60.000000 Hz  16:9     60.000 kHz    108.000000 MHz (RB)
    DMT 0x55:  1280x720    60.000000 Hz  16:9     45.000 kHz     74.250000 MHz
    DMT 0x3a:  1680x1050   59.954250 Hz  16:10    65.290 kHz    146.250000 MHz
    DMT 0x2f:  1440x900    59.887445 Hz  16:10    55.935 kHz    106.500000 MHz
    DMT 0x1c:  1280x800    59.810326 Hz  16:10    49.702 kHz     83.500000 MHz
    DMT 0x23:  1280x1024   60.019740 Hz   5:4     63.981 kHz    108.000000 MHz
  Detailed Timing Descriptors:
    DTD 1:  1920x1080   60.000000 Hz  16:9     67.500 kHz    148.500000 MHz (699 mm x 393 mm)
                 Hfront   88 Hsync  44 Hback  148 Hpol P
                 Vfront    4 Vsync   5 Vback   36 Vpol P
    Display Range Limits:
      Monitor ranges (GTF): 60-60 Hz V, 30-70 kHz H, max dotclock 150 MHz
    Display Product Name: 'HP 32f'
    Display Product Serial Number: ...
  Extension blocks: 1
Checksum: 0xb3

----------------

Block 1, CTA-861 Extension Block:
  Revision: 3
  Underscans IT Video Formats by default
  Supports YCbCr 4:4:4
  Supports YCbCr 4:2:2
  Native detailed modes: 1
  Video Data Block:
    VIC  16:  1920x1080   60.000000 Hz  16:9     67.500 kHz    148.500000 MHz (native)
    VIC   4:  1280x720    60.000000 Hz  16:9     45.000 kHz     74.250000 MHz
    VIC   3:   720x480    59.940060 Hz  16:9     31.469 kHz     27.000000 MHz
    VIC   2:   720x480    59.940060 Hz   4:3     31.469 kHz     27.000000 MHz
    VIC   1:   640x480    59.940476 Hz   4:3     31.469 kHz     25.175000 MHz
  Vendor-Specific Data Block (HDMI), OUI 00-0C-03:
    Source physical address: 1.0.0.0
  Video Capability Data Block:
    YCbCr quantization: No Data
    RGB quantization: Selectable (via AVI Q)
    PT scan behavior: Always Underscanned
    IT scan behavior: Always Underscanned
    CE scan behavior: Supports both over- and underscan
  Detailed Timing Descriptors:
    DTD 2:  1920x1080   60.000000 Hz  16:9     67.500 kHz    148.500000 MHz (699 mm x 393 mm)
                 Hfront   88 Hsync  44 Hback  148 Hpol P
                 Vfront    4 Vsync   5 Vback   36 Vpol P
    DTD 3:  1280x720    60.000000 Hz  16:9     45.000 kHz     74.250000 MHz (699 mm x 393 mm)
                 Hfront  110 Hsync  40 Hback  220 Hpol P
                 Vfront    5 Vsync   5 Vback   20 Vpol P
    DTD 4:   720x480    59.940060 Hz   3:2     31.469 kHz     27.000000 MHz (699 mm x 393 mm)
                 Hfront   16 Hsync  62 Hback   60 Hpol N
                 Vfront    9 Vsync   6 Vback   30 Vpol N
    DTD 5:   640x480    59.952381 Hz   4:3     31.475 kHz     25.180000 MHz (699 mm x 393 mm)
                 Hfront   16 Hsync  96 Hback   48 Hpol N
                 Vfront   10 Vsync   2 Vback   33 Vpol N
Checksum: 0x9b  Unused space in Extension Block: 36 bytes

----------------

Block 2, Unknown EDID Extension Block 0x00:
  00 ff ff ff ff ff ff 00 22 0e 59 36 01 00 00 00 '........".Y6....'
  2b 1e 01 03 80 46 28 78 2a 6d a5 a3 55 4f 98 27 '+....F(x*m..UO.''
  0f 50 54 21 08 00 d1 c0 a9 c0 81 c0 b3 00 95 00 '.PT!............'
  81 00 81 80 01 01 02 3a 80 18 71 38 2d 40 58 2c '.......:..q8-@X,'
  45 00 bb 89 21 00 00 1e 00 00 00 fd 00 3c 3c 1e 'E...!........<<.'
  46 0f 00 0a 20 20 20 20 20 20 00 00 00 fc 00 48 'F...      .....H'
  50 20 33 32 66 0a 20 20 20 20 20 20 00 00 00 ff 'P 32f.      ....'
  00 33 43 4d 30 34 33 31 37 34 34 20 20 20 01 b3 '.3CM0431744   ..'
Checksum: 0xb3

----------------

Block 3, CTA-861 Extension Block:
  Revision: 3
  Underscans IT Video Formats by default
  Supports YCbCr 4:4:4
  Supports YCbCr 4:2:2
  Native detailed modes: 1
  Video Data Block:
    VIC  16:  1920x1080   60.000000 Hz  16:9     67.500 kHz    148.500000 MHz (native)
    VIC   4:  1280x720    60.000000 Hz  16:9     45.000 kHz     74.250000 MHz
    VIC   3:   720x480    59.940060 Hz  16:9     31.469 kHz     27.000000 MHz
    VIC   2:   720x480    59.940060 Hz   4:3     31.469 kHz     27.000000 MHz
    VIC   1:   640x480    59.940476 Hz   4:3     31.469 kHz     25.175000 MHz
  Vendor-Specific Data Block (HDMI), OUI 00-0C-03:
    Source physical address: 1.0.0.0
  Video Capability Data Block:
    YCbCr quantization: No Data
    RGB quantization: Selectable (via AVI Q)
    PT scan behavior: Always Underscanned
    IT scan behavior: Always Underscanned
    CE scan behavior: Supports both over- and underscan
  Detailed Timing Descriptors:
    DTD 6:  1920x1080   60.000000 Hz  16:9     67.500 kHz    148.500000 MHz (699 mm x 393 mm)
                 Hfront   88 Hsync  44 Hback  148 Hpol P
                 Vfront    4 Vsync   5 Vback   36 Vpol P
    DTD 7:  1280x720    60.000000 Hz  16:9     45.000 kHz     74.250000 MHz (699 mm x 393 mm)
                 Hfront  110 Hsync  40 Hback  220 Hpol P
                 Vfront    5 Vsync   5 Vback   20 Vpol P
    DTD 8:   720x480    59.940060 Hz   3:2     31.469 kHz     27.000000 MHz (699 mm x 393 mm)
                 Hfront   16 Hsync  62 Hback   60 Hpol N
                 Vfront    9 Vsync   6 Vback   30 Vpol N
    DTD 9:   640x480    59.952381 Hz   4:3     31.475 kHz     25.180000 MHz (699 mm x 393 mm)
                 Hfront   16 Hsync  96 Hback   48 Hpol N
                 Vfront   10 Vsync   2 Vback   33 Vpol N
Checksum: 0x9b  Unused space in Extension Block: 36 bytes

----------------

Warnings:

Block 0, Base EDID:
  Vendor & Product Identification: The serial number is one of the known dummy values, it should probably be set to 0.
Block 1, CTA-861 Extension Block:
  Video Capability Data Block: Set Selectable YCbCr Quantization to avoid interop issues.
  Detailed Timing Descriptor #4: Image size is 699x393 mm, but based on the picture AR it should be 699x466 mm.
  Detailed Timing Descriptor #5: Image size is 699x393 mm, but based on the picture AR it should be 699x524 mm.
  Display Product Serial Number is set, so the Serial Number in the Base EDID should be 0.
  Add a Colorimetry Data Block with the sRGB colorimetry bit set to avoid interop issues.
Block 3, CTA-861 Extension Block:
  Video Capability Data Block: Set Selectable YCbCr Quantization to avoid interop issues.
  Detailed Timing Descriptor #8: Image size is 699x393 mm, but based on the picture AR it should be 699x466 mm.
  Detailed Timing Descriptor #9: Image size is 699x393 mm, but based on the picture AR it should be 699x524 mm.
EDID:
  CTA-861: Multiple native progressive timings are defined.

Failures:

Block 0, Base EDID:
  Display Product Serial Number: ...
Block 2, Base EDID:
  Unknown Extension Block.
Block 3, CTA-861 Extension Block:
  Video Data Block: Duplicate VIC 16.
  Video Data Block: Duplicate VIC 4.
  Video Data Block: Duplicate VIC 3.
  Video Data Block: Duplicate VIC 2.
  Video Data Block: Duplicate VIC 1.
  Video Capability Data Block: Only one instance of this Data Block is allowed.
EDID:
  Base EDID: EDID specified 1 extension block(s), but found 3 extension block(s).
  Base EDID: EDID 1.3 requires a Block Map Extension in Block 1 if there are more than 2 blocks in the EDID.

EDID conformity: FAIL
