edid-decode (hex):

00 ff ff ff ff ff ff 00 22 70 c4 1a 6c 06 00 00
31 13 01 03 0a 35 1f 78 ea 9b b6 a4 53 4b 9d 24
14 4f 54 bf ef 80 81 80 81 c0 81 40 71 4f 90 40
95 00 95 0f b3 00 02 3a 80 18 71 38 2d 40 58 2c
45 00 12 36 21 00 00 1e 00 00 00 fd 00 38 4b 18
53 12 00 0a 20 20 20 20 20 20 00 00 00 ff 00 39
34 39 52 4a 33 42 59 30 31 36 34 34 00 00 00 fc
00 48 46 32 33 37 48 0a 20 20 20 20 20 20 00 1d

00 ff ff ff ff ff ff 00 22 70 c4 1a 6c 06 00 00
31 13 01 03 0a 35 1f 78 ea 9b b6 a4 53 4b 9d 24
14 4f 54 bf ef 80 81 80 81 c0 81 40 71 4f 90 40
95 00 95 0f b3 00 02 3a 80 18 71 38 2d 40 58 2c
45 00 12 36 21 00 00 1e 00 00 00 fd 00 38 4b 18
53 12 00 0a 20 20 20 20 20 20 00 00 00 ff 00 39
34 39 52 4a 33 42 59 30 31 36 34 34 00 00 00 fc
00 48 46 32 33 37 48 0a 20 20 20 20 20 20 00 1d

----------------

Block 0, Base EDID:
  EDID Structure Version & Revision: 1.3
  Vendor & Product Identification:
    Manufacturer: HSP
    Model: 6852
    Serial Number: ...
    Made in: week 49 of 2009
  Basic Display Parameters & Features:
    Analog display
    Signal Level Standard: 0.700 : 0.300 : 1.000 V p-p
    Blank level equals black level
    Sync: Separate SyncOnGreen
    Maximum image size: 53 cm x 31 cm
    Gamma: 2.20
    DPMS levels: Standby Suspend Off
    RGB color display
    First detailed timing is the preferred timing
  Color Characteristics:
    Red  : 0.6425, 0.3251
    Green: 0.2949, 0.6162
    Blue : 0.1425, 0.0810
    White: 0.3095, 0.3300
  Established Timings I & II:
    IBM     :   720x400    70.081663 Hz   9:5     31.467 kHz     28.320000 MHz
    DMT 0x04:   640x480    59.940476 Hz   4:3     31.469 kHz     25.175000 MHz
    Apple   :   640x480    66.666667 Hz   4:3     35.000 kHz     30.240000 MHz
    DMT 0x05:   640x480    72.808802 Hz   4:3     37.861 kHz     31.500000 MHz
    DMT 0x06:   640x480    75.000000 Hz   4:3     37.500 kHz     31.500000 MHz
    DMT 0x08:   800x600    56.250000 Hz   4:3     35.156 kHz     36.000000 MHz
    DMT 0x09:   800x600    60.316541 Hz   4:3     37.879 kHz     40.000000 MHz
    DMT 0x0a:   800x600    72.187572 Hz   4:3     48.077 kHz     50.000000 MHz
    DMT 0x0b:   800x600    75.000000 Hz   4:3     46.875 kHz     49.500000 MHz
    Apple   :   832x624    74.551266 Hz   4:3     49.726 kHz     57.284000 MHz
    DMT 0x10:  1024x768    60.003840 Hz   4:3     48.363 kHz     65.000000 MHz
    DMT 0x11:  1024x768    70.069359 Hz   4:3     56.476 kHz     75.000000 MHz
    DMT 0x12:  1024x768    75.028582 Hz   4:3     60.023 kHz     78.750000 MHz
    DMT 0x24:  1280x1024   75.024675 Hz   5:4     79.976 kHz    135.000000 MHz
    Apple   :  1152x870    75.061550 Hz 192:145   68.681 kHz    100.000000 MHz
  Standard Timings:
    DMT 0x23:  1280x1024   60.019740 Hz   5:4     63.981 kHz    108.000000 MHz
    DMT 0x55:  1280x720    60.000000 Hz  16:9     45.000 kHz     74.250000 MHz
    DMT 0x20:  1280x960    60.000000 Hz   4:3     60.000 kHz    108.000000 MHz
    DMT 0x15:  1152x864    75.000000 Hz   4:3     67.500 kHz    108.000000 MHz
    DMT 0x2a:  1400x1050   59.978442 Hz   4:3     65.317 kHz    121.750000 MHz
    DMT 0x2f:  1440x900    59.887445 Hz  16:10    55.935 kHz    106.500000 MHz
    DMT 0x30:  1440x900    74.984427 Hz  16:10    70.635 kHz    136.750000 MHz
    DMT 0x3a:  1680x1050   59.954250 Hz  16:10    65.290 kHz    146.250000 MHz
  Detailed Timing Descriptors:
    DTD 1:  1920x1080   60.000000 Hz  16:9     67.500 kHz    148.500000 MHz (530 mm x 310 mm)
                 Hfront   88 Hsync  44 Hback  148 Hpol P
                 Vfront    4 Vsync   5 Vback   36 Vpol P
    Display Range Limits:
      Monitor ranges (GTF): 56-75 Hz V, 24-83 kHz H, max dotclock 180 MHz
    Display Product Serial Number: ...
    Display Product Name: 'HF237H'
Checksum: 0x1d

----------------

Warnings:

Block 0, Base EDID:
  Detailed Timing Descriptor #1: Image size is 530x310 mm, but based on the picture AR it should be 530x298 mm.

Failures:

EDID:
  Extension Block 1 started with EDID header, ignoring Extension Blocks >= 1.

EDID conformity: FAIL
