edid-decode (hex):

00 ff ff ff ff ff ff 00 36 69 82 24 01 00 00 00
1d 15 01 03 08 2c 19 64 ea 7b 00 a6 55 4b 9a 25
13 50 54 21 08 00 81 c0 95 c0 01 01 01 01 01 01
01 01 01 01 01 01 2f 26 40 a0 60 84 1a 30 30 20
35 00 ce 10 11 00 00 1e 00 00 00 ff 00 30 30 30
30 30 31 0a 20 20 20 20 20 20 00 00 00 fd 00 3c
3c 1e 3c 0a 00 0a 20 20 20 20 20 20 00 00 00 fc
00 4d 53 49 20 41 49 4f 20 50 43 0a 20 20 00 90

----------------

Block 0, Base EDID:
  EDID Structure Version & Revision: 1.3
  Vendor & Product Identification:
    Manufacturer: MSI
    Model: 9346
    Serial Number: ...
    Made in: week 29 of 2011
  Basic Display Parameters & Features:
    Analog display
    Signal Level Standard: 0.700 : 0.300 : 1.000 V p-p
    Blank level equals black level
    Sync: Separate
    Maximum image size: 44 cm x 25 cm
    Gamma: 2.00
    DPMS levels: Standby Suspend Off
    RGB color display
    First detailed timing is the preferred timing
  Color Characteristics:
    Red  : 0.6494, 0.3349
    Green: 0.2949, 0.6044
    Blue : 0.1445, 0.0742
    White: 0.3125, 0.3281
  Established Timings I & II:
    DMT 0x04:   640x480    59.940476 Hz   4:3     31.469 kHz     25.175000 MHz
    DMT 0x09:   800x600    60.316541 Hz   4:3     37.879 kHz     40.000000 MHz
    DMT 0x10:  1024x768    60.003840 Hz   4:3     48.363 kHz     65.000000 MHz
  Standard Timings:
    DMT 0x55:  1280x720    60.000000 Hz  16:9     45.000 kHz     74.250000 MHz
    GTF     :  1440x810    60.000051 Hz  16:9     50.340 kHz     95.042000 MHz
  Detailed Timing Descriptors:
    DTD 1:  1600x900    59.978156 Hz  16:9     55.540 kHz     97.750000 MHz (462 mm x 272 mm)
                 Hfront   48 Hsync  32 Hback   80 Hpol P
                 Vfront    3 Vsync   5 Vback   18 Vpol P
    Display Product Serial Number: ...
    Display Range Limits:
      Monitor ranges (GTF): 60-60 Hz V, 30-60 kHz H, max dotclock 100 MHz
    Display Product Name: 'MSI AIO PC'
Checksum: 0x90

----------------

Warnings:

Block 0, Base EDID:
  Vendor & Product Identification: The serial number is one of the known dummy values, it should probably be set to 0.
  Detailed Timing Descriptor #1: Image size is 462x272 mm, but based on the picture AR it should be 462x259 mm.
  Display Product Serial Number: ...

Failures:

Block 0, Base EDID:
  Detailed Timing Descriptor #1: Mismatch of image size 462x272 mm vs display size 440x250 mm.
EDID:
  Base EDID: The DTD max image size is 462x272mm, which is larger than the display size 440.0x250.0mm.

EDID conformity: FAIL
