edid-decode (hex):

00 ff ff ff ff ff ff 00 4d 10 93 15 00 00 00 00
2c 21 01 04 a5 1d 12 78 07 ee 95 a3 54 4c 99 26
0f 50 54 00 00 00 01 01 01 01 01 01 01 01 01 01
01 01 01 01 01 01 f0 7b 80 90 70 b0 52 45 30 20
36 00 20 b4 10 00 00 18 00 00 00 fd 00 1e 78 9a
9a 20 01 0a 20 20 20 20 20 20 00 00 00 fe 00 4b
4a 46 47 52 80 4c 51 31 33 34 4e 31 00 00 00 00
00 02 41 0c 32 00 01 00 00 0b 41 0a 20 20 01 ef

70 20 79 02 00 20 00 13 8c 52 19 93 15 00 00 00
00 2c 17 07 4c 51 31 33 34 4e 31 21 00 1d 40 0b
08 07 80 07 b0 04 88 3d 8a 54 cd a4 99 66 62 0f
02 45 54 d0 5f d0 5f 00 34 12 78 26 00 09 02 00
00 00 00 00 01 00 00 22 00 14 5e d7 04 05 7f 07
8f 00 2f 00 1f 00 af 04 50 00 02 00 05 00 25 01
09 5e d7 04 5e d7 04 1e 78 80 81 00 0b e3 05 80
00 e6 06 01 01 6a 6a 39 00 00 00 00 00 00 ce 90

00 ff ff ff ff ff ff 00 4d 10 93 15 00 00 00 00
2c 21 01 04 a5 1d 12 78 07 ee 95 a3 54 4c 99 26
0f 50 54 00 00 00 01 01 01 01 01 01 01 01 01 01
01 01 01 01 01 01 f0 7b 80 90 70 b0 52 45 30 20
36 00 20 b4 10 00 00 18 00 00 00 fd 00 1e 78 9a
9a 20 01 0a 20 20 20 20 20 20 00 00 00 fe 00 4b
4a 46 47 52 80 4c 51 31 33 34 4e 31 00 00 00 00
00 02 41 0c 32 00 01 00 00 0b 41 0a 20 20 01 ef

70 20 79 02 00 20 00 13 8c 52 19 93 15 00 00 00
00 2c 17 07 4c 51 31 33 34 4e 31 21 00 1d 40 0b
08 07 80 07 b0 04 88 3d 8a 54 cd a4 99 66 62 0f
02 45 54 d0 5f d0 5f 00 34 12 78 26 00 09 02 00
00 00 00 00 01 00 00 22 00 14 5e d7 04 05 7f 07
8f 00 2f 00 1f 00 af 04 50 00 02 00 05 00 25 01
09 5e d7 04 5e d7 04 1e 78 80 81 00 0b e3 05 80
00 e6 06 01 01 6a 6a 39 00 00 00 00 00 00 ce 90

----------------

Block 0, Base EDID:
  EDID Structure Version & Revision: 1.4
  Vendor & Product Identification:
    Manufacturer: SHP
    Model: 5523
    Made in: week 44 of 2023
  Basic Display Parameters & Features:
    Digital display
    Bits per primary color channel: 8
    DisplayPort interface
    Maximum image size: 29 cm x 18 cm
    Gamma: 2.20
    Supported color formats: RGB 4:4:4
    Default (sRGB) color space is primary color space
    First detailed timing includes the native pixel format and preferred refresh rate
    Display supports continuous frequencies
  Color Characteristics:
    Red  : 0.6396, 0.3300
    Green: 0.2998, 0.5996
    Blue : 0.1503, 0.0595
    White: 0.3134, 0.3291
  Established Timings I & II: none
  Standard Timings: none
  Detailed Timing Descriptors:
    DTD 1:  1920x1200   60.000363 Hz  16:10   153.721 kHz    317.280000 MHz (288 mm x 180 mm)
                 Hfront   48 Hsync  32 Hback   64 Hpol N
                 Vfront    3 Vsync   6 Vback 1353 Vpol N
    Display Range Limits:
      Monitor ranges (Range Limits Only): 30-120 Hz V, 154-154 kHz H, max dotclock 320 MHz
    Alphanumeric Data String: 'KJFGR.LQ134N1'
    Manufacturer-Specified Display Descriptor (0x00): 00 00 00 02 41 0c 32 00 01 00 00 0b 41 0a 20 20 '....A.2.....A.  '
  Extension blocks: 1
Checksum: 0xef

----------------

Block 1, DisplayID Extension Block:
  Version: 2.0
  Extension Count: 0
  Display Product Primary Use Case: None of the listed primary use cases; generic display
  Product Identification Data Block (0x20), OUI 8C-52-19:
    Product Code: 5523
    Year of Manufacture: 2023, Week 44
    Product ID: LQ134N1
  Display Parameters Data Block (0x21):
    Image size: 288.0 mm x 180.0 mm
    Display native pixel format: 1920x1200
    Scan Orientation: Left to Right, Top to Bottom
    Luminance Information: Guidance for the Source device
    Color Information: CIE 1931
    Audio Speaker Information: not integrated
    Native Color Chromaticity:
      Primary #1:  (0.639893, 0.330078)
      Primary #2:  (0.300049, 0.600098)
      Primary #3:  (0.149902, 0.060059)
      White Point: (0.312988, 0.329102)
    Native Maximum Luminance (Full Coverage): 500.000000 cd/m^2
    Native Maximum Luminance (10% Rectangular Coverage): 500.000000 cd/m^2
    Native Minimum Luminance: 0.250000 cd/m^2
    Native Color Depth: 8 bpc
    Display Device Technology: Active Matrix LCD
    Native Gamma EOTF: 2.20
  Display Interface Features Data Block:
    Supported bpc for RGB encoding: 8
    Supported color space and EOTF standard combination 1: sRGB
  Video Timing Modes Type 7 - Detailed Timings Data Block:
    DTD:  1920x1200  120.000348 Hz  16:10   153.720 kHz    317.279000 MHz (aspect 16:10, no 3D stereo)
               Hfront   48 Hsync  32 Hback   64 Hpol N
               Vfront    3 Vsync   6 Vback   72 Vpol N
  Dynamic Video Timing Range Limits Data Block:
    Minimum Pixel Clock: 317279 kHz
    Maximum Pixel Clock: 317279 kHz
    Minimum Vertical Refresh Rate: 30 Hz
    Maximum Vertical Refresh Rate: 120 Hz
    Seamless Dynamic Video Timing Support: Yes
  CTA-861 DisplayID Data Block:
  Colorimetry Data Block:
    BT2020RGB
  HDR Static Metadata Data Block:
    Electro optical transfer functions:
      Traditional gamma - SDR luminance range
    Supported static metadata descriptors:
      Static metadata type 1
    Desired content max luminance: 106 (496.743 cd/m^2)
    Desired content max frame-average luminance: 106 (496.743 cd/m^2)
    Desired content min luminance: 57 (0.248 cd/m^2)
  Checksum: 0xce
Checksum: 0x90

----------------

Warnings:

Block 0, Base EDID:
  Alphanumeric Data String: Non-ASCII character 0x80 at position 5, can cause problems.
  Missing Display Product Name.

Failures:

Block 0, Base EDID:
  Basic Display Parameters & Features: sRGB is signaled, but the chromaticities do not match.
EDID:
  Extension Block 2 started with EDID header, ignoring Extension Blocks >= 2.
  DisplayID: DisplayID expects at least one preferred timing.

EDID conformity: FAIL
