edid-decode (hex):

00 ff ff ff ff ff ff 00 40 2e 63 9c 01 01 01 01
00 1c 01 04 a5 3c 22 78 0a bc 95 a8 51 33 aa 26
0f 50 54 00 00 00 01 c1 01 c1 01 c1 01 c1 01 c1
01 c1 01 c1 01 c1 68 42 80 18 71 38 2d 40 58 2c
45 00 00 00 00 00 00 18 00 00 00 10 00 06 10 30
11 01 00 00 00 00 00 00 0a 20 00 00 00 10 00 38
2d 40 58 2c 45 00 00 00 00 00 00 18 00 00 00 fc
00 50 41 4e 31 39 32 30 78 31 30 38 30 20 00 76

----------------

Block 0, Base EDID:
  EDID Structure Version & Revision: 1.4
  Vendor & Product Identification:
    Manufacturer: PAN
    Model: 40035
    Serial Number: ...
    Made in: 2018
  Basic Display Parameters & Features:
    Digital display
    Bits per primary color channel: 8
    DisplayPort interface
    Maximum image size: 60 cm x 34 cm
    Gamma: 2.20
    Supported color formats: RGB 4:4:4, YCrCb 4:4:4
    First detailed timing includes the native pixel format and preferred refresh rate
  Color Characteristics:
    Red  : 0.6582, 0.3193
    Green: 0.2021, 0.6640
    Blue : 0.1503, 0.0595
    White: 0.3134, 0.3291
  Established Timings I & II: none
  Standard Timings:
  Detailed Timing Descriptors:
    DTD 1:  1920x1080   68.686869 Hz  16:9     77.273 kHz    170.000000 MHz
                 Hfront   88 Hsync  44 Hback  148 Hpol N
                 Vfront    4 Vsync   5 Vback   36 Vpol N
    Dummy Descriptor:
    Dummy Descriptor:
    Display Product Name: 'PAN1920x1080 '
Checksum: 0x76

----------------

Warnings:

Block 0, Base EDID:
  Vendor & Product Identification: The serial number is one of the known dummy values, it should probably be set to 0.

Failures:

Block 0, Base EDID:
  Standard Timings: Use 0x0101 as the invalid Standard Timings code, not 0x01c1.
  Standard Timings: Use 0x0101 as the invalid Standard Timings code, not 0x01c1.
  Standard Timings: Use 0x0101 as the invalid Standard Timings code, not 0x01c1.
  Standard Timings: Use 0x0101 as the invalid Standard Timings code, not 0x01c1.
  Standard Timings: Use 0x0101 as the invalid Standard Timings code, not 0x01c1.
  Standard Timings: Use 0x0101 as the invalid Standard Timings code, not 0x01c1.
  Standard Timings: Use 0x0101 as the invalid Standard Timings code, not 0x01c1.
  Standard Timings: Use 0x0101 as the invalid Standard Timings code, not 0x01c1.
  Detailed Timing Descriptor #1: Mismatch of image size vs display size: image size is not set, but display size is.
  Dummy Descriptor: Dummy block filled with garbage.
  Dummy Descriptor: Dummy block filled with garbage.
  Display Product Name: No newline, but one or more trailing spaces.

EDID conformity: FAIL
