edid-decode (hex):

00 ff ff ff ff ff ff 00 21 6d 00 34 00 00 00 00
01 22 01 04 b5 4f 21 78 3b b9 a5 a8 53 45 96 23
1e 50 54 21 08 00 31 40 45 40 61 40 81 c0 81 80
01 01 b3 00 a9 c0 40 80 70 a0 d0 a0 50 50 30 20
35 00 1d 4d 31 00 00 1e 00 00 00 ff 00 30 30 30
30 30 30 30 30 30 30 30 30 31 00 00 00 fd 00 30
a5 ff ff 64 01 0a 20 20 20 20 20 20 00 00 00 fc
00 46 59 33 34 57 51 48 43 0a 20 20 20 20 02 bd

02 03 2f f1 49 10 1f 04 13 03 12 01 00 3f 23 09
07 07 83 01 00 00 e3 05 c0 00 e6 06 07 01 65 65
00 6d 1a 00 00 02 01 30 a5 00 00 00 00 00 00 40
80 70 a0 d0 a0 50 50 30 20 35 00 1d 4d 31 00 00
1a 00 00 00 00 00 00 00 00 00 00 00 00 00 00 00
00 00 00 00 00 00 00 00 00 00 00 00 00 00 00 00
00 00 00 00 00 00 00 00 00 00 00 00 00 00 00 00
00 00 00 00 00 00 00 00 00 00 00 00 00 00 00 5a

70 12 79 00 00 03 00 3c 7f 00 01 84 6f 0d 9f 00
2f 80 1f 00 9f 05 4f 00 02 80 04 00 b3 2b 01 04
6f 0d 9f 00 2f 80 1f 00 9f 05 27 00 02 80 04 00
71 52 01 04 6f 0d 77 00 2f 80 1f 00 9f 05 22 00
02 80 04 00 00 00 00 00 00 00 00 00 00 00 00 00
00 00 00 00 00 00 00 00 00 00 00 00 00 00 00 00
00 00 00 00 00 00 00 00 00 00 00 00 00 00 00 00
00 00 00 00 00 00 00 00 00 00 00 00 00 00 de 90

00 ff ff ff ff ff ff 00 21 6d 00 34 00 00 00 00
01 22 01 04 b5 4f 21 78 3b b9 a5 a8 53 45 96 23
1e 50 54 21 08 00 31 40 45 40 61 40 81 c0 81 80
01 01 b3 00 a9 c0 40 80 70 a0 d0 a0 50 50 30 20
35 00 1d 4d 31 00 00 1e 00 00 00 ff 00 30 30 30
30 30 30 30 30 30 30 30 30 31 00 00 00 fd 00 30
a5 ff ff 64 01 0a 20 20 20 20 20 20 00 00 00 fc
00 46 59 33 34 57 51 48 43 0a 20 20 20 20 02 bd

02 03 2f f1 49 10 1f 04 13 03 12 01 00 3f 23 09
07 07 83 01 00 00 e3 05 c0 00 e6 06 07 01 65 65
00 6d 1a 00 00 02 01 30 a5 00 00 00 00 00 00 40
80 70 a0 d0 a0 50 50 30 20 35 00 1d 4d 31 00 00
1a 00 00 00 00 00 00 00 00 00 00 00 00 00 00 00
00 00 00 00 00 00 00 00 00 00 00 00 00 00 00 00
00 00 00 00 00 00 00 00 00 00 00 00 00 00 00 00
00 00 00 00 00 00 00 00 00 00 00 00 00 00 00 5a

70 12 79 00 00 03 00 3c 7f 00 01 84 6f 0d 9f 00
2f 80 1f 00 9f 05 4f 00 02 80 04 00 b3 2b 01 04
6f 0d 9f 00 2f 80 1f 00 9f 05 27 00 02 80 04 00
71 52 01 04 6f 0d 77 00 2f 80 1f 00 9f 05 22 00
02 80 04 00 00 00 00 00 00 00 00 00 00 00 00 00
00 00 00 00 00 00 00 00 00 00 00 00 00 00 00 00
00 00 00 00 00 00 00 00 00 00 00 00 00 00 00 00
00 00 00 00 00 00 00 00 00 00 00 00 00 00 de 90

----------------

Block 0, Base EDID:
  EDID Structure Version & Revision: 1.4
  Vendor & Product Identification:
    Manufacturer: HKM
    Model: 13312
    Made in: week 1 of 2024
  Basic Display Parameters & Features:
    Digital display
    Bits per primary color channel: 10
    DisplayPort interface
    Maximum image size: 79 cm x 33 cm
    Gamma: 2.20
    DPMS levels: Off
    Supported color formats: RGB 4:4:4, YCrCb 4:4:4, YCrCb 4:2:2
    First detailed timing includes the native pixel format and preferred refresh rate
    Display supports continuous frequencies
  Color Characteristics:
    Red  : 0.6582, 0.3271
    Green: 0.2714, 0.5869
    Blue : 0.1386, 0.1191
    White: 0.3134, 0.3291
  Established Timings I & II:
    DMT 0x04:   640x480    59.940476 Hz   4:3     31.469 kHz     25.175000 MHz
    DMT 0x09:   800x600    60.316541 Hz   4:3     37.879 kHz     40.000000 MHz
    DMT 0x10:  1024x768    60.003840 Hz   4:3     48.363 kHz     65.000000 MHz
  Standard Timings:
    DMT 0x04:   640x480    59.940476 Hz   4:3     31.469 kHz     25.175000 MHz
    DMT 0x09:   800x600    60.316541 Hz   4:3     37.879 kHz     40.000000 MHz
    DMT 0x10:  1024x768    60.003840 Hz   4:3     48.363 kHz     65.000000 MHz
    DMT 0x55:  1280x720    60.000000 Hz  16:9     45.000 kHz     74.250000 MHz
    DMT 0x23:  1280x1024   60.019740 Hz   5:4     63.981 kHz    108.000000 MHz
    DMT 0x3a:  1680x1050   59.954250 Hz  16:10    65.290 kHz    146.250000 MHz
    DMT 0x53:  1600x900    60.000000 Hz  16:9     60.000 kHz    108.000000 MHz (RB)
  Detailed Timing Descriptors:
    DTD 1:  3440x1440   60.000000 Hz  43:18    91.200 kHz    328.320000 MHz (797 mm x 333 mm)
                 Hfront   48 Hsync  32 Hback   80 Hpol P
                 Vfront    3 Vsync   5 Vback   72 Vpol P
    Display Product Serial Number: ...
    Display Range Limits:
      Monitor ranges (Range Limits Only): 48-165 Hz V, 255-255 kHz H, max dotclock 1000 MHz
    Display Product Name: 'FY34WQHC'
  Extension blocks: 2
Checksum: 0xbd

----------------

Block 1, CTA-861 Extension Block:
  Revision: 3
  Underscans IT Video Formats by default
  Basic audio support
  Supports YCbCr 4:4:4
  Supports YCbCr 4:2:2
  Native DTDs: 1
  Video Data Block:
    VIC  16:  1920x1080   60.000000 Hz  16:9     67.500 kHz    148.500000 MHz
    VIC  31:  1920x1080   50.000000 Hz  16:9     56.250 kHz    148.500000 MHz
    VIC   4:  1280x720    60.000000 Hz  16:9     45.000 kHz     74.250000 MHz
    VIC  19:  1280x720    50.000000 Hz  16:9     37.500 kHz     74.250000 MHz
    VIC   3:   720x480    59.940060 Hz  16:9     31.469 kHz     27.000000 MHz
    VIC  18:   720x576    50.000000 Hz  16:9     31.250 kHz     27.000000 MHz
    VIC   1:   640x480    59.940476 Hz   4:3     31.469 kHz     25.175000 MHz
    VIC  63:  1920x1080  120.000000 Hz  16:9    135.000 kHz    297.000000 MHz
  Audio Data Block:
    Linear PCM:
      Max channels: 2
      Supported sample rates (kHz): 48 44.1 32
      Supported sample sizes (bits): 24 20 16
  Speaker Allocation Data Block:
    FL/FR - Front Left/Right
  Colorimetry Data Block:
    BT2020YCC
    BT2020RGB
  HDR Static Metadata Data Block:
    Electro optical transfer functions:
      Traditional gamma - SDR luminance range
      Traditional gamma - HDR luminance range
      SMPTE ST2084
    Supported static metadata descriptors:
      Static metadata type 1
    Desired content max luminance: 101 (445.755 cd/m^2)
    Desired content max frame-average luminance: 101 (445.755 cd/m^2)
    Desired content min luminance: 0 (0.000 cd/m^2)
  Vendor-Specific Data Block (AMD), OUI 00-00-1A:
    Version: 2
    Feature Caps: 0x01
    Minimum Refresh Rate: 48 Hz
    Maximum Refresh Rate: 165 Hz
    Flags 1.x: 0x00
    Flags 2.x: 0x00
  Detailed Timing Descriptors:
    DTD 2:  3440x1440   60.000000 Hz  43:18    91.200 kHz    328.320000 MHz (797 mm x 333 mm)
                 Hfront   48 Hsync  32 Hback   80 Hpol P
                 Vfront    3 Vsync   5 Vback   72 Vpol N
Checksum: 0x5a  Unused space in Extension Block: 62 bytes

----------------

Block 2, DisplayID Extension Block:
  Version: 1.2
  Extension Count: 0
  Display Product Type: Extension Section
  Video Timing Modes Type 1 - Detailed Timings Data Block:
    DTD:  3440x1440  120.000000 Hz  16:9    182.400 kHz    656.640000 MHz (aspect 16:9, no 3D stereo, preferred)
               Hfront   48 Hsync  32 Hback   80 Hpol P
               Vfront    3 Vsync   5 Vback   72 Vpol P
    DTD:  3440x1440  144.001502 Hz  16:9    213.122 kHz    767.240000 MHz (aspect 16:9, no 3D stereo)
               Hfront   48 Hsync  32 Hback   80 Hpol P
               Vfront    3 Vsync   5 Vback   32 Vpol P
    DTD:  3440x1440  165.000952 Hz  16:9    243.376 kHz    866.420000 MHz (aspect 16:9, no 3D stereo)
               Hfront   48 Hsync  32 Hback   40 Hpol P
               Vfront    3 Vsync   5 Vback   27 Vpol P
  Checksum: 0xde
Checksum: 0x90

----------------

Warnings:

Block 0, Base EDID:
  Display Product Serial Number: ...
Block 1, CTA-861 Extension Block:
  Video Data Block: VIC 16 and the first DTD are not identical. Is this intended?
  Colorimetry Data Block: Set the sRGB colorimetry bit to avoid interop issues.
EDID:
  Base EDID: Some timings are out of range of the Monitor Ranges:
    Horizontal Freq: 31.250 - 243.376 kHz (Monitor: 255.000 - 255.000 kHz)

Failures:

Block 1, CTA-861 Extension Block:
  Missing VCDB, needed for Set Selectable RGB Quantization to avoid interop issues.
Block 2, DisplayID Extension Block:
  DisplayID Base Block has no product type.
EDID:
  Extension Block 3 started with EDID header, ignoring Extension Blocks >= 3.

EDID conformity: FAIL
