edid-decode (hex):

00 ff ff ff ff ff ff 00 59 6b 60 11 10 05 23 20
25 1d 01 03 80 1a 0f 78 aa 2d 8f a6 56 53 9b 25
0c 4f 53 21 08 00 71 c0 81 80 81 c0 8b c0 95 00
01 40 b3 01 01 01 02 3a 80 18 71 38 2d 40 58 2c
45 00 00 90 10 00 00 1e 00 00 00 fc 00 56 4b 31
31 36 30 43 0a 20 20 20 20 20 00 00 00 10 00 34
47 43 48 30 30 30 30 36 33 0a 20 20 00 00 00 fd
00 3c 3c 1f 46 0f 00 0a 20 20 20 20 20 20 01 7c

02 03 29 b1 00 00 05 04 03 02 07 16 01 1f 12 13
14 20 15 11 06 00 00 00 00 67 03 0c 00 10 00 38
2d e3 01 00 00 e3 05 03 01 02 3a 80 d2 70 38 1e
40 5a 3c aa 00 00 90 10 00 00 1e 02 3a 80 d2 70
38 1e 40 5a 3c aa 00 00 90 10 00 00 9e 01 1d 00
72 51 d0 1e 20 6e 28 55 00 06 44 21 00 00 1e 8c
0a d0 8a 20 e0 2d 10 10 3e 96 00 06 44 21 00 00
18 00 00 00 00 00 00 00 00 00 00 00 00 00 00 fb

00 ff ff ff ff ff ff 00 59 6b 60 11 10 05 23 20
25 1d 01 03 80 1a 0f 78 aa 2d 8f a6 56 53 9b 25
0c 4f 53 21 08 00 71 c0 81 80 81 c0 8b c0 95 00
01 40 b3 01 01 01 02 3a 80 18 71 38 2d 40 58 2c
45 00 00 90 10 00 00 1e 00 00 00 fc 00 56 4b 31
31 36 30 43 0a 20 20 20 20 20 00 00 00 10 00 34
47 43 48 30 30 30 30 36 33 0a 20 20 00 00 00 fd
00 3c 3c 1f 46 0f 00 0a 20 20 20 20 20 20 01 7c

02 03 29 b1 00 00 05 04 03 02 07 16 01 1f 12 13
14 20 15 11 06 00 00 00 00 67 03 0c 00 10 00 38
2d e3 01 00 00 e3 05 03 01 02 3a 80 d2 70 38 1e
40 5a 3c aa 00 00 90 10 00 00 1e 02 3a 80 d2 70
38 1e 40 5a 3c aa 00 00 90 10 00 00 9e 01 1d 00
72 51 d0 1e 20 6e 28 55 00 06 44 21 00 00 1e 8c
0a d0 8a 20 e0 2d 10 10 3e 96 00 06 44 21 00 00
18 00 00 00 00 00 00 00 00 00 00 00 00 00 00 fb

----------------

Block 0, Base EDID:
  EDID Structure Version & Revision: 1.3
  Vendor & Product Identification:
    Manufacturer: VKK
    Model: 4448
    Serial Number: ...
    Made in: week 37 of 2019
  Basic Display Parameters & Features:
    Digital display
    Maximum image size: 26 cm x 15 cm
    Gamma: 2.20
    DPMS levels: Standby Off
    RGB color display
    First detailed timing is the preferred timing
  Color Characteristics:
    Red  : 0.6484, 0.3378
    Green: 0.3271, 0.6064
    Blue : 0.1464, 0.0468
    White: 0.3115, 0.3271
  Established Timings I & II:
    DMT 0x04:   640x480    59.940476 Hz   4:3     31.469 kHz     25.175000 MHz
    DMT 0x09:   800x600    60.316541 Hz   4:3     37.879 kHz     40.000000 MHz
    DMT 0x10:  1024x768    60.003840 Hz   4:3     48.363 kHz     65.000000 MHz
  Standard Timings:
    GTF     :  1152x648    60.000120 Hz  16:9     40.260 kHz     59.907000 MHz
    DMT 0x23:  1280x1024   60.019740 Hz   5:4     63.981 kHz    108.000000 MHz
    DMT 0x55:  1280x720    60.000000 Hz  16:9     45.000 kHz     74.250000 MHz
    GTF     :  1360x765    60.000341 Hz  16:9     47.520 kHz     84.396000 MHz
    DMT 0x2f:  1440x900    59.887445 Hz  16:10    55.935 kHz    106.500000 MHz
    GTF     :  1680x1050   61.000166 Hz  16:10    66.307 kHz    149.589000 MHz
  Detailed Timing Descriptors:
    DTD 1:  1920x1080   60.000000 Hz  16:9     67.500 kHz    148.500000 MHz (256 mm x 144 mm)
                 Hfront   88 Hsync  44 Hback  148 Hpol P
                 Vfront    4 Vsync   5 Vback   36 Vpol P
    Display Product Name: 'VK1160C'
    Dummy Descriptor:
    Display Range Limits:
      Monitor ranges (GTF): 60-60 Hz V, 31-70 kHz H, max dotclock 150 MHz
  Extension blocks: 1
Checksum: 0x7c

----------------

Block 1, CTA-861 Extension Block:
  Revision: 3
  Underscans IT Video Formats by default
  Supports YCbCr 4:4:4
  Supports YCbCr 4:2:2
  Native DTDs: 1
  Unknown CTA-861 Data Block (tag 0x00, length 0):
  Unknown CTA-861 Data Block (tag 0x00, length 0):
  Unknown CTA-861 Data Block (tag 0x00, length 5):
    04 03 02 07 16                                  '.....'
  Unknown CTA-861 Data Block (tag 0x00, length 1):
    1f                                              '.'
  Unknown CTA-861 Data Block (tag 0x00, length 18):
    13 14 20 15 11 06 00 00 00 00 67 03 0c 00 10 00 '.. .......g.....'
    38 2d                                           '8-'
  Vendor-Specific Video Data Block, OUI 00-00-00:
  Colorimetry Data Block:
    xvYCC601
    xvYCC709
    Gamut Boundary Description Metadata Profile P0
  Detailed Timing Descriptors:
    DTD 2:  1920x1080   62.809288 Hz  16:9     69.718 kHz    148.500000 MHz (256 mm x 144 mm)
                 Hfront   90 Hsync  60 Hback   60 Hpol P
                 Vfront   10 Vsync  10 Vback   10 Vpol P
    DTD 3:  1920x2160i  62.781008 Hz   8:9     69.718 kHz    148.500000 MHz (256 mm x 144 mm)
                 Hfront   90 Hsync  60 Hback   60 Hpol P
                 Vfront   10 Vsync  10 Vback   10 Vpol P Vfront +0.5 Odd Field
                 Vfront   10 Vsync  10 Vback   10 Vpol P Vback  +0.5 Even Field
    DTD 4:  1280x720    60.000000 Hz  16:9     45.000 kHz     74.250000 MHz (518 mm x 324 mm)
                 Hfront  110 Hsync  40 Hback  220 Hpol P
                 Vfront    5 Vsync   5 Vback   20 Vpol P
    DTD 5:   720x480    59.940060 Hz   3:2     31.469 kHz     27.000000 MHz (518 mm x 324 mm)
                 Hfront   16 Hsync  62 Hback   60 Hpol N
                 Vfront    9 Vsync   6 Vback   30 Vpol N
Checksum: 0xfb  Unused space in Extension Block: 14 bytes

----------------

Warnings:

Block 0, Base EDID:
  Standard Timings: Standard Timing 1360x765 has a dubious odd vertical resolution.
  Detailed Timing Descriptor #1: DTD is identical to VIC 16, which is not present in the CTA Ext Block.
Block 1, CTA-861 Extension Block:
  Unknown CTA-861 Data Block (tag 0x00, length 0).
  Unknown CTA-861 Data Block (tag 0x00, length 0).
  Unknown CTA-861 Data Block (tag 0x00, length 5).
  Unknown CTA-861 Data Block (tag 0x00, length 1).
  Unknown CTA-861 Data Block (tag 0x00, length 18).
  Colorimetry Data Block: Set the sRGB colorimetry bit to avoid interop issues.
  Detailed Timing Descriptor #3: Image size is 256x144 mm, but based on the picture AR it should be 128x144 mm.
  Detailed Timing Descriptor #4: DTD is identical to VIC 4, which is not present in the CTA Ext Block.
  Detailed Timing Descriptor #4: Image size is 518x324 mm, but based on the picture AR it should be 518x291 mm.
  Detailed Timing Descriptor #5: Image size is 518x324 mm, but based on the picture AR it should be 486x324 mm.
EDID:
  Base EDID: Some timings are out of range of the Monitor Ranges:
    Vertical Freq: 59.887 - 62.809 Hz (Monitor: 60.000 - 60.000 Hz)

Failures:

Block 0, Base EDID:
  Standard Timings: Use 0x0101 as the invalid Standard Timings code, not 0x0140.
  Dummy Descriptor: Dummy block filled with garbage.
Block 1, CTA-861 Extension Block:
  Vendor-Specific Video Data Block, OUI 00-00-00: Data block length (2) is not enough to contain an OUI.
  Detailed Timing Descriptor #4: Mismatch of image size 518x324 mm vs display size 260x150 mm.
  Detailed Timing Descriptor #5: Mismatch of image size 518x324 mm vs display size 260x150 mm.
  Missing VCDB, needed for Set Selectable RGB Quantization to avoid interop issues.
EDID:
  Extension Block 2 started with EDID header, ignoring Extension Blocks >= 2.
  Base EDID: The DTD max image size is 518x324mm, which is larger than the display size 260.0x150.0mm.

EDID conformity: FAIL
