edid-decode (hex):

00 ff ff ff ff ff ff 00 10 ac 52 a2 53 49 36 30
30 21 01 04 b5 3b 21 78 3b ef f5 b0 4d 3d b6 24
0d 50 54 a5 4b 00 71 4f 81 80 a9 c0 d1 c0 01 01
01 01 01 01 01 01 56 5e 00 a0 a0 a0 29 50 30 20
35 00 4e 4e 21 00 00 1a 00 00 00 ff 00 46 53 31
31 5a 5a 33 0a 20 20 20 20 20 00 00 00 fc 00 41
57 32 37 32 35 44 46 0a 20 20 20 20 00 00 00 fd
0e 30 69 ff ff a9 01 0a 20 20 20 20 20 20 02 5a

02 03 29 b1 4c 3f 22 21 20 1f 13 12 10 04 03 02
01 74 1a 00 00 03 01 30 f0 00 80 00 00 00 00 68
01 00 00 00 89 00 e2 00 ea 40 e7 00 6a a0 a0 67
50 08 20 98 04 4e 4e 21 00 00 1a 6f c2 00 a0 a0
a0 55 50 30 20 35 00 4e 4e 21 00 00 1a a0 dd 80
78 70 38 50 40 1c 20 98 0c 4e 4e 21 00 00 1a 00
00 00 00 00 00 00 00 00 00 00 00 00 00 00 00 00
00 00 00 00 00 00 00 00 00 00 00 00 00 00 00 4c

00 ff ff ff ff ff ff 00 10 ac 52 a2 53 49 36 30
30 21 01 04 b5 3b 21 78 3b ef f5 b0 4d 3d b6 24
0d 50 54 a5 4b 00 71 4f 81 80 a9 c0 d1 c0 01 01
01 01 01 01 01 01 56 5e 00 a0 a0 a0 29 50 30 20
35 00 4e 4e 21 00 00 1a 00 00 00 ff 00 46 53 31
31 5a 5a 33 0a 20 20 20 20 20 00 00 00 fc 00 41
57 32 37 32 35 44 46 0a 20 20 20 20 00 00 00 fd
0e 30 69 ff ff a9 01 0a 20 20 20 20 20 20 02 5a

00 ff ff ff ff ff ff 00 10 ac 52 a2 53 49 36 30
30 21 01 04 b5 3b 21 78 3b ef f5 b0 4d 3d b6 24
0d 50 54 a5 4b 00 71 4f 81 80 a9 c0 d1 c0 01 01
01 01 01 01 01 01 56 5e 00 a0 a0 a0 29 50 30 20
35 00 4e 4e 21 00 00 1a 00 00 00 ff 00 46 53 31
31 5a 5a 33 0a 20 20 20 20 20 00 00 00 fc 00 41
57 32 37 32 35 44 46 0a 20 20 20 20 00 00 00 fd
0e 30 69 ff ff a9 01 0a 20 20 20 20 20 20 02 5a

02 03 29 b1 4c 3f 22 21 20 1f 13 12 10 04 03 02
01 74 1a 00 00 03 01 30 f0 00 80 00 00 00 00 68
01 00 00 00 89 00 e2 00 ea 40 e7 00 6a a0 a0 67
50 08 20 98 04 4e 4e 21 00 00 1a 6f c2 00 a0 a0
a0 55 50 30 20 35 00 4e 4e 21 00 00 1a a0 dd 80
78 70 38 50 40 1c 20 98 0c 4e 4e 21 00 00 1a 00
00 00 00 00 00 00 00 00 00 00 00 00 00 00 00 00
00 00 00 00 00 00 00 00 00 00 00 00 00 00 00 4c

00 ff ff ff ff ff ff 00 10 ac 52 a2 53 49 36 30
30 21 01 04 b5 3b 21 78 3b ef f5 b0 4d 3d b6 24
0d 50 54 a5 4b 00 71 4f 81 80 a9 c0 d1 c0 01 01
01 01 01 01 01 01 56 5e 00 a0 a0 a0 29 50 30 20
35 00 4e 4e 21 00 00 1a 00 00 00 ff 00 46 53 31
31 5a 5a 33 0a 20 20 20 20 20 00 00 00 fc 00 41
57 32 37 32 35 44 46 0a 20 20 20 20 00 00 00 fd
0e 30 69 ff ff a9 01 0a 20 20 20 20 20 20 02 5a

----------------

Block 0, Base EDID:
  EDID Structure Version & Revision: 1.4
  Vendor & Product Identification:
    Manufacturer: DEL
    Model: 41554
    Serial Number: ...
    Made in: week 48 of 2023
  Basic Display Parameters & Features:
    Digital display
    Bits per primary color channel: 10
    DisplayPort interface
    Maximum image size: 59 cm x 33 cm
    Gamma: 2.20
    DPMS levels: Off
    Supported color formats: RGB 4:4:4, YCrCb 4:4:4, YCrCb 4:2:2
    First detailed timing includes the native pixel format and preferred refresh rate
    Display supports continuous frequencies
  Color Characteristics:
    Red  : 0.6904, 0.3027
    Green: 0.2412, 0.7138
    Blue : 0.1435, 0.0537
    White: 0.3134, 0.3291
  Established Timings I & II:
    IBM     :   720x400    70.081663 Hz   9:5     31.467 kHz     28.320000 MHz
    DMT 0x04:   640x480    59.940476 Hz   4:3     31.469 kHz     25.175000 MHz
    DMT 0x06:   640x480    75.000000 Hz   4:3     37.500 kHz     31.500000 MHz
    DMT 0x09:   800x600    60.316541 Hz   4:3     37.879 kHz     40.000000 MHz
    DMT 0x0b:   800x600    75.000000 Hz   4:3     46.875 kHz     49.500000 MHz
    DMT 0x10:  1024x768    60.003840 Hz   4:3     48.363 kHz     65.000000 MHz
    DMT 0x12:  1024x768    75.028582 Hz   4:3     60.023 kHz     78.750000 MHz
    DMT 0x24:  1280x1024   75.024675 Hz   5:4     79.976 kHz    135.000000 MHz
  Standard Timings:
    DMT 0x15:  1152x864    75.000000 Hz   4:3     67.500 kHz    108.000000 MHz
    DMT 0x23:  1280x1024   60.019740 Hz   5:4     63.981 kHz    108.000000 MHz
    DMT 0x53:  1600x900    60.000000 Hz  16:9     60.000 kHz    108.000000 MHz (RB)
    DMT 0x52:  1920x1080   60.000000 Hz  16:9     67.500 kHz    148.500000 MHz
  Detailed Timing Descriptors:
    DTD 1:  2560x1440   59.950550 Hz  16:9     88.787 kHz    241.500000 MHz (590 mm x 334 mm)
                 Hfront   48 Hsync  32 Hback   80 Hpol P
                 Vfront    3 Vsync   5 Vback   33 Vpol N
    Display Product Serial Number: ...
    Display Product Name: 'AW2725DF'
    Display Range Limits:
      Monitor ranges (Range Limits Only): 48-360 Hz V, 510-510 kHz H, max dotclock 1690 MHz
  Extension blocks: 2
Checksum: 0x5a

----------------

Block 1, CTA-861 Extension Block:
  Revision: 3
  Underscans IT Video Formats by default
  Supports YCbCr 4:4:4
  Supports YCbCr 4:2:2
  Native DTDs: 1
  Video Data Block:
    VIC  63:  1920x1080  120.000000 Hz  16:9    135.000 kHz    297.000000 MHz
    VIC  34:  1920x1080   30.000000 Hz  16:9     33.750 kHz     74.250000 MHz
    VIC  33:  1920x1080   25.000000 Hz  16:9     28.125 kHz     74.250000 MHz
    VIC  32:  1920x1080   24.000000 Hz  16:9     27.000 kHz     74.250000 MHz
    VIC  31:  1920x1080   50.000000 Hz  16:9     56.250 kHz    148.500000 MHz
    VIC  19:  1280x720    50.000000 Hz  16:9     37.500 kHz     74.250000 MHz
    VIC  18:   720x576    50.000000 Hz  16:9     31.250 kHz     27.000000 MHz
    VIC  16:  1920x1080   60.000000 Hz  16:9     67.500 kHz    148.500000 MHz
    VIC   4:  1280x720    60.000000 Hz  16:9     45.000 kHz     74.250000 MHz
    VIC   3:   720x480    59.940060 Hz  16:9     31.469 kHz     27.000000 MHz
    VIC   2:   720x480    59.940060 Hz   4:3     31.469 kHz     27.000000 MHz
    VIC   1:   640x480    59.940476 Hz   4:3     31.469 kHz     25.175000 MHz
  Vendor-Specific Data Block (AMD), OUI 00-00-1A:
    Version: 3
    Feature Caps: 0x01
    Minimum Refresh Rate: 48 Hz
    Maximum Refresh Rate: 360 Hz
    Flags 1.x: 0x00
    Flags 2.x: 0x80
  Video Capability Data Block:
    YCbCr quantization: Selectable (via AVI YQ)
    RGB quantization: Selectable (via AVI Q)
    PT scan behavior: Always Underscanned
    IT scan behavior: Always Underscanned
    CE scan behavior: Always Underscanned
  Detailed Timing Descriptors:
    DTD 2:  2560x1440  143.911545 Hz  16:9    222.056 kHz    592.000000 MHz (590 mm x 334 mm)
                 Hfront    8 Hsync  32 Hback   66 Hpol P
                 Vfront   25 Vsync   8 Vback   70 Vpol N
    DTD 3:  2560x1440  119.997589 Hz  16:9    182.996 kHz    497.750000 MHz (590 mm x 334 mm)
                 Hfront   48 Hsync  32 Hback   80 Hpol P
                 Vfront    3 Vsync   5 Vback   77 Vpol N
    DTD 4:  1920x1080  239.756592 Hz  16:9    278.118 kHz    567.360000 MHz (590 mm x 334 mm)
                 Hfront   28 Hsync  32 Hback   60 Hpol P
                 Vfront   57 Vsync   8 Vback   15 Vpol N
Checksum: 0x4c  Unused space in Extension Block: 32 bytes

----------------

Warnings:

Block 1, CTA-861 Extension Block:
  Video Data Block: VIC 63 and the first DTD are not identical. Is this intended?
  Video Capability Data Block: S_PT is equal to S_IT and S_CE, so should be set to 0 instead.
  Display Product Serial Number is set, so the Serial Number in the Base EDID should be 0.
  Add a Colorimetry Data Block with the sRGB colorimetry bit set to avoid interop issues.
EDID:
  Base EDID: Some timings are out of range of the Monitor Ranges:
    Vertical Freq: 24.000 - 239.757 Hz (Monitor: 48.000 - 360.000 Hz)
    Horizontal Freq: 27.000 - 278.117 kHz (Monitor: 510.000 - 510.000 kHz)

Failures:

EDID:
  Extension Block 2 started with EDID header, ignoring Extension Blocks >= 2.
  Base EDID: EDID specified 2 extension block(s), but found 1 extension block(s).

EDID conformity: FAIL
