edid-decode (hex):

00 ff ff ff ff ff ff 00 28 89 00 00 00 00 00 00
00 1b 01 04 a5 1f 11 78 03 8d e0 a5 53 35 b8 26
0e 50 54 00 00 00 01 01 01 01 01 01 01 01 01 01
01 01 01 01 01 01 c0 5f 00 a0 a0 a0 3e 50 30 20
36 00 35 ae 10 00 00 1a 00 00 00 00 00 00 00 00
00 00 00 00 00 00 00 00 00 00 00 00 00 fe 00 4a
44 49 20 20 20 20 20 20 20 20 20 20 00 00 00 fe
00 4c 50 4d 31 34 30 4d 34 32 30 20 20 20 00 b7

----------------

Block 0, Base EDID:
  EDID Structure Version & Revision: 1.4
  Vendor & Product Identification:
    Manufacturer: JDI
    Model: 0
    Made in: 2017
  Basic Display Parameters & Features:
    Digital display
    Bits per primary color channel: 8
    DisplayPort interface
    Maximum image size: 31 cm x 17 cm
    Gamma: 2.20
    Supported color formats: RGB 4:4:4
    First detailed timing includes the native pixel format and preferred refresh rate
    Display supports continuous frequencies
  Color Characteristics:
    Red  : 0.6464, 0.3242
    Green: 0.2099, 0.7197
    Blue : 0.1513, 0.0566
    White: 0.3125, 0.3281
  Established Timings I & II: none
  Standard Timings: none
  Detailed Timing Descriptors:
    DTD 1:  2560x1440   59.998433 Hz  16:9     90.118 kHz    245.120000 MHz (309 mm x 174 mm)
                 Hfront   48 Hsync  32 Hback   80 Hpol P
                 Vfront    3 Vsync   6 Vback   53 Vpol N
    Empty Descriptor
    Alphanumeric Data String: 'JDI          '
    Alphanumeric Data String: 'LPM140M420   '
Checksum: 0xb7

----------------

Warnings:

Block 0, Base EDID:
  Missing Display Product Name.

Failures:

Block 0, Base EDID:
  Empty Descriptor: Use Dummy Descriptor instead of all zeroes.
  Alphanumeric Data String: No newline, but one or more trailing spaces.
  Alphanumeric Data String: No newline, but one or more trailing spaces.
  Missing Display Range Limits Descriptor.

EDID conformity: FAIL
