edid-decode (hex):

00 ff ff ff ff ff ff 00 30 e4 d6 06 00 00 00 00
00 1f 01 04 a5 1f 11 78 07 ee 05 a7 54 4c 99 25
0e 50 54 00 00 00 01 01 01 01 01 01 01 01 01 01
01 01 01 01 01 01 2e 36 80 a0 70 38 1f 40 30 20
35 00 35 ae 10 00 00 1a 58 2b 80 a0 70 38 1f 40
30 20 35 00 35 ae 10 00 00 1a 00 00 00 fe 00 52
31 30 30 54 80 31 34 30 57 46 39 0a 00 00 00 00
00 02 41 31 a8 00 10 00 00 0a 01 0a 20 20 00 e0

00 ff ff ff ff ff ff 00 30 e4 d6 06 00 00 00 00
00 1f 01 04 a5 1f 11 78 07 ee 05 a7 54 4c 99 25
0e 50 54 00 00 00 01 01 01 01 01 01 01 01 01 01
01 01 01 01 01 01 2e 36 80 a0 70 38 1f 40 30 20
35 00 35 ae 10 00 00 1a 58 2b 80 a0 70 38 1f 40
30 20 35 00 35 ae 10 00 00 1a 00 00 00 fe 00 52
31 30 30 54 80 31 34 30 57 46 39 0a 00 00 00 00
00 02 41 31 a8 00 10 00 00 0a 01 0a 20 20 00 e0

----------------

Block 0, Base EDID:
  EDID Structure Version & Revision: 1.4
  Vendor & Product Identification:
    Manufacturer: LGD
    Model: 1750
    Made in: 2021
  Basic Display Parameters & Features:
    Digital display
    Bits per primary color channel: 8
    DisplayPort interface
    Maximum image size: 31 cm x 17 cm
    Gamma: 2.20
    Supported color formats: RGB 4:4:4
    Default (sRGB) color space is primary color space
    First detailed timing includes the native pixel format and preferred refresh rate
    Display supports continuous frequencies
  Color Characteristics:
    Red  : 0.6552, 0.3300
    Green: 0.2998, 0.5996
    Blue : 0.1445, 0.0546
    White: 0.3134, 0.3291
  Established Timings I & II: none
  Standard Timings: none
  Detailed Timing Descriptors:
    DTD 1:  1920x1080   60.020425 Hz  16:9     66.683 kHz    138.700000 MHz (309 mm x 174 mm)
                 Hfront   48 Hsync  32 Hback   80 Hpol P
                 Vfront    3 Vsync   5 Vback   23 Vpol N
    DTD 2:  1920x1080   48.016340 Hz  16:9     53.346 kHz    110.960000 MHz (309 mm x 174 mm)
                 Hfront   48 Hsync  32 Hback   80 Hpol P
                 Vfront    3 Vsync   5 Vback   23 Vpol N
    Alphanumeric Data String: 'R100T.140WF9'
    Manufacturer-Specified Display Descriptor (0x00): 00 00 00 02 41 31 a8 00 10 00 00 0a 01 0a 20 20 '....A1........  '
Checksum: 0xe0

----------------

Block 1, Unknown EDID Extension Block 0x00:
  00 ff ff ff ff ff ff 00 30 e4 d6 06 00 00 00 00 '........0.......'
  00 1f 01 04 a5 1f 11 78 07 ee 05 a7 54 4c 99 25 '.......x....TL.%'
  0e 50 54 00 00 00 01 01 01 01 01 01 01 01 01 01 '.PT.............'
  01 01 01 01 01 01 2e 36 80 a0 70 38 1f 40 30 20 '.......6..p8.@0 '
  35 00 35 ae 10 00 00 1a 58 2b 80 a0 70 38 1f 40 '5.5.....X+..p8.@'
  30 20 35 00 35 ae 10 00 00 1a 00 00 00 fe 00 52 '0 5.5..........R'
  31 30 30 54 80 31 34 30 57 46 39 0a 00 00 00 00 '100T.140WF9.....'
  00 02 41 31 a8 00 10 00 00 0a 01 0a 20 20 00 e0 '..A1........  ..'
Checksum: 0xe0

----------------

Warnings:

Block 0, Base EDID:
  Alphanumeric Data String: Non-ASCII character 0x80 at position 5, can cause problems.
  Missing Display Product Name.

Failures:

Block 0, Base EDID:
  Basic Display Parameters & Features: sRGB is signaled, but the chromaticities do not match.
  Missing Display Range Limits Descriptor.
Block 1, Base EDID:
  Unknown Extension Block.
EDID:
  Base EDID: EDID specified 0 extension block(s), but found 1 extension block(s).

EDID conformity: FAIL
