edid-decode (hex):

00 ff ff ff ff ff ff 00 30 e4 01 08 00 00 00 00
00 13 01 04 a0 33 1d 78 ea f8 05 a4 55 4d 9d 25
12 50 54 00 00 00 01 01 01 01 01 01 01 01 01 01
01 01 01 01 01 01 40 38 80 00 71 38 18 40 60 40
84 00 fd 1e 11 00 00 19 00 00 00 00 00 00 00 00
00 00 00 00 00 00 00 00 00 00 00 00 00 fe 00 4c
47 20 44 69 73 70 6c 61 79 0a 20 20 00 00 00 fe
00 4c 4d 32 33 30 57 46 32 2d 53 4c 41 32 00 47

00 ff ff ff ff ff ff 00 30 e4 01 08 00 00 00 00
00 13 01 04 a0 33 1d 78 ea f8 05 a4 55 4d 9d 25
12 50 54 00 00 00 01 01 01 01 01 01 01 01 01 01
01 01 01 01 01 01 40 38 80 00 71 38 18 40 60 40
84 00 fd 1e 11 00 00 19 00 00 00 00 00 00 00 00
00 00 00 00 00 00 00 00 00 00 00 00 00 fe 00 4c
47 20 44 69 73 70 6c 61 79 0a 20 20 00 00 00 fe
00 4c 4d 32 33 30 57 46 32 2d 53 4c 41 32 00 47

----------------

Block 0, Base EDID:
  EDID Structure Version & Revision: 1.4
  Vendor & Product Identification:
    Manufacturer: LGD
    Model: 2049
    Made in: 2009
  Basic Display Parameters & Features:
    Digital display
    Bits per primary color channel: 8
    Digital interface is not defined
    Maximum image size: 51 cm x 29 cm
    Gamma: 2.20
    DPMS levels: Standby Suspend Off
    Supported color formats: RGB 4:4:4, YCrCb 4:4:4
    First detailed timing includes the native pixel format and preferred refresh rate
  Color Characteristics:
    Red  : 0.6435, 0.3349
    Green: 0.3027, 0.6132
    Blue : 0.1445, 0.0703
    White: 0.3134, 0.3291
  Established Timings I & II: none
  Standard Timings: none
  Detailed Timing Descriptors:
    DTD 1:  1920x1080   59.942455 Hz  16:9     66.176 kHz    144.000000 MHz (509 mm x 286 mm)
                 Hfront   96 Hsync  64 Hback   96 Hpol N
                 Vfront    8 Vsync   4 Vback   12 Vpol N
    Empty Descriptor
    Alphanumeric Data String: 'LG Display'
    Alphanumeric Data String: 'LM230WF2-SLA2'
Checksum: 0x47

----------------

Warnings:

Block 0, Base EDID:
  Missing Display Product Name.

Failures:

Block 0, Base EDID:
  Empty Descriptor: Use Dummy Descriptor instead of all zeroes.
EDID:
  Extension Block 1 started with EDID header, ignoring Extension Blocks >= 1.

EDID conformity: FAIL
