edid-decode (hex):

00 ff ff ff ff ff ff 00 15 c3 69 29 01 01 01 01
2a 1e 01 04 a5 22 1c 78 e2 8d b5 a2 57 4f a0 28
0e 50 54 a3 08 00 81 40 81 00 81 c0 01 01 01 01
01 01 01 01 01 01 30 2a 00 98 51 00 2a 40 30 70
13 00 52 0f 11 00 00 1e 00 00 00 ff 00 34 32 31
38 35 31 30 30 0a 20 20 20 20 00 00 00 fd 00 37
3d 1f 40 0b 00 0a 20 20 20 20 20 20 00 00 00 fc
00 53 31 37 30 33 2d 41 0a 20 20 20 20 20 00 ed

00 ff ff ff ff ff ff 00 15 c3 69 29 01 01 01 01
2a 1e 01 04 a5 22 1c 78 e2 8d b5 a2 57 4f a0 28
0e 50 54 a3 08 00 81 40 81 00 81 c0 01 01 01 01
01 01 01 01 01 01 30 2a 00 98 51 00 2a 40 30 70
13 00 52 0f 11 00 00 1e 00 00 00 ff 00 34 32 31
38 35 31 30 30 0a 20 20 20 20 00 00 00 fd 00 37
3d 1f 40 0b 00 0a 20 20 20 20 20 20 00 00 00 fc
00 53 31 37 30 33 2d 41 0a 20 20 20 20 20 00 ed

----------------

Block 0, Base EDID:
  EDID Structure Version & Revision: 1.4
  Vendor & Product Identification:
    Manufacturer: ENC
    Model: 10601
    Serial Number: ...
    Made in: week 42 of 2020
  Basic Display Parameters & Features:
    Digital display
    Bits per primary color channel: 8
    DisplayPort interface
    Maximum image size: 34 cm x 28 cm
    Gamma: 2.20
    DPMS levels: Standby Suspend Off
    Supported color formats: RGB 4:4:4
    First detailed timing includes the native pixel format and preferred refresh rate
  Color Characteristics:
    Red  : 0.6347, 0.3398
    Green: 0.3115, 0.6259
    Blue : 0.1582, 0.0576
    White: 0.3134, 0.3291
  Established Timings I & II:
    IBM     :   720x400    70.081663 Hz   9:5     31.467 kHz     28.320000 MHz
    DMT 0x04:   640x480    59.940476 Hz   4:3     31.469 kHz     25.175000 MHz
    DMT 0x08:   800x600    56.250000 Hz   4:3     35.156 kHz     36.000000 MHz
    DMT 0x09:   800x600    60.316541 Hz   4:3     37.879 kHz     40.000000 MHz
    DMT 0x10:  1024x768    60.003840 Hz   4:3     48.363 kHz     65.000000 MHz
  Standard Timings:
    DMT 0x20:  1280x960    60.000000 Hz   4:3     60.000 kHz    108.000000 MHz
    DMT 0x1c:  1280x800    59.810326 Hz  16:10    49.702 kHz     83.500000 MHz
    DMT 0x55:  1280x720    60.000000 Hz  16:9     45.000 kHz     74.250000 MHz
  Detailed Timing Descriptors:
    DTD 1:  1280x1024   60.019740 Hz   5:4     63.981 kHz    108.000000 MHz (338 mm x 271 mm)
                 Hfront   48 Hsync 112 Hback  248 Hpol P
                 Vfront    1 Vsync   3 Vback   38 Vpol P
    Display Product Serial Number: ...
    Display Range Limits:
      Monitor ranges (GTF): 55-61 Hz V, 31-64 kHz H, max dotclock 110 MHz
    Display Product Name: 'S1703-A'
Checksum: 0xed

----------------

Warnings:

Block 0, Base EDID:
  Vendor & Product Identification: The serial number is one of the known dummy values, it should probably be set to 0.
  Display Range Limits: GTF support is deprecated in EDID 1.4.
EDID:
  Base EDID: Some timings are out of range of the Monitor Ranges:
    Vertical Freq: 56.250 - 70.082 Hz (Monitor: 55.000 - 61.000 Hz)

Failures:

Block 0, Base EDID:
  Display Range Limits: GTF is supported, but the display does not support continuous frequencies.
EDID:
  Extension Block 1 started with EDID header, ignoring Extension Blocks >= 1.

EDID conformity: FAIL
