edid-decode (hex):

00 ff ff ff ff ff ff 00 04 72 00 0b eb 0f 00 33
1e 21 01 04 b5 4f 21 78 3b 8e 05 ad 4f 33 b0 26
0d 50 54 a7 cb 00 81 c0 81 80 01 01 a9 c0 b3 00
d1 c0 01 01 01 01 f5 7c 70 a0 d0 a0 29 50 30 20
35 00 1d 4e 31 00 00 1a 00 00 00 ff 00 31 33 33
30 30 30 46 45 42 32 58 30 30 00 00 00 fd 00 30
a5 de de 5c 01 0a 20 20 20 20 20 20 00 00 00 fc
00 45 44 33 34 33 43 55 52 20 56 0a 20 20 02 8a

02 03 2f f4 4e 90 9f 85 94 04 13 03 12 01 02 11
5a 5b 5c 23 09 07 07 83 01 00 00 68 1a 00 00 01
01 30 a5 00 e3 05 e3 01 e6 06 07 01 65 65 00 ec
3a 80 18 71 38 2d 40 58 2c 96 00 56 50 21 00 00
18 1f ac 00 a0 a0 38 2d 40 30 20 35 00 55 50 21
00 00 1e 42 d0 70 a0 d0 a0 29 50 30 20 35 00 1b
4e 31 00 00 1e eb f9 70 a0 d0 a0 29 50 30 20 35
00 1b 4e 31 00 00 1e 00 00 00 00 00 00 00 00 08

00 ff ff ff ff ff ff 00 04 72 00 0b eb 0f 00 33
1e 21 01 04 b5 4f 21 78 3b 8e 05 ad 4f 33 b0 26
0d 50 54 a7 cb 00 81 c0 81 80 01 01 a9 c0 b3 00
d1 c0 01 01 01 01 f5 7c 70 a0 d0 a0 29 50 30 20
35 00 1d 4e 31 00 00 1a 00 00 00 ff 00 31 33 33
30 30 30 46 45 42 32 58 30 30 00 00 00 fd 00 30
a5 de de 5c 01 0a 20 20 20 20 20 20 00 00 00 fc
00 45 44 33 34 33 43 55 52 20 56 0a 20 20 02 8a

00 ff ff ff ff ff ff 00 04 72 00 0b eb 0f 00 33
1e 21 01 04 b5 4f 21 78 3b 8e 05 ad 4f 33 b0 26
0d 50 54 a7 cb 00 81 c0 81 80 01 01 a9 c0 b3 00
d1 c0 01 01 01 01 f5 7c 70 a0 d0 a0 29 50 30 20
35 00 1d 4e 31 00 00 1a 00 00 00 ff 00 31 33 33
30 30 30 46 45 42 32 58 30 30 00 00 00 fd 00 30
a5 de de 5c 01 0a 20 20 20 20 20 20 00 00 00 fc
00 45 44 33 34 33 43 55 52 20 56 0a 20 20 02 8a

02 03 2f f4 4e 90 9f 85 94 04 13 03 12 01 02 11
5a 5b 5c 23 09 07 07 83 01 00 00 68 1a 00 00 01
01 30 a5 00 e3 05 e3 01 e6 06 07 01 65 65 00 ec
3a 80 18 71 38 2d 40 58 2c 96 00 56 50 21 00 00
18 1f ac 00 a0 a0 38 2d 40 30 20 35 00 55 50 21
00 00 1e 42 d0 70 a0 d0 a0 29 50 30 20 35 00 1b
4e 31 00 00 1e eb f9 70 a0 d0 a0 29 50 30 20 35
00 1b 4e 31 00 00 1e 00 00 00 00 00 00 00 00 08

00 ff ff ff ff ff ff 00 04 72 00 0b eb 0f 00 33
1e 21 01 04 b5 4f 21 78 3b 8e 05 ad 4f 33 b0 26
0d 50 54 a7 cb 00 81 c0 81 80 01 01 a9 c0 b3 00
d1 c0 01 01 01 01 f5 7c 70 a0 d0 a0 29 50 30 20
35 00 1d 4e 31 00 00 1a 00 00 00 ff 00 31 33 33
30 30 30 46 45 42 32 58 30 30 00 00 00 fd 00 30
a5 de de 5c 01 0a 20 20 20 20 20 20 00 00 00 fc
00 45 44 33 34 33 43 55 52 20 56 0a 20 20 02 8a

----------------

Block 0, Base EDID:
  EDID Structure Version & Revision: 1.4
  Vendor & Product Identification:
    Manufacturer: ACR
    Model: 2816
    Serial Number: ...
    Made in: week 30 of 2023
  Basic Display Parameters & Features:
    Digital display
    Bits per primary color channel: 10
    DisplayPort interface
    Maximum image size: 79 cm x 33 cm
    Gamma: 2.20
    DPMS levels: Off
    Supported color formats: RGB 4:4:4, YCrCb 4:4:4, YCrCb 4:2:2
    First detailed timing includes the native pixel format and preferred refresh rate
    Display supports continuous frequencies
  Color Characteristics:
    Red  : 0.6777, 0.3085
    Green: 0.2021, 0.6894
    Blue : 0.1484, 0.0507
    White: 0.3134, 0.3291
  Established Timings I & II:
    IBM     :   720x400    70.081663 Hz   9:5     31.467 kHz     28.320000 MHz
    DMT 0x04:   640x480    59.940476 Hz   4:3     31.469 kHz     25.175000 MHz
    DMT 0x06:   640x480    75.000000 Hz   4:3     37.500 kHz     31.500000 MHz
    DMT 0x08:   800x600    56.250000 Hz   4:3     35.156 kHz     36.000000 MHz
    DMT 0x09:   800x600    60.316541 Hz   4:3     37.879 kHz     40.000000 MHz
    DMT 0x0a:   800x600    72.187572 Hz   4:3     48.077 kHz     50.000000 MHz
    DMT 0x0b:   800x600    75.000000 Hz   4:3     46.875 kHz     49.500000 MHz
    DMT 0x10:  1024x768    60.003840 Hz   4:3     48.363 kHz     65.000000 MHz
    DMT 0x12:  1024x768    75.028582 Hz   4:3     60.023 kHz     78.750000 MHz
    DMT 0x24:  1280x1024   75.024675 Hz   5:4     79.976 kHz    135.000000 MHz
  Standard Timings:
    DMT 0x55:  1280x720    60.000000 Hz  16:9     45.000 kHz     74.250000 MHz
    DMT 0x23:  1280x1024   60.019740 Hz   5:4     63.981 kHz    108.000000 MHz
    DMT 0x53:  1600x900    60.000000 Hz  16:9     60.000 kHz    108.000000 MHz (RB)
    DMT 0x3a:  1680x1050   59.954250 Hz  16:10    65.290 kHz    146.250000 MHz
    DMT 0x52:  1920x1080   60.000000 Hz  16:9     67.500 kHz    148.500000 MHz
  Detailed Timing Descriptors:
    DTD 1:  3440x1440   59.998875 Hz  43:18    88.858 kHz    319.890000 MHz (797 mm x 334 mm)
                 Hfront   48 Hsync  32 Hback   80 Hpol P
                 Vfront    3 Vsync   5 Vback   33 Vpol N
    Display Product Serial Number: ...
    Display Range Limits:
      Monitor ranges (Range Limits Only): 48-165 Hz V, 222-222 kHz H, max dotclock 920 MHz
    Display Product Name: 'ED343CUR V'
  Extension blocks: 2
Checksum: 0x8a

----------------

Block 1, CTA-861 Extension Block:
  Revision: 3
  Underscans IT Video Formats by default
  Basic audio support
  Supports YCbCr 4:4:4
  Supports YCbCr 4:2:2
  Native detailed modes: 4
  Video Data Block:
    VIC  16:  1920x1080   60.000000 Hz  16:9     67.500 kHz    148.500000 MHz (native)
    VIC  31:  1920x1080   50.000000 Hz  16:9     56.250 kHz    148.500000 MHz (native)
    VIC   5:  1920x1080i  60.000000 Hz  16:9     33.750 kHz     74.250000 MHz (native)
    VIC  20:  1920x1080i  50.000000 Hz  16:9     28.125 kHz     74.250000 MHz (native)
    VIC   4:  1280x720    60.000000 Hz  16:9     45.000 kHz     74.250000 MHz
    VIC  19:  1280x720    50.000000 Hz  16:9     37.500 kHz     74.250000 MHz
    VIC   3:   720x480    59.940060 Hz  16:9     31.469 kHz     27.000000 MHz
    VIC  18:   720x576    50.000000 Hz  16:9     31.250 kHz     27.000000 MHz
    VIC   1:   640x480    59.940476 Hz   4:3     31.469 kHz     25.175000 MHz
    VIC   2:   720x480    59.940060 Hz   4:3     31.469 kHz     27.000000 MHz
    VIC  17:   720x576    50.000000 Hz   4:3     31.250 kHz     27.000000 MHz
    VIC  90:  2560x1080   60.000000 Hz  64:27    66.000 kHz    198.000000 MHz
    VIC  91:  2560x1080  100.000000 Hz  64:27   125.000 kHz    371.250000 MHz
    VIC  92:  2560x1080  120.000000 Hz  64:27   150.000 kHz    495.000000 MHz
  Audio Data Block:
    Linear PCM:
      Max channels: 2
      Supported sample rates (kHz): 48 44.1 32
      Supported sample sizes (bits): 24 20 16
  Speaker Allocation Data Block:
    FL/FR - Front Left/Right
  Vendor-Specific Data Block (AMD), OUI 00-00-1A:
    Version: 1
    Feature Caps: 0x01
    Minimum Refresh Rate: 48 Hz
    Maximum Refresh Rate: 165 Hz
    Flags 1.x: 0x00
  Colorimetry Data Block:
    xvYCC601
    xvYCC709
    BT2020cYCC
    BT2020YCC
    BT2020RGB
    Gamut Boundary Description Metadata Profile P0
  HDR Static Metadata Data Block:
    Electro optical transfer functions:
      Traditional gamma - SDR luminance range
      Traditional gamma - HDR luminance range
      SMPTE ST2084
    Supported static metadata descriptors:
      Static metadata type 1
    Desired content max luminance: 101 (445.755 cd/m^2)
    Desired content max frame-average luminance: 101 (445.755 cd/m^2)
    Desired content min luminance: 0 (0.000 cd/m^2)
  Detailed Timing Descriptors:
    DTD 2:  1920x1080   60.945455 Hz  16:9     68.564 kHz    150.840000 MHz (598 mm x 336 mm)
                 Hfront   88 Hsync  44 Hback  148 Hpol N
                 Vfront    9 Vsync   6 Vback   30 Vpol N
    DTD 3:  2560x1080  143.996732 Hz  64:27   161.996 kHz    440.630000 MHz (597 mm x 336 mm)
                 Hfront   48 Hsync  32 Hback   80 Hpol P
                 Vfront    3 Vsync   5 Vback   37 Vpol P
    DTD 4:  3440x1440   99.996249 Hz  43:18   148.094 kHz    533.140000 MHz (795 mm x 334 mm)
                 Hfront   48 Hsync  32 Hback   80 Hpol P
                 Vfront    3 Vsync   5 Vback   33 Vpol P
    DTD 5:  3440x1440  119.999625 Hz  43:18   177.719 kHz    639.790000 MHz (795 mm x 334 mm)
                 Hfront   48 Hsync  32 Hback   80 Hpol P
                 Vfront    3 Vsync   5 Vback   33 Vpol P
Checksum: 0x08  Unused space in Extension Block: 8 bytes

----------------

Block 2, Unknown EDID Extension Block 0x00:
  00 ff ff ff ff ff ff 00 04 72 00 0b eb 0f 00 33 '.........r.....3'
  1e 21 01 04 b5 4f 21 78 3b 8e 05 ad 4f 33 b0 26 '.!...O!x;...O3.&'
  0d 50 54 a7 cb 00 81 c0 81 80 01 01 a9 c0 b3 00 '.PT.............'
  d1 c0 01 01 01 01 f5 7c 70 a0 d0 a0 29 50 30 20 '.......|p...)P0 '
  35 00 1d 4e 31 00 00 1a 00 00 00 ff 00 31 33 33 '5..N1........133'
  30 30 30 46 45 42 32 58 30 30 00 00 00 fd 00 30 '000FEB2X00.....0'
  a5 de de 5c 01 0a 20 20 20 20 20 20 00 00 00 fc '...\..      ....'
  00 45 44 33 34 33 43 55 52 20 56 0a 20 20 02 8a '.ED343CUR V.  ..'
Checksum: 0x8a

----------------

Block 3, Unknown EDID Extension Block 0x00:
  00 ff ff ff ff ff ff 00 04 72 00 0b eb 0f 00 33 '.........r.....3'
  1e 21 01 04 b5 4f 21 78 3b 8e 05 ad 4f 33 b0 26 '.!...O!x;...O3.&'
  0d 50 54 a7 cb 00 81 c0 81 80 01 01 a9 c0 b3 00 '.PT.............'
  d1 c0 01 01 01 01 f5 7c 70 a0 d0 a0 29 50 30 20 '.......|p...)P0 '
  35 00 1d 4e 31 00 00 1a 00 00 00 ff 00 31 33 33 '5..N1........133'
  30 30 30 46 45 42 32 58 30 30 00 00 00 fd 00 30 '000FEB2X00.....0'
  a5 de de 5c 01 0a 20 20 20 20 20 20 00 00 00 fc '...\..      ....'
  00 45 44 33 34 33 43 55 52 20 56 0a 20 20 02 8a '.ED343CUR V.  ..'
Checksum: 0x8a

----------------

Block 4, CTA-861 Extension Block:
  Revision: 3
  Underscans IT Video Formats by default
  Basic audio support
  Supports YCbCr 4:4:4
  Supports YCbCr 4:2:2
  Native detailed modes: 4
  Video Data Block:
    VIC  16:  1920x1080   60.000000 Hz  16:9     67.500 kHz    148.500000 MHz (native)
    VIC  31:  1920x1080   50.000000 Hz  16:9     56.250 kHz    148.500000 MHz (native)
    VIC   5:  1920x1080i  60.000000 Hz  16:9     33.750 kHz     74.250000 MHz (native)
    VIC  20:  1920x1080i  50.000000 Hz  16:9     28.125 kHz     74.250000 MHz (native)
    VIC   4:  1280x720    60.000000 Hz  16:9     45.000 kHz     74.250000 MHz
    VIC  19:  1280x720    50.000000 Hz  16:9     37.500 kHz     74.250000 MHz
    VIC   3:   720x480    59.940060 Hz  16:9     31.469 kHz     27.000000 MHz
    VIC  18:   720x576    50.000000 Hz  16:9     31.250 kHz     27.000000 MHz
    VIC   1:   640x480    59.940476 Hz   4:3     31.469 kHz     25.175000 MHz
    VIC   2:   720x480    59.940060 Hz   4:3     31.469 kHz     27.000000 MHz
    VIC  17:   720x576    50.000000 Hz   4:3     31.250 kHz     27.000000 MHz
    VIC  90:  2560x1080   60.000000 Hz  64:27    66.000 kHz    198.000000 MHz
    VIC  91:  2560x1080  100.000000 Hz  64:27   125.000 kHz    371.250000 MHz
    VIC  92:  2560x1080  120.000000 Hz  64:27   150.000 kHz    495.000000 MHz
  Audio Data Block:
    Linear PCM:
      Max channels: 2
      Supported sample rates (kHz): 48 44.1 32
      Supported sample sizes (bits): 24 20 16
  Speaker Allocation Data Block:
    FL/FR - Front Left/Right
  Vendor-Specific Data Block (AMD), OUI 00-00-1A:
    Version: 1
    Feature Caps: 0x01
    Minimum Refresh Rate: 48 Hz
    Maximum Refresh Rate: 165 Hz
    Flags 1.x: 0x00
  Colorimetry Data Block:
    xvYCC601
    xvYCC709
    BT2020cYCC
    BT2020YCC
    BT2020RGB
    Gamut Boundary Description Metadata Profile P0
  HDR Static Metadata Data Block:
    Electro optical transfer functions:
      Traditional gamma - SDR luminance range
      Traditional gamma - HDR luminance range
      SMPTE ST2084
    Supported static metadata descriptors:
      Static metadata type 1
    Desired content max luminance: 101 (445.755 cd/m^2)
    Desired content max frame-average luminance: 101 (445.755 cd/m^2)
    Desired content min luminance: 0 (0.000 cd/m^2)
  Detailed Timing Descriptors:
    DTD 6:  1920x1080   60.945455 Hz  16:9     68.564 kHz    150.840000 MHz (598 mm x 336 mm)
                 Hfront   88 Hsync  44 Hback  148 Hpol N
                 Vfront    9 Vsync   6 Vback   30 Vpol N
    DTD 7:  2560x1080  143.996732 Hz  64:27   161.996 kHz    440.630000 MHz (597 mm x 336 mm)
                 Hfront   48 Hsync  32 Hback   80 Hpol P
                 Vfront    3 Vsync   5 Vback   37 Vpol P
    DTD 8:  3440x1440   99.996249 Hz  43:18   148.094 kHz    533.140000 MHz (795 mm x 334 mm)
                 Hfront   48 Hsync  32 Hback   80 Hpol P
                 Vfront    3 Vsync   5 Vback   33 Vpol P
    DTD 9:  3440x1440  119.999625 Hz  43:18   177.719 kHz    639.790000 MHz (795 mm x 334 mm)
                 Hfront   48 Hsync  32 Hback   80 Hpol P
                 Vfront    3 Vsync   5 Vback   33 Vpol P
Checksum: 0x08  Unused space in Extension Block: 8 bytes

----------------

Block 5, Unknown EDID Extension Block 0x00:
  00 ff ff ff ff ff ff 00 04 72 00 0b eb 0f 00 33 '.........r.....3'
  1e 21 01 04 b5 4f 21 78 3b 8e 05 ad 4f 33 b0 26 '.!...O!x;...O3.&'
  0d 50 54 a7 cb 00 81 c0 81 80 01 01 a9 c0 b3 00 '.PT.............'
  d1 c0 01 01 01 01 f5 7c 70 a0 d0 a0 29 50 30 20 '.......|p...)P0 '
  35 00 1d 4e 31 00 00 1a 00 00 00 ff 00 31 33 33 '5..N1........133'
  30 30 30 46 45 42 32 58 30 30 00 00 00 fd 00 30 '000FEB2X00.....0'
  a5 de de 5c 01 0a 20 20 20 20 20 20 00 00 00 fc '...\..      ....'
  00 45 44 33 34 33 43 55 52 20 56 0a 20 20 02 8a '.ED343CUR V.  ..'
Checksum: 0x8a

----------------

Warnings:

Block 1, CTA-861 Extension Block:
  Video Data Block: VIC 16 and the first DTD are not identical. Is this intended?
  Colorimetry Data Block: Set the sRGB colorimetry bit to avoid interop issues.
  Detailed Timing Descriptor #3: Image size is 597x336 mm, but based on the picture AR it should be 597x251 mm.
  Display Product Serial Number is set, so the Serial Number in the Base EDID should be 0.
Block 4, CTA-861 Extension Block:
  Colorimetry Data Block: Set the sRGB colorimetry bit to avoid interop issues.
  Detailed Timing Descriptor #7: Image size is 597x336 mm, but based on the picture AR it should be 597x251 mm.
EDID:
  Base EDID: Some timings are out of range of the Monitor Ranges:
    Horizontal Freq: 28.125 - 177.719 kHz (Monitor: 222.000 - 222.000 kHz)
  CTA-861: Multiple native interlaced timings are defined.

Failures:

Block 1, CTA-861 Extension Block:
  Missing VCDB, needed for Set Selectable RGB Quantization to avoid interop issues.
Block 2, Base EDID:
  Unknown Extension Block.
Block 3, Base EDID:
  Unknown Extension Block.
Block 4, CTA-861 Extension Block:
  Video Data Block: Duplicate VIC 16.
  Video Data Block: Duplicate VIC 31.
  Video Data Block: Duplicate VIC 5.
  Video Data Block: Duplicate VIC 20.
  Video Data Block: Duplicate VIC 4.
  Video Data Block: Duplicate VIC 19.
  Video Data Block: Duplicate VIC 3.
  Video Data Block: Duplicate VIC 18.
  Video Data Block: Duplicate VIC 1.
  Video Data Block: Duplicate VIC 2.
  Video Data Block: Duplicate VIC 17.
  Video Data Block: Duplicate VIC 90.
  Video Data Block: Duplicate VIC 91.
  Video Data Block: Duplicate VIC 92.
  Speaker Allocation Data Block: Only one instance of this Data Block is allowed.
  Colorimetry Data Block: Only one instance of this Data Block is allowed.
  HDR Static Metadata Data Block: Only one instance of this Data Block is allowed.
Block 5, Base EDID:
  Unknown Extension Block.
EDID:
  Base EDID: EDID specified 2 extension block(s), but found 5 extension block(s).
  CTA-861: Native progressive timings are a mix of several resolutions.

EDID conformity: FAIL
