edid-decode (hex):

00 ff ff ff ff ff ff 00 63 18 70 09 00 00 00 00
14 1d 01 04 85 34 1f 78 e6 44 55 a9 55 4d 9d 26
0f 50 54 ad cf 00 b3 00 d1 c0 a9 c0 95 00 71 40
81 00 81 c0 81 40 1c 57 00 e0 80 00 64 60 30 20
34 00 c5 93 00 00 00 1a 7f 21 56 aa 51 00 1e 30
46 8f 33 00 c5 93 00 00 00 1a 66 21 50 b0 51 00
1b 30 40 70 36 00 c5 93 00 00 00 1a 00 00 00 fc
00 48 44 4d 49 0a 20 20 20 20 20 20 20 20 01 70

02 03 28 f1 4f 10 05 04 02 03 32 f2 4f 10 05 04
13 14 1f 6c 6c 6c 27 6c 6c 6c 4b 4c e2 00 ea e3
05 c0 00 23 09 7f 07 83 01 00 00 67 03 0c 00 10
00 38 48 e6 06 05 01 69 69 4f 02 3a 80 18 71 38
2d 40 58 2c 25 00 58 c3 10 00 00 1e 01 1d 80 18
71 1c 16 20 58 2c 25 00 58 c3 10 00 00 9e 00 00
00 00 00 00 00 00 00 00 00 00 00 00 00 00 00 00
00 00 00 00 00 00 00 00 00 00 00 00 00 00 00 00

00 ff ff ff ff ff ff 00 63 18 70 09 00 00 00 00
14 1d 01 04 85 34 1f 78 e6 44 55 a9 55 4d 9d 26
0f 50 54 ad cf 00 b3 00 d1 c0 a9 c0 95 00 71 40
81 00 81 c0 81 40 1c 57 00 e0 80 00 64 60 30 20
34 00 c5 93 00 00 00 1a 7f 21 56 aa 51 00 1e 30
46 8f 33 00 c5 93 00 00 00 1a 66 21 50 b0 51 00
1b 30 40 70 36 00 c5 93 00 00 00 1a 00 00 00 fc
00 48 44 4d 49 0a 20 20 20 20 20 20 20 20 01 70

02 03 28 f1 4f 10 05 04 02 03 32 f2 4f 10 05 04
13 14 1f 6c 6c 6c 27 6c 6c 6c 4b 4c e2 00 ea e3
05 c0 00 23 09 7f 07 83 01 00 00 67 03 0c 00 10
00 38 48 e6 06 05 01 69 69 4f 02 3a 80 18 71 38
2d 40 58 2c 25 00 58 c3 10 00 00 1e 01 1d 80 18
71 1c 16 20 58 2c 25 00 58 c3 10 00 00 9e 00 00
00 00 00 00 00 00 00 00 00 00 00 00 00 00 00 00
00 00 00 00 00 00 00 00 00 00 00 00 00 00 00 00

----------------

Block 0, Base EDID:
  EDID Structure Version & Revision: 1.4
  Vendor & Product Identification:
    Manufacturer: XXX
    Model: 2416
    Made in: week 20 of 2019
  Basic Display Parameters & Features:
    Digital display
    Color depth is undefined
    DisplayPort interface
    Maximum image size: 52 cm x 31 cm
    Gamma: 2.20
    DPMS levels: Standby Suspend Off
    Supported color formats: RGB 4:4:4
    Default (sRGB) color space is primary color space
    First detailed timing includes the native pixel format and preferred refresh rate
  Color Characteristics:
    Red  : 0.6611, 0.3320
    Green: 0.3017, 0.6132
    Blue : 0.1494, 0.0595
    White: 0.3134, 0.3291
  Established Timings I & II:
    IBM     :   720x400    70.081663 Hz   9:5     31.467 kHz     28.320000 MHz
    DMT 0x04:   640x480    59.940476 Hz   4:3     31.469 kHz     25.175000 MHz
    DMT 0x05:   640x480    72.808802 Hz   4:3     37.861 kHz     31.500000 MHz
    DMT 0x06:   640x480    75.000000 Hz   4:3     37.500 kHz     31.500000 MHz
    DMT 0x09:   800x600    60.316541 Hz   4:3     37.879 kHz     40.000000 MHz
    DMT 0x0a:   800x600    72.187572 Hz   4:3     48.077 kHz     50.000000 MHz
    DMT 0x0b:   800x600    75.000000 Hz   4:3     46.875 kHz     49.500000 MHz
    DMT 0x10:  1024x768    60.003840 Hz   4:3     48.363 kHz     65.000000 MHz
    DMT 0x11:  1024x768    70.069359 Hz   4:3     56.476 kHz     75.000000 MHz
    DMT 0x12:  1024x768    75.028582 Hz   4:3     60.023 kHz     78.750000 MHz
    DMT 0x24:  1280x1024   75.024675 Hz   5:4     79.976 kHz    135.000000 MHz
  Standard Timings:
    DMT 0x3a:  1680x1050   59.954250 Hz  16:10    65.290 kHz    146.250000 MHz
    DMT 0x52:  1920x1080   60.000000 Hz  16:9     67.500 kHz    148.500000 MHz
    DMT 0x53:  1600x900    60.000000 Hz  16:9     60.000 kHz    108.000000 MHz (RB)
    DMT 0x2f:  1440x900    59.887445 Hz  16:10    55.935 kHz    106.500000 MHz
    GTF     :  1152x864    60.000000 Hz   4:3     53.700 kHz     81.624000 MHz
    DMT 0x1c:  1280x800    59.810326 Hz  16:10    49.702 kHz     83.500000 MHz
    DMT 0x55:  1280x720    60.000000 Hz  16:9     45.000 kHz     74.250000 MHz
    DMT 0x20:  1280x960    60.000000 Hz   4:3     60.000 kHz    108.000000 MHz
  Detailed Timing Descriptors:
    DTD 1:  2048x1536   59.994748 Hz   4:3     98.151 kHz    223.000000 MHz (197 mm x 147 mm)
                 Hfront   48 Hsync  32 Hback  144 Hpol P
                 Vfront    3 Vsync   4 Vback   93 Vpol N
    DTD 2:  1366x768    59.964364 Hz 683:384   47.852 kHz     85.750000 MHz (197 mm x 147 mm)
                 Hfront   70 Hsync 143 Hback  213 Hpol P
                 Vfront    3 Vsync   3 Vback   24 Vpol N
    DTD 3:  1360x768    60.015162 Hz  85:48    47.712 kHz     85.500000 MHz (197 mm x 147 mm)
                 Hfront   64 Hsync 112 Hback  256 Hpol P
                 Vfront    3 Vsync   6 Vback   18 Vpol N
    Display Product Name: 'HDMI'
  Extension blocks: 1
Checksum: 0x70

----------------

Block 1, CTA-861 Extension Block:
  Revision: 3
  Underscans IT Video Formats by default
  Basic audio support
  Supports YCbCr 4:4:4
  Supports YCbCr 4:2:2
  Native DTDs: 1
  Video Data Block:
    VIC  16:  1920x1080   60.000000 Hz  16:9     67.500 kHz    148.500000 MHz
    VIC   5:  1920x1080i  60.000000 Hz  16:9     33.750 kHz     74.250000 MHz
    VIC   4:  1280x720    60.000000 Hz  16:9     45.000 kHz     74.250000 MHz
    VIC   2:   720x480    59.940060 Hz   4:3     31.469 kHz     27.000000 MHz
    VIC   3:   720x480    59.940060 Hz  16:9     31.469 kHz     27.000000 MHz
    VIC  50:  1440x480i  119.880120 Hz   4:3     31.469 kHz     54.000000 MHz
    Unknown (VIC 242)
    VIC  79:  1680x720    24.000000 Hz  64:27    18.000 kHz     59.400000 MHz
    VIC  16:  1920x1080   60.000000 Hz  16:9     67.500 kHz    148.500000 MHz
    VIC   5:  1920x1080i  60.000000 Hz  16:9     33.750 kHz     74.250000 MHz
    VIC   4:  1280x720    60.000000 Hz  16:9     45.000 kHz     74.250000 MHz
    VIC  19:  1280x720    50.000000 Hz  16:9     37.500 kHz     74.250000 MHz
    VIC  20:  1920x1080i  50.000000 Hz  16:9     28.125 kHz     74.250000 MHz
    VIC  31:  1920x1080   50.000000 Hz  16:9     56.250 kHz    148.500000 MHz
    VIC 108:  1280x720    48.000000 Hz  16:9     36.000 kHz     90.000000 MHz
  Vendor-Specific Data Block, OUI 6C-27-6C:
    6c 6c 4b 4c e2 00 ea e3 05                      'llKL.....'
  Video Format Data Block:
  Unknown CTA-861 Data Block (tag 0x00, length 0):
  Audio Data Block:
    Linear PCM:
      Max channels: 2
      Supported sample rates (kHz): 192 176.4 96 88.2 48 44.1 32
      Supported sample sizes (bits): 24 20 16
  Speaker Allocation Data Block:
    FL/FR - Front Left/Right
  Detailed Timing Descriptors:
    Detailed mode: 01 00 00 67 03 0c 00 10 00 38 48 e6 06 05 01 69 69 4f '...g.....8H....iiO'
    DTD 5:  1920x1080   60.000000 Hz  16:9     67.500 kHz    148.500000 MHz (344 mm x 195 mm)
                 Hfront   88 Hsync  44 Hback  148 Hpol P
                 Vfront    2 Vsync   5 Vback   38 Vpol P
    DTD 6:  1920x1080i  60.000000 Hz  16:9     33.750 kHz     74.250000 MHz (344 mm x 195 mm)
                 Hfront   88 Hsync  44 Hback  148 Hpol P
                 Vfront    2 Vsync   5 Vback   15 Vpol P Vfront +0.5 Odd Field
                 Vfront    2 Vsync   5 Vback   15 Vpol P Vback  +0.5 Even Field
Checksum: 0x00 (should be 0xd3)  Unused space in Extension Block: 33 bytes

----------------

Warnings:

Block 0, Base EDID:
  Detailed Timing Descriptor #2: Image size is 197x147 mm, but based on the picture AR it should be 197x110 mm.
  Detailed Timing Descriptor #3: DTD is similar but not identical to DMT 0x27.
  Detailed Timing Descriptor #3: Image size is 197x147 mm, but based on the picture AR it should be 197x111 mm.
Block 1, CTA-861 Extension Block:
  Video Data Block: VIC 16 and the first DTD are not identical. Is this intended?
  Unknown CTA-861 Data Block (tag 0x00, length 0).
  Detailed Timing Descriptor #5: DTD is similar but not identical to VIC 16.

Failures:

Block 0, Base EDID:
  Basic Display Parameters & Features: sRGB is signaled, but the chromaticities do not match.
  Detailed Timing Descriptor #1: Mismatch of image size 197x147 mm vs display size 520x310 mm.
  Detailed Timing Descriptor #2: Mismatch of image size 197x147 mm vs display size 520x310 mm.
  Detailed Timing Descriptor #3: Mismatch of image size 197x147 mm vs display size 520x310 mm.
Block 1, CTA-861 Extension Block:
  Video Data Block: Unknown VIC 242.
  Video Data Block: Duplicate VIC 16.
  Video Data Block: Duplicate VIC 5.
  Video Data Block: Duplicate VIC 4.
  Video Format Data Block: Length is 0.
  Offset is 40, but should be 43.
  Detailed Timing Descriptor #4: Pixelclock < 10 MHz, assuming invalid data 0x01 0x00.
  Detailed Timing Descriptor #5: Mismatch of image size 344x195 mm vs display size 520x310 mm.
  Detailed Timing Descriptor #6: Mismatch of image size 344x195 mm vs display size 520x310 mm.
  Missing VCDB, needed for Set Selectable RGB Quantization to avoid interop issues.
  Invalid checksum 0x00 (should be 0xd3).
EDID:
  Extension Block 2 started with EDID header, ignoring Extension Blocks >= 2.

EDID conformity: FAIL
