edid-decode (hex):

00 ff ff ff ff ff ff 00 37 43 16 05 00 00 00 00
12 22 01 04 a5 23 14 78 02 1b bb a6 58 55 9d 26
0e 4f 55 00 00 00 01 01 01 01 01 01 01 01 01 01
01 01 01 01 01 01 9b 3b 80 36 71 38 3c 40 30 20
36 00 59 c3 10 00 00 1a 00 00 00 00 00 00 00 00
00 00 00 00 00 00 00 00 00 1a 00 00 00 fe 00 49
4e 58 20 37 43 0a 20 20 20 20 20 20 00 00 00 fe
00 4e 31 35 36 48 43 41 2d 45 41 42 38 39 00 32

00 ff ff ff ff ff ff 00 37 43 16 05 00 00 00 00
12 22 01 04 a5 23 14 78 02 1b bb a6 58 55 9d 26
0e 4f 55 00 00 00 01 01 01 01 01 01 01 01 01 01
01 01 01 01 01 01 9b 3b 80 36 71 38 3c 40 30 20
36 00 59 c3 10 00 00 1a 00 00 00 00 00 00 00 00
00 00 00 00 00 00 00 00 00 1a 00 00 00 fe 00 49
4e 58 20 37 43 0a 20 20 20 20 20 20 00 00 00 fe
00 4e 31 35 36 48 43 41 2d 45 41 42 38 39 00 32

----------------

Block 0, Base EDID:
  EDID Structure Version & Revision: 1.4
  Vendor & Product Identification:
    Manufacturer: MZC
    Model: 1302
    Made in: week 18 of 2024
  Basic Display Parameters & Features:
    Digital display
    Bits per primary color channel: 8
    DisplayPort interface
    Maximum image size: 35 cm x 20 cm
    Gamma: 2.20
    Supported color formats: RGB 4:4:4
    First detailed timing includes the native pixel format and preferred refresh rate
  Color Characteristics:
    Red  : 0.6484, 0.3447
    Green: 0.3339, 0.6162
    Blue : 0.1503, 0.0576
    White: 0.3105, 0.3349
  Established Timings I & II: none
  Standard Timings: none
  Detailed Timing Descriptors:
    DTD 1:  1920x1080   60.022815 Hz  16:9     68.426 kHz    152.590000 MHz (345 mm x 195 mm)
                 Hfront   48 Hsync  32 Hback  230 Hpol P
                 Vfront    3 Vsync   6 Vback   51 Vpol N
    Manufacturer-Specified Display Descriptor (0x00): 00 00 00 00 00 00 00 00 00 00 00 00 00 00 00 1a '................'
    Alphanumeric Data String: 'INX 7C'
    Alphanumeric Data String: 'N156HCA-EAB89'
Checksum: 0x32

----------------

Warnings:

Block 0, Base EDID:
  Missing Display Product Name.

Failures:

EDID:
  Extension Block 1 started with EDID header, ignoring Extension Blocks >= 1.

EDID conformity: FAIL
