edid-decode (hex):

00 ff ff ff ff ff ff 00 20 40 00 02 00 00 00 00
2d 15 01 03 00 46 27 78 8a 04 85 a0 57 4a 9b 26
12 50 54 21 08 00 8b c0 81 40 81 80 81 c0 01 01
01 01 01 01 01 01 86 2b 50 c0 51 fd 30 20 40 a0
13 00 bc 86 21 00 00 1e 00 00 00 fc 00 48 42 54
56 2d 33 32 44 30 35 48 44 0a 00 00 00 fd 00 3a
55 1f 52 10 00 0a 20 20 20 20 20 20 00 00 00 ff
00 47 46 30 30 30 30 30 30 30 30 30 30 31 00 e7

00 ff ff ff ff ff ff 00 20 40 00 02 00 00 00 00
2d 15 01 03 00 46 27 78 8a 04 85 a0 57 4a 9b 26
12 50 54 21 08 00 8b c0 81 40 81 80 81 c0 01 01
01 01 01 01 01 01 86 2b 50 c0 51 fd 30 20 40 a0
13 00 bc 86 21 00 00 1e 00 00 00 fc 00 48 42 54
56 2d 33 32 44 30 35 48 44 0a 00 00 00 fd 00 3a
55 1f 52 10 00 0a 20 20 20 20 20 20 00 00 00 ff
00 47 46 30 30 30 30 30 30 30 30 30 30 31 00 e7

----------------

Block 0, Base EDID:
  EDID Structure Version & Revision: 1.3
  Vendor & Product Identification:
    Manufacturer: HB@
    Model: 512
    Made in: week 45 of 2011
  Basic Display Parameters & Features:
    Analog display
    Signal Level Standard: 0.700 : 0.300 : 1.000 V p-p
    Blank level equals black level
    Maximum image size: 70 cm x 39 cm
    Gamma: 2.20
    DPMS levels: Standby
    RGB color display
    First detailed timing is the preferred timing
  Color Characteristics:
    Red  : 0.6250, 0.3398
    Green: 0.2900, 0.6054
    Blue : 0.1503, 0.0703
    White: 0.3134, 0.3291
  Established Timings I & II:
    DMT 0x04:   640x480    59.940476 Hz   4:3     31.469 kHz     25.175000 MHz
    DMT 0x09:   800x600    60.316541 Hz   4:3     37.879 kHz     40.000000 MHz
    DMT 0x10:  1024x768    60.003840 Hz   4:3     48.363 kHz     65.000000 MHz
  Standard Timings:
    GTF     :  1360x765    60.000341 Hz  16:9     47.520 kHz     84.396000 MHz
    DMT 0x20:  1280x960    60.000000 Hz   4:3     60.000 kHz    108.000000 MHz
    DMT 0x23:  1280x1024   60.019740 Hz   5:4     63.981 kHz    108.000000 MHz
    DMT 0x55:  1280x720    60.000000 Hz  16:9     45.000 kHz     74.250000 MHz
  Detailed Timing Descriptors:
    DTD 1:  1360x765    75.800869 Hz  16:9     61.626 kHz    111.420000 MHz (700 mm x 390 mm)
                 Hfront   64 Hsync 160 Hback  224 Hpol P
                 Vfront    1 Vsync   3 Vback   44 Vpol P
    Display Product Name: 'HBTV-32D05HD'
    Display Range Limits:
      Monitor ranges (GTF): 58-85 Hz V, 31-82 kHz H, max dotclock 160 MHz
    Display Product Serial Number: ...
Checksum: 0xe7

----------------

Warnings:

Block 0, Base EDID:
  Standard Timings: Standard Timing 1360x765 has a dubious odd vertical resolution.

Failures:

Block 0, Base EDID:
  Vendor & Product Identification: Manufacturer name field contains garbage.
EDID:
  Extension Block 1 started with EDID header, ignoring Extension Blocks >= 1.

EDID conformity: FAIL
