edid-decode (hex):

00 ff ff ff ff ff ff 00 22 0e 45 36 01 01 01 01
0d 1f 01 03 80 3c 22 78 2e 69 85 ab 50 47 aa 26
0e 50 54 a5 4b 00 d1 c0 a9 c0 81 c0 d1 00 b3 00
95 00 81 00 a9 40 56 5e 00 a0 a0 a0 29 50 30 20
35 00 55 50 21 00 00 1a 00 00 00 fd 00 30 90 1e
df 3c 00 0a 20 20 20 20 20 20 00 00 00 fc 00 4f
4d 45 4e 20 58 20 32 37 0a 20 20 20 00 00 00 ff
00 43 4e 4b 31 31 33 32 36 30 4e 0a 20 20 01 da

02 03 43 f1 4a 10 1f 04 13 03 12 02 11 01 3f 23
09 07 07 83 01 00 00 67 03 0c 00 10 00 38 44 67
d8 5d c4 01 78 80 00 6d 1a 00 00 02 0b 30 f0 ed
07 69 38 69 38 e6 06 07 01 69 69 2f e3 05 e3 81
e2 00 6b a1 dd 80 78 70 38 50 40 1c 20 98 0c 55
50 21 00 00 1a 9e e8 00 78 a0 a0 67 50 08 20 98
04 55 50 21 00 00 1a 6f c2 00 a0 a0 a0 55 50 30
20 35 00 55 50 21 00 00 1a 00 00 00 00 00 00 1c

00 ff ff ff ff ff ff 00 22 0e 45 36 01 01 01 01
0d 1f 01 03 80 3c 22 78 2e 69 85 ab 50 47 aa 26
0e 50 54 a5 4b 00 d1 c0 a9 c0 81 c0 d1 00 b3 00
95 00 81 00 a9 40 56 5e 00 a0 a0 a0 29 50 30 20
35 00 55 50 21 00 00 1a 00 00 00 fd 00 30 90 1e
df 3c 00 0a 20 20 20 20 20 20 00 00 00 fc 00 4f
4d 45 4e 20 58 20 32 37 0a 20 20 20 00 00 00 ff
00 43 4e 4b 31 31 33 32 36 30 4e 0a 20 20 01 da

02 03 43 f1 4a 10 1f 04 13 03 12 02 11 01 3f 23
09 07 07 83 01 00 00 67 03 0c 00 10 00 38 44 67
d8 5d c4 01 78 80 00 6d 1a 00 00 02 0b 30 f0 ed
07 69 38 69 38 e6 06 07 01 69 69 2f e3 05 e3 81
e2 00 6b a1 dd 80 78 70 38 50 40 1c 20 98 0c 55
50 21 00 00 1a 9e e8 00 78 a0 a0 67 50 08 20 98
04 55 50 21 00 00 1a 6f c2 00 a0 a0 a0 55 50 30
20 35 00 55 50 21 00 00 1a 00 00 00 00 00 00 1c

----------------

Block 0, Base EDID:
  EDID Structure Version & Revision: 1.3
  Vendor & Product Identification:
    Manufacturer: HPN
    Model: 13893
    Serial Number: ...
    Made in: week 13 of 2021
  Basic Display Parameters & Features:
    Digital display
    Maximum image size: 60 cm x 34 cm
    Gamma: 2.20
    DPMS levels: Off
    RGB color display
    Default (sRGB) color space is primary color space
    First detailed timing is the preferred timing
  Color Characteristics:
    Red  : 0.6689, 0.3144
    Green: 0.2792, 0.6650
    Blue : 0.1503, 0.0546
    White: 0.3134, 0.3291
  Established Timings I & II:
    IBM     :   720x400    70.081663 Hz   9:5     31.467 kHz     28.320000 MHz
    DMT 0x04:   640x480    59.940476 Hz   4:3     31.469 kHz     25.175000 MHz
    DMT 0x06:   640x480    75.000000 Hz   4:3     37.500 kHz     31.500000 MHz
    DMT 0x09:   800x600    60.316541 Hz   4:3     37.879 kHz     40.000000 MHz
    DMT 0x0b:   800x600    75.000000 Hz   4:3     46.875 kHz     49.500000 MHz
    DMT 0x10:  1024x768    60.003840 Hz   4:3     48.363 kHz     65.000000 MHz
    DMT 0x12:  1024x768    75.028582 Hz   4:3     60.023 kHz     78.750000 MHz
    DMT 0x24:  1280x1024   75.024675 Hz   5:4     79.976 kHz    135.000000 MHz
  Standard Timings:
    DMT 0x52:  1920x1080   60.000000 Hz  16:9     67.500 kHz    148.500000 MHz
    DMT 0x53:  1600x900    60.000000 Hz  16:9     60.000 kHz    108.000000 MHz (RB)
    DMT 0x55:  1280x720    60.000000 Hz  16:9     45.000 kHz     74.250000 MHz
    DMT 0x45:  1920x1200   59.884600 Hz  16:10    74.556 kHz    193.250000 MHz
    DMT 0x3a:  1680x1050   59.954250 Hz  16:10    65.290 kHz    146.250000 MHz
    DMT 0x2f:  1440x900    59.887445 Hz  16:10    55.935 kHz    106.500000 MHz
    DMT 0x1c:  1280x800    59.810326 Hz  16:10    49.702 kHz     83.500000 MHz
    DMT 0x33:  1600x1200   60.000000 Hz   4:3     75.000 kHz    162.000000 MHz
  Detailed Timing Descriptors:
    DTD 1:  2560x1440   59.950550 Hz  16:9     88.787 kHz    241.500000 MHz (597 mm x 336 mm)
                 Hfront   48 Hsync  32 Hback   80 Hpol P
                 Vfront    3 Vsync   5 Vback   33 Vpol N
    Display Range Limits:
      Monitor ranges (GTF): 48-144 Hz V, 30-223 kHz H, max dotclock 600 MHz
    Display Product Name: 'OMEN X 27'
    Display Product Serial Number: ...
  Extension blocks: 1
Checksum: 0xda

----------------

Block 1, CTA-861 Extension Block:
  Revision: 3
  Underscans IT Video Formats by default
  Basic audio support
  Supports YCbCr 4:4:4
  Supports YCbCr 4:2:2
  Native DTDs: 1
  Video Data Block:
    VIC  16:  1920x1080   60.000000 Hz  16:9     67.500 kHz    148.500000 MHz
    VIC  31:  1920x1080   50.000000 Hz  16:9     56.250 kHz    148.500000 MHz
    VIC   4:  1280x720    60.000000 Hz  16:9     45.000 kHz     74.250000 MHz
    VIC  19:  1280x720    50.000000 Hz  16:9     37.500 kHz     74.250000 MHz
    VIC   3:   720x480    59.940060 Hz  16:9     31.469 kHz     27.000000 MHz
    VIC  18:   720x576    50.000000 Hz  16:9     31.250 kHz     27.000000 MHz
    VIC   2:   720x480    59.940060 Hz   4:3     31.469 kHz     27.000000 MHz
    VIC  17:   720x576    50.000000 Hz   4:3     31.250 kHz     27.000000 MHz
    VIC   1:   640x480    59.940476 Hz   4:3     31.469 kHz     25.175000 MHz
    VIC  63:  1920x1080  120.000000 Hz  16:9    135.000 kHz    297.000000 MHz
  Audio Data Block:
    Linear PCM:
      Max channels: 2
      Supported sample rates (kHz): 48 44.1 32
      Supported sample sizes (bits): 24 20 16
  Speaker Allocation Data Block:
    FL/FR - Front Left/Right
  Vendor-Specific Data Block (HDMI), OUI 00-0C-03:
    Source physical address: 1.0.0.0
    DC_36bit
    DC_30bit
    DC_Y444
    Maximum TMDS clock: 340 MHz
  Vendor-Specific Data Block (HDMI Forum), OUI C4-5D-D8:
    Version: 1
    Maximum TMDS Character Rate: 600 MHz
    SCDC Present
  Vendor-Specific Data Block (AMD), OUI 00-00-1A:
    Version: 2
    Flags 1: 0x0b
      FreeSync Supported
      FreeSync 2 HDR Supported
      Local Dimming Supported
    Minimum Refresh Rate: 48 Hz
    Maximum Refresh Rate: 240 Hz
    MCCS VCP Code: 0xed
    Flags 5: 0x07
      sRGB EOTF Supported
      BT.709 EOTF Supported
      Gamma 2.2 EOTF Supported
    Maximum luminance: 105 (486.099 cd/m^2)
    Minimum luminance: 56 (0.234 cd/m^2)
    Maximum luminance (without local dimming): 105 (486.099 cd/m^2)
    Minimum luminance (without local dimming): 56 (0.234 cd/m^2)
  HDR Static Metadata Data Block:
    Electro optical transfer functions:
      Traditional gamma - SDR luminance range
      Traditional gamma - HDR luminance range
      SMPTE ST2084
    Supported static metadata descriptors:
      Static metadata type 1
    Desired content max luminance: 105 (486.099 cd/m^2)
    Desired content max frame-average luminance: 105 (486.099 cd/m^2)
    Desired content min luminance: 47 (0.165 cd/m^2)
  Colorimetry Data Block:
    xvYCC601
    xvYCC709
    BT2020cYCC
    BT2020YCC
    BT2020RGB
    Gamut Boundary Description Metadata Profile P0
    ST2113RGB
  Video Capability Data Block:
    YCbCr quantization: No Data
    RGB quantization: Selectable (via AVI Q)
    PT scan behavior: Always Underscanned
    IT scan behavior: Always Underscanned
    CE scan behavior: Supports both over- and underscan
  Detailed Timing Descriptors:
    DTD 2:  1920x1080  239.760818 Hz  16:9    278.123 kHz    567.370000 MHz (597 mm x 336 mm)
                 Hfront   28 Hsync  32 Hback   60 Hpol P
                 Vfront   57 Vsync   8 Vback   15 Vpol N
    DTD 3:  2560x1440  144.006152 Hz  16:9    222.201 kHz    595.500000 MHz (597 mm x 336 mm)
                 Hfront    8 Hsync  32 Hback   80 Hpol P
                 Vfront   25 Vsync   8 Vback   70 Vpol N
    DTD 4:  2560x1440  119.997589 Hz  16:9    182.996 kHz    497.750000 MHz (597 mm x 336 mm)
                 Hfront   48 Hsync  32 Hback   80 Hpol P
                 Vfront    3 Vsync   5 Vback   77 Vpol N
Checksum: 0x1c  Unused space in Extension Block: 6 bytes

----------------

Warnings:

Block 0, Base EDID:
  Vendor & Product Identification: The serial number is one of the known dummy values, it should probably be set to 0.
Block 1, CTA-861 Extension Block:
  Video Data Block: VIC 16 and the first DTD are not identical. Is this intended?
  Video Capability Data Block: Set Selectable YCbCr Quantization to avoid interop issues.
  Display Product Serial Number is set, so the Serial Number in the Base EDID should be 0.
EDID:
  Base EDID: Some timings are out of range of the Monitor Ranges:
    Vertical Freq: 50.000 - 239.761 Hz (Monitor: 48.000 - 144.000 Hz)
    Horizontal Freq: 31.250 - 278.122 kHz (Monitor: 30.000 - 223.000 kHz)

Failures:

Block 0, Base EDID:
  Basic Display Parameters & Features: sRGB is signaled, but the chromaticities do not match.
EDID:
  Extension Block 2 started with EDID header, ignoring Extension Blocks >= 2.

EDID conformity: FAIL
