edid-decode (hex):

00 ff ff ff ff ff ff 00 30 e4 6a 06 00 00 00 00
00 1d 01 04 a5 22 13 78 03 e0 85 a3 54 4e 9b 26
0e 50 54 00 00 00 01 01 01 01 01 01 01 01 01 01
01 01 01 01 01 01 5f 87 80 a0 70 38 4d 40 30 20
35 00 58 c2 10 00 00 1a 68 38 80 a0 70 38 4d 40
30 20 35 00 58 c2 10 00 00 1a 00 00 00 fd 00 30
90 a7 a7 23 01 0a 20 20 20 20 20 20 00 00 00 fe
00 4c 50 31 35 36 57 46 47 2d 53 50 42 35 00 c2

----------------

Block 0, Base EDID:
  EDID Structure Version & Revision: 1.4
  Vendor & Product Identification:
    Manufacturer: LGD
    Model: 1642
    Made in: 2019
  Basic Display Parameters & Features:
    Digital display
    Bits per primary color channel: 8
    DisplayPort interface
    Maximum image size: 34 cm x 19 cm
    Gamma: 2.20
    Supported color formats: RGB 4:4:4
    First detailed timing includes the native pixel format and preferred refresh rate
    Display supports continuous frequencies
  Color Characteristics:
    Red  : 0.6396, 0.3300
    Green: 0.3046, 0.6054
    Blue : 0.1503, 0.0546
    White: 0.3134, 0.3291
  Established Timings I & II: none
  Standard Timings: none
  Detailed Timing Descriptors:
    DTD 1:  1920x1080  144.002227 Hz  16:9    166.611 kHz    346.550000 MHz (344 mm x 194 mm)
                 Hfront   48 Hsync  32 Hback   80 Hpol P
                 Vfront    3 Vsync   5 Vback   69 Vpol N
    DTD 2:  1920x1080   60.002659 Hz  16:9     69.423 kHz    144.400000 MHz (344 mm x 194 mm)
                 Hfront   48 Hsync  32 Hback   80 Hpol P
                 Vfront    3 Vsync   5 Vback   69 Vpol N
    Display Range Limits:
      Monitor ranges (Range Limits Only): 48-144 Hz V, 167-167 kHz H, max dotclock 350 MHz
    Alphanumeric Data String: 'LP156WFG-SPB5'
Checksum: 0xc2

----------------

Warnings:

Block 0, Base EDID:
  Missing Display Product Name.
EDID:
  Base EDID: Some timings are out of range of the Monitor Ranges:
    Horizontal Freq: 69.423 - 166.610 kHz (Monitor: 167.000 - 167.000 kHz)

EDID conformity: PASS
