edid-decode (hex):

00 ff ff ff ff ff ff 00 0e 14 bf 14 00 00 00 00
27 13 01 03 80 22 13 78 0a 4e 4d 9e 57 54 91 26
0f 50 54 00 00 00 01 01 01 01 01 01 01 01 01 01
01 01 01 01 01 01 78 1d 56 c2 50 00 26 30 3b 27
5a 00 58 c1 10 00 00 18 00 00 00 0f 00 20 20 20
20 20 20 20 20 20 6e 05 0f 00 00 00 00 fe 00 43
50 54 0a 20 20 20 20 20 20 20 20 20 00 00 00 fe
00 43 4c 41 41 31 35 36 57 41 31 31 41 20 00 28

00 ff ff ff ff ff ff 00 0e 14 bf 14 00 00 00 00
27 13 01 03 80 22 13 78 0a 4e 4d 9e 57 54 91 26
0f 50 54 00 00 00 01 01 01 01 01 01 01 01 01 01
01 01 01 01 01 01 78 1d 56 c2 50 00 26 30 3b 27
5a 00 58 c1 10 00 00 18 00 00 00 0f 00 20 20 20
20 20 20 20 20 20 6e 05 0f 00 00 00 00 fe 00 43
50 54 0a 20 20 20 20 20 20 20 20 20 00 00 00 fe
00 43 4c 41 41 31 35 36 57 41 31 31 41 20 00 28

----------------

Block 0, Base EDID:
  EDID Structure Version & Revision: 1.3
  Vendor & Product Identification:
    Manufacturer: CPT
    Model: 5311
    Made in: week 39 of 2009
  Basic Display Parameters & Features:
    Digital display
    Maximum image size: 34 cm x 19 cm
    Gamma: 2.20
    RGB color display
    First detailed timing is the preferred timing
  Color Characteristics:
    Red  : 0.6181, 0.3398
    Green: 0.3310, 0.5683
    Blue : 0.1494, 0.0585
    White: 0.3154, 0.3291
  Established Timings I & II: none
  Standard Timings: none
  Detailed Timing Descriptors:
    DTD 1:  1366x768    59.998727 Hz 683:384   48.359 kHz     75.440000 MHz (344 mm x 193 mm)
                 Hfront   59 Hsync  39 Hback   96 Hpol N
                 Vfront    5 Vsync  10 Vback   23 Vpol N
    Manufacturer-Specified Display Descriptor (0x0f): 00 0f 00 20 20 20 20 20 20 20 20 20 6e 05 0f 00 '...         n...'
    Alphanumeric Data String: 'CPT'
    Alphanumeric Data String: 'CLAA156WA11A '
Checksum: 0x28

----------------

Block 1, Unknown EDID Extension Block 0x00:
  00 ff ff ff ff ff ff 00 0e 14 bf 14 00 00 00 00 '................'
  27 13 01 03 80 22 13 78 0a 4e 4d 9e 57 54 91 26 ''....".x.NM.WT.&'
  0f 50 54 00 00 00 01 01 01 01 01 01 01 01 01 01 '.PT.............'
  01 01 01 01 01 01 78 1d 56 c2 50 00 26 30 3b 27 '......x.V.P.&0;''
  5a 00 58 c1 10 00 00 18 00 00 00 0f 00 20 20 20 'Z.X..........   '
  20 20 20 20 20 20 6e 05 0f 00 00 00 00 fe 00 43 '      n........C'
  50 54 0a 20 20 20 20 20 20 20 20 20 00 00 00 fe 'PT.         ....'
  00 43 4c 41 41 31 35 36 57 41 31 31 41 20 00 28 '.CLAA156WA11A .('
Checksum: 0x28

----------------

Failures:

Block 0, Base EDID:
  Alphanumeric Data String: No newline, but one or more trailing spaces.
  Missing Display Product Name.
  Missing Display Range Limits Descriptor.
Block 1, Base EDID:
  Unknown Extension Block.
EDID:
  Base EDID: EDID specified 0 extension block(s), but found 1 extension block(s).

EDID conformity: FAIL
