edid-decode (hex):

00 ff ff ff ff ff ff 00 1e 6d e5 5b d6 fa 06 00
0b 1f 01 04 a5 3c 22 78 fa 7b 45 a4 55 4a a2 27
0b 50 54 a5 4b 00 71 4f 81 c0 81 00 81 80 95 00
90 40 a9 c0 b3 00 2a 44 80 a0 70 38 27 40 30 20
35 00 e0 0e 11 00 00 1e 02 3a 80 18 71 38 2d 40
58 2c 45 00 fe 22 11 00 00 1e 00 00 00 fd 00 38
4b 1e 55 12 00 0a 20 20 20 20 20 20 00 00 00 fc
00 4c 47 20 46 48 44 0a 20 20 20 20 20 20 01 f6

02 03 1c f1 49 90 04 03 01 10 12 10 1f 13 23 09
07 07 83 01 00 00 65 03 0c 00 10 00 02 3a 80 18
71 38 2d 40 58 2c 45 00 fe 22 11 00 00 1e 01 1d
00 72 51 d0 1e 20 6e 28 55 00 fe 22 11 00 00 1e
8c 0a d0 8a 20 e0 2d 10 10 3e 96 00 fe 22 11 00
00 18 00 00 00 ff 00 31 31 31 4e 54 55 57 44 46
34 33 30 0a 00 00 00 00 00 00 00 00 00 00 00 00
00 00 00 00 00 00 00 00 00 00 00 00 00 00 00 d7

00 ff ff ff ff ff ff 00 1e 6d e5 5b d6 fa 06 00
0b 1f 01 04 a5 3c 22 78 fa 7b 45 a4 55 4a a2 27
0b 50 54 a5 4b 00 71 4f 81 c0 81 00 81 80 95 00
90 40 a9 c0 b3 00 2a 44 80 a0 70 38 27 40 30 20
35 00 e0 0e 11 00 00 1e 02 3a 80 18 71 38 2d 40
58 2c 45 00 fe 22 11 00 00 1e 00 00 00 fd 00 38
4b 1e 55 12 00 0a 20 20 20 20 20 20 00 00 00 fc
00 4c 47 20 46 48 44 0a 20 20 20 20 20 20 01 f6

02 03 1c f1 49 90 04 03 01 10 12 10 1f 13 23 09
07 07 83 01 00 00 65 03 0c 00 10 00 02 3a 80 18
71 38 2d 40 58 2c 45 00 fe 22 11 00 00 1e 01 1d
00 72 51 d0 1e 20 6e 28 55 00 fe 22 11 00 00 1e
8c 0a d0 8a 20 e0 2d 10 10 3e 96 00 fe 22 11 00
00 18 00 00 00 ff 00 31 31 31 4e 54 55 57 44 46
34 33 30 0a 00 00 00 00 00 00 00 00 00 00 00 00
00 00 00 00 00 00 00 00 00 00 00 00 00 00 00 d7

----------------

Block 0, Base EDID:
  EDID Structure Version & Revision: 1.4
  Vendor & Product Identification:
    Manufacturer: GSM
    Model: 23525
    Serial Number: ...
    Made in: week 11 of 2021
  Basic Display Parameters & Features:
    Digital display
    Bits per primary color channel: 8
    DisplayPort interface
    Maximum image size: 60 cm x 34 cm
    Gamma: 2.20
    DPMS levels: Standby Suspend Off
    Supported color formats: RGB 4:4:4, YCrCb 4:4:4, YCrCb 4:2:2
    First detailed timing includes the native pixel format and preferred refresh rate
  Color Characteristics:
    Red  : 0.6416, 0.3349
    Green: 0.2910, 0.6357
    Blue : 0.1533, 0.0429
    White: 0.3134, 0.3291
  Established Timings I & II:
    IBM     :   720x400    70.081663 Hz   9:5     31.467 kHz     28.320000 MHz
    DMT 0x04:   640x480    59.940476 Hz   4:3     31.469 kHz     25.175000 MHz
    DMT 0x06:   640x480    75.000000 Hz   4:3     37.500 kHz     31.500000 MHz
    DMT 0x09:   800x600    60.316541 Hz   4:3     37.879 kHz     40.000000 MHz
    DMT 0x0b:   800x600    75.000000 Hz   4:3     46.875 kHz     49.500000 MHz
    DMT 0x10:  1024x768    60.003840 Hz   4:3     48.363 kHz     65.000000 MHz
    DMT 0x12:  1024x768    75.028582 Hz   4:3     60.023 kHz     78.750000 MHz
    DMT 0x24:  1280x1024   75.024675 Hz   5:4     79.976 kHz    135.000000 MHz
  Standard Timings:
    DMT 0x15:  1152x864    75.000000 Hz   4:3     67.500 kHz    108.000000 MHz
    DMT 0x55:  1280x720    60.000000 Hz  16:9     45.000 kHz     74.250000 MHz
    DMT 0x1c:  1280x800    59.810326 Hz  16:10    49.702 kHz     83.500000 MHz
    DMT 0x23:  1280x1024   60.019740 Hz   5:4     63.981 kHz    108.000000 MHz
    DMT 0x2f:  1440x900    59.887445 Hz  16:10    55.935 kHz    106.500000 MHz
    DMT 0x2a:  1400x1050   59.978442 Hz   4:3     65.317 kHz    121.750000 MHz
    DMT 0x53:  1600x900    60.000000 Hz  16:9     60.000 kHz    108.000000 MHz (RB)
    DMT 0x3a:  1680x1050   59.954250 Hz  16:10    65.290 kHz    146.250000 MHz
  Detailed Timing Descriptors:
    DTD 1:  1920x1080   74.972503 Hz  16:9     83.894 kHz    174.500000 MHz (480 mm x 270 mm)
                 Hfront   48 Hsync  32 Hback   80 Hpol P
                 Vfront    3 Vsync   5 Vback   31 Vpol P
    DTD 2:  1920x1080   60.000000 Hz  16:9     67.500 kHz    148.500000 MHz (510 mm x 290 mm)
                 Hfront   88 Hsync  44 Hback  148 Hpol P
                 Vfront    4 Vsync   5 Vback   36 Vpol P
    Display Range Limits:
      Monitor ranges (GTF): 56-75 Hz V, 30-85 kHz H, max dotclock 180 MHz
    Display Product Name: 'LG FHD'
  Extension blocks: 1
Checksum: 0xf6

----------------

Block 1, CTA-861 Extension Block:
  Revision: 3
  Underscans IT Video Formats by default
  Basic audio support
  Supports YCbCr 4:4:4
  Supports YCbCr 4:2:2
  Native DTDs: 1
  Video Data Block:
    VIC  16:  1920x1080   60.000000 Hz  16:9     67.500 kHz    148.500000 MHz (native)
    VIC   4:  1280x720    60.000000 Hz  16:9     45.000 kHz     74.250000 MHz
    VIC   3:   720x480    59.940060 Hz  16:9     31.469 kHz     27.000000 MHz
    VIC   1:   640x480    59.940476 Hz   4:3     31.469 kHz     25.175000 MHz
    VIC  16:  1920x1080   60.000000 Hz  16:9     67.500 kHz    148.500000 MHz
    VIC  18:   720x576    50.000000 Hz  16:9     31.250 kHz     27.000000 MHz
    VIC  16:  1920x1080   60.000000 Hz  16:9     67.500 kHz    148.500000 MHz
    VIC  31:  1920x1080   50.000000 Hz  16:9     56.250 kHz    148.500000 MHz
    VIC  19:  1280x720    50.000000 Hz  16:9     37.500 kHz     74.250000 MHz
  Audio Data Block:
    Linear PCM:
      Max channels: 2
      Supported sample rates (kHz): 48 44.1 32
      Supported sample sizes (bits): 24 20 16
  Speaker Allocation Data Block:
    FL/FR - Front Left/Right
  Vendor-Specific Data Block (HDMI), OUI 00-0C-03:
    Source physical address: 1.0.0.0
  Detailed Timing Descriptors:
    DTD 3:  1920x1080   60.000000 Hz  16:9     67.500 kHz    148.500000 MHz (510 mm x 290 mm)
                 Hfront   88 Hsync  44 Hback  148 Hpol P
                 Vfront    4 Vsync   5 Vback   36 Vpol P
    DTD 4:  1280x720    60.000000 Hz  16:9     45.000 kHz     74.250000 MHz (510 mm x 290 mm)
                 Hfront  110 Hsync  40 Hback  220 Hpol P
                 Vfront    5 Vsync   5 Vback   20 Vpol P
    DTD 5:   720x480    59.940060 Hz   3:2     31.469 kHz     27.000000 MHz (510 mm x 290 mm)
                 Hfront   16 Hsync  62 Hback   60 Hpol N
                 Vfront    9 Vsync   6 Vback   30 Vpol N
    Display Product Serial Number: ...
Checksum: 0xd7  Unused space in Extension Block: 27 bytes

----------------

Warnings:

Block 0, Base EDID:
  Display Range Limits: GTF support is deprecated in EDID 1.4.
Block 1, CTA-861 Extension Block:
  Video Data Block: VIC 16 and the first DTD are not identical. Is this intended?
  Detailed Timing Descriptor #5: Image size is 510x290 mm, but based on the picture AR it should be 435x290 mm.
  Display Product Serial Number is set, so the Serial Number in the Base EDID should be 0.
  Add a Colorimetry Data Block with the sRGB colorimetry bit set to avoid interop issues.
EDID:
  Base EDID: Some timings are out of range of the Monitor Ranges:
    Vertical Freq: 50.000 - 75.029 Hz (Monitor: 56.000 - 75.000 Hz)

Failures:

Block 0, Base EDID:
  Detailed Timing Descriptor #1: Mismatch of image size 480x270 mm vs display size 600x340 mm.
  Detailed Timing Descriptor #2: Mismatch of image size 510x290 mm vs display size 600x340 mm.
  Display Range Limits: GTF is supported, but the display does not support continuous frequencies.
Block 1, CTA-861 Extension Block:
  Video Data Block: Duplicate VIC 16.
  Vendor-Specific Data Block (HDMI), OUI 00-0C-03: The HDMI Specification requires EDID 1.3 instead of 1.4.
  Detailed Timing Descriptor #3: Mismatch of image size 510x290 mm vs display size 600x340 mm.
  Detailed Timing Descriptor #4: Mismatch of image size 510x290 mm vs display size 600x340 mm.
  Detailed Timing Descriptor #5: Mismatch of image size 510x290 mm vs display size 600x340 mm.
  Missing VCDB, needed for Set Selectable RGB Quantization to avoid interop issues.
EDID:
  Extension Block 2 started with EDID header, ignoring Extension Blocks >= 2.

EDID conformity: FAIL
