edid-decode (hex):

00 ff ff ff ff ff ff 00 06 af b1 ec 00 00 00 00
0b 22 01 04 a5 1d 12 78 03 17 35 a9 54 49 9f 25
0e 50 54 00 00 00 01 01 01 01 01 01 01 01 01 01
01 01 01 01 01 01 f0 3c 80 a0 70 b0 32 40 30 20
35 00 1e b2 10 00 00 1a c0 30 80 a0 70 b0 32 40
30 20 35 00 1e b2 10 00 00 1a 00 00 00 fe 00 52
32 32 58 52 80 42 31 33 33 55 41 4b 00 00 00 00
00 03 41 22 9e 00 11 00 00 0a 01 0a 20 20 00 9b

00 ff ff ff ff ff ff 00 06 af b1 ec 00 00 00 00
0b 22 01 04 a5 1d 12 78 03 17 35 a9 54 49 9f 25
0e 50 54 00 00 00 01 01 01 01 01 01 01 01 01 01
01 01 01 01 01 01 f0 3c 80 a0 70 b0 32 40 30 20
35 00 1e b2 10 00 00 1a c0 30 80 a0 70 b0 32 40
30 20 35 00 1e b2 10 00 00 1a 00 00 00 fe 00 52
32 32 58 52 80 42 31 33 33 55 41 4b 00 00 00 00
00 03 41 22 9e 00 11 00 00 0a 01 0a 20 20 00 9b

----------------

Block 0, Base EDID:
  EDID Structure Version & Revision: 1.4
  Vendor & Product Identification:
    Manufacturer: AUO
    Model: 60593
    Made in: week 11 of 2024
  Basic Display Parameters & Features:
    Digital display
    Bits per primary color channel: 8
    DisplayPort interface
    Maximum image size: 29 cm x 18 cm
    Gamma: 2.20
    Supported color formats: RGB 4:4:4
    First detailed timing includes the native pixel format and preferred refresh rate
    Display supports continuous frequencies
  Color Characteristics:
    Red  : 0.6601, 0.3291
    Green: 0.2861, 0.6240
    Blue : 0.1445, 0.0576
    White: 0.3134, 0.3291
  Established Timings I & II: none
  Standard Timings: none
  Detailed Timing Descriptors:
    DTD 1:  1920x1200   60.000000 Hz  16:10    75.000 kHz    156.000000 MHz (286 mm x 178 mm)
                 Hfront   48 Hsync  32 Hback   80 Hpol P
                 Vfront    3 Vsync   5 Vback   42 Vpol N
    DTD 2:  1920x1200   48.000000 Hz  16:10    60.000 kHz    124.800000 MHz (286 mm x 178 mm)
                 Hfront   48 Hsync  32 Hback   80 Hpol P
                 Vfront    3 Vsync   5 Vback   42 Vpol N
    Alphanumeric Data String: 'R22XR.B133UAK'
    Manufacturer-Specified Display Descriptor (0x00): 00 00 00 03 41 22 9e 00 11 00 00 0a 01 0a 20 20 '....A"........  '
Checksum: 0x9b

----------------

Warnings:

Block 0, Base EDID:
  Alphanumeric Data String: Non-ASCII character 0x80 at position 5, can cause problems.
  Missing Display Product Name.

Failures:

Block 0, Base EDID:
  Missing Display Range Limits Descriptor.
EDID:
  Extension Block 1 started with EDID header, ignoring Extension Blocks >= 1.

EDID conformity: FAIL
