edid-decode (hex):

00 ff ff ff ff ff ff 00 26 13 00 34 01 00 00 00
28 22 01 03 b4 51 1e 78 2a e6 40 ac 4f 44 ad 27
0c 50 54 21 08 00 81 c0 81 80 95 00 a9 c0 b3 00
d1 c0 01 01 01 01 b7 7d 70 a0 d0 a0 32 50 30 20
35 00 2a 2c 31 00 00 1a 25 6a 80 78 70 38 1e 40
30 20 35 00 55 50 21 00 00 1e 00 00 00 fd 00 3c
64 1e ff 3c 00 0a 20 20 20 20 20 20 00 00 00 fc
00 47 50 33 34 30 31 0a 20 20 20 20 20 20 01 b3

02 03 37 f3 46 3f 02 03 04 90 4e 23 09 07 07 83
01 00 00 67 03 0c 00 10 00 18 78 67 d8 5d c4 01
78 c0 00 68 1a 00 00 01 01 3c 78 ed e3 05 e3 01
e6 06 07 01 60 50 43 6a 5e 00 a0 a0 a0 29 50 30
20 35 00 55 50 21 00 00 1a 74 d6 70 a0 d0 a0 55
50 30 20 35 00 55 50 21 00 00 1e d7 a0 70 a0 d0
a0 55 50 30 20 35 00 55 50 21 00 00 1e 70 c2 00
a0 a0 a0 55 50 30 20 35 00 55 50 21 00 00 1a a1

00 ff ff ff ff ff ff 00 26 13 00 34 01 00 00 00
28 22 01 03 b4 51 1e 78 2a e6 40 ac 4f 44 ad 27
0c 50 54 21 08 00 81 c0 81 80 95 00 a9 c0 b3 00
d1 c0 01 01 01 01 b7 7d 70 a0 d0 a0 32 50 30 20
35 00 2a 2c 31 00 00 1a 25 6a 80 78 70 38 1e 40
30 20 35 00 55 50 21 00 00 1e 00 00 00 fd 00 3c
64 1e ff 3c 00 0a 20 20 20 20 20 20 00 00 00 fc
00 47 50 33 34 30 31 0a 20 20 20 20 20 20 01 b3

02 03 37 f3 46 3f 02 03 04 90 4e 23 09 07 07 83
01 00 00 67 03 0c 00 10 00 18 78 67 d8 5d c4 01
78 c0 00 68 1a 00 00 01 01 3c 78 ed e3 05 e3 01
e6 06 07 01 60 50 43 6a 5e 00 a0 a0 a0 29 50 30
20 35 00 55 50 21 00 00 1a 74 d6 70 a0 d0 a0 55
50 30 20 35 00 55 50 21 00 00 1e d7 a0 70 a0 d0
a0 55 50 30 20 35 00 55 50 21 00 00 1e 70 c2 00
a0 a0 a0 55 50 30 20 35 00 55 50 21 00 00 1a a1

----------------

Block 0, Base EDID:
  EDID Structure Version & Revision: 1.3
  Vendor & Product Identification:
    Manufacturer: IPS
    Model: 13312
    Serial Number: ...
    Made in: week 40 of 2024
  Basic Display Parameters & Features:
    Digital display
    Maximum image size: 81 cm x 30 cm
    Gamma: 2.20
    DPMS levels: Off
    RGB color display
    First detailed timing is the preferred timing
  Color Characteristics:
    Red  : 0.6748, 0.3105
    Green: 0.2666, 0.6777
    Blue : 0.1533, 0.0468
    White: 0.3125, 0.3281
  Established Timings I & II:
    DMT 0x04:   640x480    59.940476 Hz   4:3     31.469 kHz     25.175000 MHz
    DMT 0x09:   800x600    60.316541 Hz   4:3     37.879 kHz     40.000000 MHz
    DMT 0x10:  1024x768    60.003840 Hz   4:3     48.363 kHz     65.000000 MHz
  Standard Timings:
    DMT 0x55:  1280x720    60.000000 Hz  16:9     45.000 kHz     74.250000 MHz
    DMT 0x23:  1280x1024   60.019740 Hz   5:4     63.981 kHz    108.000000 MHz
    DMT 0x2f:  1440x900    59.887445 Hz  16:10    55.935 kHz    106.500000 MHz
    DMT 0x53:  1600x900    60.000000 Hz  16:9     60.000 kHz    108.000000 MHz (RB)
    DMT 0x3a:  1680x1050   59.954250 Hz  16:10    65.290 kHz    146.250000 MHz
    DMT 0x52:  1920x1080   60.000000 Hz  16:9     67.500 kHz    148.500000 MHz
  Detailed Timing Descriptors:
    DTD 1:  3440x1440   59.998136 Hz  43:18    89.397 kHz    321.830000 MHz (810 mm x 300 mm)
                 Hfront   48 Hsync  32 Hback   80 Hpol P
                 Vfront    3 Vsync   5 Vback   42 Vpol N
    DTD 2:  1920x1080  120.000883 Hz  16:9    133.201 kHz    271.730000 MHz (597 mm x 336 mm)
                 Hfront   48 Hsync  32 Hback   40 Hpol P
                 Vfront    3 Vsync   5 Vback   22 Vpol P
    Display Range Limits:
      Monitor ranges (GTF): 60-100 Hz V, 30-255 kHz H, max dotclock 600 MHz
    Display Product Name: 'GP3401'
  Extension blocks: 1
Checksum: 0xb3

----------------

Block 1, CTA-861 Extension Block:
  Revision: 3
  Underscans IT Video Formats by default
  Basic audio support
  Supports YCbCr 4:4:4
  Supports YCbCr 4:2:2
  Native DTDs: 3
  Video Data Block:
    VIC  63:  1920x1080  120.000000 Hz  16:9    135.000 kHz    297.000000 MHz
    VIC   2:   720x480    59.940060 Hz   4:3     31.469 kHz     27.000000 MHz
    VIC   3:   720x480    59.940060 Hz  16:9     31.469 kHz     27.000000 MHz
    VIC   4:  1280x720    60.000000 Hz  16:9     45.000 kHz     74.250000 MHz
    VIC  16:  1920x1080   60.000000 Hz  16:9     67.500 kHz    148.500000 MHz (native)
    VIC  78:  1920x1080  120.000000 Hz  64:27   135.000 kHz    297.000000 MHz
  Audio Data Block:
    Linear PCM:
      Max channels: 2
      Supported sample rates (kHz): 48 44.1 32
      Supported sample sizes (bits): 24 20 16
  Speaker Allocation Data Block:
    FL/FR - Front Left/Right
  Vendor-Specific Data Block (HDMI), OUI 00-0C-03:
    Source physical address: 1.0.0.0
    DC_30bit
    DC_Y444
    Maximum TMDS clock: 600 MHz
  Vendor-Specific Data Block (HDMI Forum), OUI C4-5D-D8:
    Version: 1
    Maximum TMDS Character Rate: 600 MHz
    SCDC Present
    SCDC Read Request Capable
  Vendor-Specific Data Block (AMD), OUI 00-00-1A:
    Version: 1
    Feature Caps: 0x01
    Minimum Refresh Rate: 60 Hz
    Maximum Refresh Rate: 120 Hz
    Flags 1.x: 0xed (MCCS)
  Colorimetry Data Block:
    xvYCC601
    xvYCC709
    BT2020cYCC
    BT2020YCC
    BT2020RGB
    Gamut Boundary Description Metadata Profile P0
  HDR Static Metadata Data Block:
    Electro optical transfer functions:
      Traditional gamma - SDR luminance range
      Traditional gamma - HDR luminance range
      SMPTE ST2084
    Supported static metadata descriptors:
      Static metadata type 1
    Desired content max luminance: 96 (400.000 cd/m^2)
    Desired content max frame-average luminance: 80 (282.843 cd/m^2)
    Desired content min luminance: 67 (0.276 cd/m^2)
  Detailed Timing Descriptors:
    DTD 3:  2560x1440   60.000199 Hz  16:9     88.860 kHz    241.700000 MHz (597 mm x 336 mm)
                 Hfront   48 Hsync  32 Hback   80 Hpol P
                 Vfront    3 Vsync   5 Vback   33 Vpol N
    DTD 4:  3440x1440  100.000000 Hz  43:18   152.500 kHz    549.000000 MHz (597 mm x 336 mm)
                 Hfront   48 Hsync  32 Hback   80 Hpol P
                 Vfront    3 Vsync   5 Vback   77 Vpol P
    DTD 5:  3440x1440   75.000000 Hz  43:18   114.375 kHz    411.750000 MHz (597 mm x 336 mm)
                 Hfront   48 Hsync  32 Hback   80 Hpol P
                 Vfront    3 Vsync   5 Vback   77 Vpol P
    DTD 6:  2560x1440  120.000000 Hz  16:9    183.000 kHz    497.760000 MHz (597 mm x 336 mm)
                 Hfront   48 Hsync  32 Hback   80 Hpol P
                 Vfront    3 Vsync   5 Vback   77 Vpol N
Checksum: 0xa1

----------------

Warnings:

Block 0, Base EDID:
  Vendor & Product Identification: The serial number is one of the known dummy values, it should probably be set to 0.
  Detailed Timing Descriptor #1: Image size is 810x300 mm, but based on the picture AR it should be 716x300 mm.
Block 1, CTA-861 Extension Block:
  Video Data Block: VIC 63 and the first DTD are not identical. Is this intended?
  Colorimetry Data Block: Set the sRGB colorimetry bit to avoid interop issues.
  Detailed Timing Descriptor #4: Image size is 597x336 mm, but based on the picture AR it should be 597x249 mm.
  Detailed Timing Descriptor #5: Image size is 597x336 mm, but based on the picture AR it should be 597x249 mm.
EDID:
  Base EDID: Some timings are out of range of the Monitor Ranges:
    Vertical Freq: 59.887 - 120.001 Hz (Monitor: 60.000 - 100.000 Hz)

Failures:

Block 0, Base EDID:
  Basic Display Parameters & Features: Digital Video Interface Standard set to reserved value 0x34.
  Detailed Timing Descriptor #2: Mismatch of image size 597x336 mm vs display size 810x300 mm.
Block 1, CTA-861 Extension Block:
  Vendor-Specific Data Block (HDMI), OUI 00-0C-03: HDMI VSDB Max TMDS rate is > 340.
  Detailed Timing Descriptor #3: Mismatch of image size 597x336 mm vs display size 810x300 mm.
  Detailed Timing Descriptor #4: Mismatch of image size 597x336 mm vs display size 810x300 mm.
  Detailed Timing Descriptor #5: Mismatch of image size 597x336 mm vs display size 810x300 mm.
  Detailed Timing Descriptor #6: Mismatch of image size 597x336 mm vs display size 810x300 mm.
  Missing VCDB, needed for Set Selectable RGB Quantization to avoid interop issues.
EDID:
  Extension Block 2 started with EDID header, ignoring Extension Blocks >= 2.
  Base EDID: The DTD max image size is 810x336mm, which is larger than the display size 810.0x300.0mm.
  CTA-861: Native progressive timings are a mix of several resolutions.

EDID conformity: FAIL
