edid-decode (hex):

00 ff ff ff ff ff ff 00 09 e5 06 06 00 00 00 00
01 17 01 04 95 1f 11 78 02 b0 90 97 58 54 92 26
1d 50 54 00 00 00 01 01 01 01 01 01 01 01 01 01
01 01 01 01 01 01 64 1b 56 77 50 00 13 30 30 20
36 00 35 ad 10 00 00 1a 64 1b 56 77 50 00 d8 30
30 20 36 00 35 ad 10 00 00 00 00 00 00 fe 00 38
50 47 48 4e 80 48 42 31 34 31 30 32 00 00 00 00
00 00 41 01 94 01 10 00 00 09 01 0a 20 20 00 77

00 ff ff ff ff ff ff 00 09 e5 06 06 00 00 00 00
01 17 01 04 95 1f 11 78 02 b0 90 97 58 54 92 26
1d 50 54 00 00 00 01 01 01 01 01 01 01 01 01 01
01 01 01 01 01 01 64 1b 56 77 50 00 13 30 30 20
36 00 35 ad 10 00 00 1a 64 1b 56 77 50 00 d8 30
30 20 36 00 35 ad 10 00 00 00 00 00 00 fe 00 38
50 47 48 4e 80 48 42 31 34 31 30 32 00 00 00 00
00 00 41 01 94 01 10 00 00 09 01 0a 20 20 00 77

----------------

Block 0, Base EDID:
  EDID Structure Version & Revision: 1.4
  Vendor & Product Identification:
    Manufacturer: BOE
    Model: 1542
    Made in: week 1 of 2013
  Basic Display Parameters & Features:
    Digital display
    Bits per primary color channel: 6
    DisplayPort interface
    Maximum image size: 31 cm x 17 cm
    Gamma: 2.20
    Supported color formats: RGB 4:4:4
    First detailed timing includes the native pixel format and preferred refresh rate
  Color Characteristics:
    Red  : 0.5917, 0.3466
    Green: 0.3281, 0.5703
    Blue : 0.1503, 0.1142
    White: 0.3125, 0.3281
  Established Timings I & II: none
  Standard Timings: none
  Detailed Timing Descriptors:
    DTD 1:  1366x768    59.998545 Hz 683:384   47.219 kHz     70.120000 MHz (309 mm x 173 mm)
                 Hfront   48 Hsync  32 Hback   39 Hpol P
                 Vfront    3 Vsync   6 Vback   10 Vpol N
    DTD 2:  1366x768    47.986641 Hz 683:384   47.219 kHz     70.120000 MHz (analog composite, sync-on-green, 309 mm x 173 mm)
                 Hfront   48 Hsync  32 Hback   39 Hpol N
                 Vfront    3 Vsync   6 Vback  207 Vpol N
    Alphanumeric Data String: '8PGHN.HB14102'
    Manufacturer-Specified Display Descriptor (0x00): 00 00 00 00 41 01 94 01 10 00 00 09 01 0a 20 20 '....A.........  '
Checksum: 0x77

----------------

Block 1, Unknown EDID Extension Block 0x00:
  00 ff ff ff ff ff ff 00 09 e5 06 06 00 00 00 00 '................'
  01 17 01 04 95 1f 11 78 02 b0 90 97 58 54 92 26 '.......x....XT.&'
  1d 50 54 00 00 00 01 01 01 01 01 01 01 01 01 01 '.PT.............'
  01 01 01 01 01 01 64 1b 56 77 50 00 13 30 30 20 '......d.VwP..00 '
  36 00 35 ad 10 00 00 1a 64 1b 56 77 50 00 d8 30 '6.5.....d.VwP..0'
  30 20 36 00 35 ad 10 00 00 00 00 00 00 fe 00 38 '0 6.5..........8'
  50 47 48 4e 80 48 42 31 34 31 30 32 00 00 00 00 'PGHN.HB14102....'
  00 00 41 01 94 01 10 00 00 09 01 0a 20 20 00 77 '..A.........  .w'
Checksum: 0x77

----------------

Warnings:

Block 0, Base EDID:
  Alphanumeric Data String: Non-ASCII character 0x80 at position 5, can cause problems.
  Missing Display Product Name.

Failures:

Block 1, Base EDID:
  Unknown Extension Block.
EDID:
  Base EDID: EDID specified 0 extension block(s), but found 1 extension block(s).

EDID conformity: FAIL
