edid-decode (hex):

00 ff ff ff ff ff ff 00 04 72 07 0c 3a 19 51 32
19 21 01 03 80 35 1e 78 2a 35 85 aa 4f 45 ab 27
0e 50 54 bf ef 80 71 4f 81 40 81 80 81 c0 81 00
95 00 d1 fc d1 c0 02 3a 80 18 71 38 2d 40 58 2c
45 00 0f 28 21 00 00 1e 00 00 00 ff 00 33 33 32
35 31 31 39 33 41 34 32 33 38 00 00 00 fd 00 30
a5 1e c3 2a 01 0a 20 20 20 20 20 20 00 00 00 fc
00 56 47 32 34 30 59 20 53 0a 20 20 20 20 01 10

02 03 52 f1 51 01 03 04 12 13 05 14 3f 1f 10 07
4e 5e 5f 60 61 5d 23 09 07 07 83 01 00 00 6d 03
0c 00 10 00 38 44 20 00 60 01 02 03 67 d8 5d c4
01 78 80 03 6d 1a 00 00 02 01 30 a5 e6 00 00 00
00 00 e3 05 e3 01 e4 0f 00 c0 00 e6 06 07 01 6b
6b 43 3c 82 80 a6 70 38 1e 40 18 20 35 00 0f 28
21 00 00 1e d0 94 80 a0 70 38 1e 40 30 40 35 00
0f 28 21 00 00 1a 00 00 00 00 00 00 00 00 00 9c

00 ff ff ff ff ff ff 00 04 72 07 0c 3a 19 51 32
19 21 01 03 80 35 1e 78 2a 35 85 aa 4f 45 ab 27
0e 50 54 bf ef 80 71 4f 81 40 81 80 81 c0 81 00
95 00 d1 fc d1 c0 02 3a 80 18 71 38 2d 40 58 2c
45 00 0f 28 21 00 00 1e 00 00 00 ff 00 33 33 32
35 31 31 39 33 41 34 32 33 38 00 00 00 fd 00 30
a5 1e c3 2a 01 0a 20 20 20 20 20 20 00 00 00 fc
00 56 47 32 34 30 59 20 53 0a 20 20 20 20 01 10

02 03 52 f1 51 01 03 04 12 13 05 14 3f 1f 10 07
4e 5e 5f 60 61 5d 23 09 07 07 83 01 00 00 6d 03
0c 00 10 00 38 44 20 00 60 01 02 03 67 d8 5d c4
01 78 80 03 6d 1a 00 00 02 01 30 a5 e6 00 00 00
00 00 e3 05 e3 01 e4 0f 00 c0 00 e6 06 07 01 6b
6b 43 3c 82 80 a6 70 38 1e 40 18 20 35 00 0f 28
21 00 00 1e d0 94 80 a0 70 38 1e 40 30 40 35 00
0f 28 21 00 00 1a 00 00 00 00 00 00 00 00 00 9c

----------------

Block 0, Base EDID:
  EDID Structure Version & Revision: 1.3
  Vendor & Product Identification:
    Manufacturer: ACR
    Model: 3079
    Serial Number: ...
    Made in: week 25 of 2023
  Basic Display Parameters & Features:
    Digital display
    Maximum image size: 53 cm x 30 cm
    Gamma: 2.20
    DPMS levels: Off
    RGB color display
    First detailed timing is the preferred timing
  Color Characteristics:
    Red  : 0.6640, 0.3115
    Green: 0.2705, 0.6689
    Blue : 0.1542, 0.0546
    White: 0.3134, 0.3291
  Established Timings I & II:
    IBM     :   720x400    70.081663 Hz   9:5     31.467 kHz     28.320000 MHz
    DMT 0x04:   640x480    59.940476 Hz   4:3     31.469 kHz     25.175000 MHz
    Apple   :   640x480    66.666667 Hz   4:3     35.000 kHz     30.240000 MHz
    DMT 0x05:   640x480    72.808802 Hz   4:3     37.861 kHz     31.500000 MHz
    DMT 0x06:   640x480    75.000000 Hz   4:3     37.500 kHz     31.500000 MHz
    DMT 0x08:   800x600    56.250000 Hz   4:3     35.156 kHz     36.000000 MHz
    DMT 0x09:   800x600    60.316541 Hz   4:3     37.879 kHz     40.000000 MHz
    DMT 0x0a:   800x600    72.187572 Hz   4:3     48.077 kHz     50.000000 MHz
    DMT 0x0b:   800x600    75.000000 Hz   4:3     46.875 kHz     49.500000 MHz
    Apple   :   832x624    74.551266 Hz   4:3     49.726 kHz     57.284000 MHz
    DMT 0x10:  1024x768    60.003840 Hz   4:3     48.363 kHz     65.000000 MHz
    DMT 0x11:  1024x768    70.069359 Hz   4:3     56.476 kHz     75.000000 MHz
    DMT 0x12:  1024x768    75.028582 Hz   4:3     60.023 kHz     78.750000 MHz
    DMT 0x24:  1280x1024   75.024675 Hz   5:4     79.976 kHz    135.000000 MHz
    Apple   :  1152x870    75.061550 Hz 192:145   68.681 kHz    100.000000 MHz
  Standard Timings:
    DMT 0x15:  1152x864    75.000000 Hz   4:3     67.500 kHz    108.000000 MHz
    DMT 0x20:  1280x960    60.000000 Hz   4:3     60.000 kHz    108.000000 MHz
    DMT 0x23:  1280x1024   60.019740 Hz   5:4     63.981 kHz    108.000000 MHz
    DMT 0x55:  1280x720    60.000000 Hz  16:9     45.000 kHz     74.250000 MHz
    DMT 0x1c:  1280x800    59.810326 Hz  16:10    49.702 kHz     83.500000 MHz
    DMT 0x2f:  1440x900    59.887445 Hz  16:10    55.935 kHz    106.500000 MHz
    GTF     :  1920x1080  119.999987 Hz  16:9    138.840 kHz    368.759000 MHz
    DMT 0x52:  1920x1080   60.000000 Hz  16:9     67.500 kHz    148.500000 MHz
  Detailed Timing Descriptors:
    DTD 1:  1920x1080   60.000000 Hz  16:9     67.500 kHz    148.500000 MHz (527 mm x 296 mm)
                 Hfront   88 Hsync  44 Hback  148 Hpol P
                 Vfront    4 Vsync   5 Vback   36 Vpol P
    Display Product Serial Number: ...
    Display Range Limits:
      Monitor ranges (Range Limits Only): 48-165 Hz V, 30-195 kHz H, max dotclock 420 MHz
    Display Product Name: 'VG240Y S'
  Extension blocks: 1
Checksum: 0x10

----------------

Block 1, CTA-861 Extension Block:
  Revision: 3
  Underscans IT Video Formats by default
  Basic audio support
  Supports YCbCr 4:4:4
  Supports YCbCr 4:2:2
  Native DTDs: 1
  Video Data Block:
    VIC   1:   640x480    59.940476 Hz   4:3     31.469 kHz     25.175000 MHz
    VIC   3:   720x480    59.940060 Hz  16:9     31.469 kHz     27.000000 MHz
    VIC   4:  1280x720    60.000000 Hz  16:9     45.000 kHz     74.250000 MHz
    VIC  18:   720x576    50.000000 Hz  16:9     31.250 kHz     27.000000 MHz
    VIC  19:  1280x720    50.000000 Hz  16:9     37.500 kHz     74.250000 MHz
    VIC   5:  1920x1080i  60.000000 Hz  16:9     33.750 kHz     74.250000 MHz
    VIC  20:  1920x1080i  50.000000 Hz  16:9     28.125 kHz     74.250000 MHz
    VIC  63:  1920x1080  120.000000 Hz  16:9    135.000 kHz    297.000000 MHz
    VIC  31:  1920x1080   50.000000 Hz  16:9     56.250 kHz    148.500000 MHz
    VIC  16:  1920x1080   60.000000 Hz  16:9     67.500 kHz    148.500000 MHz
    VIC   7:  1440x480i   59.940060 Hz  16:9     15.734 kHz     27.000000 MHz
    VIC  78:  1920x1080  120.000000 Hz  64:27   135.000 kHz    297.000000 MHz
    VIC  94:  3840x2160   25.000000 Hz  16:9     56.250 kHz    297.000000 MHz
    VIC  95:  3840x2160   30.000000 Hz  16:9     67.500 kHz    297.000000 MHz
    VIC  96:  3840x2160   50.000000 Hz  16:9    112.500 kHz    594.000000 MHz
    VIC  97:  3840x2160   60.000000 Hz  16:9    135.000 kHz    594.000000 MHz
    VIC  93:  3840x2160   24.000000 Hz  16:9     54.000 kHz    297.000000 MHz
  Audio Data Block:
    Linear PCM:
      Max channels: 2
      Supported sample rates (kHz): 48 44.1 32
      Supported sample sizes (bits): 24 20 16
  Speaker Allocation Data Block:
    FL/FR - Front Left/Right
  Vendor-Specific Data Block (HDMI), OUI 00-0C-03:
    Source physical address: 1.0.0.0
    DC_36bit
    DC_30bit
    DC_Y444
    Maximum TMDS clock: 340 MHz
    Extended HDMI video details:
      HDMI VICs:
        HDMI VIC 1:  3840x2160   30.000000 Hz  16:9     67.500 kHz    297.000000 MHz
        HDMI VIC 2:  3840x2160   25.000000 Hz  16:9     56.250 kHz    297.000000 MHz
        HDMI VIC 3:  3840x2160   24.000000 Hz  16:9     54.000 kHz    297.000000 MHz
  Vendor-Specific Data Block (HDMI Forum), OUI C4-5D-D8:
    Version: 1
    Maximum TMDS Character Rate: 600 MHz
    SCDC Present
    Supports 12-bits/component Deep Color 4:2:0 Pixel Encoding
    Supports 10-bits/component Deep Color 4:2:0 Pixel Encoding
  Vendor-Specific Data Block (AMD), OUI 00-00-1A:
    Version: 2
    Flags 1: 0x01
      FreeSync Supported
    Minimum Refresh Rate: 48 Hz
    Maximum Refresh Rate: 165 Hz
    MCCS VCP Code: 0xe6
    Flags 5: 0x00
  Colorimetry Data Block:
    xvYCC601
    xvYCC709
    BT2020cYCC
    BT2020YCC
    BT2020RGB
    Gamut Boundary Description Metadata Profile P0
  YCbCr 4:2:0 Capability Map Data Block:
    VIC  96:  3840x2160   50.000000 Hz  16:9    112.500 kHz    594.000000 MHz
    VIC  97:  3840x2160   60.000000 Hz  16:9    135.000 kHz    594.000000 MHz
  HDR Static Metadata Data Block:
    Electro optical transfer functions:
      Traditional gamma - SDR luminance range
      Traditional gamma - HDR luminance range
      SMPTE ST2084
    Supported static metadata descriptors:
      Static metadata type 1
    Desired content max luminance: 107 (507.620 cd/m^2)
    Desired content max frame-average luminance: 107 (507.620 cd/m^2)
    Desired content min luminance: 67 (0.350 cd/m^2)
  Detailed Timing Descriptors:
    DTD 2:  1920x1080  143.988667 Hz  16:9    159.827 kHz    333.400000 MHz (527 mm x 296 mm)
                 Hfront   24 Hsync  32 Hback  110 Hpol P
                 Vfront    3 Vsync   5 Vback   22 Vpol P
    DTD 3:  1920x1080  165.003465 Hz  16:9    183.154 kHz    380.960000 MHz (527 mm x 296 mm)
                 Hfront   48 Hsync  64 Hback   48 Hpol P
                 Vfront    3 Vsync   5 Vback   22 Vpol N
Checksum: 0x9c  Unused space in Extension Block: 9 bytes

----------------

Warnings:

Block 1, CTA-861 Extension Block:
  Video Data Block: VIC 1 and the first DTD are not identical. Is this intended?
  Colorimetry Data Block: Set the sRGB colorimetry bit to avoid interop issues.
  Display Product Serial Number is set, so the Serial Number in the Base EDID should be 0.
EDID:
  Base EDID: Some timings are out of range of the Monitor Ranges:
    Vertical Freq: 24.000 - 165.003 Hz (Monitor: 48.000 - 165.000 Hz)
    Horizontal Freq: 15.734 - 183.153 kHz (Monitor: 30.000 - 195.000 kHz)
    Maximum Clock: 594.000 MHz (Monitor: 420.000 MHz)

Failures:

Block 0, Base EDID:
  Display Range Limits: 'Range Limits Only' is not allowed for EDID < 1.4.
Block 1, CTA-861 Extension Block:
  Vendor-Specific Data Block (HDMI Forum), OUI C4-5D-D8: HDMI VIC and related CTA VIC codes are present, but the UHD VIC bit is 0.
  Missing VCDB, needed for Set Selectable RGB Quantization to avoid interop issues.
EDID:
  Extension Block 2 started with EDID header, ignoring Extension Blocks >= 2.

EDID conformity: FAIL
