edid-decode (hex):

00 ff ff ff ff ff ff 00 4e 81 00 00 00 00 00 00
0b 1c 01 04 a5 1f 11 78 0a 69 65 96 57 52 8f 27
22 50 54 00 00 00 01 01 01 01 01 01 01 01 01 01
01 01 01 01 01 01 86 1a 56 46 50 00 14 30 29 1b
34 00 36 ae 10 00 00 18 00 00 00 fe 00 00 00 00
00 00 00 00 00 00 00 00 00 00 00 00 00 fe 00 53
54 41 52 52 59 0a 20 20 20 20 20 20 00 00 00 fe
00 53 54 41 00 00 00 00 00 00 00 00 00 00 00 36

----------------

Block 0, Base EDID:
  EDID Structure Version & Revision: 1.4
  Vendor & Product Identification:
    Manufacturer: STA
    Model: 0
    Made in: week 11 of 2018
  Basic Display Parameters & Features:
    Digital display
    Bits per primary color channel: 8
    DisplayPort interface
    Maximum image size: 31 cm x 17 cm
    Gamma: 2.20
    Supported color formats: RGB 4:4:4, YCrCb 4:4:4
    First detailed timing includes the native pixel format and preferred refresh rate
  Color Characteristics:
    Red  : 0.5869, 0.3417
    Green: 0.3222, 0.5595
    Blue : 0.1533, 0.1347
    White: 0.3134, 0.3291
  Established Timings I & II: none
  Standard Timings: none
  Detailed Timing Descriptors:
    DTD 1:  1366x768    60.005232 Hz 683:384   47.284 kHz     67.900000 MHz (310 mm x 174 mm)
                 Hfront   41 Hsync  27 Hback    2 Hpol N
                 Vfront    3 Vsync   4 Vback   13 Vpol N
    Alphanumeric Data String: ''
    Alphanumeric Data String: 'STARRY'
    Alphanumeric Data String: 'STA'
Checksum: 0x36

----------------

Warnings:

Block 0, Base EDID:
  Missing Display Product Name.

Failures:

Block 0, Base EDID:
  Alphanumeric Data String: NUL byte at position 0.
  Alphanumeric Data String: NUL byte at position 3.

EDID conformity: FAIL
