edid-decode (hex):

00 ff ff ff ff ff ff 00 56 83 a7 64 01 00 00 00
0f 22 01 03 80 35 1d 78 ea 3e b5 a6 55 4d 9b 26
0f 50 54 a5 4b 00 81 80 95 00 b3 00 01 01 01 01
01 01 01 01 01 01 02 3a 80 18 71 38 2d 40 58 2c
45 00 0f 27 21 00 00 18 00 00 00 fc 00 55 6e 69
73 20 42 32 34 35 46 0a 20 20 00 00 00 fd 00 30
64 1e 70 18 00 0a 20 20 20 20 20 20 00 00 00 ff
00 30 30 30 30 30 30 30 30 30 30 30 30 31 01 0a

02 03 13 b1 45 90 04 03 01 12 65 03 0c 00 10 00
e2 00 7f 2a 44 80 a0 70 38 27 40 30 20 35 00 0f
28 21 00 00 18 eb 5a 80 a0 70 38 27 40 30 20 35
00 0f 28 21 00 00 18 01 1d 00 bc 52 d0 1e 20 b8
28 55 40 0f 28 21 00 00 1e 00 00 00 00 00 00 00
00 00 00 00 00 00 00 00 00 00 00 00 00 00 00 00
00 00 00 00 00 00 00 00 00 00 00 00 00 00 00 00
00 00 00 00 00 00 00 00 00 00 00 00 00 00 00 43

00 ff ff ff ff ff ff 00 56 83 a7 64 01 00 00 00
0f 22 01 03 80 35 1d 78 ea 3e b5 a6 55 4d 9b 26
0f 50 54 a5 4b 00 81 80 95 00 b3 00 01 01 01 01
01 01 01 01 01 01 02 3a 80 18 71 38 2d 40 58 2c
45 00 0f 27 21 00 00 18 00 00 00 fc 00 55 6e 69
73 20 42 32 34 35 46 0a 20 20 00 00 00 fd 00 30
64 1e 70 18 00 0a 20 20 20 20 20 20 00 00 00 ff
00 30 30 30 30 30 30 30 30 30 30 30 30 31 01 0a

02 03 13 b1 45 90 04 03 01 12 65 03 0c 00 10 00
e2 00 7f 2a 44 80 a0 70 38 27 40 30 20 35 00 0f
28 21 00 00 18 eb 5a 80 a0 70 38 27 40 30 20 35
00 0f 28 21 00 00 18 01 1d 00 bc 52 d0 1e 20 b8
28 55 40 0f 28 21 00 00 1e 00 00 00 00 00 00 00
00 00 00 00 00 00 00 00 00 00 00 00 00 00 00 00
00 00 00 00 00 00 00 00 00 00 00 00 00 00 00 00
00 00 00 00 00 00 00 00 00 00 00 00 00 00 00 43

----------------

Block 0, Base EDID:
  EDID Structure Version & Revision: 1.3
  Vendor & Product Identification:
    Manufacturer: UTC
    Model: 25767
    Serial Number: ...
    Made in: week 15 of 2024
  Basic Display Parameters & Features:
    Digital display
    Maximum image size: 53 cm x 29 cm
    Gamma: 2.20
    DPMS levels: Standby Suspend Off
    RGB color display
    First detailed timing is the preferred timing
  Color Characteristics:
    Red  : 0.6484, 0.3349
    Green: 0.3037, 0.6074
    Blue : 0.1503, 0.0615
    White: 0.3134, 0.3291
  Established Timings I & II:
    IBM     :   720x400    70.081663 Hz   9:5     31.467 kHz     28.320000 MHz
    DMT 0x04:   640x480    59.940476 Hz   4:3     31.469 kHz     25.175000 MHz
    DMT 0x06:   640x480    75.000000 Hz   4:3     37.500 kHz     31.500000 MHz
    DMT 0x09:   800x600    60.316541 Hz   4:3     37.879 kHz     40.000000 MHz
    DMT 0x0b:   800x600    75.000000 Hz   4:3     46.875 kHz     49.500000 MHz
    DMT 0x10:  1024x768    60.003840 Hz   4:3     48.363 kHz     65.000000 MHz
    DMT 0x12:  1024x768    75.028582 Hz   4:3     60.023 kHz     78.750000 MHz
    DMT 0x24:  1280x1024   75.024675 Hz   5:4     79.976 kHz    135.000000 MHz
  Standard Timings:
    DMT 0x23:  1280x1024   60.019740 Hz   5:4     63.981 kHz    108.000000 MHz
    DMT 0x2f:  1440x900    59.887445 Hz  16:10    55.935 kHz    106.500000 MHz
    DMT 0x3a:  1680x1050   59.954250 Hz  16:10    65.290 kHz    146.250000 MHz
  Detailed Timing Descriptors:
    DTD 1:  1920x1080   60.000000 Hz  16:9     67.500 kHz    148.500000 MHz (527 mm x 295 mm)
                 Hfront   88 Hsync  44 Hback  148 Hpol N
                 Vfront    4 Vsync   5 Vback   36 Vpol N
    Display Product Name: 'Unis B245F'
    Display Range Limits:
      Monitor ranges (GTF): 48-100 Hz V, 30-112 kHz H, max dotclock 240 MHz
    Display Product Serial Number: ...
  Extension blocks: 1
Checksum: 0x0a

----------------

Block 1, CTA-861 Extension Block:
  Revision: 3
  Underscans IT Video Formats by default
  Supports YCbCr 4:4:4
  Supports YCbCr 4:2:2
  Native DTDs: 1
  Video Data Block:
    VIC  16:  1920x1080   60.000000 Hz  16:9     67.500 kHz    148.500000 MHz (native)
    VIC   4:  1280x720    60.000000 Hz  16:9     45.000 kHz     74.250000 MHz
    VIC   3:   720x480    59.940060 Hz  16:9     31.469 kHz     27.000000 MHz
    VIC   1:   640x480    59.940476 Hz   4:3     31.469 kHz     25.175000 MHz
    VIC  18:   720x576    50.000000 Hz  16:9     31.250 kHz     27.000000 MHz
  Vendor-Specific Data Block (HDMI), OUI 00-0C-03:
    Source physical address: 1.0.0.0
  Video Capability Data Block:
    YCbCr quantization: No Data
    RGB quantization: Selectable (via AVI Q)
    PT scan behavior: Supports both over- and underscan
    IT scan behavior: Supports both over- and underscan
    CE scan behavior: Supports both over- and underscan
  Detailed Timing Descriptors:
    DTD 2:  1920x1080   74.972503 Hz  16:9     83.894 kHz    174.500000 MHz (527 mm x 296 mm)
                 Hfront   48 Hsync  32 Hback   80 Hpol N
                 Vfront    3 Vsync   5 Vback   31 Vpol N
    DTD 3:  1920x1080   99.999141 Hz  16:9    111.899 kHz    232.750000 MHz (527 mm x 296 mm)
                 Hfront   48 Hsync  32 Hback   80 Hpol N
                 Vfront    3 Vsync   5 Vback   31 Vpol N
    DTD 4:  1280x720    50.000000 Hz  16:9     37.500 kHz     74.250000 MHz (527 mm x 296 mm)
                 Hfront  440 Hsync  40 Hback  220 Hpol P
                 Vfront    5 Vsync   5 Vback   20 Vpol P
Checksum: 0x43  Unused space in Extension Block: 54 bytes

----------------

Warnings:

Block 0, Base EDID:
  Vendor & Product Identification: The serial number is one of the known dummy values, it should probably be set to 0.
  Detailed Timing Descriptor #1: DTD is similar but not identical to VIC 16.
  Display Product Serial Number: ...
Block 1, CTA-861 Extension Block:
  Video Data Block: VIC 16 and the first DTD are not identical. Is this intended?
  Video Capability Data Block: Set Selectable YCbCr Quantization to avoid interop issues.
  Video Capability Data Block: S_PT is equal to S_IT and S_CE, so should be set to 0 instead.
  Detailed Timing Descriptor #4: DTD is identical to VIC 19, which is not present in the CTA Ext Block.
  Display Product Serial Number is set, so the Serial Number in the Base EDID should be 0.
  Add a Colorimetry Data Block with the sRGB colorimetry bit set to avoid interop issues.

Failures:

EDID:
  Extension Block 2 started with EDID header, ignoring Extension Blocks >= 2.

EDID conformity: FAIL
