edid-decode (hex):

00 ff ff ff ff ff ff 00 5c 73 84 b2 01 01 01 01
30 22 01 03 a3 17 0e 78 2e ee 91 a3 54 4c 99 26
0f 50 54 21 08 00 d1 c0 a9 c0 8b c0 81 c0 61 c0
59 c0 4b c0 3b c0 62 40 80 82 70 00 3c 50 30 20
36 00 e2 8d 00 00 00 1a 00 00 00 fc 00 52 46 31
30 0a 20 20 20 20 20 20 20 20 00 00 00 ff 00 64
65 6d 6f 73 65 74 2d 31 0a 20 30 20 00 00 00 fd
00 1e 3c 26 4c 24 00 0a 20 20 20 20 20 20 01 e8

02 03 35 f2 48 03 00 13 04 0f 22 1f 10 e2 00 d5
e3 05 c0 00 23 09 7f 07 83 01 00 00 68 03 0c 00
10 00 38 48 00 e6 06 05 01 69 69 4f 68 1a 00 00
01 01 1e 3c e6 30 2a 40 c8 60 84 64 30 18 50 36
00 e2 8d 00 00 00 1a 01 1d 00 72 51 d0 1e 20 6e
28 36 00 e2 8d 00 00 00 1a a7 35 80 82 70 00 3c
50 30 20 36 00 e2 8d 00 00 00 1a 31 20 80 82 70
00 3c 50 30 20 36 00 e2 8d 00 00 00 1a 00 00 13

00 ff ff ff ff ff ff 00 5c 73 84 b2 01 01 01 01
30 22 01 03 a3 17 0e 78 2e ee 91 a3 54 4c 99 26
0f 50 54 21 08 00 d1 c0 a9 c0 8b c0 81 c0 61 c0
59 c0 4b c0 3b c0 62 40 80 82 70 00 3c 50 30 20
36 00 e2 8d 00 00 00 1a 00 00 00 fc 00 52 46 31
30 0a 20 20 20 20 20 20 20 20 00 00 00 ff 00 64
65 6d 6f 73 65 74 2d 31 0a 20 30 20 00 00 00 fd
00 1e 3c 26 4c 24 00 0a 20 20 20 20 20 20 01 e8

02 03 35 f2 48 03 00 13 04 0f 22 1f 10 e2 00 d5
e3 05 c0 00 23 09 7f 07 83 01 00 00 68 03 0c 00
10 00 38 48 00 e6 06 05 01 69 69 4f 68 1a 00 00
01 01 1e 3c e6 30 2a 40 c8 60 84 64 30 18 50 36
00 e2 8d 00 00 00 1a 01 1d 00 72 51 d0 1e 20 6e
28 36 00 e2 8d 00 00 00 1a a7 35 80 82 70 00 3c
50 30 20 36 00 e2 8d 00 00 00 1a 31 20 80 82 70
00 3c 50 30 20 36 00 e2 8d 00 00 00 1a 00 00 13

----------------

Block 0, Base EDID:
  EDID Structure Version & Revision: 1.3
  Vendor & Product Identification:
    Manufacturer: WCS
    Model: 45700
    Serial Number: ...
    Made in: week 48 of 2024
  Basic Display Parameters & Features:
    Digital display
    DFP 1.x compatible TMDS
    Maximum image size: 23 cm x 14 cm
    Gamma: 2.20
    DPMS levels: Off
    RGB color display
    Default (sRGB) color space is primary color space
    First detailed timing is the preferred timing
  Color Characteristics:
    Red  : 0.6396, 0.3300
    Green: 0.2998, 0.5996
    Blue : 0.1503, 0.0595
    White: 0.3125, 0.3291
  Established Timings I & II:
    DMT 0x04:   640x480    59.940476 Hz   4:3     31.469 kHz     25.175000 MHz
    DMT 0x09:   800x600    60.316541 Hz   4:3     37.879 kHz     40.000000 MHz
    DMT 0x10:  1024x768    60.003840 Hz   4:3     48.363 kHz     65.000000 MHz
  Standard Timings:
    DMT 0x52:  1920x1080   60.000000 Hz  16:9     67.500 kHz    148.500000 MHz
    DMT 0x53:  1600x900    60.000000 Hz  16:9     60.000 kHz    108.000000 MHz (RB)
    GTF     :  1360x765    60.000341 Hz  16:9     47.520 kHz     84.396000 MHz
    DMT 0x55:  1280x720    60.000000 Hz  16:9     45.000 kHz     74.250000 MHz
    GTF     :  1024x576    60.000204 Hz  16:9     35.820 kHz     46.996000 MHz
    GTF     :   960x540    60.000530 Hz  16:9     33.540 kHz     40.785000 MHz
    GTF     :   848x477    60.000307 Hz  16:9     29.640 kHz     31.300000 MHz
    GTF     :   720x405    60.000000 Hz  16:9     25.200 kHz     22.176000 MHz
  Detailed Timing Descriptors:
    DTD 1:  1920x1280   60.000000 Hz   3:2     80.400 kHz    164.820000 MHz (226 mm x 141 mm)
                 Hfront   48 Hsync  32 Hback   50 Hpol P
                 Vfront    3 Vsync   6 Vback   51 Vpol N
    Display Product Name: 'RF10'
    Display Product Serial Number: ...
    Display Range Limits:
      Monitor ranges (GTF): 30-60 Hz V, 38-76 kHz H, max dotclock 360 MHz
  Extension blocks: 1
Checksum: 0xe8

----------------

Block 1, CTA-861 Extension Block:
  Revision: 3
  Underscans IT Video Formats by default
  Basic audio support
  Supports YCbCr 4:4:4
  Supports YCbCr 4:2:2
  Native DTDs: 2
  Video Data Block:
    VIC   3:   720x480    59.940060 Hz  16:9     31.469 kHz     27.000000 MHz
    VIC  19:  1280x720    50.000000 Hz  16:9     37.500 kHz     74.250000 MHz
    VIC   4:  1280x720    60.000000 Hz  16:9     45.000 kHz     74.250000 MHz
    VIC  15:  1440x480    59.940060 Hz  16:9     31.469 kHz     54.000000 MHz
    VIC  34:  1920x1080   30.000000 Hz  16:9     33.750 kHz     74.250000 MHz
    VIC  31:  1920x1080   50.000000 Hz  16:9     56.250 kHz    148.500000 MHz
    VIC  16:  1920x1080   60.000000 Hz  16:9     67.500 kHz    148.500000 MHz
  Video Capability Data Block:
    YCbCr quantization: Selectable (via AVI YQ)
    RGB quantization: Selectable (via AVI Q)
    PT scan behavior: Always Overscanned
    IT scan behavior: Always Overscanned
    CE scan behavior: Always Overscanned
  Colorimetry Data Block:
    BT2020YCC
    BT2020RGB
  Audio Data Block:
    Linear PCM:
      Max channels: 2
      Supported sample rates (kHz): 192 176.4 96 88.2 48 44.1 32
      Supported sample sizes (bits): 24 20 16
  Speaker Allocation Data Block:
    FL/FR - Front Left/Right
  Vendor-Specific Data Block (HDMI), OUI 00-0C-03:
    Source physical address: 1.0.0.0
    DC_36bit
    DC_30bit
    DC_Y444
    Maximum TMDS clock: 360 MHz
  HDR Static Metadata Data Block:
    Electro optical transfer functions:
      Traditional gamma - SDR luminance range
      SMPTE ST2084
    Supported static metadata descriptors:
      Static metadata type 1
    Desired content max luminance: 105 (486.099 cd/m^2)
    Desired content max frame-average luminance: 105 (486.099 cd/m^2)
    Desired content min luminance: 79 (0.467 cd/m^2)
  Vendor-Specific Data Block (AMD), OUI 00-00-1A:
    Version: 1
    Flags 1: 0x01
      FreeSync Supported
    Minimum Refresh Rate: 30 Hz
    Maximum Refresh Rate: 60 Hz
    MCCS VCP Code: 0xe6
  Detailed Timing Descriptors:
    DTD 2:  1600x900    60.000000 Hz  16:9     60.000 kHz    108.000000 MHz (226 mm x 141 mm)
                 Hfront   24 Hsync  80 Hback   96 Hpol P
                 Vfront    3 Vsync   6 Vback   91 Vpol N
    DTD 3:  1280x720    60.000000 Hz  16:9     45.000 kHz     74.250000 MHz (226 mm x 141 mm)
                 Hfront  110 Hsync  40 Hback  220 Hpol P
                 Vfront    3 Vsync   6 Vback   21 Vpol N
    DTD 4:  1920x1280   50.000000 Hz   3:2     67.000 kHz    137.350000 MHz (226 mm x 141 mm)
                 Hfront   48 Hsync  32 Hback   50 Hpol P
                 Vfront    3 Vsync   6 Vback   51 Vpol N
    DTD 5:  1920x1280   30.000000 Hz   3:2     40.200 kHz     82.410000 MHz (226 mm x 141 mm)
                 Hfront   48 Hsync  32 Hback   50 Hpol P
                 Vfront    3 Vsync   6 Vback   51 Vpol N
Checksum: 0x13  Unused space in Extension Block: 2 bytes

----------------

Warnings:

Block 0, Base EDID:
  Vendor & Product Identification: The serial number is one of the known dummy values, it should probably be set to 0.
  Standard Timings: Standard Timing 1360x765 has a dubious odd vertical resolution.
  Standard Timings: Standard Timing 848x477 has a dubious odd vertical resolution.
  Standard Timings: Standard Timing 720x405 has a dubious odd vertical resolution.
  Display Product Serial Number: ...
Block 1, CTA-861 Extension Block:
  Video Data Block: VIC 3 and the first DTD are not identical. Is this intended?
  Video Capability Data Block: IT scan behavior is expected to support underscanned.
  Video Capability Data Block: S_PT is equal to S_IT and S_CE, so should be set to 0 instead.
  Detailed Timing Descriptor #2: DTD is similar but not identical to DMT 0x53.
  Detailed Timing Descriptor #2: Image size is 226x141 mm, but based on the picture AR it should be 226x127 mm.
  Detailed Timing Descriptor #3: DTD is similar but not identical to VIC 4.
  Detailed Timing Descriptor #3: Image size is 226x141 mm, but based on the picture AR it should be 226x127 mm.
  Display Product Serial Number is set, so the Serial Number in the Base EDID should be 0.
EDID:
  Base EDID: Some timings are out of range of the Monitor Ranges:
    Horizontal Freq: 25.200 - 80.400 kHz (Monitor: 38.000 - 76.000 kHz)

Failures:

Block 0, Base EDID:
  Display Product Serial Number: ...
  Basic Display Parameters & Features: Digital Video Interface Standard set to reserved value 0x22.
Block 1, CTA-861 Extension Block:
  Video Capability Data Block: IT video formats are always overscanned, but bit 7 of Byte 3 of the CTA-861 Extension header is set to underscanned.
  Vendor-Specific Data Block (HDMI), OUI 00-0C-03: HDMI VSDB Max TMDS rate is > 340.
EDID:
  Extension Block 2 started with EDID header, ignoring Extension Blocks >= 2.
  CTA-861: Native progressive timings are a mix of several resolutions.

EDID conformity: FAIL
