edid-decode (hex):

00 ff ff ff ff ff ff 00 22 f0 2e 42 01 00 00 00
31 16 01 03 80 2c 19 78 ee 40 a0 a3 5a 52 a2 26
0e 50 54 00 00 00 01 01 01 01 01 01 01 01 01 01
01 01 01 01 01 01 36 2e 40 00 62 84 1a 30 18 50
13 00 bb f9 10 00 00 1e 00 00 00 fc 00 48 50 20
41 6c 6c 2d 69 6e 2d 4f 6e 65 00 00 00 fc 00 0a
20 20 20 20 20 20 20 20 20 20 20 20 00 00 00 fc
00 0a 20 20 20 20 20 20 20 20 20 20 20 20 00 f7

00 ff ff ff ff ff ff 00 22 f0 2e 42 01 00 00 00
31 16 01 03 80 2c 19 78 ee 40 a0 a3 5a 52 a2 26
0e 50 54 00 00 00 01 01 01 01 01 01 01 01 01 01
01 01 01 01 01 01 36 2e 40 00 62 84 1a 30 18 50
13 00 bb f9 10 00 00 1e 00 00 00 fc 00 48 50 20
41 6c 6c 2d 69 6e 2d 4f 6e 65 00 00 00 fc 00 0a
20 20 20 20 20 20 20 20 20 20 20 20 00 00 00 fc
00 0a 20 20 20 20 20 20 20 20 20 20 20 20 00 f7

----------------

Block 0, Base EDID:
  EDID Structure Version & Revision: 1.3
  Vendor & Product Identification:
    Manufacturer: HWP
    Model: 16942
    Serial Number: ...
    Made in: week 49 of 2012
  Basic Display Parameters & Features:
    Digital display
    Maximum image size: 44 cm x 25 cm
    Gamma: 2.20
    DPMS levels: Standby Suspend Off
    RGB color display
    Default (sRGB) color space is primary color space
    First detailed timing is the preferred timing
  Color Characteristics:
    Red  : 0.6376, 0.3515
    Green: 0.3203, 0.6328
    Blue : 0.1503, 0.0566
    White: 0.3125, 0.3281
  Established Timings I & II: none
  Standard Timings: none
  Detailed Timing Descriptors:
    DTD 1:  1600x900    60.489479 Hz  16:9     56.013 kHz    118.300000 MHz (443 mm x 249 mm)
                 Hfront   24 Hsync  80 Hback  408 Hpol P
                 Vfront    1 Vsync   3 Vback   22 Vpol P
    Display Product Name: 'HP All-in-One'
    Display Product Name: ''
    Display Product Name: ''
Checksum: 0xf7

----------------

Block 1, Unknown EDID Extension Block 0x00:
  00 ff ff ff ff ff ff 00 22 f0 2e 42 01 00 00 00 '........"..B....'
  31 16 01 03 80 2c 19 78 ee 40 a0 a3 5a 52 a2 26 '1....,.x.@..ZR.&'
  0e 50 54 00 00 00 01 01 01 01 01 01 01 01 01 01 '.PT.............'
  01 01 01 01 01 01 36 2e 40 00 62 84 1a 30 18 50 '......6.@.b..0.P'
  13 00 bb f9 10 00 00 1e 00 00 00 fc 00 48 50 20 '.............HP '
  41 6c 6c 2d 69 6e 2d 4f 6e 65 00 00 00 fc 00 0a 'All-in-One......'
  20 20 20 20 20 20 20 20 20 20 20 20 00 00 00 fc '            ....'
  00 0a 20 20 20 20 20 20 20 20 20 20 20 20 00 f7 '..            ..'
Checksum: 0xf7

----------------

Warnings:

Block 0, Base EDID:
  Vendor & Product Identification: The serial number is one of the known dummy values, it should probably be set to 0.

Failures:

Block 0, Base EDID:
  Basic Display Parameters & Features: sRGB is signaled, but the chromaticities do not match.
  Display Product Name: Empty string.
  Display Product Name: Empty string.
  Missing Display Range Limits Descriptor.
Block 1, Base EDID:
  Unknown Extension Block.
EDID:
  Base EDID: EDID specified 0 extension block(s), but found 1 extension block(s).

EDID conformity: FAIL
