edid-decode (hex):

00 ff ff ff ff ff ff 00 05 e3 98 42 bb 86 01 00
2a 12 01 03 80 40 24 78 0a c1 ec a1 53 46 97 24
11 47 49 bf ee 00 81 c0 81 80 01 01 01 01 01 01
01 01 01 01 01 01 1b 21 50 a0 51 00 1e 30 48 88
35 00 80 68 21 00 00 18 f1 27 00 a0 51 00 25 30
50 80 37 00 80 68 21 00 00 1c 00 00 00 fc 00 4c
34 32 57 39 38 48 0a 20 20 20 20 20 00 00 00 fd
00 38 4c 1e 4c 10 00 0a 20 20 20 20 20 20 01 75

02 03 22 70 4d 1f 10 21 22 14 05 13 04 11 02 15
06 01 23 09 07 03 83 01 00 00 67 03 0c 00 30 00
b8 2d 02 3a 80 d0 72 38 2d 40 10 2c 45 80 80 68
21 00 00 1e 01 1d 80 d0 72 1c 16 20 10 2c 25 80
80 68 21 00 00 9e 01 1d 00 bc 52 d0 1e 20 b8 28
55 40 80 68 21 00 00 1e 01 1d 00 72 51 d0 1e 20
6e 28 55 00 80 68 21 00 00 1e 00 00 00 00 00 00
00 00 00 00 00 00 00 00 00 00 00 00 00 00 00 aa

00 ff ff ff ff ff ff 00 05 e3 98 42 bb 86 01 00
2a 12 01 03 80 40 24 78 0a c1 ec a1 53 46 97 24
11 47 49 bf ee 00 81 c0 81 80 01 01 01 01 01 01
01 01 01 01 01 01 1b 21 50 a0 51 00 1e 30 48 88
35 00 80 68 21 00 00 18 f1 27 00 a0 51 00 25 30
50 80 37 00 80 68 21 00 00 1c 00 00 00 fc 00 4c
34 32 57 39 38 48 0a 20 20 20 20 20 00 00 00 fd
00 38 4c 1e 4c 10 00 0a 20 20 20 20 20 20 01 75

02 03 22 70 4d 1f 10 21 22 14 05 13 04 11 02 15
06 01 23 09 07 03 83 01 00 00 67 03 0c 00 30 00
b8 2d 02 3a 80 d0 72 38 2d 40 10 2c 45 80 80 68
21 00 00 1e 01 1d 80 d0 72 1c 16 20 10 2c 25 80
80 68 21 00 00 9e 01 1d 00 bc 52 d0 1e 20 b8 28
55 40 80 68 21 00 00 1e 01 1d 00 72 51 d0 1e 20
6e 28 55 00 80 68 21 00 00 1e 00 00 00 00 00 00
00 00 00 00 00 00 00 00 00 00 00 00 00 00 00 aa

----------------

Block 0, Base EDID:
  EDID Structure Version & Revision: 1.3
  Vendor & Product Identification:
    Manufacturer: AOC
    Model: 17048
    Serial Number: ...
    Made in: week 42 of 2008
  Basic Display Parameters & Features:
    Digital display
    Maximum image size: 64 cm x 36 cm
    Gamma: 2.20
    RGB color display
    First detailed timing is the preferred timing
  Color Characteristics:
    Red  : 0.6318, 0.3242
    Green: 0.2734, 0.5908
    Blue : 0.1435, 0.0683
    White: 0.2802, 0.2851
  Established Timings I & II:
    IBM     :   720x400    70.081663 Hz   9:5     31.467 kHz     28.320000 MHz
    DMT 0x04:   640x480    59.940476 Hz   4:3     31.469 kHz     25.175000 MHz
    Apple   :   640x480    66.666667 Hz   4:3     35.000 kHz     30.240000 MHz
    DMT 0x05:   640x480    72.808802 Hz   4:3     37.861 kHz     31.500000 MHz
    DMT 0x06:   640x480    75.000000 Hz   4:3     37.500 kHz     31.500000 MHz
    DMT 0x08:   800x600    56.250000 Hz   4:3     35.156 kHz     36.000000 MHz
    DMT 0x09:   800x600    60.316541 Hz   4:3     37.879 kHz     40.000000 MHz
    DMT 0x0a:   800x600    72.187572 Hz   4:3     48.077 kHz     50.000000 MHz
    DMT 0x0b:   800x600    75.000000 Hz   4:3     46.875 kHz     49.500000 MHz
    Apple   :   832x624    74.551266 Hz   4:3     49.726 kHz     57.284000 MHz
    DMT 0x10:  1024x768    60.003840 Hz   4:3     48.363 kHz     65.000000 MHz
    DMT 0x11:  1024x768    70.069359 Hz   4:3     56.476 kHz     75.000000 MHz
    DMT 0x12:  1024x768    75.028582 Hz   4:3     60.023 kHz     78.750000 MHz
  Standard Timings:
    DMT 0x55:  1280x720    60.000000 Hz  16:9     45.000 kHz     74.250000 MHz
    DMT 0x23:  1280x1024   60.019740 Hz   5:4     63.981 kHz    108.000000 MHz
  Detailed Timing Descriptors:
    DTD 1:  1360x768    59.798991 Hz  85:48    47.720 kHz     84.750000 MHz (640 mm x 360 mm)
                 Hfront   72 Hsync 136 Hback  208 Hpol N
                 Vfront    3 Vsync   5 Vback   22 Vpol N
    DTD 2:  1280x768    74.893062 Hz   5:3     60.289 kHz    102.250000 MHz (640 mm x 360 mm)
                 Hfront   80 Hsync 128 Hback  208 Hpol N
                 Vfront    3 Vsync   7 Vback   27 Vpol P
    Display Product Name: 'L42W98H'
    Display Range Limits:
      Monitor ranges (GTF): 56-76 Hz V, 30-76 kHz H, max dotclock 160 MHz
  Extension blocks: 1
Checksum: 0x75

----------------

Block 1, CTA-861 Extension Block:
  Revision: 3
  Basic audio support
  Supports YCbCr 4:4:4
  Supports YCbCr 4:2:2
  Native DTDs: 0
  Video Data Block:
    VIC  31:  1920x1080   50.000000 Hz  16:9     56.250 kHz    148.500000 MHz
    VIC  16:  1920x1080   60.000000 Hz  16:9     67.500 kHz    148.500000 MHz
    VIC  33:  1920x1080   25.000000 Hz  16:9     28.125 kHz     74.250000 MHz
    VIC  34:  1920x1080   30.000000 Hz  16:9     33.750 kHz     74.250000 MHz
    VIC  20:  1920x1080i  50.000000 Hz  16:9     28.125 kHz     74.250000 MHz
    VIC   5:  1920x1080i  60.000000 Hz  16:9     33.750 kHz     74.250000 MHz
    VIC  19:  1280x720    50.000000 Hz  16:9     37.500 kHz     74.250000 MHz
    VIC   4:  1280x720    60.000000 Hz  16:9     45.000 kHz     74.250000 MHz
    VIC  17:   720x576    50.000000 Hz   4:3     31.250 kHz     27.000000 MHz
    VIC   2:   720x480    59.940060 Hz   4:3     31.469 kHz     27.000000 MHz
    VIC  21:  1440x576i   50.000000 Hz   4:3     15.625 kHz     27.000000 MHz
    VIC   6:  1440x480i   59.940060 Hz   4:3     15.734 kHz     27.000000 MHz
    VIC   1:   640x480    59.940476 Hz   4:3     31.469 kHz     25.175000 MHz
  Audio Data Block:
    Linear PCM:
      Max channels: 2
      Supported sample rates (kHz): 48 44.1 32
      Supported sample sizes (bits): 20 16
  Speaker Allocation Data Block:
    FL/FR - Front Left/Right
  Vendor-Specific Data Block (HDMI), OUI 00-0C-03:
    Source physical address: 3.0.0.0
    Supports_AI
    DC_36bit
    DC_30bit
    DC_Y444
    Maximum TMDS clock: 225 MHz
  Detailed Timing Descriptors:
    DTD 3:  1920x1080   50.000000 Hz  16:9     56.250 kHz    148.500000 MHz (640 mm x 360 mm)
                 Hfront  528 Hsync  44 Hback  148 Hpol P
                 Vfront    4 Vsync   5 Vback   36 Vpol P
    DTD 4:  1920x1080i  50.000000 Hz  16:9     28.125 kHz     74.250000 MHz (640 mm x 360 mm)
                 Hfront  528 Hsync  44 Hback  148 Hpol P
                 Vfront    2 Vsync   5 Vback   15 Vpol P Vfront +0.5 Odd Field
                 Vfront    2 Vsync   5 Vback   15 Vpol P Vback  +0.5 Even Field
    DTD 5:  1280x720    50.000000 Hz  16:9     37.500 kHz     74.250000 MHz (640 mm x 360 mm)
                 Hfront  440 Hsync  40 Hback  220 Hpol P
                 Vfront    5 Vsync   5 Vback   20 Vpol P
    DTD 6:  1280x720    60.000000 Hz  16:9     45.000 kHz     74.250000 MHz (640 mm x 360 mm)
                 Hfront  110 Hsync  40 Hback  220 Hpol P
                 Vfront    5 Vsync   5 Vback   20 Vpol P
Checksum: 0xaa  Unused space in Extension Block: 21 bytes

----------------

Warnings:

Block 0, Base EDID:
  Detailed Timing Descriptor #2: Image size is 640x360 mm, but based on the picture AR it should be 600x360 mm.
Block 1, CTA-861 Extension Block:
  IT Video Formats are overscanned by default, but normally this should be underscanned.
  Video Data Block: VIC 31 and the first DTD are not identical. Is this intended?
  Add a Colorimetry Data Block with the sRGB colorimetry bit set to avoid interop issues.
EDID:
  Base EDID: Some timings are out of range of the Monitor Ranges:
    Vertical Freq: 25.000 - 75.029 Hz (Monitor: 56.000 - 76.000 Hz)
    Horizontal Freq: 15.625 - 67.500 kHz (Monitor: 30.000 - 76.000 kHz)

Failures:

Block 1, CTA-861 Extension Block:
  Missing VCDB, needed for Set Selectable RGB Quantization to avoid interop issues.
EDID:
  Extension Block 2 started with EDID header, ignoring Extension Blocks >= 2.

EDID conformity: FAIL
