edid-decode (hex):

00 ff ff ff ff ff ff 00 15 a3 35 02 9b 42 00 00
2c 0c 01 01 08 1e 17 c6 e8 5c 11 9e 59 47 9b 27
10 48 4f ad ce 00 00 00 00 00 00 00 00 00 00 00
00 00 00 00 00 00 c3 1e 00 20 41 00 20 30 10 60
13 00 1e 16 00 00 00 00 00 00 00 00 00 00 00 00
00 00 00 00 00 00 00 00 00 00 00 00 00 fd 00 3c
4b 1f 3c 08 00 0a 20 20 20 20 20 20 00 00 00 fe
00 4d 5a 4f 55 30 32 35 30 30 31 39 39 38 00 71

----------------

Block 0, Base EDID:
  EDID Structure Version & Revision: 1.1
  Vendor & Product Identification:
    Manufacturer: EMC
    Model: 565
    Serial Number: ...
    Made in: week 44 of 2002
  Basic Display Parameters & Features:
    Analog display
    Signal Level Standard: 0.700 : 0.300 : 1.000 V p-p
    Blank level equals black level
    Sync: Separate
    Maximum image size: 30 cm x 23 cm
    Gamma: 2.98
    DPMS levels: Standby Suspend Off
    RGB color display
  Color Characteristics:
    Red  : 0.6181, 0.3486
    Green: 0.2802, 0.6054
    Blue : 0.1523, 0.0634
    White: 0.2812, 0.3095
  Established Timings I & II:
    IBM     :   720x400    70.081663 Hz   9:5     31.467 kHz     28.320000 MHz
    DMT 0x04:   640x480    59.940476 Hz   4:3     31.469 kHz     25.175000 MHz
    DMT 0x05:   640x480    72.808802 Hz   4:3     37.861 kHz     31.500000 MHz
    DMT 0x06:   640x480    75.000000 Hz   4:3     37.500 kHz     31.500000 MHz
    DMT 0x09:   800x600    60.316541 Hz   4:3     37.879 kHz     40.000000 MHz
    DMT 0x0a:   800x600    72.187572 Hz   4:3     48.077 kHz     50.000000 MHz
    DMT 0x0b:   800x600    75.000000 Hz   4:3     46.875 kHz     49.500000 MHz
    DMT 0x10:  1024x768    60.003840 Hz   4:3     48.363 kHz     65.000000 MHz
    DMT 0x11:  1024x768    70.069359 Hz   4:3     56.476 kHz     75.000000 MHz
    DMT 0x12:  1024x768    75.028582 Hz   4:3     60.023 kHz     78.750000 MHz
  Standard Timings:
  Detailed Timing Descriptors:
    DTD 1:  1024x768    75.028582 Hz   4:3     60.023 kHz     78.750000 MHz (analog composite, sync-on-green, 30 mm x 22 mm)
                 Hfront   16 Hsync  96 Hback  176 Hpol N
                 Vfront    1 Vsync   3 Vback   28 Vpol N
    Empty Descriptor
    Display Range Limits:
      Monitor ranges (GTF): 60-75 Hz V, 31-60 kHz H, max dotclock 80 MHz
    Alphanumeric Data String: 'MZOU025001998'
Checksum: 0x71

----------------

Warnings:

Block 0, Base EDID:
  EDID Structure Version & Revision: EDID 1.1 is deprecated, do not use.
  Detailed Timing Descriptor #1: DTD is similar but not identical to DMT 0x12.
  Detailed Timing Descriptor #1: Dubious image size (30x22 mm is smaller than 100x100 mm).

Failures:

Block 0, Base EDID:
  Standard Timings: Use 0x0101 as the invalid Standard Timings code, not 0x0000.
  Standard Timings: Use 0x0101 as the invalid Standard Timings code, not 0x0000.
  Standard Timings: Use 0x0101 as the invalid Standard Timings code, not 0x0000.
  Standard Timings: Use 0x0101 as the invalid Standard Timings code, not 0x0000.
  Standard Timings: Use 0x0101 as the invalid Standard Timings code, not 0x0000.
  Standard Timings: Use 0x0101 as the invalid Standard Timings code, not 0x0000.
  Standard Timings: Use 0x0101 as the invalid Standard Timings code, not 0x0000.
  Standard Timings: Use 0x0101 as the invalid Standard Timings code, not 0x0000.
  Detailed Timing Descriptor #1: Mismatch of image size 30x22 mm vs display size 300x230 mm.
  Empty Descriptor: Use Dummy Descriptor instead of all zeroes.

EDID conformity: FAIL
