edid-decode (hex):

00 ff ff ff ff ff ff 00 04 69 aa 22 b9 40 00 00
30 15 01 04 a5 2f 1e 78 22 c7 20 a4 55 49 99 27
13 50 54 bf ef 00 71 4f 81 40 81 80 95 00 b3 00
81 00 01 01 01 01 08 39 90 30 62 1a 27 40 18 b0
36 40 d9 28 11 00 00 1c 00 00 00 ff 00 42 43 4c
4d 54 46 30 31 36 35 36 39 0a 00 00 00 fd 00 37
4b 1e 55 10 00 0a 20 20 20 20 20 20 00 00 00 fc
00 41 53 55 53 20 56 57 32 32 34 0a 20 20 00 62

00 ff ff ff ff ff ff 00 04 69 aa 22 b9 40 00 00
30 15 01 04 a5 2f 1e 78 22 c7 20 a4 55 49 99 27
13 50 54 bf ef 00 71 4f 81 40 81 80 95 00 b3 00
81 00 01 01 01 01 08 39 90 30 62 1a 27 40 18 b0
36 40 d9 28 11 00 00 1c 00 00 00 ff 00 42 43 4c
4d 54 46 30 31 36 35 36 39 0a 00 00 00 fd 00 37
4b 1e 55 10 00 0a 20 20 20 20 20 20 00 00 00 fc
00 41 53 55 53 20 56 57 32 32 34 0a 20 20 00 62

----------------

Block 0, Base EDID:
  EDID Structure Version & Revision: 1.4
  Vendor & Product Identification:
    Manufacturer: ACI
    Model: 8874
    Serial Number: ...
    Made in: week 48 of 2011
  Basic Display Parameters & Features:
    Digital display
    Bits per primary color channel: 8
    DisplayPort interface
    Maximum image size: 47 cm x 30 cm
    Gamma: 2.20
    DPMS levels: Off
    Supported color formats: RGB 4:4:4
    First detailed timing includes the native pixel format and preferred refresh rate
  Color Characteristics:
    Red  : 0.6435, 0.3320
    Green: 0.2861, 0.6005
    Blue : 0.1523, 0.0761
    White: 0.3125, 0.3281
  Established Timings I & II:
    IBM     :   720x400    70.081663 Hz   9:5     31.467 kHz     28.320000 MHz
    DMT 0x04:   640x480    59.940476 Hz   4:3     31.469 kHz     25.175000 MHz
    Apple   :   640x480    66.666667 Hz   4:3     35.000 kHz     30.240000 MHz
    DMT 0x05:   640x480    72.808802 Hz   4:3     37.861 kHz     31.500000 MHz
    DMT 0x06:   640x480    75.000000 Hz   4:3     37.500 kHz     31.500000 MHz
    DMT 0x08:   800x600    56.250000 Hz   4:3     35.156 kHz     36.000000 MHz
    DMT 0x09:   800x600    60.316541 Hz   4:3     37.879 kHz     40.000000 MHz
    DMT 0x0a:   800x600    72.187572 Hz   4:3     48.077 kHz     50.000000 MHz
    DMT 0x0b:   800x600    75.000000 Hz   4:3     46.875 kHz     49.500000 MHz
    Apple   :   832x624    74.551266 Hz   4:3     49.726 kHz     57.284000 MHz
    DMT 0x10:  1024x768    60.003840 Hz   4:3     48.363 kHz     65.000000 MHz
    DMT 0x11:  1024x768    70.069359 Hz   4:3     56.476 kHz     75.000000 MHz
    DMT 0x12:  1024x768    75.028582 Hz   4:3     60.023 kHz     78.750000 MHz
    DMT 0x24:  1280x1024   75.024675 Hz   5:4     79.976 kHz    135.000000 MHz
  Standard Timings:
    DMT 0x15:  1152x864    75.000000 Hz   4:3     67.500 kHz    108.000000 MHz
    DMT 0x20:  1280x960    60.000000 Hz   4:3     60.000 kHz    108.000000 MHz
    DMT 0x23:  1280x1024   60.019740 Hz   5:4     63.981 kHz    108.000000 MHz
    DMT 0x2f:  1440x900    59.887445 Hz  16:10    55.935 kHz    106.500000 MHz
    DMT 0x3a:  1680x1050   59.954250 Hz  16:10    65.290 kHz    146.250000 MHz
    DMT 0x1c:  1280x800    59.810326 Hz  16:10    49.702 kHz     83.500000 MHz
  Detailed Timing Descriptors:
    DTD 1:  1680x1050   59.851764 Hz  16:10    65.179 kHz    146.000000 MHz (473 mm x 296 mm)
                 Hfront  280 Hsync 176 Hback  104 Hpol N
                 Vfront    3 Vsync   6 Vback   30 Vpol P
    Display Product Serial Number: ...
    Display Range Limits:
      Monitor ranges (GTF): 55-75 Hz V, 30-85 kHz H, max dotclock 160 MHz
    Display Product Name: 'ASUS VW224'
Checksum: 0x62

----------------

Warnings:

Block 0, Base EDID:
  Display Range Limits: GTF support is deprecated in EDID 1.4.

Failures:

Block 0, Base EDID:
  Display Range Limits: GTF is supported, but the display does not support continuous frequencies.
EDID:
  Extension Block 1 started with EDID header, ignoring Extension Blocks >= 1.

EDID conformity: FAIL
