edid-decode (hex):

00 ff ff ff ff ff ff 00 33 54 01 00 00 00 00 00
0c 1b 01 03 80 00 00 78 0a 07 f5 9a 56 4e 86 26
1e 50 54 00 00 00 00 00 00 00 00 00 00 00 00 00
00 00 00 00 00 00 7a 11 20 5c 30 20 24 30 28 0c
cc 00 5a a0 00 00 00 18 00 00 00 fc 00 4c 53 30
36 30 52 31 53 58 30 31 20 20 00 00 00 ff 00 30
30 30 30 30 30 30 30 20 20 20 20 20 00 00 00 fd
00 17 4b 0f f0 22 00 0a 20 20 20 20 20 20 01 82

02 03 17 74 47 00 00 00 00 00 00 00 23 09 7f 07
66 03 0c 00 30 00 80 7a 11 20 5c 30 20 24 30 28
0c cc 00 5a a0 00 00 00 18 7a 11 20 5c 30 20 24
30 28 0c cc 00 5a a0 00 00 00 18 7a 11 20 5c 30
20 24 30 28 0c cc 00 5a a0 00 00 00 18 7a 11 20
5c 30 20 24 30 28 0c cc 00 5a a0 00 00 00 18 7a
11 20 5c 30 20 24 30 28 0c cc 00 5a a0 00 00 00
18 00 00 00 00 00 00 00 00 00 00 00 00 00 00 a1

----------------

Block 0, Base EDID:
  EDID Structure Version & Revision: 1.3
  Vendor & Product Identification:
    Manufacturer: LZT
    Model: 1
    Made in: week 12 of 2017
  Basic Display Parameters & Features:
    Digital display
    Image size is variable
    Gamma: 2.20
    RGB color display
    First detailed timing is the preferred timing
  Color Characteristics:
    Red  : 0.6015, 0.3359
    Green: 0.3056, 0.5263
    Blue : 0.1513, 0.1201
    White: 0.3134, 0.3291
  Established Timings I & II: none
  Standard Timings:
  Detailed Timing Descriptors:
    DTD 1:   800x800    59.996352 Hz   1:1     50.157 kHz     44.740000 MHz (90 mm x 160 mm)
                 Hfront   40 Hsync  12 Hback   40 Hpol N
                 Vfront   12 Vsync  12 Vback   12 Vpol N
    Display Product Name: 'LS060R1SX01  '
    Display Product Serial Number: ...
    Display Range Limits:
      Monitor ranges (GTF): 23-75 Hz V, 15-240 kHz H, max dotclock 340 MHz
  Extension blocks: 1
Checksum: 0x82

----------------

Block 1, CTA-861 Extension Block:
  Revision: 3
  Basic audio support
  Supports YCbCr 4:4:4
  Supports YCbCr 4:2:2
  Native DTDs: 4
  Video Data Block:
  Audio Data Block:
    Linear PCM:
      Max channels: 2
      Supported sample rates (kHz): 192 176.4 96 88.2 48 44.1 32
      Supported sample sizes (bits): 24 20 16
  Vendor-Specific Data Block (HDMI), OUI 00-0C-03:
    Source physical address: 3.0.0.0
    Supports_AI
  Detailed Timing Descriptors:
    DTD 2:   800x800    59.996352 Hz   1:1     50.157 kHz     44.740000 MHz (90 mm x 160 mm)
                 Hfront   40 Hsync  12 Hback   40 Hpol N
                 Vfront   12 Vsync  12 Vback   12 Vpol N
    DTD 3:   800x800    59.996352 Hz   1:1     50.157 kHz     44.740000 MHz (90 mm x 160 mm)
                 Hfront   40 Hsync  12 Hback   40 Hpol N
                 Vfront   12 Vsync  12 Vback   12 Vpol N
    DTD 4:   800x800    59.996352 Hz   1:1     50.157 kHz     44.740000 MHz (90 mm x 160 mm)
                 Hfront   40 Hsync  12 Hback   40 Hpol N
                 Vfront   12 Vsync  12 Vback   12 Vpol N
    DTD 5:   800x800    59.996352 Hz   1:1     50.157 kHz     44.740000 MHz (90 mm x 160 mm)
                 Hfront   40 Hsync  12 Hback   40 Hpol N
                 Vfront   12 Vsync  12 Vback   12 Vpol N
    DTD 6:   800x800    59.996352 Hz   1:1     50.157 kHz     44.740000 MHz (90 mm x 160 mm)
                 Hfront   40 Hsync  12 Hback   40 Hpol N
                 Vfront   12 Vsync  12 Vback   12 Vpol N
Checksum: 0xa1  Unused space in Extension Block: 14 bytes

----------------

Warnings:

Block 0, Base EDID:
  Detailed Timing Descriptor #1: Dubious image size (90x160 mm is smaller than 100x100 mm).
  Display Product Serial Number: ...
Block 1, CTA-861 Extension Block:
  IT Video Formats are overscanned by default, but normally this should be underscanned.
  Detailed Timing Descriptor #2: Dubious image size (90x160 mm is smaller than 100x100 mm).
  Detailed Timing Descriptor #3: Dubious image size (90x160 mm is smaller than 100x100 mm).
  Detailed Timing Descriptor #4: Dubious image size (90x160 mm is smaller than 100x100 mm).
  Detailed Timing Descriptor #5: Dubious image size (90x160 mm is smaller than 100x100 mm).
  Detailed Timing Descriptor #6: Dubious image size (90x160 mm is smaller than 100x100 mm).
  Add a Colorimetry Data Block with the sRGB colorimetry bit set to avoid interop issues.

Failures:

Block 0, Base EDID:
  Display Product Serial Number: ...
  Standard Timings: Use 0x0101 as the invalid Standard Timings code, not 0x0000.
  Standard Timings: Use 0x0101 as the invalid Standard Timings code, not 0x0000.
  Standard Timings: Use 0x0101 as the invalid Standard Timings code, not 0x0000.
  Standard Timings: Use 0x0101 as the invalid Standard Timings code, not 0x0000.
  Standard Timings: Use 0x0101 as the invalid Standard Timings code, not 0x0000.
  Standard Timings: Use 0x0101 as the invalid Standard Timings code, not 0x0000.
  Standard Timings: Use 0x0101 as the invalid Standard Timings code, not 0x0000.
  Standard Timings: Use 0x0101 as the invalid Standard Timings code, not 0x0000.
  Display Product Name: No newline, but one or more trailing spaces.
Block 1, CTA-861 Extension Block:
  Required 640x480p60 timings are missing in the established timings and the SVD list (VIC 1).
  Missing VCDB, needed for Set Selectable RGB Quantization to avoid interop issues.
EDID:
  Base EDID: The DTD max image size is 90x160mm, but the display size is not specified anywhere.

EDID conformity: FAIL
