edid-decode (hex):

00 ff ff ff ff ff ff 00 1e 6d 79 77 8e 7c 0a 00
09 1f 01 03 80 50 22 78 ea a2 25 ae 4f 45 ab 27
0e 50 54 21 08 00 d1 c0 61 40 01 01 01 01 01 01
01 01 01 01 01 01 7d 7d 70 b0 d0 a0 29 50 38 20
3a 00 20 4e 31 00 00 1a 00 00 00 fd 00 30 4b 1e
70 29 00 0a 20 20 20 20 20 20 00 00 00 fc 00 4c
47 20 55 4c 54 52 41 57 49 44 45 0a 00 00 00 ff
00 31 30 39 4e 54 55 57 4c 37 32 34 36 0a 01 41

02 03 4d 73 23 09 07 07 83 01 00 00 4f 61 60 5f
5e 5d 5a 59 22 20 1f 12 10 04 03 01 6d 03 0c 00
11 00 b8 3c 20 00 60 01 02 03 67 d8 5d c4 01 78
80 03 e3 0f 03 00 e2 00 6a e3 05 c0 00 e6 06 05
01 53 53 5d 68 1a 00 00 01 01 30 4b 00 02 9e 70
b0 d0 a0 34 50 38 20 3a 00 20 4e 31 00 00 1a 01
68 70 b0 d0 a0 22 50 38 20 3a 00 20 4e 31 00 00
1a 00 00 00 00 00 00 00 00 00 00 00 00 00 00 20

00 ff ff ff ff ff ff 00 1e 6d 79 77 8e 7c 0a 00
09 1f 01 03 80 50 22 78 ea a2 25 ae 4f 45 ab 27
0e 50 54 21 08 00 d1 c0 61 40 01 01 01 01 01 01
01 01 01 01 01 01 7d 7d 70 b0 d0 a0 29 50 38 20
3a 00 20 4e 31 00 00 1a 00 00 00 fd 00 30 4b 1e
70 29 00 0a 20 20 20 20 20 20 00 00 00 fc 00 4c
47 20 55 4c 54 52 41 57 49 44 45 0a 00 00 00 ff
00 31 30 39 4e 54 55 57 4c 37 32 34 36 0a 01 41

02 03 4d 73 23 09 07 07 83 01 00 00 4f 61 60 5f
5e 5d 5a 59 22 20 1f 12 10 04 03 01 6d 03 0c 00
11 00 b8 3c 20 00 60 01 02 03 67 d8 5d c4 01 78
80 03 e3 0f 03 00 e2 00 6a e3 05 c0 00 e6 06 05
01 53 53 5d 68 1a 00 00 01 01 30 4b 00 02 9e 70
b0 d0 a0 34 50 38 20 3a 00 20 4e 31 00 00 1a 01
68 70 b0 d0 a0 22 50 38 20 3a 00 20 4e 31 00 00
1a 00 00 00 00 00 00 00 00 00 00 00 00 00 00 20

----------------

Block 0, Base EDID:
  EDID Structure Version & Revision: 1.3
  Vendor & Product Identification:
    Manufacturer: GSM
    Model: 30585
    Serial Number: ...
    Made in: week 9 of 2021
  Basic Display Parameters & Features:
    Digital display
    Maximum image size: 80 cm x 34 cm
    Gamma: 2.20
    DPMS levels: Standby Suspend Off
    RGB color display
    First detailed timing is the preferred timing
  Color Characteristics:
    Red  : 0.6816, 0.3105
    Green: 0.2695, 0.6699
    Blue : 0.1523, 0.0566
    White: 0.3134, 0.3291
  Established Timings I & II:
    DMT 0x04:   640x480    59.940476 Hz   4:3     31.469 kHz     25.175000 MHz
    DMT 0x09:   800x600    60.316541 Hz   4:3     37.879 kHz     40.000000 MHz
    DMT 0x10:  1024x768    60.003840 Hz   4:3     48.363 kHz     65.000000 MHz
  Standard Timings:
    DMT 0x52:  1920x1080   60.000000 Hz  16:9     67.500 kHz    148.500000 MHz
    DMT 0x10:  1024x768    60.003840 Hz   4:3     48.363 kHz     65.000000 MHz
  Detailed Timing Descriptors:
    DTD 1:  3440x1440   59.987347 Hz  43:18    88.841 kHz    321.250000 MHz (800 mm x 334 mm)
                 Hfront   56 Hsync  32 Hback   88 Hpol P
                 Vfront    3 Vsync  10 Vback   28 Vpol N
    Display Range Limits:
      Monitor ranges (GTF): 48-75 Hz V, 30-112 kHz H, max dotclock 410 MHz
    Display Product Name: 'LG ULTRAWIDE'
    Display Product Serial Number: ...
  Extension blocks: 1
Checksum: 0x41

----------------

Block 1, CTA-861 Extension Block:
  Revision: 3
  Basic audio support
  Supports YCbCr 4:4:4
  Supports YCbCr 4:2:2
  Native DTDs: 3
  Audio Data Block:
    Linear PCM:
      Max channels: 2
      Supported sample rates (kHz): 48 44.1 32
      Supported sample sizes (bits): 24 20 16
  Speaker Allocation Data Block:
    FL/FR - Front Left/Right
  Video Data Block:
    VIC  97:  3840x2160   60.000000 Hz  16:9    135.000 kHz    594.000000 MHz
    VIC  96:  3840x2160   50.000000 Hz  16:9    112.500 kHz    594.000000 MHz
    VIC  95:  3840x2160   30.000000 Hz  16:9     67.500 kHz    297.000000 MHz
    VIC  94:  3840x2160   25.000000 Hz  16:9     56.250 kHz    297.000000 MHz
    VIC  93:  3840x2160   24.000000 Hz  16:9     54.000 kHz    297.000000 MHz
    VIC  90:  2560x1080   60.000000 Hz  64:27    66.000 kHz    198.000000 MHz
    VIC  89:  2560x1080   50.000000 Hz  64:27    56.250 kHz    185.625000 MHz
    VIC  34:  1920x1080   30.000000 Hz  16:9     33.750 kHz     74.250000 MHz
    VIC  32:  1920x1080   24.000000 Hz  16:9     27.000 kHz     74.250000 MHz
    VIC  31:  1920x1080   50.000000 Hz  16:9     56.250 kHz    148.500000 MHz
    VIC  18:   720x576    50.000000 Hz  16:9     31.250 kHz     27.000000 MHz
    VIC  16:  1920x1080   60.000000 Hz  16:9     67.500 kHz    148.500000 MHz
    VIC   4:  1280x720    60.000000 Hz  16:9     45.000 kHz     74.250000 MHz
    VIC   3:   720x480    59.940060 Hz  16:9     31.469 kHz     27.000000 MHz
    VIC   1:   640x480    59.940476 Hz   4:3     31.469 kHz     25.175000 MHz
  Vendor-Specific Data Block (HDMI), OUI 00-0C-03:
    Source physical address: 1.1.0.0
    Supports_AI
    DC_36bit
    DC_30bit
    DC_Y444
    Maximum TMDS clock: 300 MHz
    Extended HDMI video details:
      HDMI VICs:
        HDMI VIC 1:  3840x2160   30.000000 Hz  16:9     67.500 kHz    297.000000 MHz
        HDMI VIC 2:  3840x2160   25.000000 Hz  16:9     56.250 kHz    297.000000 MHz
        HDMI VIC 3:  3840x2160   24.000000 Hz  16:9     54.000 kHz    297.000000 MHz
  Vendor-Specific Data Block (HDMI Forum), OUI C4-5D-D8:
    Version: 1
    Maximum TMDS Character Rate: 600 MHz
    SCDC Present
    Supports 12-bits/component Deep Color 4:2:0 Pixel Encoding
    Supports 10-bits/component Deep Color 4:2:0 Pixel Encoding
  YCbCr 4:2:0 Capability Map Data Block:
    VIC  97:  3840x2160   60.000000 Hz  16:9    135.000 kHz    594.000000 MHz
    VIC  96:  3840x2160   50.000000 Hz  16:9    112.500 kHz    594.000000 MHz
  Video Capability Data Block:
    YCbCr quantization: No Data
    RGB quantization: Selectable (via AVI Q)
    PT scan behavior: Always Underscanned
    IT scan behavior: Always Underscanned
    CE scan behavior: Always Underscanned
  Colorimetry Data Block:
    BT2020YCC
    BT2020RGB
  HDR Static Metadata Data Block:
    Electro optical transfer functions:
      Traditional gamma - SDR luminance range
      SMPTE ST2084
    Supported static metadata descriptors:
      Static metadata type 1
    Desired content max luminance: 83 (301.833 cd/m^2)
    Desired content max frame-average luminance: 83 (301.833 cd/m^2)
    Desired content min luminance: 93 (0.401 cd/m^2)
  Vendor-Specific Data Block (AMD), OUI 00-00-1A:
    Version: 1
    Flags 1: 0x01
      FreeSync Supported
    Minimum Refresh Rate: 48 Hz
    Maximum Refresh Rate: 75 Hz
  Detailed Timing Descriptors:
    DTD 2:  3440x1440   74.975830 Hz  43:18   111.864 kHz    404.500000 MHz (800 mm x 334 mm)
                 Hfront   56 Hsync  32 Hback   88 Hpol P
                 Vfront    3 Vsync  10 Vback   39 Vpol N
    DTD 3:  3440x1440   49.953246 Hz  43:18    73.631 kHz    266.250000 MHz (800 mm x 334 mm)
                 Hfront   56 Hsync  32 Hback   88 Hpol P
                 Vfront    3 Vsync  10 Vback   21 Vpol N
Checksum: 0x20  Unused space in Extension Block: 14 bytes

----------------

Warnings:

Block 1, CTA-861 Extension Block:
  IT Video Formats are overscanned by default, but normally this should be underscanned.
  Video Data Block: VIC 97 and the first DTD are not identical. Is this intended?
  Video Capability Data Block: Set Selectable YCbCr Quantization to avoid interop issues.
  Video Capability Data Block: S_PT is equal to S_IT and S_CE, so should be set to 0 instead.
  Colorimetry Data Block: Set the sRGB colorimetry bit to avoid interop issues.
  Display Product Serial Number is set, so the Serial Number in the Base EDID should be 0.
EDID:
  Base EDID: Some timings are out of range of the Monitor Ranges:
    Vertical Freq: 24.000 - 74.976 Hz (Monitor: 48.000 - 75.000 Hz)
    Horizontal Freq: 27.000 - 135.000 kHz (Monitor: 30.000 - 112.000 kHz)
    Maximum Clock: 594.000 MHz (Monitor: 410.000 MHz)
  CTA-861: Native progressive resolution of 3440x1440 is smaller than the max preferred progressive resolution 3840x2160.

Failures:

Block 1, CTA-861 Extension Block:
  Vendor-Specific Data Block (HDMI Forum), OUI C4-5D-D8: HDMI VIC and related CTA VIC codes are present, but the UHD VIC bit is 0.
  Video Capability Data Block: IT video formats are always underscanned, but bit 7 of Byte 3 of the CTA-861 Extension header is set to overscanned.
EDID:
  Extension Block 2 started with EDID header, ignoring Extension Blocks >= 2.

EDID conformity: FAIL
