edid-decode (hex):

00 ff ff ff ff ff ff 00 0e 77 4f 16 00 00 00 00
00 22 01 04 a5 22 16 78 03 c1 75 a5 54 4d 9a 24
0d 50 54 00 00 00 01 01 01 01 01 01 01 01 01 01
01 01 01 01 01 01 3f 6f 00 a0 a0 40 91 60 30 20
36 00 58 d7 10 00 00 18 00 00 00 fd 0c 30 b4 3c
3c 56 01 0a 20 20 20 20 20 20 00 00 00 fc 00 4d
4e 47 30 30 37 44 41 35 2d 35 0a 20 00 00 00 fe
00 43 53 4f 54 20 54 33 0a 20 20 20 20 20 01 dc

70 20 79 02 00 21 00 1d 77 0d 6a 08 00 0a 40 06
00 5a fa 53 d1 64 9a 46 d2 0d 02 45 54 00 80 00
80 00 80 12 78 22 00 14 51 09 0d 85 ff 09 9f 00
2f 00 1f 00 3f 06 90 00 02 00 05 00 2b 00 0c 27
00 30 3b 00 00 27 00 3c b3 00 00 81 00 15 74 1a
00 00 03 71 30 b4 00 00 00 00 00 00 b4 00 00 00
00 00 00 00 00 00 00 00 00 00 00 00 00 00 00 00
00 00 00 00 00 00 00 00 00 00 00 00 00 00 9f 90

00 ff ff ff ff ff ff 00 0e 77 4f 16 00 00 00 00
00 22 01 04 a5 22 16 78 03 c1 75 a5 54 4d 9a 24
0d 50 54 00 00 00 01 01 01 01 01 01 01 01 01 01
01 01 01 01 01 01 3f 6f 00 a0 a0 40 91 60 30 20
36 00 58 d7 10 00 00 18 00 00 00 fd 0c 30 b4 3c
3c 56 01 0a 20 20 20 20 20 20 00 00 00 fc 00 4d
4e 47 30 30 37 44 41 35 2d 35 0a 20 00 00 00 fe
00 43 53 4f 54 20 54 33 0a 20 20 20 20 20 01 dc

70 20 79 02 00 21 00 1d 77 0d 6a 08 00 0a 40 06
00 5a fa 53 d1 64 9a 46 d2 0d 02 45 54 00 80 00
80 00 80 12 78 22 00 14 51 09 0d 85 ff 09 9f 00
2f 00 1f 00 3f 06 90 00 02 00 05 00 2b 00 0c 27
00 30 3b 00 00 27 00 3c b3 00 00 81 00 15 74 1a
00 00 03 71 30 b4 00 00 00 00 00 00 b4 00 00 00
00 00 00 00 00 00 00 00 00 00 00 00 00 00 00 00
00 00 00 00 00 00 00 00 00 00 00 00 00 00 9f 90

----------------

Block 0, Base EDID:
  EDID Structure Version & Revision: 1.4
  Vendor & Product Identification:
    Manufacturer: CSW
    Model: 5711
    Made in: 2024
  Basic Display Parameters & Features:
    Digital display
    Bits per primary color channel: 8
    DisplayPort interface
    Maximum image size: 34 cm x 22 cm
    Gamma: 2.20
    Supported color formats: RGB 4:4:4
    First detailed timing includes the native pixel format and preferred refresh rate
    Display supports continuous frequencies
  Color Characteristics:
    Red  : 0.6474, 0.3281
    Green: 0.3007, 0.6025
    Blue : 0.1416, 0.0537
    White: 0.3134, 0.3291
  Established Timings I & II: none
  Standard Timings: none
  Detailed Timing Descriptors:
    DTD 1:  2560x1600   60.001264 Hz  16:10   104.702 kHz    284.790000 MHz (344 mm x 215 mm)
                 Hfront   48 Hsync  32 Hback   80 Hpol N
                 Vfront    3 Vsync   6 Vback  136 Vpol N
    Display Range Limits:
      Monitor ranges (Range Limits Only): 48-180 Hz V, 315-315 kHz H, max dotclock 860 MHz
    Display Product Name: 'MNG007DA5-5'
    Alphanumeric Data String: 'CSOT T3'
  Extension blocks: 1
Checksum: 0xdc

----------------

Block 1, DisplayID Extension Block:
  Version: 2.0
  Extension Count: 0
  Display Product Primary Use Case: None of the listed primary use cases; generic display
  Display Parameters Data Block (0x21):
    Image size: 344.7 mm x 215.4 mm
    Display native pixel format: 2560x1600
    Scan Orientation: Left to Right, Top to Bottom
    Luminance Information: Minimum guaranteed value
    Color Information: CIE 1931
    Audio Speaker Information: integrated
    Native Color Chromaticity:
      Primary #1:  (0.646973, 0.327881)
      Primary #2:  (0.301025, 0.603027)
      Primary #3:  (0.142090, 0.053955)
      White Point: (0.312988, 0.329102)
    Native Maximum Luminance (Full Coverage): do not use
    Native Maximum Luminance (10% Rectangular Coverage): do not use
    Native Minimum Luminance: do not use
    Native Color Depth: 8 bpc
    Display Device Technology: Active Matrix LCD
    Native Gamma EOTF: 2.20
  Video Timing Modes Type 7 - Detailed Timings Data Block:
    DTD:  2560x1600  180.000421 Hz  16:10   314.101 kHz    854.354000 MHz (aspect 16:10, no 3D stereo, preferred)
               Hfront   48 Hsync  32 Hback   80 Hpol N
               Vfront    3 Vsync   6 Vback  136 Vpol N
  Adaptive Sync Data Block:
    Descriptor #1:
      Native Panel Range
      Fixed Average V-Total and Adaptive V-Total
      Supports Seamless Transition
      'Max Single Frame Duration Increase' field value without jitter impact
      'Max Single Frame Duration Decrease' field value without jitter impact
      Max Duration Increase: 0.00 ms
      Max Duration Decrease: 0.00 ms
      Min Refresh Rate: 48 Hz
      Max Refresh Rate: 60 Hz
    Descriptor #2:
      Native Panel Range
      Fixed Average V-Total and Adaptive V-Total
      Supports Seamless Transition
      'Max Single Frame Duration Increase' field value without jitter impact
      'Max Single Frame Duration Decrease' field value without jitter impact
      Max Duration Increase: 0.00 ms
      Max Duration Decrease: 0.00 ms
      Min Refresh Rate: 60 Hz
      Max Refresh Rate: 180 Hz
  CTA-861 DisplayID Data Block:
  Vendor-Specific Data Block (AMD), OUI 00-00-1A:
    Version: 3
    Feature Caps: 0x71
      FreeSync Panel Replay Supported
    Minimum Refresh Rate: 48 Hz
    Maximum Refresh Rate: 180 Hz
    Flags 1.x: 0x00
    Flags 2.x: 0x00
  Checksum: 0x9f
Checksum: 0x90

----------------

Warnings:

EDID:
  Base EDID: Some timings are out of range of the Monitor Ranges:
    Horizontal Freq: 104.702 - 314.100 kHz (Monitor: 315.000 - 315.000 kHz)

Failures:

EDID:
  Extension Block 2 started with EDID header, ignoring Extension Blocks >= 2.

EDID conformity: FAIL
