edid-decode (hex):

00 ff ff ff ff ff ff 00 09 e5 58 09 00 00 00 00
19 1e 01 04 b5 1d 12 78 07 f0 85 a4 53 4b 9b 25
0f 50 54 00 00 00 01 01 01 01 01 01 01 01 01 01
01 01 01 01 01 01 52 69 00 b4 a0 40 28 60 30 20
36 00 1e b2 10 00 00 1a 42 54 00 b4 a0 40 28 60
30 20 36 00 1e b2 10 00 00 1a 00 00 00 fe 00 32
34 56 35 58 80 4e 45 31 33 4e 36 30 00 00 00 00
00 03 41 21 9e 00 11 00 00 0b 01 0a 20 20 00 79

----------------

Block 0, Base EDID:
  EDID Structure Version & Revision: 1.4
  Vendor & Product Identification:
    Manufacturer: BOE
    Model: 2392
    Made in: week 25 of 2020
  Basic Display Parameters & Features:
    Digital display
    Bits per primary color channel: 10
    DisplayPort interface
    Maximum image size: 29 cm x 18 cm
    Gamma: 2.20
    Supported color formats: RGB 4:4:4
    Default (sRGB) color space is primary color space
    First detailed timing includes the native pixel format and preferred refresh rate
    Display supports continuous frequencies
  Color Characteristics:
    Red  : 0.6435, 0.3271
    Green: 0.2929, 0.6054
    Blue : 0.1464, 0.0585
    White: 0.3134, 0.3291
  Established Timings I & II: none
  Standard Timings: none
  Detailed Timing Descriptors:
    DTD 1:  2560x1600   60.000890 Hz  16:10    98.401 kHz    269.620000 MHz (286 mm x 178 mm)
                 Hfront   48 Hsync  32 Hback  100 Hpol P
                 Vfront    3 Vsync   6 Vback   31 Vpol N
    DTD 2:  2560x1600   48.001602 Hz  16:10    78.723 kHz    215.700000 MHz (286 mm x 178 mm)
                 Hfront   48 Hsync  32 Hback  100 Hpol P
                 Vfront    3 Vsync   6 Vback   31 Vpol N
    Alphanumeric Data String: '24V5X.NE13N60'
    Manufacturer-Specified Display Descriptor (0x00): 00 00 00 03 41 21 9e 00 11 00 00 0b 01 0a 20 20 '....A!........  '
Checksum: 0x79

----------------

Warnings:

Block 0, Base EDID:
  Alphanumeric Data String: Non-ASCII character 0x80 at position 5, can cause problems.
  Missing Display Product Name.

Failures:

Block 0, Base EDID:
  Basic Display Parameters & Features: sRGB is signaled, but the chromaticities do not match.
  Missing Display Range Limits Descriptor.

EDID conformity: FAIL
