edid-decode (hex):

00 ff ff ff ff ff ff 00 4d b0 51 43 01 00 00 00
13 19 01 03 80 46 27 78 0a e5 1d a3 54 4a 9c 25
0f 47 4a b1 2a 80 81 c0 81 40 81 80 90 40 95 00
a9 c0 a9 40 b3 00 66 21 56 aa 51 00 1e 30 46 8f
33 00 bc 86 21 00 00 1e 02 3a 80 18 71 38 2d 40
58 2c 45 00 bc 86 21 00 00 1e 00 00 00 fc 00 45
4d 2d 33 32 43 54 31 36 44 0a 20 20 00 00 00 fd
00 32 46 0f 4b 11 00 0a 20 20 20 20 20 20 01 2f

02 03 37 71 52 01 02 03 04 05 06 07 10 11 12 13
14 1f 20 21 22 15 16 23 09 07 07 83 01 00 00 70
03 0c 00 10 00 38 3c 20 00 63 01 02 03 00 00 00
e3 05 03 01 e2 00 fb 02 3a 80 d0 72 38 2d 40 10
2c 45 80 bc 86 21 00 00 1a 0e 1f 00 80 51 00 1e
30 40 80 37 00 bc 86 21 00 00 1c 46 05 d0 90 20
20 18 10 0c 3f 33 00 bc 86 21 00 00 98 00 00 00
00 00 00 00 00 00 00 00 00 00 00 00 00 00 00 5c

00 ff ff ff ff ff ff 00 4d b0 51 43 01 00 00 00
13 19 01 03 80 46 27 78 0a e5 1d a3 54 4a 9c 25
0f 47 4a b1 2a 80 81 c0 81 40 81 80 90 40 95 00
a9 c0 a9 40 b3 00 66 21 56 aa 51 00 1e 30 46 8f
33 00 bc 86 21 00 00 1e 02 3a 80 18 71 38 2d 40
58 2c 45 00 bc 86 21 00 00 1e 00 00 00 fc 00 45
4d 2d 33 32 43 54 31 36 44 0a 20 20 00 00 00 fd
00 32 46 0f 4b 11 00 0a 20 20 20 20 20 20 01 2f

02 03 37 71 52 01 02 03 04 05 06 07 10 11 12 13
14 1f 20 21 22 15 16 23 09 07 07 83 01 00 00 70
03 0c 00 10 00 38 3c 20 00 63 01 02 03 00 00 00
e3 05 03 01 e2 00 fb 02 3a 80 d0 72 38 2d 40 10
2c 45 80 bc 86 21 00 00 1a 0e 1f 00 80 51 00 1e
30 40 80 37 00 bc 86 21 00 00 1c 46 05 d0 90 20
20 18 10 0c 3f 33 00 bc 86 21 00 00 98 00 00 00
00 00 00 00 00 00 00 00 00 00 00 00 00 00 00 5c

----------------

Block 0, Base EDID:
  EDID Structure Version & Revision: 1.3
  Vendor & Product Identification:
    Manufacturer: SMP
    Model: 17233
    Serial Number: ...
    Made in: week 19 of 2015
  Basic Display Parameters & Features:
    Digital display
    Maximum image size: 70 cm x 39 cm
    Gamma: 2.20
    RGB color display
    First detailed timing is the preferred timing
  Color Characteristics:
    Red  : 0.6396, 0.3300
    Green: 0.2900, 0.6103
    Blue : 0.1445, 0.0595
    White: 0.2802, 0.2900
  Established Timings I & II:
    IBM     :   720x400    70.081663 Hz   9:5     31.467 kHz     28.320000 MHz
    DMT 0x04:   640x480    59.940476 Hz   4:3     31.469 kHz     25.175000 MHz
    Apple   :   640x480    66.666667 Hz   4:3     35.000 kHz     30.240000 MHz
    DMT 0x09:   800x600    60.316541 Hz   4:3     37.879 kHz     40.000000 MHz
    Apple   :   832x624    74.551266 Hz   4:3     49.726 kHz     57.284000 MHz
    DMT 0x10:  1024x768    60.003840 Hz   4:3     48.363 kHz     65.000000 MHz
    DMT 0x12:  1024x768    75.028582 Hz   4:3     60.023 kHz     78.750000 MHz
    Apple   :  1152x870    75.061550 Hz 192:145   68.681 kHz    100.000000 MHz
  Standard Timings:
    DMT 0x55:  1280x720    60.000000 Hz  16:9     45.000 kHz     74.250000 MHz
    DMT 0x20:  1280x960    60.000000 Hz   4:3     60.000 kHz    108.000000 MHz
    DMT 0x23:  1280x1024   60.019740 Hz   5:4     63.981 kHz    108.000000 MHz
    DMT 0x2a:  1400x1050   59.978442 Hz   4:3     65.317 kHz    121.750000 MHz
    DMT 0x2f:  1440x900    59.887445 Hz  16:10    55.935 kHz    106.500000 MHz
    DMT 0x53:  1600x900    60.000000 Hz  16:9     60.000 kHz    108.000000 MHz (RB)
    DMT 0x33:  1600x1200   60.000000 Hz   4:3     75.000 kHz    162.000000 MHz
    DMT 0x3a:  1680x1050   59.954250 Hz  16:10    65.290 kHz    146.250000 MHz
  Detailed Timing Descriptors:
    DTD 1:  1366x768    59.789541 Hz 683:384   47.712 kHz     85.500000 MHz (700 mm x 390 mm)
                 Hfront   70 Hsync 143 Hback  213 Hpol P
                 Vfront    3 Vsync   3 Vback   24 Vpol P
    DTD 2:  1920x1080   60.000000 Hz  16:9     67.500 kHz    148.500000 MHz (700 mm x 390 mm)
                 Hfront   88 Hsync  44 Hback  148 Hpol P
                 Vfront    4 Vsync   5 Vback   36 Vpol P
    Display Product Name: 'EM-32CT16D'
    Display Range Limits:
      Monitor ranges (GTF): 50-70 Hz V, 15-75 kHz H, max dotclock 170 MHz
  Extension blocks: 1
Checksum: 0x2f

----------------

Block 1, CTA-861 Extension Block:
  Revision: 3
  Basic audio support
  Supports YCbCr 4:4:4
  Supports YCbCr 4:2:2
  Native DTDs: 1
  Video Data Block:
    VIC   1:   640x480    59.940476 Hz   4:3     31.469 kHz     25.175000 MHz
    VIC   2:   720x480    59.940060 Hz   4:3     31.469 kHz     27.000000 MHz
    VIC   3:   720x480    59.940060 Hz  16:9     31.469 kHz     27.000000 MHz
    VIC   4:  1280x720    60.000000 Hz  16:9     45.000 kHz     74.250000 MHz
    VIC   5:  1920x1080i  60.000000 Hz  16:9     33.750 kHz     74.250000 MHz
    VIC   6:  1440x480i   59.940060 Hz   4:3     15.734 kHz     27.000000 MHz
    VIC   7:  1440x480i   59.940060 Hz  16:9     15.734 kHz     27.000000 MHz
    VIC  16:  1920x1080   60.000000 Hz  16:9     67.500 kHz    148.500000 MHz
    VIC  17:   720x576    50.000000 Hz   4:3     31.250 kHz     27.000000 MHz
    VIC  18:   720x576    50.000000 Hz  16:9     31.250 kHz     27.000000 MHz
    VIC  19:  1280x720    50.000000 Hz  16:9     37.500 kHz     74.250000 MHz
    VIC  20:  1920x1080i  50.000000 Hz  16:9     28.125 kHz     74.250000 MHz
    VIC  31:  1920x1080   50.000000 Hz  16:9     56.250 kHz    148.500000 MHz
    VIC  32:  1920x1080   24.000000 Hz  16:9     27.000 kHz     74.250000 MHz
    VIC  33:  1920x1080   25.000000 Hz  16:9     28.125 kHz     74.250000 MHz
    VIC  34:  1920x1080   30.000000 Hz  16:9     33.750 kHz     74.250000 MHz
    VIC  21:  1440x576i   50.000000 Hz   4:3     15.625 kHz     27.000000 MHz
    VIC  22:  1440x576i   50.000000 Hz  16:9     15.625 kHz     27.000000 MHz
  Audio Data Block:
    Linear PCM:
      Max channels: 2
      Supported sample rates (kHz): 48 44.1 32
      Supported sample sizes (bits): 24 20 16
  Speaker Allocation Data Block:
    FL/FR - Front Left/Right
  Vendor-Specific Data Block (HDMI), OUI 00-0C-03:
    Source physical address: 1.0.0.0
    DC_36bit
    DC_30bit
    DC_Y444
    Maximum TMDS clock: 300 MHz
    Extended HDMI video details:
      HDMI VICs:
        HDMI VIC 1:  3840x2160   30.000000 Hz  16:9     67.500 kHz    297.000000 MHz
        HDMI VIC 2:  3840x2160   25.000000 Hz  16:9     56.250 kHz    297.000000 MHz
        HDMI VIC 3:  3840x2160   24.000000 Hz  16:9     54.000 kHz    297.000000 MHz
      3D VIC indices with specific capabilities:
        VIC   1:   640x480    59.940476 Hz   4:3     31.469 kHz     25.175000 MHz (frame packing)
        VIC   1:   640x480    59.940476 Hz   4:3     31.469 kHz     25.175000 MHz (frame packing)
        VIC   1:   640x480    59.940476 Hz   4:3     31.469 kHz     25.175000 MHz (frame packing)
  Colorimetry Data Block:
    xvYCC601
    xvYCC709
    Gamut Boundary Description Metadata Profile P0
  Video Capability Data Block:
    YCbCr quantization: Selectable (via AVI YQ)
    RGB quantization: Selectable (via AVI Q)
    PT scan behavior: Supports both over- and underscan
    IT scan behavior: Always Underscanned
    CE scan behavior: Supports both over- and underscan
  Detailed Timing Descriptors:
    DTD 3:  1920x1080   50.000000 Hz  16:9     56.250 kHz    148.500000 MHz (700 mm x 390 mm)
                 Hfront  528 Hsync  44 Hback  148 Hpol P
                 Vfront    4 Vsync   5 Vback   36 Vpol N
    DTD 4:  1280x768    59.870228 Hz   5:3     47.776 kHz     79.500000 MHz (700 mm x 390 mm)
                 Hfront   64 Hsync 128 Hback  192 Hpol N
                 Vfront    3 Vsync   7 Vback   20 Vpol P
    DTD 5:   720x576i   50.000000 Hz   5:4     15.625 kHz     13.500000 MHz (700 mm x 390 mm)
                 Hfront   12 Hsync  63 Hback   69 Hpol N
                 Vfront    3 Vsync   3 Vback   18 Vpol N Vfront +0.5 Odd Field
                 Vfront    3 Vsync   3 Vback   18 Vpol N Vback  +0.5 Even Field
Checksum: 0x5c  Unused space in Extension Block: 18 bytes

----------------

Warnings:

Block 0, Base EDID:
  Vendor & Product Identification: The serial number is one of the known dummy values, it should probably be set to 0.
Block 1, CTA-861 Extension Block:
  IT Video Formats are overscanned by default, but normally this should be underscanned.
  Video Data Block: VIC 1 and the first DTD are not identical. Is this intended?
  Colorimetry Data Block: Set the sRGB colorimetry bit to avoid interop issues.
  Detailed Timing Descriptor #3: DTD is similar but not identical to VIC 31.
  Detailed Timing Descriptor #4: Image size is 700x390 mm, but based on the picture AR it should be 650x390 mm.
  Detailed Timing Descriptor #5: Image size is 700x390 mm, but based on the picture AR it should be 487x390 mm.
EDID:
  Base EDID: Some timings are out of range of the Monitor Ranges:
    Vertical Freq: 24.000 - 75.062 Hz (Monitor: 50.000 - 70.000 Hz)
    Maximum Clock: 297.000 MHz (Monitor: 170.000 MHz)

Failures:

Block 1, CTA-861 Extension Block:
  Vendor-Specific Data Block (HDMI), OUI 00-0C-03: HDMI VIC Codes must have their CTA-861 VIC equivalents in the VSB.
  Video Capability Data Block: IT video formats are always underscanned, but bit 7 of Byte 3 of the CTA-861 Extension header is set to overscanned.
EDID:
  Extension Block 2 started with EDID header, ignoring Extension Blocks >= 2.

EDID conformity: FAIL
