edid-decode (hex):

00 ff ff ff ff ff ff 00 4c 2d 5e 0e 50 31 53 30
17 1d 01 04 b5 78 22 78 2a cf f5 ae 4f 45 a8 26
0e 50 54 bf ef 80 71 4f 81 c0 81 00 81 80 95 00
a9 c0 b3 00 01 01 f4 b0 00 a0 a0 38 4d 40 30 20
3a 00 ac 50 41 00 00 1a 00 00 00 fd 00 38 90 1e
aa 2e 00 0a 20 20 20 20 20 20 00 00 00 fc 00 43
34 39 48 47 39 78 0a 20 20 20 20 20 00 00 00 ff
00 48 54 4a 4d 36 30 30 32 35 30 0a 20 20 01 ba

02 03 13 f1 46 90 04 03 5a 3f 40 23 09 07 07 83
01 00 00 02 3a 80 18 71 38 2d 40 58 2c 45 00 ac
50 41 00 00 1e 01 1d 00 72 51 d0 1e 20 6e 28 55
00 ac 50 41 00 00 1e 8c 0a d0 8a 20 e0 2d 10 10
3e 96 00 ac 50 41 00 00 18 50 78 00 a0 a0 38 35
40 30 20 3a 00 ac 50 41 00 00 1a cd 91 00 a0 a0
38 40 40 30 20 3a 00 ac 50 41 00 00 1a 00 00 00
00 00 00 00 00 00 00 00 00 00 00 00 00 00 00 0d

00 ff ff ff ff ff ff 00 4c 2d 5e 0e 50 31 53 30
17 1d 01 04 b5 78 22 78 2a cf f5 ae 4f 45 a8 26
0e 50 54 bf ef 80 71 4f 81 c0 81 00 81 80 95 00
a9 c0 b3 00 01 01 f4 b0 00 a0 a0 38 4d 40 30 20
3a 00 ac 50 41 00 00 1a 00 00 00 fd 00 38 90 1e
aa 2e 00 0a 20 20 20 20 20 20 00 00 00 fc 00 43
34 39 48 47 39 78 0a 20 20 20 20 20 00 00 00 ff
00 48 54 4a 4d 36 30 30 32 35 30 0a 20 20 01 ba

02 03 13 f1 46 90 04 03 5a 3f 40 23 09 07 07 83
01 00 00 02 3a 80 18 71 38 2d 40 58 2c 45 00 ac
50 41 00 00 1e 01 1d 00 72 51 d0 1e 20 6e 28 55
00 ac 50 41 00 00 1e 8c 0a d0 8a 20 e0 2d 10 10
3e 96 00 ac 50 41 00 00 18 50 78 00 a0 a0 38 35
40 30 20 3a 00 ac 50 41 00 00 1a cd 91 00 a0 a0
38 40 40 30 20 3a 00 ac 50 41 00 00 1a 00 00 00
00 00 00 00 00 00 00 00 00 00 00 00 00 00 00 0d

----------------

Block 0, Base EDID:
  EDID Structure Version & Revision: 1.4
  Vendor & Product Identification:
    Manufacturer: SAM
    Model: 3678
    Serial Number: ...
    Made in: week 23 of 2019
  Basic Display Parameters & Features:
    Digital display
    Bits per primary color channel: 10
    DisplayPort interface
    Maximum image size: 120 cm x 34 cm
    Gamma: 2.20
    DPMS levels: Off
    Supported color formats: RGB 4:4:4, YCrCb 4:4:4
    First detailed timing includes the native pixel format and preferred refresh rate
  Color Characteristics:
    Red  : 0.6826, 0.3085
    Green: 0.2724, 0.6591
    Blue : 0.1513, 0.0576
    White: 0.3134, 0.3291
  Established Timings I & II:
    IBM     :   720x400    70.081663 Hz   9:5     31.467 kHz     28.320000 MHz
    DMT 0x04:   640x480    59.940476 Hz   4:3     31.469 kHz     25.175000 MHz
    Apple   :   640x480    66.666667 Hz   4:3     35.000 kHz     30.240000 MHz
    DMT 0x05:   640x480    72.808802 Hz   4:3     37.861 kHz     31.500000 MHz
    DMT 0x06:   640x480    75.000000 Hz   4:3     37.500 kHz     31.500000 MHz
    DMT 0x08:   800x600    56.250000 Hz   4:3     35.156 kHz     36.000000 MHz
    DMT 0x09:   800x600    60.316541 Hz   4:3     37.879 kHz     40.000000 MHz
    DMT 0x0a:   800x600    72.187572 Hz   4:3     48.077 kHz     50.000000 MHz
    DMT 0x0b:   800x600    75.000000 Hz   4:3     46.875 kHz     49.500000 MHz
    Apple   :   832x624    74.551266 Hz   4:3     49.726 kHz     57.284000 MHz
    DMT 0x10:  1024x768    60.003840 Hz   4:3     48.363 kHz     65.000000 MHz
    DMT 0x11:  1024x768    70.069359 Hz   4:3     56.476 kHz     75.000000 MHz
    DMT 0x12:  1024x768    75.028582 Hz   4:3     60.023 kHz     78.750000 MHz
    DMT 0x24:  1280x1024   75.024675 Hz   5:4     79.976 kHz    135.000000 MHz
    Apple   :  1152x870    75.061550 Hz 192:145   68.681 kHz    100.000000 MHz
  Standard Timings:
    DMT 0x15:  1152x864    75.000000 Hz   4:3     67.500 kHz    108.000000 MHz
    DMT 0x55:  1280x720    60.000000 Hz  16:9     45.000 kHz     74.250000 MHz
    DMT 0x1c:  1280x800    59.810326 Hz  16:10    49.702 kHz     83.500000 MHz
    DMT 0x23:  1280x1024   60.019740 Hz   5:4     63.981 kHz    108.000000 MHz
    DMT 0x2f:  1440x900    59.887445 Hz  16:10    55.935 kHz    106.500000 MHz
    DMT 0x53:  1600x900    60.000000 Hz  16:9     60.000 kHz    108.000000 MHz (RB)
    DMT 0x3a:  1680x1050   59.954250 Hz  16:10    65.290 kHz    146.250000 MHz
  Detailed Timing Descriptors:
    DTD  1:  2560x1080  143.944786 Hz  64:27   166.544 kHz    453.000000 MHz (1196 mm x 336 mm)
                  Hfront   48 Hsync  32 Hback   80 Hpol P
                  Vfront    3 Vsync  10 Vback   64 Vpol N
    Display Range Limits:
      Monitor ranges (GTF): 56-144 Hz V, 30-170 kHz H, max dotclock 460 MHz
    Display Product Name: 'C49HG9x'
    Display Product Serial Number: ...
  Extension blocks: 1
Checksum: 0xba

----------------

Block 1, CTA-861 Extension Block:
  Revision: 3
  Underscans IT Video Formats by default
  Basic audio support
  Supports YCbCr 4:4:4
  Supports YCbCr 4:2:2
  Native detailed modes: 1
  Video Data Block:
    VIC  16:  1920x1080   60.000000 Hz  16:9     67.500 kHz    148.500000 MHz (native)
    VIC   4:  1280x720    60.000000 Hz  16:9     45.000 kHz     74.250000 MHz
    VIC   3:   720x480    59.940060 Hz  16:9     31.469 kHz     27.000000 MHz
    VIC  90:  2560x1080   60.000000 Hz  64:27    66.000 kHz    198.000000 MHz
    VIC  63:  1920x1080  120.000000 Hz  16:9    135.000 kHz    297.000000 MHz
    VIC  64:  1920x1080  100.000000 Hz  16:9    112.500 kHz    297.000000 MHz
  Audio Data Block:
    Linear PCM:
      Max channels: 2
      Supported sample rates (kHz): 48 44.1 32
      Supported sample sizes (bits): 24 20 16
  Speaker Allocation Data Block:
    FL/FR - Front Left/Right
  Detailed Timing Descriptors:
    DTD  2:  1920x1080   60.000000 Hz  16:9     67.500 kHz    148.500000 MHz (1196 mm x 336 mm)
                  Hfront   88 Hsync  44 Hback  148 Hpol P
                  Vfront    4 Vsync   5 Vback   36 Vpol P
    DTD  3:  1280x720    60.000000 Hz  16:9     45.000 kHz     74.250000 MHz (1196 mm x 336 mm)
                  Hfront  110 Hsync  40 Hback  220 Hpol P
                  Vfront    5 Vsync   5 Vback   20 Vpol P
    DTD  4:   720x480    59.940060 Hz   3:2     31.469 kHz     27.000000 MHz (1196 mm x 336 mm)
                  Hfront   16 Hsync  62 Hback   60 Hpol N
                  Vfront    9 Vsync   6 Vback   30 Vpol N
    DTD  5:  2560x1080   99.942890 Hz  64:27   113.235 kHz    308.000000 MHz (1196 mm x 336 mm)
                  Hfront   48 Hsync  32 Hback   80 Hpol P
                  Vfront    3 Vsync  10 Vback   40 Vpol N
    DTD  6:  2560x1080  119.951280 Hz  64:27   137.224 kHz    373.250000 MHz (1196 mm x 336 mm)
                  Hfront   48 Hsync  32 Hback   80 Hpol P
                  Vfront    3 Vsync  10 Vback   51 Vpol N
Checksum: 0x0d  Unused space in Extension Block: 18 bytes

----------------

Block 2, Unknown EDID Extension Block 0x00:
  00 ff ff ff ff ff ff 00 4c 2d 5e 0e 50 31 53 30 '........L-^.P1S0'
  17 1d 01 04 b5 78 22 78 2a cf f5 ae 4f 45 a8 26 '.....x"x*...OE.&'
  0e 50 54 bf ef 80 71 4f 81 c0 81 00 81 80 95 00 '.PT...qO........'
  a9 c0 b3 00 01 01 f4 b0 00 a0 a0 38 4d 40 30 20 '...........8M@0 '
  3a 00 ac 50 41 00 00 1a 00 00 00 fd 00 38 90 1e ':..PA........8..'
  aa 2e 00 0a 20 20 20 20 20 20 00 00 00 fc 00 43 '....      .....C'
  34 39 48 47 39 78 0a 20 20 20 20 20 00 00 00 ff '49HG9x.     ....'
  00 48 54 4a 4d 36 30 30 32 35 30 0a 20 20 01 ba '.HTJM600250.  ..'
Checksum: 0xba

----------------

Block 3, CTA-861 Extension Block:
  Revision: 3
  Underscans IT Video Formats by default
  Basic audio support
  Supports YCbCr 4:4:4
  Supports YCbCr 4:2:2
  Native detailed modes: 1
  Video Data Block:
    VIC  16:  1920x1080   60.000000 Hz  16:9     67.500 kHz    148.500000 MHz (native)
    VIC   4:  1280x720    60.000000 Hz  16:9     45.000 kHz     74.250000 MHz
    VIC   3:   720x480    59.940060 Hz  16:9     31.469 kHz     27.000000 MHz
    VIC  90:  2560x1080   60.000000 Hz  64:27    66.000 kHz    198.000000 MHz
    VIC  63:  1920x1080  120.000000 Hz  16:9    135.000 kHz    297.000000 MHz
    VIC  64:  1920x1080  100.000000 Hz  16:9    112.500 kHz    297.000000 MHz
  Audio Data Block:
    Linear PCM:
      Max channels: 2
      Supported sample rates (kHz): 48 44.1 32
      Supported sample sizes (bits): 24 20 16
  Speaker Allocation Data Block:
    FL/FR - Front Left/Right
  Detailed Timing Descriptors:
    DTD  7:  1920x1080   60.000000 Hz  16:9     67.500 kHz    148.500000 MHz (1196 mm x 336 mm)
                  Hfront   88 Hsync  44 Hback  148 Hpol P
                  Vfront    4 Vsync   5 Vback   36 Vpol P
    DTD  8:  1280x720    60.000000 Hz  16:9     45.000 kHz     74.250000 MHz (1196 mm x 336 mm)
                  Hfront  110 Hsync  40 Hback  220 Hpol P
                  Vfront    5 Vsync   5 Vback   20 Vpol P
    DTD  9:   720x480    59.940060 Hz   3:2     31.469 kHz     27.000000 MHz (1196 mm x 336 mm)
                  Hfront   16 Hsync  62 Hback   60 Hpol N
                  Vfront    9 Vsync   6 Vback   30 Vpol N
    DTD 10:  2560x1080   99.942890 Hz  64:27   113.235 kHz    308.000000 MHz (1196 mm x 336 mm)
                  Hfront   48 Hsync  32 Hback   80 Hpol P
                  Vfront    3 Vsync  10 Vback   40 Vpol N
    DTD 11:  2560x1080  119.951280 Hz  64:27   137.224 kHz    373.250000 MHz (1196 mm x 336 mm)
                  Hfront   48 Hsync  32 Hback   80 Hpol P
                  Vfront    3 Vsync  10 Vback   51 Vpol N
Checksum: 0x0d  Unused space in Extension Block: 18 bytes

----------------

Warnings:

Block 0, Base EDID:
  Detailed Timing Descriptor #1: Image size is 1196x336 mm, but based on the picture AR it should be 1196x504 mm.
  Display Range Limits: GTF support is deprecated in EDID 1.4.
Block 1, CTA-861 Extension Block:
  Video Data Block: VIC 16 and the first DTD are not identical. Is this intended?
  Detailed Timing Descriptor #2: Image size is 1196x336 mm, but based on the picture AR it should be 1196x672 mm.
  Detailed Timing Descriptor #3: Image size is 1196x336 mm, but based on the picture AR it should be 1196x672 mm.
  Detailed Timing Descriptor #4: Image size is 1196x336 mm, but based on the picture AR it should be 1196x797 mm.
  Detailed Timing Descriptor #5: Image size is 1196x336 mm, but based on the picture AR it should be 1196x504 mm.
  Detailed Timing Descriptor #6: Image size is 1196x336 mm, but based on the picture AR it should be 1196x504 mm.
  Display Product Serial Number is set, so the Serial Number in the Base EDID should be 0.
  Add a Colorimetry Data Block with the sRGB colorimetry bit set to avoid interop issues.
Block 3, CTA-861 Extension Block:
  Detailed Timing Descriptor #7: Image size is 1196x336 mm, but based on the picture AR it should be 1196x672 mm.
  Detailed Timing Descriptor #8: Image size is 1196x336 mm, but based on the picture AR it should be 1196x672 mm.
  Detailed Timing Descriptor #9: Image size is 1196x336 mm, but based on the picture AR it should be 1196x797 mm.
  Detailed Timing Descriptor #10: Image size is 1196x336 mm, but based on the picture AR it should be 1196x504 mm.
  Detailed Timing Descriptor #11: Image size is 1196x336 mm, but based on the picture AR it should be 1196x504 mm.

Failures:

Block 0, Base EDID:
  Display Range Limits: GTF is supported, but the display does not support continuous frequencies.
Block 1, CTA-861 Extension Block:
  Missing VCDB, needed for Set Selectable RGB Quantization to avoid interop issues.
Block 2, Base EDID:
  Unknown Extension Block.
Block 3, CTA-861 Extension Block:
  Video Data Block: Duplicate VIC 16.
  Video Data Block: Duplicate VIC 4.
  Video Data Block: Duplicate VIC 3.
  Video Data Block: Duplicate VIC 90.
  Video Data Block: Duplicate VIC 63.
  Video Data Block: Duplicate VIC 64.
  Speaker Allocation Data Block: Only one instance of this Data Block is allowed.
EDID:
  Base EDID: EDID specified 1 extension block(s), but found 3 extension block(s).
  CTA-861: Native progressive timings are a mix of several resolutions.

EDID conformity: FAIL
