edid-decode (hex):

00 ff ff ff ff ff ff 00 09 e5 44 07 00 00 00 00
01 1b 01 04 95 1a 0e 78 0a 7d 70 9e 5b 57 9e 27
19 50 54 00 00 00 01 01 01 01 01 01 01 01 01 01
01 01 01 01 01 01 bc 1b 56 84 50 00 16 30 30 20
36 00 00 90 10 00 00 1a 9a 16 56 a0 50 00 16 30
30 20 36 00 00 90 10 00 00 1a 00 00 00 fe 00 44
44 39 4e 43 80 4e 56 31 31 36 34 33 00 00 00 00
00 00 41 01 94 01 10 00 00 09 01 0a 20 20 00 ed

----------------

Block 0, Base EDID:
  EDID Structure Version & Revision: 1.4
  Vendor & Product Identification:
    Manufacturer: BOE
    Model: 1860
    Made in: week 1 of 2017
  Basic Display Parameters & Features:
    Digital display
    Bits per primary color channel: 6
    DisplayPort interface
    Maximum image size: 26 cm x 14 cm
    Gamma: 2.20
    Supported color formats: RGB 4:4:4, YCrCb 4:4:4
    First detailed timing includes the native pixel format and preferred refresh rate
  Color Characteristics:
    Red  : 0.6181, 0.3583
    Green: 0.3427, 0.6181
    Blue : 0.1533, 0.1005
    White: 0.3125, 0.3281
  Established Timings I & II: none
  Standard Timings: none
  Detailed Timing Descriptors:
    DTD 1:  1366x768    59.995606 Hz 683:384   47.397 kHz     71.000000 MHz (256 mm x 144 mm)
                 Hfront   48 Hsync  32 Hback   52 Hpol P
                 Vfront    3 Vsync   6 Vback   13 Vpol N
    DTD 2:  1366x768    47.995089 Hz 683:384   37.916 kHz     57.860000 MHz (256 mm x 144 mm)
                 Hfront   48 Hsync  32 Hback   80 Hpol P
                 Vfront    3 Vsync   6 Vback   13 Vpol N
    Alphanumeric Data String: 'DD9NC.NV11643'
    Manufacturer-Specified Display Descriptor (0x00): 00 00 00 00 41 01 94 01 10 00 00 09 01 0a 20 20 '....A.........  '
Checksum: 0xed

----------------

Warnings:

Block 0, Base EDID:
  Alphanumeric Data String: Non-ASCII character 0x80 at position 5, can cause problems.
  Missing Display Product Name.

EDID conformity: PASS
