edid-decode (hex):

00 ff ff ff ff ff ff 00 06 af 2c 31 00 00 00 00
00 14 01 04 90 1d 10 78 02 15 85 97 58 53 8a 26
25 50 54 00 00 00 01 01 01 01 01 01 01 01 01 01
01 01 01 01 01 01 4a 1d 56 c4 50 00 20 30 30 20
36 00 25 a4 10 00 00 1a 87 13 56 c4 50 00 20 30
30 20 36 00 25 a4 10 00 00 1a 00 00 00 fe 00 4b
4b 37 33 36 80 42 31 33 33 58 57 33 00 00 00 00
00 00 41 21 96 01 11 00 00 01 01 0a 20 20 00 13

----------------

Block 0, Base EDID:
  EDID Structure Version & Revision: 1.4
  Vendor & Product Identification:
    Manufacturer: AUO
    Model: 12588
    Made in: 2010
  Basic Display Parameters & Features:
    Digital display
    Bits per primary color channel: 6
    Digital interface is not defined
    Maximum image size: 29 cm x 16 cm
    Gamma: 2.20
    Supported color formats: RGB 4:4:4
    First detailed timing includes the native pixel format and preferred refresh rate
  Color Characteristics:
    Red  : 0.5898, 0.3447
    Green: 0.3251, 0.5400
    Blue : 0.1503, 0.1445
    White: 0.3134, 0.3291
  Established Timings I & II: none
  Standard Timings: none
  Detailed Timing Descriptors:
    DTD 1:  1366x768    60.003201 Hz 683:384   48.003 kHz     74.980000 MHz (293 mm x 164 mm)
                 Hfront   48 Hsync  32 Hback  116 Hpol P
                 Vfront    3 Vsync   6 Vback   23 Vpol N
    DTD 2:  1366x768    40.004802 Hz 683:384   32.004 kHz     49.990000 MHz (293 mm x 164 mm)
                 Hfront   48 Hsync  32 Hback  116 Hpol P
                 Vfront    3 Vsync   6 Vback   23 Vpol N
    Alphanumeric Data String: 'KK736.B133XW3'
    Manufacturer-Specified Display Descriptor (0x00): 00 00 00 00 41 21 96 01 11 00 00 01 01 0a 20 20 '....A!........  '
Checksum: 0x13

----------------

Warnings:

Block 0, Base EDID:
  Alphanumeric Data String: Non-ASCII character 0x80 at position 5, can cause problems.
  Missing Display Product Name.

EDID conformity: PASS
