edid-decode (hex):

00 ff ff ff ff ff ff 00 06 b3 4b 16 01 01 01 01
16 20 01 04 a5 22 13 78 3a 6e 85 93 58 58 92 28
1e 50 54 21 08 00 81 80 81 40 81 c0 95 00 b3 00
81 00 a9 40 01 01 02 3a 80 18 71 38 2d 40 58 2c
45 00 58 c2 10 00 00 1e 00 00 00 fd 00 32 4c 1e
53 11 01 0a 20 20 20 20 20 20 00 00 00 fc 00 4d
42 31 36 41 0a 20 20 20 20 20 20 20 00 00 00 ff
00 4e 35 4c 4d 51 53 31 39 30 38 34 31 0a 00 af

00 ff ff ff ff ff ff 00 06 b3 4b 16 01 01 01 01
16 20 01 04 a5 22 13 78 3a 6e 85 93 58 58 92 28
1e 50 54 21 08 00 81 80 81 40 81 c0 95 00 b3 00
81 00 a9 40 01 01 02 3a 80 18 71 38 2d 40 58 2c
45 00 58 c2 10 00 00 1e 00 00 00 fd 00 32 4c 1e
53 11 01 0a 20 20 20 20 20 20 00 00 00 fc 00 4d
42 31 36 41 0a 20 20 20 20 20 20 20 00 00 00 ff
00 4e 35 4c 4d 51 53 31 39 30 38 34 31 0a 00 af

----------------

Block 0, Base EDID:
  EDID Structure Version & Revision: 1.4
  Vendor & Product Identification:
    Manufacturer: AUS
    Model: 5707
    Serial Number: ...
    Made in: week 22 of 2022
  Basic Display Parameters & Features:
    Digital display
    Bits per primary color channel: 8
    DisplayPort interface
    Maximum image size: 34 cm x 19 cm
    Gamma: 2.20
    DPMS levels: Off
    Supported color formats: RGB 4:4:4, YCrCb 4:4:4, YCrCb 4:2:2
    First detailed timing includes the native pixel format and preferred refresh rate
  Color Characteristics:
    Red  : 0.5751, 0.3457
    Green: 0.3466, 0.5722
    Blue : 0.1582, 0.1171
    White: 0.3134, 0.3291
  Established Timings I & II:
    DMT 0x04:   640x480    59.940476 Hz   4:3     31.469 kHz     25.175000 MHz
    DMT 0x09:   800x600    60.316541 Hz   4:3     37.879 kHz     40.000000 MHz
    DMT 0x10:  1024x768    60.003840 Hz   4:3     48.363 kHz     65.000000 MHz
  Standard Timings:
    DMT 0x23:  1280x1024   60.019740 Hz   5:4     63.981 kHz    108.000000 MHz
    DMT 0x20:  1280x960    60.000000 Hz   4:3     60.000 kHz    108.000000 MHz
    DMT 0x55:  1280x720    60.000000 Hz  16:9     45.000 kHz     74.250000 MHz
    DMT 0x2f:  1440x900    59.887445 Hz  16:10    55.935 kHz    106.500000 MHz
    DMT 0x3a:  1680x1050   59.954250 Hz  16:10    65.290 kHz    146.250000 MHz
    DMT 0x1c:  1280x800    59.810326 Hz  16:10    49.702 kHz     83.500000 MHz
    DMT 0x33:  1600x1200   60.000000 Hz   4:3     75.000 kHz    162.000000 MHz
  Detailed Timing Descriptors:
    DTD 1:  1920x1080   60.000000 Hz  16:9     67.500 kHz    148.500000 MHz (344 mm x 194 mm)
                 Hfront   88 Hsync  44 Hback  148 Hpol P
                 Vfront    4 Vsync   5 Vback   36 Vpol P
    Display Range Limits:
      Monitor ranges (Range Limits Only): 50-76 Hz V, 30-83 kHz H, max dotclock 170 MHz
    Display Product Name: 'MB16A'
    Display Product Serial Number: ...
Checksum: 0xaf

----------------

Block 1, Unknown EDID Extension Block 0x00:
  00 ff ff ff ff ff ff 00 06 b3 4b 16 01 01 01 01 '..........K.....'
  16 20 01 04 a5 22 13 78 3a 6e 85 93 58 58 92 28 '. ...".x:n..XX.('
  1e 50 54 21 08 00 81 80 81 40 81 c0 95 00 b3 00 '.PT!.....@......'
  81 00 a9 40 01 01 02 3a 80 18 71 38 2d 40 58 2c '...@...:..q8-@X,'
  45 00 58 c2 10 00 00 1e 00 00 00 fd 00 32 4c 1e 'E.X..........2L.'
  53 11 01 0a 20 20 20 20 20 20 00 00 00 fc 00 4d 'S...      .....M'
  42 31 36 41 0a 20 20 20 20 20 20 20 00 00 00 ff 'B16A.       ....'
  00 4e 35 4c 4d 51 53 31 39 30 38 34 31 0a 00 af '.N5LMQS190841...'
Checksum: 0xaf

----------------

Warnings:

Block 0, Base EDID:
  Vendor & Product Identification: The serial number is one of the known dummy values, it should probably be set to 0.

Failures:

Block 1, Base EDID:
  Unknown Extension Block.
EDID:
  Base EDID: EDID specified 0 extension block(s), but found 1 extension block(s).

EDID conformity: FAIL
