edid-decode (hex):

00 ff ff ff ff ff ff 00 06 af 8a 71 00 00 00 00
2d 1d 01 04 a5 22 13 78 02 8c 55 a4 55 4c a0 27
0c 50 54 00 00 00 01 01 01 01 01 01 01 01 01 01
01 01 01 01 01 01 78 37 80 b4 70 38 2e 40 6c 30
aa 00 58 c2 10 00 00 1a 60 2c 80 b4 70 38 2e 40
6c 30 aa 00 58 c2 10 00 00 1a 00 00 00 fe 00 38
35 33 36 48 80 42 31 35 36 48 41 4e 00 00 00 00
00 02 41 02 9e 00 11 00 00 0a 01 0a 20 20 00 89

----------------

Block 0, Base EDID:
  EDID Structure Version & Revision: 1.4
  Vendor & Product Identification:
    Manufacturer: AUO
    Model: 29066
    Made in: week 45 of 2019
  Basic Display Parameters & Features:
    Digital display
    Bits per primary color channel: 8
    DisplayPort interface
    Maximum image size: 34 cm x 19 cm
    Gamma: 2.20
    Supported color formats: RGB 4:4:4
    First detailed timing includes the native pixel format and preferred refresh rate
  Color Characteristics:
    Red  : 0.6425, 0.3320
    Green: 0.2998, 0.6250
    Blue : 0.1533, 0.0478
    White: 0.3134, 0.3291
  Established Timings I & II: none
  Standard Timings: none
  Detailed Timing Descriptors:
    DTD 1:  1920x1080   60.052440 Hz  16:9     67.619 kHz    142.000000 MHz (344 mm x 194 mm)
                 Hfront  108 Hsync  48 Hback   24 Hpol P
                 Vfront   10 Vsync  10 Vback   26 Vpol N
    DTD 2:  1920x1080   48.041952 Hz  16:9     54.095 kHz    113.600000 MHz (344 mm x 194 mm)
                 Hfront  108 Hsync  48 Hback   24 Hpol P
                 Vfront   10 Vsync  10 Vback   26 Vpol N
    Alphanumeric Data String: '8536H.B156HAN'
    Manufacturer-Specified Display Descriptor (0x00): 00 00 00 02 41 02 9e 00 11 00 00 0a 01 0a 20 20 '....A.........  '
Checksum: 0x89

----------------

Warnings:

Block 0, Base EDID:
  Alphanumeric Data String: Non-ASCII character 0x80 at position 5, can cause problems.
  Missing Display Product Name.

EDID conformity: PASS
