edid-decode (hex):

00 ff ff ff ff ff ff 00 1e 6d 8d 5b d1 e2 06 00
09 1f 01 03 80 3d 24 78 ea 43 95 aa 54 4e 9e 26
0f 50 54 25 4b 00 31 7c 45 7c 61 7c 81 80 81 bc
95 3c 01 01 01 01 02 3a 80 18 71 38 2d 40 58 2c
45 00 13 2a 21 00 00 1e 00 00 00 fd 00 30 78 1e
ff 22 00 0a 20 20 20 20 20 20 00 00 00 fc 00 32
37 47 4e 37 0a 20 20 20 20 20 20 20 00 00 00 ff
00 31 30 39 4e 54 54 51 44 39 32 38 31 0a 01 07

02 03 1c f1 23 09 07 07 49 01 02 03 04 11 12 13
1f 90 83 01 00 00 65 03 0c 00 10 00 86 6f 80 a0
70 38 40 40 30 20 35 00 31 2a 21 00 00 1e 80 48
80 18 71 38 2d 40 58 2c 45 00 13 2a 21 00 00 1e
00 00 00 00 00 00 00 00 00 00 00 00 00 00 00 00
00 00 00 00 00 00 00 00 00 00 00 00 00 00 00 00
00 00 00 00 00 00 00 00 00 00 00 00 00 00 00 00
00 00 00 00 00 00 00 00 00 00 00 00 00 00 00 5d

00 ff ff ff ff ff ff 00 1e 6d 8d 5b d1 e2 06 00
09 1f 01 03 80 3d 24 78 ea 43 95 aa 54 4e 9e 26
0f 50 54 25 4b 00 31 7c 45 7c 61 7c 81 80 81 bc
95 3c 01 01 01 01 02 3a 80 18 71 38 2d 40 58 2c
45 00 13 2a 21 00 00 1e 00 00 00 fd 00 30 78 1e
ff 22 00 0a 20 20 20 20 20 20 00 00 00 fc 00 32
37 47 4e 37 0a 20 20 20 20 20 20 20 00 00 00 ff
00 31 30 39 4e 54 54 51 44 39 32 38 31 0a 01 07

02 03 1c f1 23 09 07 07 49 01 02 03 04 11 12 13
1f 90 83 01 00 00 65 03 0c 00 10 00 86 6f 80 a0
70 38 40 40 30 20 35 00 31 2a 21 00 00 1e 80 48
80 18 71 38 2d 40 58 2c 45 00 13 2a 21 00 00 1e
00 00 00 00 00 00 00 00 00 00 00 00 00 00 00 00
00 00 00 00 00 00 00 00 00 00 00 00 00 00 00 00
00 00 00 00 00 00 00 00 00 00 00 00 00 00 00 00
00 00 00 00 00 00 00 00 00 00 00 00 00 00 00 5d

----------------

Block 0, Base EDID:
  EDID Structure Version & Revision: 1.3
  Vendor & Product Identification:
    Manufacturer: GSM
    Model: 23437
    Serial Number: ...
    Made in: week 9 of 2021
  Basic Display Parameters & Features:
    Digital display
    Maximum image size: 61 cm x 36 cm
    Gamma: 2.20
    DPMS levels: Standby Suspend Off
    RGB color display
    First detailed timing is the preferred timing
  Color Characteristics:
    Red  : 0.6650, 0.3281
    Green: 0.3046, 0.6201
    Blue : 0.1503, 0.0595
    White: 0.3134, 0.3291
  Established Timings I & II:
    DMT 0x04:   640x480    59.940476 Hz   4:3     31.469 kHz     25.175000 MHz
    DMT 0x06:   640x480    75.000000 Hz   4:3     37.500 kHz     31.500000 MHz
    DMT 0x09:   800x600    60.316541 Hz   4:3     37.879 kHz     40.000000 MHz
    DMT 0x0b:   800x600    75.000000 Hz   4:3     46.875 kHz     49.500000 MHz
    DMT 0x10:  1024x768    60.003840 Hz   4:3     48.363 kHz     65.000000 MHz
    DMT 0x12:  1024x768    75.028582 Hz   4:3     60.023 kHz     78.750000 MHz
    DMT 0x24:  1280x1024   75.024675 Hz   5:4     79.976 kHz    135.000000 MHz
  Standard Timings:
    GTF     :   640x480   119.999084 Hz   4:3     61.800 kHz     52.406000 MHz
    GTF     :   800x600   119.999886 Hz   4:3     77.160 kHz     83.950000 MHz
    GTF     :  1024x768   119.999931 Hz   4:3     98.760 kHz    139.054000 MHz
    DMT 0x23:  1280x1024   60.019740 Hz   5:4     63.981 kHz    108.000000 MHz
    GTF     :  1280x1024  120.000185 Hz   5:4    131.640 kHz    233.793000 MHz
    GTF     :  1440x900   119.999896 Hz  16:10   115.800 kHz    229.747000 MHz
  Detailed Timing Descriptors:
    DTD 1:  1920x1080   60.000000 Hz  16:9     67.500 kHz    148.500000 MHz (531 mm x 298 mm)
                 Hfront   88 Hsync  44 Hback  148 Hpol P
                 Vfront    4 Vsync   5 Vback   36 Vpol P
    Display Range Limits:
      Monitor ranges (GTF): 48-120 Hz V, 30-255 kHz H, max dotclock 340 MHz
    Display Product Name: '27GN7'
    Display Product Serial Number: ...
  Extension blocks: 1
Checksum: 0x07

----------------

Block 1, CTA-861 Extension Block:
  Revision: 3
  Underscans IT Video Formats by default
  Basic audio support
  Supports YCbCr 4:4:4
  Supports YCbCr 4:2:2
  Native detailed modes: 1
  Audio Data Block:
    Linear PCM:
      Max channels: 2
      Supported sample rates (kHz): 48 44.1 32
      Supported sample sizes (bits): 24 20 16
  Video Data Block:
    VIC   1:   640x480    59.940476 Hz   4:3     31.469 kHz     25.175000 MHz
    VIC   2:   720x480    59.940060 Hz   4:3     31.469 kHz     27.000000 MHz
    VIC   3:   720x480    59.940060 Hz  16:9     31.469 kHz     27.000000 MHz
    VIC   4:  1280x720    60.000000 Hz  16:9     45.000 kHz     74.250000 MHz
    VIC  17:   720x576    50.000000 Hz   4:3     31.250 kHz     27.000000 MHz
    VIC  18:   720x576    50.000000 Hz  16:9     31.250 kHz     27.000000 MHz
    VIC  19:  1280x720    50.000000 Hz  16:9     37.500 kHz     74.250000 MHz
    VIC  31:  1920x1080   50.000000 Hz  16:9     56.250 kHz    148.500000 MHz
    VIC  16:  1920x1080   60.000000 Hz  16:9     67.500 kHz    148.500000 MHz (native)
  Speaker Allocation Data Block:
    FL/FR - Front Left/Right
  Vendor-Specific Data Block (HDMI), OUI 00-0C-03:
    Source physical address: 1.0.0.0
  Detailed Timing Descriptors:
    DTD 2:  1920x1080  119.982181 Hz  16:9    137.260 kHz    285.500000 MHz (561 mm x 298 mm)
                 Hfront   48 Hsync  32 Hback   80 Hpol P
                 Vfront    3 Vsync   5 Vback   56 Vpol P
    DTD 3:  1920x1080   74.989899 Hz  16:9     84.364 kHz    185.600000 MHz (531 mm x 298 mm)
                 Hfront   88 Hsync  44 Hback  148 Hpol P
                 Vfront    4 Vsync   5 Vback   36 Vpol P
Checksum: 0x5d  Unused space in Extension Block: 63 bytes

----------------

Block 2, Unknown EDID Extension Block 0x00:
  00 ff ff ff ff ff ff 00 1e 6d 8d 5b d1 e2 06 00 '.........m.[....'
  09 1f 01 03 80 3d 24 78 ea 43 95 aa 54 4e 9e 26 '.....=$x.C..TN.&'
  0f 50 54 25 4b 00 31 7c 45 7c 61 7c 81 80 81 bc '.PT%K.1|E|a|....'
  95 3c 01 01 01 01 02 3a 80 18 71 38 2d 40 58 2c '.<.....:..q8-@X,'
  45 00 13 2a 21 00 00 1e 00 00 00 fd 00 30 78 1e 'E..*!........0x.'
  ff 22 00 0a 20 20 20 20 20 20 00 00 00 fc 00 32 '."..      .....2'
  37 47 4e 37 0a 20 20 20 20 20 20 20 00 00 00 ff '7GN7.       ....'
  00 31 30 39 4e 54 54 51 44 39 32 38 31 0a 01 07 '.109NTTQD9281...'
Checksum: 0x07

----------------

Block 3, CTA-861 Extension Block:
  Revision: 3
  Underscans IT Video Formats by default
  Basic audio support
  Supports YCbCr 4:4:4
  Supports YCbCr 4:2:2
  Native detailed modes: 1
  Audio Data Block:
    Linear PCM:
      Max channels: 2
      Supported sample rates (kHz): 48 44.1 32
      Supported sample sizes (bits): 24 20 16
  Video Data Block:
    VIC   1:   640x480    59.940476 Hz   4:3     31.469 kHz     25.175000 MHz
    VIC   2:   720x480    59.940060 Hz   4:3     31.469 kHz     27.000000 MHz
    VIC   3:   720x480    59.940060 Hz  16:9     31.469 kHz     27.000000 MHz
    VIC   4:  1280x720    60.000000 Hz  16:9     45.000 kHz     74.250000 MHz
    VIC  17:   720x576    50.000000 Hz   4:3     31.250 kHz     27.000000 MHz
    VIC  18:   720x576    50.000000 Hz  16:9     31.250 kHz     27.000000 MHz
    VIC  19:  1280x720    50.000000 Hz  16:9     37.500 kHz     74.250000 MHz
    VIC  31:  1920x1080   50.000000 Hz  16:9     56.250 kHz    148.500000 MHz
    VIC  16:  1920x1080   60.000000 Hz  16:9     67.500 kHz    148.500000 MHz (native)
  Speaker Allocation Data Block:
    FL/FR - Front Left/Right
  Vendor-Specific Data Block (HDMI), OUI 00-0C-03:
    Source physical address: 1.0.0.0
  Detailed Timing Descriptors:
    DTD 4:  1920x1080  119.982181 Hz  16:9    137.260 kHz    285.500000 MHz (561 mm x 298 mm)
                 Hfront   48 Hsync  32 Hback   80 Hpol P
                 Vfront    3 Vsync   5 Vback   56 Vpol P
    DTD 5:  1920x1080   74.989899 Hz  16:9     84.364 kHz    185.600000 MHz (531 mm x 298 mm)
                 Hfront   88 Hsync  44 Hback  148 Hpol P
                 Vfront    4 Vsync   5 Vback   36 Vpol P
Checksum: 0x5d  Unused space in Extension Block: 63 bytes

----------------

Warnings:

Block 1, CTA-861 Extension Block:
  Video Data Block: VIC 1 and the first DTD are not identical. Is this intended?
  Detailed Timing Descriptor #2: Image size is 561x298 mm, but based on the picture AR it should be 561x315 mm.
  Display Product Serial Number is set, so the Serial Number in the Base EDID should be 0.
  Add a Colorimetry Data Block with the sRGB colorimetry bit set to avoid interop issues.
Block 3, CTA-861 Extension Block:
  Detailed Timing Descriptor #4: Image size is 561x298 mm, but based on the picture AR it should be 561x315 mm.
EDID:
  CTA-861: Multiple native progressive timings are defined.

Failures:

Block 0, Base EDID:
  Detailed Timing Descriptor #1: Mismatch of image size 531x298 mm vs display size 610x360 mm.
Block 1, CTA-861 Extension Block:
  Detailed Timing Descriptor #2: Mismatch of image size 561x298 mm vs display size 610x360 mm.
  Detailed Timing Descriptor #3: Mismatch of image size 531x298 mm vs display size 610x360 mm.
  Missing VCDB, needed for Set Selectable RGB Quantization to avoid interop issues.
Block 2, Base EDID:
  Unknown Extension Block.
Block 3, CTA-861 Extension Block:
  Video Data Block: Duplicate VIC 1.
  Video Data Block: Duplicate VIC 2.
  Video Data Block: Duplicate VIC 3.
  Video Data Block: Duplicate VIC 4.
  Video Data Block: Duplicate VIC 17.
  Video Data Block: Duplicate VIC 18.
  Video Data Block: Duplicate VIC 19.
  Video Data Block: Duplicate VIC 31.
  Video Data Block: Duplicate VIC 16.
  Speaker Allocation Data Block: Only one instance of this Data Block is allowed.
  Detailed Timing Descriptor #4: Mismatch of image size 561x298 mm vs display size 610x360 mm.
  Detailed Timing Descriptor #5: Mismatch of image size 531x298 mm vs display size 610x360 mm.
EDID:
  Base EDID: EDID specified 1 extension block(s), but found 3 extension block(s).
  Base EDID: EDID 1.3 requires a Block Map Extension in Block 1 if there are more than 2 blocks in the EDID.

EDID conformity: FAIL
