edid-decode (hex):

00 ff ff ff ff ff ff 00 1e 55 48 44 01 00 00 00
01 15 01 03 78 52 2e 78 ef d4 6c a3 57 49 9c 25
19 48 4b 27 cf 80 95 00 81 40 81 80 81 8f 90 40
a9 40 01 01 01 01 1b 21 50 a0 51 00 1e 30 d0 88
65 04 a0 5a 00 00 00 1c 0e 1f 00 80 51 00 1e 30
c0 80 47 04 a0 5a 00 00 00 1c 00 00 00 fd 00 39
4c 41 44 11 00 0a 20 20 20 20 20 20 00 00 00 fc
00 47 52 55 4e 44 49 47 20 57 58 47 41 0a 00 25

00 ff ff ff ff ff ff 00 1e 55 48 44 01 00 00 00
01 15 01 03 78 52 2e 78 ef d4 6c a3 57 49 9c 25
19 48 4b 27 cf 80 95 00 81 40 81 80 81 8f 90 40
a9 40 01 01 01 01 1b 21 50 a0 51 00 1e 30 d0 88
65 04 a0 5a 00 00 00 1c 0e 1f 00 80 51 00 1e 30
c0 80 47 04 a0 5a 00 00 00 1c 00 00 00 fd 00 39
4c 41 44 11 00 0a 20 20 20 20 20 20 00 00 00 fc
00 47 52 55 4e 44 49 47 20 57 58 47 41 0a 00 25

----------------

Block 0, Base EDID:
  EDID Structure Version & Revision: 1.3
  Vendor & Product Identification:
    Manufacturer: GRU
    Model: 17480
    Serial Number: ...
    Made in: week 1 of 2011
  Basic Display Parameters & Features:
    Analog display
    Signal Level Standard: 0.700 : 0.000 : 0.700 V p-p
    Blank-to-black setup/pedestal
    Sync: Separate
    Maximum image size: 82 cm x 46 cm
    Gamma: 2.20
    DPMS levels: Standby Suspend Off
    RGB color display
    Default (sRGB) color space is primary color space
    First detailed timing is the preferred timing
    Supports GTF timings within operating range
  Color Characteristics:
    Red  : 0.6396, 0.3408
    Green: 0.2861, 0.6093
    Blue : 0.1455, 0.0996
    White: 0.2841, 0.2929
  Established Timings I & II:
    DMT 0x04:   640x480    59.940476 Hz   4:3     31.469 kHz     25.175000 MHz
    DMT 0x06:   640x480    75.000000 Hz   4:3     37.500 kHz     31.500000 MHz
    DMT 0x08:   800x600    56.250000 Hz   4:3     35.156 kHz     36.000000 MHz
    DMT 0x09:   800x600    60.316541 Hz   4:3     37.879 kHz     40.000000 MHz
    DMT 0x0a:   800x600    72.187572 Hz   4:3     48.077 kHz     50.000000 MHz
    DMT 0x0b:   800x600    75.000000 Hz   4:3     46.875 kHz     49.500000 MHz
    DMT 0x10:  1024x768    60.003840 Hz   4:3     48.363 kHz     65.000000 MHz
    DMT 0x11:  1024x768    70.069359 Hz   4:3     56.476 kHz     75.000000 MHz
    DMT 0x12:  1024x768    75.028582 Hz   4:3     60.023 kHz     78.750000 MHz
    DMT 0x24:  1280x1024   75.024675 Hz   5:4     79.976 kHz    135.000000 MHz
    Apple   :  1152x870    75.061550 Hz 192:145   68.681 kHz    100.000000 MHz
  Standard Timings:
    DMT 0x2f:  1440x900    59.887445 Hz  16:10    55.935 kHz    106.500000 MHz
    DMT 0x20:  1280x960    60.000000 Hz   4:3     60.000 kHz    108.000000 MHz
    DMT 0x23:  1280x1024   60.019740 Hz   5:4     63.981 kHz    108.000000 MHz
    DMT 0x24:  1280x1024   75.024675 Hz   5:4     79.976 kHz    135.000000 MHz
    DMT 0x2a:  1400x1050   59.978442 Hz   4:3     65.317 kHz    121.750000 MHz
    DMT 0x33:  1600x1200   60.000000 Hz   4:3     75.000 kHz    162.000000 MHz
  Detailed Timing Descriptors:
    DTD 1:  1360x768    59.798991 Hz  85:48    47.720 kHz     84.750000 MHz (160 mm x 90 mm)
                 Hfront  208 Hsync 136 Hback   72 Hpol N
                 Vfront   22 Vsync   5 Vback    3 Vpol P
    DTD 2:  1280x768    59.870228 Hz   5:3     47.776 kHz     79.500000 MHz (160 mm x 90 mm)
                 Hfront  192 Hsync 128 Hback   64 Hpol N
                 Vfront   20 Vsync   7 Vback    3 Vpol P
    Display Range Limits:
      Monitor ranges (GTF): 57-76 Hz V, 65-68 kHz H, max dotclock 170 MHz
    Display Product Name: 'GRUNDIG WXGA'
Checksum: 0x25

----------------

Warnings:

Block 0, Base EDID:
  Vendor & Product Identification: The serial number is one of the known dummy values, it should probably be set to 0.
  Detailed Timing Descriptor #1: Dubious image size (160x90 mm is smaller than 100x100 mm).
  Detailed Timing Descriptor #2: DTD is similar but not identical to DMT 0x17.
  Detailed Timing Descriptor #2: Dubious image size (160x90 mm is smaller than 100x100 mm).
EDID:
  Base EDID: Some timings are out of range of the Monitor Ranges:
    Vertical Freq: 56.250 - 75.062 Hz (Monitor: 57.000 - 76.000 Hz)
    Horizontal Freq: 31.468 - 79.976 kHz (Monitor: 65.000 - 68.000 kHz)

Failures:

Block 0, Base EDID:
  Basic Display Parameters & Features: sRGB is signaled, but the chromaticities do not match.
  Detailed Timing Descriptor #1: Mismatch of image size 160x90 mm vs display size 820x460 mm.
  Detailed Timing Descriptor #2: Mismatch of image size 160x90 mm vs display size 820x460 mm.
EDID:
  Extension Block 1 started with EDID header, ignoring Extension Blocks >= 1.

EDID conformity: FAIL
