edid-decode (hex):

00 ff ff ff ff ff ff 00 09 d1 6f 7f 01 01 01 01
14 1e 01 03 80 3c 22 78 2e 58 35 a6 55 53 9f 28
0e 50 54 a5 6b 80 d1 c0 81 c0 81 00 81 80 a9 c0
b3 00 81 bc 61 7c 02 3a 80 18 71 38 2d 40 58 2c
45 00 56 50 21 00 00 1e 00 00 00 ff 00 45 42 54
35 4c 30 32 32 39 32 53 4c 30 00 00 00 fd 00 28
90 1e a7 23 00 0a 20 20 20 20 20 20 00 00 00 fc
00 5a 4f 57 49 45 20 58 4c 20 4c 43 44 0a 01 9e

02 03 36 f1 52 90 05 04 03 02 01 11 12 13 14 06
07 15 16 1f 20 21 22 23 09 07 07 83 01 00 00 65
03 0c 00 20 00 67 d8 5d c4 01 78 c0 00 68 1a 00
00 01 01 28 90 00 9f 6f 00 f4 51 00 5c 40 6c 8e
37 00 56 50 21 00 00 1c 86 6f 80 a0 70 38 40 40
30 20 35 00 56 50 21 00 00 1a 5a 87 80 a0 70 38
4d 40 30 20 35 00 56 50 21 00 00 1a fe 5b 80 a0
70 38 35 40 30 20 35 00 56 50 21 00 00 1a 00 7a

00 ff ff ff ff ff ff 00 09 d1 6f 7f 01 01 01 01
14 1e 01 03 80 3c 22 78 2e 58 35 a6 55 53 9f 28
0e 50 54 a5 6b 80 d1 c0 81 c0 81 00 81 80 a9 c0
b3 00 81 bc 61 7c 02 3a 80 18 71 38 2d 40 58 2c
45 00 56 50 21 00 00 1e 00 00 00 ff 00 45 42 54
35 4c 30 32 32 39 32 53 4c 30 00 00 00 fd 00 28
90 1e a7 23 00 0a 20 20 20 20 20 20 00 00 00 fc
00 5a 4f 57 49 45 20 58 4c 20 4c 43 44 0a 01 9e

02 03 36 f1 52 90 05 04 03 02 01 11 12 13 14 06
07 15 16 1f 20 21 22 23 09 07 07 83 01 00 00 65
03 0c 00 20 00 67 d8 5d c4 01 78 c0 00 68 1a 00
00 01 01 28 90 00 9f 6f 00 f4 51 00 5c 40 6c 8e
37 00 56 50 21 00 00 1c 86 6f 80 a0 70 38 40 40
30 20 35 00 56 50 21 00 00 1a 5a 87 80 a0 70 38
4d 40 30 20 35 00 56 50 21 00 00 1a fe 5b 80 a0
70 38 35 40 30 20 35 00 56 50 21 00 00 1a 00 7a

----------------

Block 0, Base EDID:
  EDID Structure Version & Revision: 1.3
  Vendor & Product Identification:
    Manufacturer: BNQ
    Model: 32623
    Serial Number: ...
    Made in: week 20 of 2020
  Basic Display Parameters & Features:
    Digital display
    Maximum image size: 60 cm x 34 cm
    Gamma: 2.20
    DPMS levels: Off
    RGB color display
    Default (sRGB) color space is primary color space
    First detailed timing is the preferred timing
  Color Characteristics:
    Red  : 0.6494, 0.3330
    Green: 0.3261, 0.6210
    Blue : 0.1562, 0.0576
    White: 0.3134, 0.3291
  Established Timings I & II:
    IBM     :   720x400    70.081663 Hz   9:5     31.467 kHz     28.320000 MHz
    DMT 0x04:   640x480    59.940476 Hz   4:3     31.469 kHz     25.175000 MHz
    DMT 0x06:   640x480    75.000000 Hz   4:3     37.500 kHz     31.500000 MHz
    DMT 0x09:   800x600    60.316541 Hz   4:3     37.879 kHz     40.000000 MHz
    DMT 0x0b:   800x600    75.000000 Hz   4:3     46.875 kHz     49.500000 MHz
    Apple   :   832x624    74.551266 Hz   4:3     49.726 kHz     57.284000 MHz
    DMT 0x10:  1024x768    60.003840 Hz   4:3     48.363 kHz     65.000000 MHz
    DMT 0x12:  1024x768    75.028582 Hz   4:3     60.023 kHz     78.750000 MHz
    DMT 0x24:  1280x1024   75.024675 Hz   5:4     79.976 kHz    135.000000 MHz
    Apple   :  1152x870    75.061550 Hz 192:145   68.681 kHz    100.000000 MHz
  Standard Timings:
    DMT 0x52:  1920x1080   60.000000 Hz  16:9     67.500 kHz    148.500000 MHz
    DMT 0x55:  1280x720    60.000000 Hz  16:9     45.000 kHz     74.250000 MHz
    DMT 0x1c:  1280x800    59.810326 Hz  16:10    49.702 kHz     83.500000 MHz
    DMT 0x23:  1280x1024   60.019740 Hz   5:4     63.981 kHz    108.000000 MHz
    DMT 0x53:  1600x900    60.000000 Hz  16:9     60.000 kHz    108.000000 MHz (RB)
    DMT 0x3a:  1680x1050   59.954250 Hz  16:10    65.290 kHz    146.250000 MHz
    GTF     :  1280x1024  120.000185 Hz   5:4    131.640 kHz    233.793000 MHz
    GTF     :  1024x768   119.999931 Hz   4:3     98.760 kHz    139.054000 MHz
  Detailed Timing Descriptors:
    DTD 1:  1920x1080   60.000000 Hz  16:9     67.500 kHz    148.500000 MHz (598 mm x 336 mm)
                 Hfront   88 Hsync  44 Hback  148 Hpol P
                 Vfront    4 Vsync   5 Vback   36 Vpol P
    Display Product Serial Number: ...
    Display Range Limits:
      Monitor ranges (GTF): 40-144 Hz V, 30-167 kHz H, max dotclock 350 MHz
    Display Product Name: 'ZOWIE XL LCD'
  Extension blocks: 1
Checksum: 0x9e

----------------

Block 1, CTA-861 Extension Block:
  Revision: 3
  Underscans IT Video Formats by default
  Basic audio support
  Supports YCbCr 4:4:4
  Supports YCbCr 4:2:2
  Native DTDs: 1
  Video Data Block:
    VIC  16:  1920x1080   60.000000 Hz  16:9     67.500 kHz    148.500000 MHz (native)
    VIC   5:  1920x1080i  60.000000 Hz  16:9     33.750 kHz     74.250000 MHz
    VIC   4:  1280x720    60.000000 Hz  16:9     45.000 kHz     74.250000 MHz
    VIC   3:   720x480    59.940060 Hz  16:9     31.469 kHz     27.000000 MHz
    VIC   2:   720x480    59.940060 Hz   4:3     31.469 kHz     27.000000 MHz
    VIC   1:   640x480    59.940476 Hz   4:3     31.469 kHz     25.175000 MHz
    VIC  17:   720x576    50.000000 Hz   4:3     31.250 kHz     27.000000 MHz
    VIC  18:   720x576    50.000000 Hz  16:9     31.250 kHz     27.000000 MHz
    VIC  19:  1280x720    50.000000 Hz  16:9     37.500 kHz     74.250000 MHz
    VIC  20:  1920x1080i  50.000000 Hz  16:9     28.125 kHz     74.250000 MHz
    VIC   6:  1440x480i   59.940060 Hz   4:3     15.734 kHz     27.000000 MHz
    VIC   7:  1440x480i   59.940060 Hz  16:9     15.734 kHz     27.000000 MHz
    VIC  21:  1440x576i   50.000000 Hz   4:3     15.625 kHz     27.000000 MHz
    VIC  22:  1440x576i   50.000000 Hz  16:9     15.625 kHz     27.000000 MHz
    VIC  31:  1920x1080   50.000000 Hz  16:9     56.250 kHz    148.500000 MHz
    VIC  32:  1920x1080   24.000000 Hz  16:9     27.000 kHz     74.250000 MHz
    VIC  33:  1920x1080   25.000000 Hz  16:9     28.125 kHz     74.250000 MHz
    VIC  34:  1920x1080   30.000000 Hz  16:9     33.750 kHz     74.250000 MHz
  Audio Data Block:
    Linear PCM:
      Max channels: 2
      Supported sample rates (kHz): 48 44.1 32
      Supported sample sizes (bits): 24 20 16
  Speaker Allocation Data Block:
    FL/FR - Front Left/Right
  Vendor-Specific Data Block (HDMI), OUI 00-0C-03:
    Source physical address: 2.0.0.0
  Vendor-Specific Data Block (HDMI Forum), OUI C4-5D-D8:
    Version: 1
    Maximum TMDS Character Rate: 600 MHz
    SCDC Present
    SCDC Read Request Capable
  Vendor-Specific Data Block (AMD), OUI 00-00-1A:
    Version: 1
    Feature Caps: 0x01
    Minimum Refresh Rate: 40 Hz
    Maximum Refresh Rate: 144 Hz
    Flags 1.x: 0x00
  Detailed Timing Descriptors:
    DTD 2:  1280x1024  143.847408 Hz   5:4    160.534 kHz    285.750000 MHz (598 mm x 336 mm)
                 Hfront  108 Hsync 142 Hback  250 Hpol N
                 Vfront    3 Vsync   7 Vback   82 Vpol P
    DTD 3:  1920x1080  119.982181 Hz  16:9    137.260 kHz    285.500000 MHz (598 mm x 336 mm)
                 Hfront   48 Hsync  32 Hback   80 Hpol P
                 Vfront    3 Vsync   5 Vback   56 Vpol N
    DTD 4:  1920x1080  143.981451 Hz  16:9    166.587 kHz    346.500000 MHz (598 mm x 336 mm)
                 Hfront   48 Hsync  32 Hback   80 Hpol P
                 Vfront    3 Vsync   5 Vback   69 Vpol N
    DTD 5:  1920x1080   99.930409 Hz  16:9    113.221 kHz    235.500000 MHz (598 mm x 336 mm)
                 Hfront   48 Hsync  32 Hback   80 Hpol P
                 Vfront    3 Vsync   5 Vback   45 Vpol N
Checksum: 0x7a  Unused space in Extension Block: 1 byte

----------------

Warnings:

Block 0, Base EDID:
  Vendor & Product Identification: The serial number is one of the known dummy values, it should probably be set to 0.
Block 1, CTA-861 Extension Block:
  Detailed Timing Descriptor #2: Image size is 598x336 mm, but based on the picture AR it should be 420x336 mm.
  Display Product Serial Number is set, so the Serial Number in the Base EDID should be 0.
EDID:
  Base EDID: Some timings are out of range of the Monitor Ranges:
    Vertical Freq: 24.000 - 143.981 Hz (Monitor: 40.000 - 144.000 Hz)
    Horizontal Freq: 15.625 - 166.586 kHz (Monitor: 30.000 - 167.000 kHz)

Failures:

Block 0, Base EDID:
  Basic Display Parameters & Features: sRGB is signaled, but the chromaticities do not match.
Block 1, CTA-861 Extension Block:
  Missing VCDB, needed for Set Selectable RGB Quantization to avoid interop issues.
EDID:
  Extension Block 2 started with EDID header, ignoring Extension Blocks >= 2.

EDID conformity: FAIL
