edid-decode (hex):

00 ff ff ff ff ff ff 00 59 3a 33 10 01 01 01 01
01 1e 01 03 80 8e 50 78 2a 62 6d ad 4f 48 aa 25
0c 47 4a a5 ce 00 d1 c0 01 00 01 01 01 01 01 01
01 01 01 01 01 01 04 74 00 30 f2 70 5a 80 b0 58
8a 00 48 68 42 00 00 1e 02 3a 80 18 71 38 2d 40
58 2c 45 00 48 68 42 00 00 1e 00 00 00 fc 00 56
37 35 35 2d 48 34 0a 20 20 20 20 20 00 00 00 fd
00 17 4c 0f 8c 26 00 0a 20 20 20 20 20 20 01 fe

02 03 6a f0 58 61 60 5d 5e 5f 01 1f 10 14 05 13
04 20 22 3c 3e 12 16 03 07 11 15 02 06 2f 09 7f
07 15 07 50 3d 06 c0 57 07 00 5f 7e 01 83 0f 00
00 6d 03 0c 00 30 00 38 3c 20 00 60 01 02 03 67
d8 5d c4 01 78 88 03 e2 00 f9 eb 01 46 d0 00 48
8f 32 9a 3e 27 b5 e5 01 8b 84 90 01 e3 05 e3 01
e5 0f 03 00 00 00 e3 06 0d 01 01 1d 80 18 71 1c
16 20 58 2c 25 00 40 84 63 00 00 9e 00 00 00 2c

00 ff ff ff ff ff ff 00 59 3a 33 10 01 01 01 01
01 1e 01 03 80 8e 50 78 2a 62 6d ad 4f 48 aa 25
0c 47 4a a5 ce 00 d1 c0 01 00 01 01 01 01 01 01
01 01 01 01 01 01 04 74 00 30 f2 70 5a 80 b0 58
8a 00 48 68 42 00 00 1e 02 3a 80 18 71 38 2d 40
58 2c 45 00 48 68 42 00 00 1e 00 00 00 fc 00 56
37 35 35 2d 48 34 0a 20 20 20 20 20 00 00 00 fd
00 17 4c 0f 8c 26 00 0a 20 20 20 20 20 20 01 fe

02 03 6a f0 58 61 60 5d 5e 5f 01 1f 10 14 05 13
04 20 22 3c 3e 12 16 03 07 11 15 02 06 2f 09 7f
07 15 07 50 3d 06 c0 57 07 00 5f 7e 01 83 0f 00
00 6d 03 0c 00 30 00 38 3c 20 00 60 01 02 03 67
d8 5d c4 01 78 88 03 e2 00 f9 eb 01 46 d0 00 48
8f 32 9a 3e 27 b5 e5 01 8b 84 90 01 e3 05 e3 01
e5 0f 03 00 00 00 e3 06 0d 01 01 1d 80 18 71 1c
16 20 58 2c 25 00 40 84 63 00 00 9e 00 00 00 2c

----------------

Block 0, Base EDID:
  EDID Structure Version & Revision: 1.3
  Vendor & Product Identification:
    Manufacturer: VIZ
    Model: 4147
    Serial Number: ...
    Made in: week 1 of 2020
  Basic Display Parameters & Features:
    Digital display
    Maximum image size: 142 cm x 80 cm
    Gamma: 2.20
    DPMS levels: Off
    RGB color display
    First detailed timing is the preferred timing
  Color Characteristics:
    Red  : 0.6767, 0.3105
    Green: 0.2812, 0.6660
    Blue : 0.1455, 0.0488
    White: 0.2802, 0.2900
  Established Timings I & II:
    IBM     :   720x400    70.081663 Hz   9:5     31.467 kHz     28.320000 MHz
    DMT 0x04:   640x480    59.940476 Hz   4:3     31.469 kHz     25.175000 MHz
    DMT 0x06:   640x480    75.000000 Hz   4:3     37.500 kHz     31.500000 MHz
    DMT 0x09:   800x600    60.316541 Hz   4:3     37.879 kHz     40.000000 MHz
    DMT 0x0a:   800x600    72.187572 Hz   4:3     48.077 kHz     50.000000 MHz
    DMT 0x0b:   800x600    75.000000 Hz   4:3     46.875 kHz     49.500000 MHz
    DMT 0x10:  1024x768    60.003840 Hz   4:3     48.363 kHz     65.000000 MHz
    DMT 0x11:  1024x768    70.069359 Hz   4:3     56.476 kHz     75.000000 MHz
    DMT 0x12:  1024x768    75.028582 Hz   4:3     60.023 kHz     78.750000 MHz
  Standard Timings:
    DMT 0x52:  1920x1080   60.000000 Hz  16:9     67.500 kHz    148.500000 MHz
  Detailed Timing Descriptors:
    DTD 1:  3840x2160   30.000000 Hz  16:9     67.500 kHz    297.000000 MHz (1096 mm x 616 mm)
                 Hfront  176 Hsync  88 Hback  296 Hpol P
                 Vfront    8 Vsync  10 Vback   72 Vpol P
    DTD 2:  1920x1080   60.000000 Hz  16:9     67.500 kHz    148.500000 MHz (1096 mm x 616 mm)
                 Hfront   88 Hsync  44 Hback  148 Hpol P
                 Vfront    4 Vsync   5 Vback   36 Vpol P
    Display Product Name: 'V755-H4'
    Display Range Limits:
      Monitor ranges (GTF): 23-76 Hz V, 15-140 kHz H, max dotclock 380 MHz
  Extension blocks: 1
Checksum: 0xfe

----------------

Block 1, CTA-861 Extension Block:
  Revision: 3
  Underscans IT Video Formats by default
  Basic audio support
  Supports YCbCr 4:4:4
  Supports YCbCr 4:2:2
  Native detailed modes: 0
  Video Data Block:
    VIC  97:  3840x2160   60.000000 Hz  16:9    135.000 kHz    594.000000 MHz
    VIC  96:  3840x2160   50.000000 Hz  16:9    112.500 kHz    594.000000 MHz
    VIC  93:  3840x2160   24.000000 Hz  16:9     54.000 kHz    297.000000 MHz
    VIC  94:  3840x2160   25.000000 Hz  16:9     56.250 kHz    297.000000 MHz
    VIC  95:  3840x2160   30.000000 Hz  16:9     67.500 kHz    297.000000 MHz
    VIC   1:   640x480    59.940476 Hz   4:3     31.469 kHz     25.175000 MHz
    VIC  31:  1920x1080   50.000000 Hz  16:9     56.250 kHz    148.500000 MHz
    VIC  16:  1920x1080   60.000000 Hz  16:9     67.500 kHz    148.500000 MHz
    VIC  20:  1920x1080i  50.000000 Hz  16:9     28.125 kHz     74.250000 MHz
    VIC   5:  1920x1080i  60.000000 Hz  16:9     33.750 kHz     74.250000 MHz
    VIC  19:  1280x720    50.000000 Hz  16:9     37.500 kHz     74.250000 MHz
    VIC   4:  1280x720    60.000000 Hz  16:9     45.000 kHz     74.250000 MHz
    VIC  32:  1920x1080   24.000000 Hz  16:9     27.000 kHz     74.250000 MHz
    VIC  34:  1920x1080   30.000000 Hz  16:9     33.750 kHz     74.250000 MHz
    VIC  60:  1280x720    24.000000 Hz  16:9     18.000 kHz     59.400000 MHz
    VIC  62:  1280x720    30.000000 Hz  16:9     22.500 kHz     74.250000 MHz
    VIC  18:   720x576    50.000000 Hz  16:9     31.250 kHz     27.000000 MHz
    VIC  22:  1440x576i   50.000000 Hz  16:9     15.625 kHz     27.000000 MHz
    VIC   3:   720x480    59.940060 Hz  16:9     31.469 kHz     27.000000 MHz
    VIC   7:  1440x480i   59.940060 Hz  16:9     15.734 kHz     27.000000 MHz
    VIC  17:   720x576    50.000000 Hz   4:3     31.250 kHz     27.000000 MHz
    VIC  21:  1440x576i   50.000000 Hz   4:3     15.625 kHz     27.000000 MHz
    VIC   2:   720x480    59.940060 Hz   4:3     31.469 kHz     27.000000 MHz
    VIC   6:  1440x480i   59.940060 Hz   4:3     15.734 kHz     27.000000 MHz
  Audio Data Block:
    Linear PCM:
      Max channels: 2
      Supported sample rates (kHz): 192 176.4 96 88.2 48 44.1 32
      Supported sample sizes (bits): 24 20 16
    AC-3:
      Max channels: 6
      Supported sample rates (kHz): 48 44.1 32
      Maximum bit rate: 640 kb/s
    DTS:
      Max channels: 6
      Supported sample rates (kHz): 48 44.1
      Maximum bit rate: 1536 kb/s
    Enhanced AC-3 (DD+):
      Max channels: 8
      Supported sample rates (kHz): 48 44.1 32
    DTS-HD:
      Max channels: 8
      Supported sample rates (kHz): 192 176.4 96 88.2 48 44.1
      Audio Format Code dependent value: 0x01
  Speaker Allocation Data Block:
    FL/FR - Front Left/Right
    LFE1 - Low Frequency Effects 1
    FC - Front Center
    LS/RS - Left/Right Surround
  Vendor-Specific Data Block (HDMI), OUI 00-0C-03:
    Source physical address: 3.0.0.0
    DC_36bit
    DC_30bit
    DC_Y444
    Maximum TMDS clock: 300 MHz
    Extended HDMI video details:
      HDMI VICs:
        HDMI VIC 1:  3840x2160   30.000000 Hz  16:9     67.500 kHz    297.000000 MHz
        HDMI VIC 2:  3840x2160   25.000000 Hz  16:9     56.250 kHz    297.000000 MHz
        HDMI VIC 3:  3840x2160   24.000000 Hz  16:9     54.000 kHz    297.000000 MHz
  Vendor-Specific Data Block (HDMI Forum), OUI C4-5D-D8:
    Version: 1
    Maximum TMDS Character Rate: 600 MHz
    SCDC Present
    Supports scrambling for <= 340 Mcsc
    Supports 12-bits/component Deep Color 4:2:0 Pixel Encoding
    Supports 10-bits/component Deep Color 4:2:0 Pixel Encoding
  Video Capability Data Block:
    YCbCr quantization: Selectable (via AVI YQ)
    RGB quantization: Selectable (via AVI Q)
    PT scan behavior: Supports both over- and underscan
    IT scan behavior: Always Underscanned
    CE scan behavior: Always Overscanned
  Vendor-Specific Video Data Block (Dolby), OUI 00-D0-46:
    Version: 2 (12 bytes)
    Supports global dimming
    DM Version: 4.x
    Backlt Min Luma: 100 cd/m^2
    Interface: Standard + Low-Latency
    Supports 10b 12b 444: Not supported
    Target Min PQ v2: 340 (0.20116887 cd/m^2)
    Target Max PQ v2: 2445 (237 cd/m^2)
    Unique Rx, Ry: 0.64062500, 0.33593750
    Unique Gx, Gy: 0.30078125, 0.62109375
    Unique Bx, By: 0.15234375, 0.05078125
  Vendor-Specific Video Data Block (HDR10+), OUI 90-84-8B:
    Application Version: 1
    Full Frame Peak Luminance Index: 0
    Peak Luminance Index: 0
  Colorimetry Data Block:
    xvYCC601
    xvYCC709
    BT2020cYCC
    BT2020YCC
    BT2020RGB
    Gamut Boundary Description Metadata Profile P0
  YCbCr 4:2:0 Capability Map Data Block:
    VIC  97:  3840x2160   60.000000 Hz  16:9    135.000 kHz    594.000000 MHz
    VIC  96:  3840x2160   50.000000 Hz  16:9    112.500 kHz    594.000000 MHz
  HDR Static Metadata Data Block:
    Electro optical transfer functions:
      Traditional gamma - SDR luminance range
      SMPTE ST2084
      Hybrid Log-Gamma
    Supported static metadata descriptors:
      Static metadata type 1
  Detailed Timing Descriptors:
    DTD 3:  1920x1080i  60.000000 Hz  16:9     33.750 kHz     74.250000 MHz (1600 mm x 900 mm)
                 Hfront   88 Hsync  44 Hback  148 Hpol P
                 Vfront    2 Vsync   5 Vback   15 Vpol P Vfront +0.5 Odd Field
                 Vfront    2 Vsync   5 Vback   15 Vpol P Vback  +0.5 Even Field
Checksum: 0x2c  Unused space in Extension Block: 3 bytes

----------------

Block 2, Unknown EDID Extension Block 0x00:
  00 ff ff ff ff ff ff 00 59 3a 33 10 01 01 01 01 '........Y:3.....'
  01 1e 01 03 80 8e 50 78 2a 62 6d ad 4f 48 aa 25 '......Px*bm.OH.%'
  0c 47 4a a5 ce 00 d1 c0 01 00 01 01 01 01 01 01 '.GJ.............'
  01 01 01 01 01 01 04 74 00 30 f2 70 5a 80 b0 58 '.......t.0.pZ..X'
  8a 00 48 68 42 00 00 1e 02 3a 80 18 71 38 2d 40 '..HhB....:..q8-@'
  58 2c 45 00 48 68 42 00 00 1e 00 00 00 fc 00 56 'X,E.HhB........V'
  37 35 35 2d 48 34 0a 20 20 20 20 20 00 00 00 fd '755-H4.     ....'
  00 17 4c 0f 8c 26 00 0a 20 20 20 20 20 20 01 fe '..L..&..      ..'
Checksum: 0xfe

----------------

Block 3, CTA-861 Extension Block:
  Revision: 3
  Underscans IT Video Formats by default
  Basic audio support
  Supports YCbCr 4:4:4
  Supports YCbCr 4:2:2
  Native detailed modes: 0
  Video Data Block:
    VIC  97:  3840x2160   60.000000 Hz  16:9    135.000 kHz    594.000000 MHz
    VIC  96:  3840x2160   50.000000 Hz  16:9    112.500 kHz    594.000000 MHz
    VIC  93:  3840x2160   24.000000 Hz  16:9     54.000 kHz    297.000000 MHz
    VIC  94:  3840x2160   25.000000 Hz  16:9     56.250 kHz    297.000000 MHz
    VIC  95:  3840x2160   30.000000 Hz  16:9     67.500 kHz    297.000000 MHz
    VIC   1:   640x480    59.940476 Hz   4:3     31.469 kHz     25.175000 MHz
    VIC  31:  1920x1080   50.000000 Hz  16:9     56.250 kHz    148.500000 MHz
    VIC  16:  1920x1080   60.000000 Hz  16:9     67.500 kHz    148.500000 MHz
    VIC  20:  1920x1080i  50.000000 Hz  16:9     28.125 kHz     74.250000 MHz
    VIC   5:  1920x1080i  60.000000 Hz  16:9     33.750 kHz     74.250000 MHz
    VIC  19:  1280x720    50.000000 Hz  16:9     37.500 kHz     74.250000 MHz
    VIC   4:  1280x720    60.000000 Hz  16:9     45.000 kHz     74.250000 MHz
    VIC  32:  1920x1080   24.000000 Hz  16:9     27.000 kHz     74.250000 MHz
    VIC  34:  1920x1080   30.000000 Hz  16:9     33.750 kHz     74.250000 MHz
    VIC  60:  1280x720    24.000000 Hz  16:9     18.000 kHz     59.400000 MHz
    VIC  62:  1280x720    30.000000 Hz  16:9     22.500 kHz     74.250000 MHz
    VIC  18:   720x576    50.000000 Hz  16:9     31.250 kHz     27.000000 MHz
    VIC  22:  1440x576i   50.000000 Hz  16:9     15.625 kHz     27.000000 MHz
    VIC   3:   720x480    59.940060 Hz  16:9     31.469 kHz     27.000000 MHz
    VIC   7:  1440x480i   59.940060 Hz  16:9     15.734 kHz     27.000000 MHz
    VIC  17:   720x576    50.000000 Hz   4:3     31.250 kHz     27.000000 MHz
    VIC  21:  1440x576i   50.000000 Hz   4:3     15.625 kHz     27.000000 MHz
    VIC   2:   720x480    59.940060 Hz   4:3     31.469 kHz     27.000000 MHz
    VIC   6:  1440x480i   59.940060 Hz   4:3     15.734 kHz     27.000000 MHz
  Audio Data Block:
    Linear PCM:
      Max channels: 2
      Supported sample rates (kHz): 192 176.4 96 88.2 48 44.1 32
      Supported sample sizes (bits): 24 20 16
    AC-3:
      Max channels: 6
      Supported sample rates (kHz): 48 44.1 32
      Maximum bit rate: 640 kb/s
    DTS:
      Max channels: 6
      Supported sample rates (kHz): 48 44.1
      Maximum bit rate: 1536 kb/s
    Enhanced AC-3 (DD+):
      Max channels: 8
      Supported sample rates (kHz): 48 44.1 32
    DTS-HD:
      Max channels: 8
      Supported sample rates (kHz): 192 176.4 96 88.2 48 44.1
      Audio Format Code dependent value: 0x01
  Speaker Allocation Data Block:
    FL/FR - Front Left/Right
    LFE1 - Low Frequency Effects 1
    FC - Front Center
    LS/RS - Left/Right Surround
  Vendor-Specific Data Block (HDMI), OUI 00-0C-03:
    Source physical address: 3.0.0.0
    DC_36bit
    DC_30bit
    DC_Y444
    Maximum TMDS clock: 300 MHz
    Extended HDMI video details:
      HDMI VICs:
        HDMI VIC 1:  3840x2160   30.000000 Hz  16:9     67.500 kHz    297.000000 MHz
        HDMI VIC 2:  3840x2160   25.000000 Hz  16:9     56.250 kHz    297.000000 MHz
        HDMI VIC 3:  3840x2160   24.000000 Hz  16:9     54.000 kHz    297.000000 MHz
  Vendor-Specific Data Block (HDMI Forum), OUI C4-5D-D8:
    Version: 1
    Maximum TMDS Character Rate: 600 MHz
    SCDC Present
    Supports scrambling for <= 340 Mcsc
    Supports 12-bits/component Deep Color 4:2:0 Pixel Encoding
    Supports 10-bits/component Deep Color 4:2:0 Pixel Encoding
  Video Capability Data Block:
    YCbCr quantization: Selectable (via AVI YQ)
    RGB quantization: Selectable (via AVI Q)
    PT scan behavior: Supports both over- and underscan
    IT scan behavior: Always Underscanned
    CE scan behavior: Always Overscanned
  Vendor-Specific Video Data Block (Dolby), OUI 00-D0-46:
    Version: 2 (12 bytes)
    Supports global dimming
    DM Version: 4.x
    Backlt Min Luma: 100 cd/m^2
    Interface: Standard + Low-Latency
    Supports 10b 12b 444: Not supported
    Target Min PQ v2: 340 (0.20116887 cd/m^2)
    Target Max PQ v2: 2445 (237 cd/m^2)
    Unique Rx, Ry: 0.64062500, 0.33593750
    Unique Gx, Gy: 0.30078125, 0.62109375
    Unique Bx, By: 0.15234375, 0.05078125
  Vendor-Specific Video Data Block (HDR10+), OUI 90-84-8B:
    Application Version: 1
    Full Frame Peak Luminance Index: 0
    Peak Luminance Index: 0
  Colorimetry Data Block:
    xvYCC601
    xvYCC709
    BT2020cYCC
    BT2020YCC
    BT2020RGB
    Gamut Boundary Description Metadata Profile P0
  YCbCr 4:2:0 Capability Map Data Block:
    VIC  97:  3840x2160   60.000000 Hz  16:9    135.000 kHz    594.000000 MHz
    VIC  96:  3840x2160   50.000000 Hz  16:9    112.500 kHz    594.000000 MHz
  HDR Static Metadata Data Block:
    Electro optical transfer functions:
      Traditional gamma - SDR luminance range
      SMPTE ST2084
      Hybrid Log-Gamma
    Supported static metadata descriptors:
      Static metadata type 1
  Detailed Timing Descriptors:
    DTD 4:  1920x1080i  60.000000 Hz  16:9     33.750 kHz     74.250000 MHz (1600 mm x 900 mm)
                 Hfront   88 Hsync  44 Hback  148 Hpol P
                 Vfront    2 Vsync   5 Vback   15 Vpol P Vfront +0.5 Odd Field
                 Vfront    2 Vsync   5 Vback   15 Vpol P Vback  +0.5 Even Field
Checksum: 0x2c  Unused space in Extension Block: 3 bytes

----------------

Warnings:

Block 0, Base EDID:
  Vendor & Product Identification: The serial number is one of the known dummy values, it should probably be set to 0.
Block 1, CTA-861 Extension Block:
  Video Data Block: VIC 97 and the first DTD are not identical. Is this intended?
  Colorimetry Data Block: Set the sRGB colorimetry bit to avoid interop issues.
Block 3, CTA-861 Extension Block:
  Colorimetry Data Block: Set the sRGB colorimetry bit to avoid interop issues.
EDID:
  Base EDID: Some timings are out of range of the Monitor Ranges:
    Maximum Clock: 594.000 MHz (Monitor: 380.000 MHz)

Failures:

Block 0, Base EDID:
  Standard Timings: Use 0x0101 as the invalid Standard Timings code, not 0x0100.
  Detailed Timing Descriptor #1: Mismatch of image size 1096x616 mm vs display size 1420x800 mm.
  Detailed Timing Descriptor #2: Mismatch of image size 1096x616 mm vs display size 1420x800 mm.
Block 1, CTA-861 Extension Block:
  Vendor-Specific Data Block (HDMI Forum), OUI C4-5D-D8: HDMI VIC and related CTA VIC codes are present, but the UHD VIC bit is 0.
  Detailed Timing Descriptor #3: Mismatch of image size 1600x900 mm vs display size 1420x800 mm.
Block 2, Base EDID:
  Unknown Extension Block.
Block 3, CTA-861 Extension Block:
  Video Data Block: Duplicate VIC 97.
  Video Data Block: Duplicate VIC 96.
  Video Data Block: Duplicate VIC 93.
  Video Data Block: Duplicate VIC 94.
  Video Data Block: Duplicate VIC 95.
  Video Data Block: Duplicate VIC 1.
  Video Data Block: Duplicate VIC 31.
  Video Data Block: Duplicate VIC 16.
  Video Data Block: Duplicate VIC 20.
  Video Data Block: Duplicate VIC 5.
  Video Data Block: Duplicate VIC 19.
  Video Data Block: Duplicate VIC 4.
  Video Data Block: Duplicate VIC 32.
  Video Data Block: Duplicate VIC 34.
  Video Data Block: Duplicate VIC 60.
  Video Data Block: Duplicate VIC 62.
  Video Data Block: Duplicate VIC 18.
  Video Data Block: Duplicate VIC 22.
  Video Data Block: Duplicate VIC 3.
  Video Data Block: Duplicate VIC 7.
  Video Data Block: Duplicate VIC 17.
  Video Data Block: Duplicate VIC 21.
  Video Data Block: Duplicate VIC 2.
  Video Data Block: Duplicate VIC 6.
  Speaker Allocation Data Block: Only one instance of this Data Block is allowed.
  Vendor-Specific Data Block (HDMI Forum), OUI C4-5D-D8: Duplicate HDMI Forum VSDB/SCDB.
  Vendor-Specific Data Block (HDMI Forum), OUI C4-5D-D8: HDMI VIC and related CTA VIC codes are present, but the UHD VIC bit is 0.
  Video Capability Data Block: Only one instance of this Data Block is allowed.
  Colorimetry Data Block: Only one instance of this Data Block is allowed.
  YCbCr 4:2:0 Capability Map Data Block: Only one instance of this Data Block is allowed.
  HDR Static Metadata Data Block: Only one instance of this Data Block is allowed.
  Detailed Timing Descriptor #4: Mismatch of image size 1600x900 mm vs display size 1420x800 mm.
EDID:
  Base EDID: The DTD max image size is 1600x900mm, which is larger than the display size 1420.0x800.0mm.
  Base EDID: EDID specified 1 extension block(s), but found 3 extension block(s).
  Base EDID: EDID 1.3 requires a Block Map Extension in Block 1 if there are more than 2 blocks in the EDID.

EDID conformity: FAIL
