edid-decode (hex):

00 ff ff ff ff ff ff 00 4a 8b 38 06 80 10 20 19
29 22 01 04 a5 00 00 78 ff de 58 a3 54 4c 99 26
0f 47 4a af cf 00 d1 c0 b3 00 a9 c0 d1 cf 95 00
81 80 61 7c 45 7c 04 74 80 18 71 38 2d 40 58 2c
45 00 ba 89 21 00 00 1e ae 60 80 18 71 38 2d 40
30 20 35 00 ba 89 21 00 00 1e 00 00 00 fc 00 4a
36 33 38 4a 33 38 0a 20 20 20 20 20 00 00 00 fd
00 3c 78 1e fa 24 01 0a 20 20 20 20 20 20 01 b4

02 03 3d f2 50 04 05 10 dc dc 1f 00 40 00 dc 00
00 00 dc 4c 3f e3 00 ea e5 e3 05 c0 00 23 09 7f
07 83 01 00 00 67 03 0c 00 10 00 38 48 e6 06 05
01 62 62 00 68 1a 00 00 01 01 3c 78 00 02 3a 80
18 71 38 2d 40 30 2c 45 00 ba 89 21 00 00 1e 81
48 80 18 71 38 2d 40 30 2c 45 00 ba 89 21 00 00
1e be 6e 80 b4 70 38 2d 40 30 20 35 00 ba 89 21
00 00 1e 00 00 00 00 00 00 00 00 00 00 00 00 62

00 ff ff ff ff ff ff 00 4a 8b 38 06 80 10 20 19
29 22 01 04 a5 00 00 78 ff de 58 a3 54 4c 99 26
0f 47 4a af cf 00 d1 c0 b3 00 a9 c0 d1 cf 95 00
81 80 61 7c 45 7c 04 74 80 18 71 38 2d 40 58 2c
45 00 ba 89 21 00 00 1e ae 60 80 18 71 38 2d 40
30 20 35 00 ba 89 21 00 00 1e 00 00 00 fc 00 4a
36 33 38 4a 33 38 0a 20 20 20 20 20 00 00 00 fd
00 3c 78 1e fa 24 01 0a 20 20 20 20 20 20 01 b4

02 03 3d f2 50 04 05 10 dc dc 1f 00 40 00 dc 00
00 00 dc 4c 3f e3 00 ea e5 e3 05 c0 00 23 09 7f
07 83 01 00 00 67 03 0c 00 10 00 38 48 e6 06 05
01 62 62 00 68 1a 00 00 01 01 3c 78 00 02 3a 80
18 71 38 2d 40 30 2c 45 00 ba 89 21 00 00 1e 81
48 80 18 71 38 2d 40 30 2c 45 00 ba 89 21 00 00
1e be 6e 80 b4 70 38 2d 40 30 20 35 00 ba 89 21
00 00 1e 00 00 00 00 00 00 00 00 00 00 00 00 62

----------------

Block 0, Base EDID:
  EDID Structure Version & Revision: 1.4
  Vendor & Product Identification:
    Manufacturer: RTK
    Model: 1592
    Serial Number: ...
    Made in: week 41 of 2024
  Basic Display Parameters & Features:
    Digital display
    Bits per primary color channel: 8
    DisplayPort interface
    Image size is variable
    Gamma: 2.20
    DPMS levels: Standby Suspend Off
    Supported color formats: RGB 4:4:4, YCrCb 4:4:4, YCrCb 4:2:2
    Default (sRGB) color space is primary color space
    First detailed timing includes the native pixel format and preferred refresh rate
    Display supports continuous frequencies
  Color Characteristics:
    Red  : 0.6396, 0.3291
    Green: 0.2998, 0.5996
    Blue : 0.1494, 0.0595
    White: 0.2792, 0.2890
  Established Timings I & II:
    IBM     :   720x400    70.081663 Hz   9:5     31.467 kHz     28.320000 MHz
    DMT 0x04:   640x480    59.940476 Hz   4:3     31.469 kHz     25.175000 MHz
    DMT 0x05:   640x480    72.808802 Hz   4:3     37.861 kHz     31.500000 MHz
    DMT 0x06:   640x480    75.000000 Hz   4:3     37.500 kHz     31.500000 MHz
    DMT 0x08:   800x600    56.250000 Hz   4:3     35.156 kHz     36.000000 MHz
    DMT 0x09:   800x600    60.316541 Hz   4:3     37.879 kHz     40.000000 MHz
    DMT 0x0a:   800x600    72.187572 Hz   4:3     48.077 kHz     50.000000 MHz
    DMT 0x0b:   800x600    75.000000 Hz   4:3     46.875 kHz     49.500000 MHz
    DMT 0x10:  1024x768    60.003840 Hz   4:3     48.363 kHz     65.000000 MHz
    DMT 0x11:  1024x768    70.069359 Hz   4:3     56.476 kHz     75.000000 MHz
    DMT 0x12:  1024x768    75.028582 Hz   4:3     60.023 kHz     78.750000 MHz
    DMT 0x24:  1280x1024   75.024675 Hz   5:4     79.976 kHz    135.000000 MHz
  Standard Timings:
    DMT 0x52:  1920x1080   60.000000 Hz  16:9     67.500 kHz    148.500000 MHz
    DMT 0x3a:  1680x1050   59.954250 Hz  16:10    65.290 kHz    146.250000 MHz
    DMT 0x53:  1600x900    60.000000 Hz  16:9     60.000 kHz    108.000000 MHz (RB)
    GTF     :  1920x1080   75.000068 Hz  16:9     84.600 kHz    220.637000 MHz
    DMT 0x2f:  1440x900    59.887445 Hz  16:10    55.935 kHz    106.500000 MHz
    DMT 0x23:  1280x1024   60.019740 Hz   5:4     63.981 kHz    108.000000 MHz
    GTF     :  1024x768   119.999931 Hz   4:3     98.760 kHz    139.054000 MHz
    GTF     :   800x600   119.999886 Hz   4:3     77.160 kHz     83.950000 MHz
  Detailed Timing Descriptors:
    DTD 1:  1920x1080  120.000000 Hz  16:9    135.000 kHz    297.000000 MHz (698 mm x 393 mm)
                 Hfront   88 Hsync  44 Hback  148 Hpol P
                 Vfront    4 Vsync   5 Vback   36 Vpol P
    DTD 2:  1920x1080  100.000000 Hz  16:9    112.500 kHz    247.500000 MHz (698 mm x 393 mm)
                 Hfront   48 Hsync  32 Hback  200 Hpol P
                 Vfront    3 Vsync   5 Vback   37 Vpol P
    Display Product Name: 'J638J38'
    Display Range Limits:
      Monitor ranges (Range Limits Only): 60-120 Hz V, 30-250 kHz H, max dotclock 360 MHz
  Extension blocks: 1
Checksum: 0xb4

----------------

Block 1, CTA-861 Extension Block:
  Revision: 3
  Underscans IT Video Formats by default
  Basic audio support
  Supports YCbCr 4:4:4
  Supports YCbCr 4:2:2
  Native DTDs: 2
  Video Data Block:
    VIC   4:  1280x720    60.000000 Hz  16:9     45.000 kHz     74.250000 MHz
    VIC   5:  1920x1080i  60.000000 Hz  16:9     33.750 kHz     74.250000 MHz
    VIC  16:  1920x1080   60.000000 Hz  16:9     67.500 kHz    148.500000 MHz
    Unknown (VIC 220)
    Unknown (VIC 220)
    VIC  31:  1920x1080   50.000000 Hz  16:9     56.250 kHz    148.500000 MHz
    VIC  64:  1920x1080  100.000000 Hz  16:9    112.500 kHz    297.000000 MHz
    Unknown (VIC 220)
    Unknown (VIC 220)
    VIC  76:  1920x1080   60.000000 Hz  64:27    67.500 kHz    148.500000 MHz
    VIC  63:  1920x1080  120.000000 Hz  16:9    135.000 kHz    297.000000 MHz
  Video Capability Data Block:
    YCbCr quantization: Selectable (via AVI YQ)
    RGB quantization: Selectable (via AVI Q)
    PT scan behavior: Always Underscanned
    IT scan behavior: Always Underscanned
    CE scan behavior: Always Underscanned
  Colorimetry Data Block:
    BT2020YCC
    BT2020RGB
  Audio Data Block:
    Linear PCM:
      Max channels: 2
      Supported sample rates (kHz): 192 176.4 96 88.2 48 44.1 32
      Supported sample sizes (bits): 24 20 16
  Speaker Allocation Data Block:
    FL/FR - Front Left/Right
  Vendor-Specific Data Block (HDMI), OUI 00-0C-03:
    Source physical address: 1.0.0.0
    DC_36bit
    DC_30bit
    DC_Y444
    Maximum TMDS clock: 360 MHz
  HDR Static Metadata Data Block:
    Electro optical transfer functions:
      Traditional gamma - SDR luminance range
      SMPTE ST2084
    Supported static metadata descriptors:
      Static metadata type 1
    Desired content max luminance: 98 (417.710 cd/m^2)
    Desired content max frame-average luminance: 98 (417.710 cd/m^2)
    Desired content min luminance: 0 (0.000 cd/m^2)
  Vendor-Specific Data Block (AMD), OUI 00-00-1A:
    Version: 1
    Feature Caps: 0x01
    Minimum Refresh Rate: 60 Hz
    Maximum Refresh Rate: 120 Hz
    Flags 1.x: 0x00
  Detailed Timing Descriptors:
    DTD 3:  1920x1080   60.000000 Hz  16:9     67.500 kHz    148.500000 MHz (698 mm x 393 mm)
                 Hfront   48 Hsync  44 Hback  188 Hpol P
                 Vfront    4 Vsync   5 Vback   36 Vpol P
    DTD 4:  1920x1080   74.993939 Hz  16:9     84.368 kHz    185.610000 MHz (698 mm x 393 mm)
                 Hfront   48 Hsync  44 Hback  188 Hpol P
                 Vfront    4 Vsync   5 Vback   36 Vpol P
    DTD 5:  1920x1080  120.000000 Hz  16:9    135.000 kHz    283.500000 MHz (698 mm x 393 mm)
                 Hfront   48 Hsync  32 Hback  100 Hpol P
                 Vfront    3 Vsync   5 Vback   37 Vpol P
Checksum: 0x62  Unused space in Extension Block: 12 bytes

----------------

Warnings:

Block 1, CTA-861 Extension Block:
  Video Data Block: VIC 4 and the first DTD are not identical. Is this intended?
  Video Capability Data Block: S_PT is equal to S_IT and S_CE, so should be set to 0 instead.
  Detailed Timing Descriptor #3: DTD is similar but not identical to VIC 16.
EDID:
  Base EDID: Some timings are out of range of the Monitor Ranges:
    Vertical Freq: 50.000 - 120.000 Hz (Monitor: 60.000 - 120.000 Hz)

Failures:

Block 0, Base EDID:
  Basic Display Parameters & Features: sRGB is signaled, but the chromaticities do not match.
Block 1, CTA-861 Extension Block:
  Video Data Block: Unknown VIC 220.
  Video Data Block: Unknown VIC 220.
  Video Data Block: Duplicate VIC 220.
  Video Data Block: Unknown VIC 220.
  Video Data Block: Unknown VIC 220.
  Vendor-Specific Data Block (HDMI), OUI 00-0C-03: HDMI VSDB Max TMDS rate is > 340.
  Vendor-Specific Data Block (HDMI), OUI 00-0C-03: The HDMI Specification requires EDID 1.3 instead of 1.4.
EDID:
  Extension Block 2 started with EDID header, ignoring Extension Blocks >= 2.
  Base EDID: The DTD max image size is 698x393mm, but the display size is not specified anywhere.

EDID conformity: FAIL
