edid-decode (hex):

00 ff ff ff ff ff ff 00 30 61 f0 26 01 01 01 01
27 14 01 03 0e 37 22 78 ea da 85 ae 4f 32 b2 26
0e 50 54 bf ef 80 81 80 90 40 81 c0 8b c0 95 00
a9 40 b3 00 d1 00 7d 4b 80 a0 72 b0 2d 40 88 c8
36 00 26 58 21 00 00 1c 00 00 00 fd 00 32 55 1f
5e 15 00 0a 20 20 20 20 20 20 00 00 00 fc 00 4c
61 43 69 65 35 32 36 0a 20 20 20 20 00 00 00 ff
00 30 39 33 30 30 38 33 34 55 57 0a 20 20 00 a5

00 ff ff ff ff ff ff 00 30 61 f0 26 01 01 01 01
27 14 01 03 0e 37 22 78 ea da 85 ae 4f 32 b2 26
0e 50 54 bf ef 80 81 80 90 40 81 c0 8b c0 95 00
a9 40 b3 00 d1 00 7d 4b 80 a0 72 b0 2d 40 88 c8
36 00 26 58 21 00 00 1c 00 00 00 fd 00 32 55 1f
5e 15 00 0a 20 20 20 20 20 20 00 00 00 fc 00 4c
61 43 69 65 35 32 36 0a 20 20 20 20 00 00 00 ff
00 30 39 33 30 30 38 33 34 55 57 0a 20 20 00 a5

----------------

Block 0, Base EDID:
  EDID Structure Version & Revision: 1.3
  Vendor & Product Identification:
    Manufacturer: LCA
    Model: 9968
    Serial Number: ...
    Made in: week 39 of 2010
  Basic Display Parameters & Features:
    Analog display
    Signal Level Standard: 0.700 : 0.300 : 1.000 V p-p
    Blank level equals black level
    Sync: Separate Composite SyncOnGreen
    Maximum image size: 55 cm x 34 cm
    Gamma: 2.20
    DPMS levels: Standby Suspend Off
    RGB color display
    First detailed timing is the preferred timing
  Color Characteristics:
    Red  : 0.6826, 0.3095
    Green: 0.1972, 0.6972
    Blue : 0.1503, 0.0546
    White: 0.3134, 0.3291
  Established Timings I & II:
    IBM     :   720x400    70.081663 Hz   9:5     31.467 kHz     28.320000 MHz
    DMT 0x04:   640x480    59.940476 Hz   4:3     31.469 kHz     25.175000 MHz
    Apple   :   640x480    66.666667 Hz   4:3     35.000 kHz     30.240000 MHz
    DMT 0x05:   640x480    72.808802 Hz   4:3     37.861 kHz     31.500000 MHz
    DMT 0x06:   640x480    75.000000 Hz   4:3     37.500 kHz     31.500000 MHz
    DMT 0x08:   800x600    56.250000 Hz   4:3     35.156 kHz     36.000000 MHz
    DMT 0x09:   800x600    60.316541 Hz   4:3     37.879 kHz     40.000000 MHz
    DMT 0x0a:   800x600    72.187572 Hz   4:3     48.077 kHz     50.000000 MHz
    DMT 0x0b:   800x600    75.000000 Hz   4:3     46.875 kHz     49.500000 MHz
    Apple   :   832x624    74.551266 Hz   4:3     49.726 kHz     57.284000 MHz
    DMT 0x10:  1024x768    60.003840 Hz   4:3     48.363 kHz     65.000000 MHz
    DMT 0x11:  1024x768    70.069359 Hz   4:3     56.476 kHz     75.000000 MHz
    DMT 0x12:  1024x768    75.028582 Hz   4:3     60.023 kHz     78.750000 MHz
    DMT 0x24:  1280x1024   75.024675 Hz   5:4     79.976 kHz    135.000000 MHz
    Apple   :  1152x870    75.061550 Hz 192:145   68.681 kHz    100.000000 MHz
  Standard Timings:
    DMT 0x23:  1280x1024   60.019740 Hz   5:4     63.981 kHz    108.000000 MHz
    DMT 0x2a:  1400x1050   59.978442 Hz   4:3     65.317 kHz    121.750000 MHz
    DMT 0x55:  1280x720    60.000000 Hz  16:9     45.000 kHz     74.250000 MHz
    GTF     :  1360x765    60.000341 Hz  16:9     47.520 kHz     84.396000 MHz
    DMT 0x2f:  1440x900    59.887445 Hz  16:10    55.935 kHz    106.500000 MHz
    DMT 0x33:  1600x1200   60.000000 Hz   4:3     75.000 kHz    162.000000 MHz
    DMT 0x3a:  1680x1050   59.954250 Hz  16:10    65.290 kHz    146.250000 MHz
    DMT 0x45:  1920x1200   59.884600 Hz  16:10    74.556 kHz    193.250000 MHz
  Detailed Timing Descriptors:
    DTD 1:  1920x1200   59.884600 Hz  16:10    74.556 kHz    193.250000 MHz (550 mm x 344 mm)
                 Hfront  136 Hsync 200 Hback  336 Hpol N
                 Vfront    3 Vsync   6 Vback   36 Vpol P
    Display Range Limits:
      Monitor ranges (GTF): 50-85 Hz V, 31-94 kHz H, max dotclock 210 MHz
    Display Product Name: 'LaCie526'
    Display Product Serial Number: ...
Checksum: 0xa5

----------------

Warnings:

Block 0, Base EDID:
  Vendor & Product Identification: The serial number is one of the known dummy values, it should probably be set to 0.
  Standard Timings: Standard Timing 1360x765 has a dubious odd vertical resolution.

Failures:

EDID:
  Extension Block 1 started with EDID header, ignoring Extension Blocks >= 1.

EDID conformity: FAIL
