edid-decode (hex):

00 ff ff ff ff ff ff 00 38 a3 6c 66 01 00 00 00
18 15 01 03 80 30 1b 78 0a 7c a5 a3 54 4e a0 27
12 50 54 21 08 00 01 01 01 01 01 01 01 01 01 01
01 01 01 01 01 01 02 3a 80 18 71 38 2d 40 58 2c
45 00 db 0b 11 00 00 1e 00 00 00 fd 00 3a 3e 0f
44 0f 00 0a 20 20 20 20 20 20 00 00 00 fc 00 56
41 4c 55 45 53 54 41 52 20 4e 0a 20 00 00 00 01
00 0a 20 20 20 20 20 20 20 20 20 20 20 20 01 7e

02 03 19 71 46 90 05 04 03 02 01 23 09 07 07 83
01 00 00 65 03 0c 00 10 00 01 1d 80 18 71 1c 16
20 58 2c 25 00 fd 1e 11 00 00 9e 01 1d 00 72 51
d0 1e 20 6e 28 55 00 fd 1e 11 00 00 1e 8c 0a d0
8a 20 e0 2d 10 10 3e 96 00 fd 1e 11 00 00 18 00
00 00 00 00 00 00 00 00 00 00 00 00 00 00 00 00
00 00 00 00 00 00 00 00 00 00 00 00 00 00 00 00
00 00 00 00 00 00 00 00 00 00 00 00 00 00 00 e5

00 ff ff ff ff ff ff 00 38 a3 6c 66 01 00 00 00
18 15 01 03 80 30 1b 78 0a 7c a5 a3 54 4e a0 27
12 50 54 21 08 00 01 01 01 01 01 01 01 01 01 01
01 01 01 01 01 01 02 3a 80 18 71 38 2d 40 58 2c
45 00 db 0b 11 00 00 1e 00 00 00 fd 00 3a 3e 0f
44 0f 00 0a 20 20 20 20 20 20 00 00 00 fc 00 56
41 4c 55 45 53 54 41 52 20 4e 0a 20 00 00 00 01
00 0a 20 20 20 20 20 20 20 20 20 20 20 20 01 7e

02 03 19 71 46 90 05 04 03 02 01 23 09 07 07 83
01 00 00 65 03 0c 00 10 00 01 1d 80 18 71 1c 16
20 58 2c 25 00 fd 1e 11 00 00 9e 01 1d 00 72 51
d0 1e 20 6e 28 55 00 fd 1e 11 00 00 1e 8c 0a d0
8a 20 e0 2d 10 10 3e 96 00 fd 1e 11 00 00 18 00
00 00 00 00 00 00 00 00 00 00 00 00 00 00 00 00
00 00 00 00 00 00 00 00 00 00 00 00 00 00 00 00
00 00 00 00 00 00 00 00 00 00 00 00 00 00 00 e5

----------------

Block 0, Base EDID:
  EDID Structure Version & Revision: 1.3
  Vendor & Product Identification:
    Manufacturer: NEC
    Model: 26220
    Serial Number: ...
    Made in: week 24 of 2011
  Basic Display Parameters & Features:
    Digital display
    Maximum image size: 48 cm x 27 cm
    Gamma: 2.20
    RGB color display
    First detailed timing is the preferred timing
  Color Characteristics:
    Red  : 0.6376, 0.3310
    Green: 0.3076, 0.6250
    Blue : 0.1542, 0.0722
    White: 0.3134, 0.3291
  Established Timings I & II:
    DMT 0x04:   640x480    59.940476 Hz   4:3     31.469 kHz     25.175000 MHz
    DMT 0x09:   800x600    60.316541 Hz   4:3     37.879 kHz     40.000000 MHz
    DMT 0x10:  1024x768    60.003840 Hz   4:3     48.363 kHz     65.000000 MHz
  Standard Timings: none
  Detailed Timing Descriptors:
    DTD 1:  1920x1080   60.000000 Hz  16:9     67.500 kHz    148.500000 MHz (475 mm x 267 mm)
                 Hfront   88 Hsync  44 Hback  148 Hpol P
                 Vfront    4 Vsync   5 Vback   36 Vpol P
    Display Range Limits:
      Monitor ranges (GTF): 58-62 Hz V, 15-68 kHz H, max dotclock 150 MHz
    Display Product Name: 'VALUESTAR N'
    Manufacturer-Specified Display Descriptor (0x01): 00 01 00 0a 20 20 20 20 20 20 20 20 20 20 20 20 '....            '
  Extension blocks: 1
Checksum: 0x7e

----------------

Block 1, CTA-861 Extension Block:
  Revision: 3
  Basic audio support
  Supports YCbCr 4:4:4
  Supports YCbCr 4:2:2
  Native DTDs: 1
  Video Data Block:
    VIC  16:  1920x1080   60.000000 Hz  16:9     67.500 kHz    148.500000 MHz (native)
    VIC   5:  1920x1080i  60.000000 Hz  16:9     33.750 kHz     74.250000 MHz
    VIC   4:  1280x720    60.000000 Hz  16:9     45.000 kHz     74.250000 MHz
    VIC   3:   720x480    59.940060 Hz  16:9     31.469 kHz     27.000000 MHz
    VIC   2:   720x480    59.940060 Hz   4:3     31.469 kHz     27.000000 MHz
    VIC   1:   640x480    59.940476 Hz   4:3     31.469 kHz     25.175000 MHz
  Audio Data Block:
    Linear PCM:
      Max channels: 2
      Supported sample rates (kHz): 48 44.1 32
      Supported sample sizes (bits): 24 20 16
  Speaker Allocation Data Block:
    FL/FR - Front Left/Right
  Vendor-Specific Data Block (HDMI), OUI 00-0C-03:
    Source physical address: 1.0.0.0
  Detailed Timing Descriptors:
    DTD 2:  1920x1080i  60.000000 Hz  16:9     33.750 kHz     74.250000 MHz (509 mm x 286 mm)
                 Hfront   88 Hsync  44 Hback  148 Hpol P
                 Vfront    2 Vsync   5 Vback   15 Vpol P Vfront +0.5 Odd Field
                 Vfront    2 Vsync   5 Vback   15 Vpol P Vback  +0.5 Even Field
    DTD 3:  1280x720    60.000000 Hz  16:9     45.000 kHz     74.250000 MHz (509 mm x 286 mm)
                 Hfront  110 Hsync  40 Hback  220 Hpol P
                 Vfront    5 Vsync   5 Vback   20 Vpol P
    DTD 4:   720x480    59.940060 Hz   3:2     31.469 kHz     27.000000 MHz (509 mm x 286 mm)
                 Hfront   16 Hsync  62 Hback   60 Hpol N
                 Vfront    9 Vsync   6 Vback   30 Vpol N
Checksum: 0xe5  Unused space in Extension Block: 48 bytes

----------------

Warnings:

Block 0, Base EDID:
  Vendor & Product Identification: The serial number is one of the known dummy values, it should probably be set to 0.
Block 1, CTA-861 Extension Block:
  IT Video Formats are overscanned by default, but normally this should be underscanned.
  Detailed Timing Descriptor #4: Image size is 509x286 mm, but based on the picture AR it should be 429x286 mm.
  Add a Colorimetry Data Block with the sRGB colorimetry bit set to avoid interop issues.

Failures:

Block 1, CTA-861 Extension Block:
  Detailed Timing Descriptor #2: Mismatch of image size 509x286 mm vs display size 480x270 mm.
  Detailed Timing Descriptor #3: Mismatch of image size 509x286 mm vs display size 480x270 mm.
  Detailed Timing Descriptor #4: Mismatch of image size 509x286 mm vs display size 480x270 mm.
  Missing VCDB, needed for Set Selectable RGB Quantization to avoid interop issues.
EDID:
  Extension Block 2 started with EDID header, ignoring Extension Blocks >= 2.
  Base EDID: The DTD max image size is 509x286mm, which is larger than the display size 480.0x270.0mm.

EDID conformity: FAIL
