edid-decode (hex):

00 ff ff ff ff ff ff 00 21 63 60 21 01 00 00 00
03 15 01 03 00 36 1e 78 ea 2d 36 a7 54 38 ae 26
0d 4f 54 af cf 00 d1 c0 b3 00 95 00 81 80 81 8a
81 00 81 40 01 01 30 43 80 90 72 38 28 40 78 d0
36 00 fe 1e 11 00 00 1c 34 21 50 00 51 00 1b 30
40 70 36 00 30 e4 10 00 00 1e 00 00 00 fd 00 3c
4b 1e 53 11 00 0a 20 20 20 20 20 20 00 00 00 fc
00 0a 20 20 20 20 20 20 20 20 20 20 20 20 00 52

00 ff ff ff ff ff ff 00 21 63 60 21 01 00 00 00
03 15 01 03 00 36 1e 78 ea 2d 36 a7 54 38 ae 26
0d 4f 54 af cf 00 d1 c0 b3 00 95 00 81 80 81 8a
81 00 81 40 01 01 30 43 80 90 72 38 28 40 78 d0
36 00 fe 1e 11 00 00 1c 34 21 50 00 51 00 1b 30
40 70 36 00 30 e4 10 00 00 1e 00 00 00 fd 00 3c
4b 1e 53 11 00 0a 20 20 20 20 20 20 00 00 00 fc
00 0a 20 20 20 20 20 20 20 20 20 20 20 20 00 52

----------------

Block 0, Base EDID:
  EDID Structure Version & Revision: 1.3
  Vendor & Product Identification:
    Manufacturer: HKC
    Model: 8544
    Serial Number: ...
    Made in: week 3 of 2011
  Basic Display Parameters & Features:
    Analog display
    Signal Level Standard: 0.700 : 0.300 : 1.000 V p-p
    Blank level equals black level
    Maximum image size: 54 cm x 30 cm
    Gamma: 2.20
    DPMS levels: Standby Suspend Off
    RGB color display
    First detailed timing is the preferred timing
  Color Characteristics:
    Red  : 0.6523, 0.3300
    Green: 0.2216, 0.6806
    Blue : 0.1484, 0.0537
    White: 0.3095, 0.3300
  Established Timings I & II:
    IBM     :   720x400    70.081663 Hz   9:5     31.467 kHz     28.320000 MHz
    DMT 0x04:   640x480    59.940476 Hz   4:3     31.469 kHz     25.175000 MHz
    DMT 0x05:   640x480    72.808802 Hz   4:3     37.861 kHz     31.500000 MHz
    DMT 0x06:   640x480    75.000000 Hz   4:3     37.500 kHz     31.500000 MHz
    DMT 0x08:   800x600    56.250000 Hz   4:3     35.156 kHz     36.000000 MHz
    DMT 0x09:   800x600    60.316541 Hz   4:3     37.879 kHz     40.000000 MHz
    DMT 0x0a:   800x600    72.187572 Hz   4:3     48.077 kHz     50.000000 MHz
    DMT 0x0b:   800x600    75.000000 Hz   4:3     46.875 kHz     49.500000 MHz
    DMT 0x10:  1024x768    60.003840 Hz   4:3     48.363 kHz     65.000000 MHz
    DMT 0x11:  1024x768    70.069359 Hz   4:3     56.476 kHz     75.000000 MHz
    DMT 0x12:  1024x768    75.028582 Hz   4:3     60.023 kHz     78.750000 MHz
    DMT 0x24:  1280x1024   75.024675 Hz   5:4     79.976 kHz    135.000000 MHz
  Standard Timings:
    DMT 0x52:  1920x1080   60.000000 Hz  16:9     67.500 kHz    148.500000 MHz
    DMT 0x3a:  1680x1050   59.954250 Hz  16:10    65.290 kHz    146.250000 MHz
    DMT 0x2f:  1440x900    59.887445 Hz  16:10    55.935 kHz    106.500000 MHz
    DMT 0x23:  1280x1024   60.019740 Hz   5:4     63.981 kHz    108.000000 MHz
    GTF     :  1280x1024   69.999805 Hz   5:4     74.620 kHz    128.943000 MHz
    DMT 0x1c:  1280x800    59.810326 Hz  16:10    49.702 kHz     83.500000 MHz
    DMT 0x20:  1280x960    60.000000 Hz   4:3     60.000 kHz    108.000000 MHz
  Detailed Timing Descriptors:
    DTD 1:  1920x1080   59.616238 Hz  16:9     66.770 kHz    172.000000 MHz (510 mm x 286 mm)
                 Hfront  120 Hsync 208 Hback  328 Hpol N
                 Vfront    3 Vsync   6 Vback   31 Vpol P
    DTD 2:  1360x768    66.162277 Hz  85:48    52.599 kHz     85.000000 MHz (304 mm x 228 mm)
                 Hfront   64 Hsync 112 Hback   80 Hpol P
                 Vfront    3 Vsync   6 Vback   18 Vpol P
    Display Range Limits:
      Monitor ranges (GTF): 60-75 Hz V, 30-83 kHz H, max dotclock 170 MHz
    Display Product Name: ''
Checksum: 0x52

----------------

Block 1, Unknown EDID Extension Block 0x00:
  00 ff ff ff ff ff ff 00 21 63 60 21 01 00 00 00 '........!c`!....'
  03 15 01 03 00 36 1e 78 ea 2d 36 a7 54 38 ae 26 '.....6.x.-6.T8.&'
  0d 4f 54 af cf 00 d1 c0 b3 00 95 00 81 80 81 8a '.OT.............'
  81 00 81 40 01 01 30 43 80 90 72 38 28 40 78 d0 '...@..0C..r8(@x.'
  36 00 fe 1e 11 00 00 1c 34 21 50 00 51 00 1b 30 '6.......4!P.Q..0'
  40 70 36 00 30 e4 10 00 00 1e 00 00 00 fd 00 3c '@p6.0..........<'
  4b 1e 53 11 00 0a 20 20 20 20 20 20 00 00 00 fc 'K.S...      ....'
  00 0a 20 20 20 20 20 20 20 20 20 20 20 20 00 52 '..            .R'
Checksum: 0x52

----------------

Warnings:

Block 0, Base EDID:
  Vendor & Product Identification: The serial number is one of the known dummy values, it should probably be set to 0.
  Detailed Timing Descriptor #2: Image size is 304x228 mm, but based on the picture AR it should be 304x171 mm.
EDID:
  Base EDID: Some timings are out of range of the Monitor Ranges:
    Vertical Freq: 56.250 - 75.029 Hz (Monitor: 60.000 - 75.000 Hz)
    Maximum Clock: 172.000 MHz (Monitor: 170.000 MHz)

Failures:

Block 0, Base EDID:
  Detailed Timing Descriptor #1: Mismatch of image size 510x286 mm vs display size 540x300 mm.
  Detailed Timing Descriptor #2: Mismatch of image size 304x228 mm vs display size 540x300 mm.
  Display Product Name: Empty string.
Block 1, Base EDID:
  Unknown Extension Block.
EDID:
  Base EDID: EDID specified 0 extension block(s), but found 1 extension block(s).

EDID conformity: FAIL
