edid-decode (hex):

00 ff ff ff ff ff ff 00 06 b3 ea 38 01 01 01 01
26 20 01 04 b5 54 2f 78 3b 7d b0 ad 51 42 ae 24
0c 50 54 bf cf 00 d1 c0 b3 00 81 c0 71 4f 95 00
81 80 81 40 61 7c 4d d0 00 a0 f0 70 3e 80 30 40
35 00 49 d9 31 00 00 1a 00 00 00 fd 0c 30 90 5f
5f 8c 01 0a 20 20 20 20 20 20 00 00 00 fc 00 50
47 33 38 55 51 0a 20 20 20 20 20 20 00 00 00 ff
00 52 35 4c 4d 54 46 30 36 35 33 38 36 0a 02 c1

02 03 42 f1 59 04 13 1f 10 0f 0e 01 1e 1d 5d 5e
5f 60 61 76 03 02 12 11 3f 20 21 22 40 75 23 09
07 07 83 01 00 00 e2 00 ea e3 05 c1 01 e6 06 05
01 7a 7a 1d 6d 1a 00 00 02 0b 30 90 00 05 78 16
78 2c 6f c2 00 a0 a0 a0 55 50 30 20 35 00 49 d9
31 00 00 1a 00 00 00 00 00 00 00 00 00 00 00 00
00 00 00 00 00 00 00 00 00 00 00 00 00 00 00 00
00 00 00 00 00 00 00 00 00 00 00 00 00 00 00 96

70 12 79 03 00 03 01 64 ef fe 01 84 ff 0e 9f 00
2f 80 1f 00 6f 08 6f 00 02 00 04 00 83 ac 01 04
ff 0e 9f 00 2f 80 1f 00 6f 08 7e 00 02 00 04 00
e7 61 01 04 ff 0e 9f 00 2f 80 1f 00 6f 08 68 00
02 00 04 00 08 ec 00 04 ff 09 9f 00 2f 80 1f 00
9f 05 66 00 02 00 04 00 4c 6c 00 04 7f 07 9f 00
2f 80 1f 00 6f 08 3d 00 02 00 09 00 00 00 00 00
00 00 00 00 00 00 00 00 00 00 00 00 00 00 f2 90

00 ff ff ff ff ff ff 00 06 b3 ea 38 01 01 01 01
26 20 01 04 b5 54 2f 78 3b 7d b0 ad 51 42 ae 24
0c 50 54 bf cf 00 d1 c0 b3 00 81 c0 71 4f 95 00
81 80 81 40 61 7c 4d d0 00 a0 f0 70 3e 80 30 40
35 00 49 d9 31 00 00 1a 00 00 00 fd 0c 30 90 5f
5f 8c 01 0a 20 20 20 20 20 20 00 00 00 fc 00 50
47 33 38 55 51 0a 20 20 20 20 20 20 00 00 00 ff
00 52 35 4c 4d 54 46 30 36 35 33 38 36 0a 02 c1

02 03 42 f1 59 04 13 1f 10 0f 0e 01 1e 1d 5d 5e
5f 60 61 76 03 02 12 11 3f 20 21 22 40 75 23 09
07 07 83 01 00 00 e2 00 ea e3 05 c1 01 e6 06 05
01 7a 7a 1d 6d 1a 00 00 02 0b 30 90 00 05 78 16
78 2c 6f c2 00 a0 a0 a0 55 50 30 20 35 00 49 d9
31 00 00 1a 00 00 00 00 00 00 00 00 00 00 00 00
00 00 00 00 00 00 00 00 00 00 00 00 00 00 00 00
00 00 00 00 00 00 00 00 00 00 00 00 00 00 00 96

70 12 79 03 00 03 01 64 ef fe 01 84 ff 0e 9f 00
2f 80 1f 00 6f 08 6f 00 02 00 04 00 83 ac 01 04
ff 0e 9f 00 2f 80 1f 00 6f 08 7e 00 02 00 04 00
e7 61 01 04 ff 0e 9f 00 2f 80 1f 00 6f 08 68 00
02 00 04 00 08 ec 00 04 ff 09 9f 00 2f 80 1f 00
9f 05 66 00 02 00 04 00 4c 6c 00 04 7f 07 9f 00
2f 80 1f 00 6f 08 3d 00 02 00 09 00 00 00 00 00
00 00 00 00 00 00 00 00 00 00 00 00 00 00 f2 90

----------------

Block 0, Base EDID:
  EDID Structure Version & Revision: 1.4
  Vendor & Product Identification:
    Manufacturer: AUS
    Model: 14570
    Serial Number: ...
    Made in: week 38 of 2022
  Basic Display Parameters & Features:
    Digital display
    Bits per primary color channel: 10
    DisplayPort interface
    Maximum image size: 84 cm x 47 cm
    Gamma: 2.20
    DPMS levels: Off
    Supported color formats: RGB 4:4:4, YCrCb 4:4:4, YCrCb 4:2:2
    First detailed timing includes the native pixel format and preferred refresh rate
    Display supports continuous frequencies
  Color Characteristics:
    Red  : 0.6767, 0.3193
    Green: 0.2607, 0.6806
    Blue : 0.1425, 0.0498
    White: 0.3125, 0.3281
  Established Timings I & II:
    IBM     :   720x400    70.081663 Hz   9:5     31.467 kHz     28.320000 MHz
    DMT 0x04:   640x480    59.940476 Hz   4:3     31.469 kHz     25.175000 MHz
    Apple   :   640x480    66.666667 Hz   4:3     35.000 kHz     30.240000 MHz
    DMT 0x05:   640x480    72.808802 Hz   4:3     37.861 kHz     31.500000 MHz
    DMT 0x06:   640x480    75.000000 Hz   4:3     37.500 kHz     31.500000 MHz
    DMT 0x08:   800x600    56.250000 Hz   4:3     35.156 kHz     36.000000 MHz
    DMT 0x09:   800x600    60.316541 Hz   4:3     37.879 kHz     40.000000 MHz
    DMT 0x0a:   800x600    72.187572 Hz   4:3     48.077 kHz     50.000000 MHz
    DMT 0x0b:   800x600    75.000000 Hz   4:3     46.875 kHz     49.500000 MHz
    DMT 0x10:  1024x768    60.003840 Hz   4:3     48.363 kHz     65.000000 MHz
    DMT 0x11:  1024x768    70.069359 Hz   4:3     56.476 kHz     75.000000 MHz
    DMT 0x12:  1024x768    75.028582 Hz   4:3     60.023 kHz     78.750000 MHz
    DMT 0x24:  1280x1024   75.024675 Hz   5:4     79.976 kHz    135.000000 MHz
  Standard Timings:
    DMT 0x52:  1920x1080   60.000000 Hz  16:9     67.500 kHz    148.500000 MHz
    DMT 0x3a:  1680x1050   59.954250 Hz  16:10    65.290 kHz    146.250000 MHz
    DMT 0x55:  1280x720    60.000000 Hz  16:9     45.000 kHz     74.250000 MHz
    DMT 0x15:  1152x864    75.000000 Hz   4:3     67.500 kHz    108.000000 MHz
    DMT 0x2f:  1440x900    59.887445 Hz  16:10    55.935 kHz    106.500000 MHz
    DMT 0x23:  1280x1024   60.019740 Hz   5:4     63.981 kHz    108.000000 MHz
    DMT 0x20:  1280x960    60.000000 Hz   4:3     60.000 kHz    108.000000 MHz
    GTF     :  1024x768   119.999931 Hz   4:3     98.760 kHz    139.054000 MHz
  Detailed Timing Descriptors:
    DTD 1:  3840x2160   59.996625 Hz  16:9    133.312 kHz    533.250000 MHz (841 mm x 473 mm)
                 Hfront   48 Hsync  64 Hback   48 Hpol P
                 Vfront    3 Vsync   5 Vback   54 Vpol N
    Display Range Limits:
      Monitor ranges (Range Limits Only): 48-144 Hz V, 350-350 kHz H, max dotclock 1400 MHz
    Display Product Name: 'PG38UQ'
    Display Product Serial Number: ...
  Extension blocks: 2
Checksum: 0xc1

----------------

Block 1, CTA-861 Extension Block:
  Revision: 3
  Underscans IT Video Formats by default
  Basic audio support
  Supports YCbCr 4:4:4
  Supports YCbCr 4:2:2
  Native DTDs: 1
  Video Data Block:
    VIC   4:  1280x720    60.000000 Hz  16:9     45.000 kHz     74.250000 MHz
    VIC  19:  1280x720    50.000000 Hz  16:9     37.500 kHz     74.250000 MHz
    VIC  31:  1920x1080   50.000000 Hz  16:9     56.250 kHz    148.500000 MHz
    VIC  16:  1920x1080   60.000000 Hz  16:9     67.500 kHz    148.500000 MHz
    VIC  15:  1440x480    59.940060 Hz  16:9     31.469 kHz     54.000000 MHz
    VIC  14:  1440x480    59.940060 Hz   4:3     31.469 kHz     54.000000 MHz
    VIC   1:   640x480    59.940476 Hz   4:3     31.469 kHz     25.175000 MHz
    VIC  30:  1440x576    50.000000 Hz  16:9     31.250 kHz     54.000000 MHz
    VIC  29:  1440x576    50.000000 Hz   4:3     31.250 kHz     54.000000 MHz
    VIC  93:  3840x2160   24.000000 Hz  16:9     54.000 kHz    297.000000 MHz
    VIC  94:  3840x2160   25.000000 Hz  16:9     56.250 kHz    297.000000 MHz
    VIC  95:  3840x2160   30.000000 Hz  16:9     67.500 kHz    297.000000 MHz
    VIC  96:  3840x2160   50.000000 Hz  16:9    112.500 kHz    594.000000 MHz
    VIC  97:  3840x2160   60.000000 Hz  16:9    135.000 kHz    594.000000 MHz
    VIC 118:  3840x2160  120.000000 Hz  16:9    270.000 kHz   1188.000000 MHz
    VIC   3:   720x480    59.940060 Hz  16:9     31.469 kHz     27.000000 MHz
    VIC   2:   720x480    59.940060 Hz   4:3     31.469 kHz     27.000000 MHz
    VIC  18:   720x576    50.000000 Hz  16:9     31.250 kHz     27.000000 MHz
    VIC  17:   720x576    50.000000 Hz   4:3     31.250 kHz     27.000000 MHz
    VIC  63:  1920x1080  120.000000 Hz  16:9    135.000 kHz    297.000000 MHz
    VIC  32:  1920x1080   24.000000 Hz  16:9     27.000 kHz     74.250000 MHz
    VIC  33:  1920x1080   25.000000 Hz  16:9     28.125 kHz     74.250000 MHz
    VIC  34:  1920x1080   30.000000 Hz  16:9     33.750 kHz     74.250000 MHz
    VIC  64:  1920x1080  100.000000 Hz  16:9    112.500 kHz    297.000000 MHz
    VIC 117:  3840x2160  100.000000 Hz  16:9    225.000 kHz   1188.000000 MHz
  Audio Data Block:
    Linear PCM:
      Max channels: 2
      Supported sample rates (kHz): 48 44.1 32
      Supported sample sizes (bits): 24 20 16
  Speaker Allocation Data Block:
    FL/FR - Front Left/Right
  Video Capability Data Block:
    YCbCr quantization: Selectable (via AVI YQ)
    RGB quantization: Selectable (via AVI Q)
    PT scan behavior: Always Underscanned
    IT scan behavior: Always Underscanned
    CE scan behavior: Always Underscanned
  Colorimetry Data Block:
    xvYCC601
    BT2020YCC
    BT2020RGB
    Gamut Boundary Description Metadata Profile P0
  HDR Static Metadata Data Block:
    Electro optical transfer functions:
      Traditional gamma - SDR luminance range
      SMPTE ST2084
    Supported static metadata descriptors:
      Static metadata type 1
    Desired content max luminance: 122 (702.501 cd/m^2)
    Desired content max frame-average luminance: 122 (702.501 cd/m^2)
    Desired content min luminance: 29 (0.091 cd/m^2)
  Vendor-Specific Data Block (AMD), OUI 00-00-1A:
    Version: 2
    Feature Caps: 0x0b
      Local Dimming Supported
    Minimum Refresh Rate: 48 Hz
    Maximum Refresh Rate: 144 Hz
    Flags 1.x: 0x00
    Flags 2.x: 0x05
      ST 2084 (PQ) EOTF Supported
      Linear EOTF (Windows scRGB, 0.0 - 125.0) Supported
      Gamma 2.2 EOTF Supported
      BT.2020 Gamut Supported
    Maximum luminance: 120 (672.717 cd/m^2)
    Minimum luminance: 22 (0.050 cd/m^2)
    Maximum luminance (without local dimming): 120 (672.717 cd/m^2)
    Minimum luminance (without local dimming): 44 (0.200 cd/m^2)
  Detailed Timing Descriptors:
    DTD 2:  2560x1440  119.997589 Hz  16:9    182.996 kHz    497.750000 MHz (841 mm x 473 mm)
                 Hfront   48 Hsync  32 Hback   80 Hpol P
                 Vfront    3 Vsync   5 Vback   77 Vpol N
Checksum: 0x96  Unused space in Extension Block: 43 bytes

----------------

Block 2, DisplayID Extension Block:
  Version: 1.2
  Extension Count: 0
  Display Product Type: Standalone display device
  Video Timing Modes Type 1 - Detailed Timings Data Block:
    DTD:  3840x2160  143.926056 Hz  16:9    327.000 kHz   1308.000000 MHz (aspect 16:9, no 3D stereo, preferred)
               Hfront   48 Hsync  32 Hback   80 Hpol P
               Vfront    3 Vsync   5 Vback  104 Vpol N
    DTD:  3840x2160  119.916922 Hz  16:9    274.250 kHz   1097.000000 MHz (aspect 16:9, no 3D stereo)
               Hfront   48 Hsync  32 Hback   80 Hpol P
               Vfront    3 Vsync   5 Vback  119 Vpol N
    DTD:  3840x2160  100.000000 Hz  16:9    226.500 kHz    906.000000 MHz (aspect 16:9, no 3D stereo)
               Hfront   48 Hsync  32 Hback   80 Hpol P
               Vfront    3 Vsync   5 Vback   97 Vpol N
    DTD:  2560x1440  143.973257 Hz  16:9    222.151 kHz    604.250000 MHz (aspect 16:9, no 3D stereo)
               Hfront   48 Hsync  32 Hback   80 Hpol P
               Vfront    3 Vsync   5 Vback   95 Vpol N
    DTD:  1920x2160   59.987970 Hz  16:9    133.293 kHz    277.250000 MHz (aspect 16:9, no 3D stereo)
               Hfront   48 Hsync  32 Hback   80 Hpol P
               Vfront    3 Vsync  10 Vback   49 Vpol N
  Checksum: 0xf2
Checksum: 0x90

----------------

Warnings:

Block 0, Base EDID:
  Vendor & Product Identification: The serial number is one of the known dummy values, it should probably be set to 0.
Block 1, CTA-861 Extension Block:
  Video Data Block: VIC 4 and the first DTD are not identical. Is this intended?
  Video Capability Data Block: S_PT is equal to S_IT and S_CE, so should be set to 0 instead.
  Colorimetry Data Block: Set the sRGB colorimetry bit to avoid interop issues.
  Display Product Serial Number is set, so the Serial Number in the Base EDID should be 0.
EDID:
  Base EDID: Some timings are out of range of the Monitor Ranges:
    Vertical Freq: 24.000 - 143.973 Hz (Monitor: 48.000 - 144.000 Hz)
    Horizontal Freq: 27.000 - 327.000 kHz (Monitor: 350.000 - 350.000 kHz)

Failures:

EDID:
  Extension Block 3 started with EDID header, ignoring Extension Blocks >= 3.
  DisplayID: Missing DisplayID Display Parameters Data Block.

EDID conformity: FAIL
