edid-decode (hex):

00 ff ff ff ff ff ff 00 1e 6d 35 77 ff ff ff ff
ff 1d 01 04 b5 59 27 78 3b e4 81 ae 4f 41 ae 26
0e 50 54 21 08 00 01 01 01 01 01 01 01 01 01 01
01 01 01 01 01 01 4c 9a 00 a0 f0 40 2e 60 30 20
35 00 7a 84 31 00 00 1a 00 00 00 ff 00 23 41 53
4e 56 67 42 64 53 49 6c 33 64 00 00 00 fd 00 01
af ff ff 7a 01 0a 20 20 20 20 20 20 00 00 00 fc
00 33 38 47 4c 39 35 30 47 0a 20 20 20 20 02 f5

02 03 20 f1 23 09 07 01 83 01 00 00 65 4b 04 00
01 01 e3 05 c0 00 e2 00 6a e6 06 05 01 60 5a 28
31 dd 00 a0 f0 40 42 60 30 20 35 00 7a 84 31 00
00 1a 00 00 00 00 00 00 00 00 00 00 00 00 00 00
00 00 00 00 00 00 00 00 00 00 00 00 00 00 00 00
00 00 00 00 00 00 00 00 00 00 00 00 00 00 00 00
00 00 00 00 00 00 00 00 00 00 00 00 00 00 00 00
00 00 00 00 00 00 00 00 00 00 00 00 00 00 00 66

00 ff ff ff ff ff ff 00 1e 6d 35 77 ff ff ff ff
ff 1d 01 04 b5 59 27 78 3b e4 81 ae 4f 41 ae 26
0e 50 54 21 08 00 01 01 01 01 01 01 01 01 01 01
01 01 01 01 01 01 4c 9a 00 a0 f0 40 2e 60 30 20
35 00 7a 84 31 00 00 1a 00 00 00 ff 00 23 41 53
4e 56 67 42 64 53 49 6c 33 64 00 00 00 fd 00 01
af ff ff 7a 01 0a 20 20 20 20 20 20 00 00 00 fc
00 33 38 47 4c 39 35 30 47 0a 20 20 20 20 02 f5

00 ff ff ff ff ff ff 00 1e 6d 35 77 ff ff ff ff
ff 1d 01 04 b5 59 27 78 3b e4 81 ae 4f 41 ae 26
0e 50 54 21 08 00 01 01 01 01 01 01 01 01 01 01
01 01 01 01 01 01 4c 9a 00 a0 f0 40 2e 60 30 20
35 00 7a 84 31 00 00 1a 00 00 00 ff 00 23 41 53
4e 56 67 42 64 53 49 6c 33 64 00 00 00 fd 00 01
af ff ff 7a 01 0a 20 20 20 20 20 20 00 00 00 fc
00 33 38 47 4c 39 35 30 47 0a 20 20 20 20 02 f5

02 03 20 f1 23 09 07 01 83 01 00 00 65 4b 04 00
01 01 e3 05 c0 00 e2 00 6a e6 06 05 01 60 5a 28
31 dd 00 a0 f0 40 42 60 30 20 35 00 7a 84 31 00
00 1a 00 00 00 00 00 00 00 00 00 00 00 00 00 00
00 00 00 00 00 00 00 00 00 00 00 00 00 00 00 00
00 00 00 00 00 00 00 00 00 00 00 00 00 00 00 00
00 00 00 00 00 00 00 00 00 00 00 00 00 00 00 00
00 00 00 00 00 00 00 00 00 00 00 00 00 00 00 66

00 ff ff ff ff ff ff 00 1e 6d 35 77 ff ff ff ff
ff 1d 01 04 b5 59 27 78 3b e4 81 ae 4f 41 ae 26
0e 50 54 21 08 00 01 01 01 01 01 01 01 01 01 01
01 01 01 01 01 01 4c 9a 00 a0 f0 40 2e 60 30 20
35 00 7a 84 31 00 00 1a 00 00 00 ff 00 23 41 53
4e 56 67 42 64 53 49 6c 33 64 00 00 00 fd 00 01
af ff ff 7a 01 0a 20 20 20 20 20 20 00 00 00 fc
00 33 38 47 4c 39 35 30 47 0a 20 20 20 20 02 f5

----------------

Block 0, Base EDID:
  EDID Structure Version & Revision: 1.4
  Vendor & Product Identification:
    Manufacturer: GSM
    Model: 30517
    Serial Number: ...
    Model year: 2019
  Basic Display Parameters & Features:
    Digital display
    Bits per primary color channel: 10
    DisplayPort interface
    Maximum image size: 89 cm x 39 cm
    Gamma: 2.20
    DPMS levels: Off
    Supported color formats: RGB 4:4:4, YCrCb 4:4:4, YCrCb 4:2:2
    First detailed timing includes the native pixel format and preferred refresh rate
    Display supports continuous frequencies
  Color Characteristics:
    Red  : 0.6826, 0.3105
    Green: 0.2548, 0.6796
    Blue : 0.1503, 0.0546
    White: 0.3125, 0.3291
  Established Timings I & II:
    DMT 0x04:   640x480    59.940476 Hz   4:3     31.469 kHz     25.175000 MHz
    DMT 0x09:   800x600    60.316541 Hz   4:3     37.879 kHz     40.000000 MHz
    DMT 0x10:  1024x768    60.003840 Hz   4:3     48.363 kHz     65.000000 MHz
  Standard Timings: none
  Detailed Timing Descriptors:
    DTD 1:  3840x1600   59.993925 Hz  12:5     98.750 kHz    395.000000 MHz (890 mm x 388 mm)
                 Hfront   48 Hsync  32 Hback   80 Hpol P
                 Vfront    3 Vsync   5 Vback   38 Vpol N
    Display Product Serial Number: ...
    Display Range Limits:
      Monitor ranges (Range Limits Only): 1-175 Hz V, 255-255 kHz H, max dotclock 1220 MHz
    Display Product Name: '38GL950G'
  Extension blocks: 2
Checksum: 0xf5

----------------

Block 1, CTA-861 Extension Block:
  Revision: 3
  Underscans IT Video Formats by default
  Basic audio support
  Supports YCbCr 4:4:4
  Supports YCbCr 4:2:2
  Native DTDs: 1
  Audio Data Block:
    Linear PCM:
      Max channels: 2
      Supported sample rates (kHz): 48 44.1 32
      Supported sample sizes (bits): 16
  Speaker Allocation Data Block:
    FL/FR - Front Left/Right
  Vendor-Specific Data Block (NVIDIA), OUI 00-04-4B:
    01 01                                           '..'
  Colorimetry Data Block:
    BT2020YCC
    BT2020RGB
  Video Capability Data Block:
    YCbCr quantization: No Data
    RGB quantization: Selectable (via AVI Q)
    PT scan behavior: Always Underscanned
    IT scan behavior: Always Underscanned
    CE scan behavior: Always Underscanned
  HDR Static Metadata Data Block:
    Electro optical transfer functions:
      Traditional gamma - SDR luminance range
      SMPTE ST2084
    Supported static metadata descriptors:
      Static metadata type 1
    Desired content max luminance: 96 (400.000 cd/m^2)
    Desired content max frame-average luminance: 90 (351.250 cd/m^2)
    Desired content min luminance: 40 (0.098 cd/m^2)
  Detailed Timing Descriptors:
    DTD 2:  3840x1600   84.971489 Hz  12:5    141.562 kHz    566.250000 MHz (890 mm x 388 mm)
                 Hfront   48 Hsync  32 Hback   80 Hpol P
                 Vfront    3 Vsync   5 Vback   58 Vpol N
Checksum: 0x66  Unused space in Extension Block: 77 bytes

----------------

Warnings:

Block 0, Base EDID:
  Detailed Timing Descriptor #1: Image size is 890x388 mm, but based on the picture AR it should be 890x370 mm.
Block 1, CTA-861 Extension Block:
  Colorimetry Data Block: Set the sRGB colorimetry bit to avoid interop issues.
  Video Capability Data Block: Set Selectable YCbCr Quantization to avoid interop issues.
  Video Capability Data Block: S_PT is equal to S_IT and S_CE, so should be set to 0 instead.
  Detailed Timing Descriptor #2: Image size is 890x388 mm, but based on the picture AR it should be 890x370 mm.
  Display Product Serial Number is set, so the Serial Number in the Base EDID should be 0.
EDID:
  Base EDID: Some timings are out of range of the Monitor Ranges:
    Horizontal Freq: 31.468 - 141.562 kHz (Monitor: 255.000 - 255.000 kHz)

Failures:

EDID:
  Extension Block 2 started with EDID header, ignoring Extension Blocks >= 2.
  Base EDID: EDID specified 2 extension block(s), but found 1 extension block(s).

EDID conformity: FAIL
