edid-decode (hex):

00 ff ff ff ff ff ff 00 06 af ed 22 00 00 00 00
00 1a 01 04 95 22 13 78 11 6e 85 93 58 58 92 28
1e 50 54 00 00 00 01 01 01 01 01 01 01 01 01 01
01 01 01 01 01 01 14 37 80 a6 70 38 2e 40 6c 30
aa 00 58 c1 10 00 00 18 b8 24 80 a6 70 38 2e 40
6c 30 aa 00 58 c1 10 00 00 18 00 00 00 00 00 00
00 00 00 00 00 00 00 00 00 00 00 00 00 00 00 02
00 10 48 ff 0f 3c 6e 0f 16 28 6e 20 20 20 00 34

----------------

Block 0, Base EDID:
  EDID Structure Version & Revision: 1.4
  Vendor & Product Identification:
    Manufacturer: AUO
    Model: 8941
    Made in: 2016
  Basic Display Parameters & Features:
    Digital display
    Bits per primary color channel: 6
    DisplayPort interface
    Maximum image size: 34 cm x 19 cm
    Gamma: 2.20
    Supported color formats: RGB 4:4:4, YCrCb 4:2:2
    First detailed timing does not include the native pixel format and preferred refresh rate
    Display supports continuous frequencies
  Color Characteristics:
    Red  : 0.5751, 0.3457
    Green: 0.3466, 0.5722
    Blue : 0.1582, 0.1171
    White: 0.3134, 0.3291
  Established Timings I & II: none
  Standard Timings: none
  Detailed Timing Descriptors:
    DTD 1:  1920x1080   60.029734 Hz  16:9     67.593 kHz    141.000000 MHz (344 mm x 193 mm)
                 Hfront  108 Hsync  48 Hback   10 Hpol N
                 Vfront   10 Vsync  10 Vback   26 Vpol N
    DTD 2:  1920x1080   40.019823 Hz  16:9     45.062 kHz     94.000000 MHz (344 mm x 193 mm)
                 Hfront  108 Hsync  48 Hback   10 Hpol N
                 Vfront   10 Vsync  10 Vback   26 Vpol N
    Empty Descriptor
    Manufacturer-Specified Display Descriptor (0x02): 00 02 00 10 48 ff 0f 3c 6e 0f 16 28 6e 20 20 20 '....H..<n..(n   '
Checksum: 0x34

----------------

Warnings:

Block 0, Base EDID:
  Missing Display Product Name.
EDID:
  No Native Video Resolution was defined.

Failures:

Block 0, Base EDID:
  Empty Descriptor: Use Dummy Descriptor instead of all zeroes.
  Missing Display Range Limits Descriptor.

EDID conformity: FAIL
