edid-decode (hex):

00 ff ff ff ff ff ff 00 30 e4 a0 04 00 00 00 00
00 18 01 04 a5 1f 11 78 02 17 15 a5 56 51 9c 27
0c 50 54 00 00 00 01 01 01 01 01 01 01 01 01 01
01 01 01 01 01 01 e4 5c 00 a0 a0 a0 11 50 30 20
23 00 36 ae 10 00 00 1a 50 4a 00 a0 a0 a0 11 50
30 20 23 00 36 ae 10 00 00 1a 00 00 00 fe 00 54
59 44 32 46 80 31 34 30 51 48 31 0a 00 00 00 00
00 02 41 31 9e 00 00 00 00 0b 01 0a 20 20 00 d1

----------------

Block 0, Base EDID:
  EDID Structure Version & Revision: 1.4
  Vendor & Product Identification:
    Manufacturer: LGD
    Model: 1184
    Made in: 2014
  Basic Display Parameters & Features:
    Digital display
    Bits per primary color channel: 8
    DisplayPort interface
    Maximum image size: 31 cm x 17 cm
    Gamma: 2.20
    Supported color formats: RGB 4:4:4
    First detailed timing includes the native pixel format and preferred refresh rate
  Color Characteristics:
    Red  : 0.6445, 0.3369
    Green: 0.3173, 0.6123
    Blue : 0.1523, 0.0478
    White: 0.3134, 0.3291
  Established Timings I & II: none
  Standard Timings: none
  Detailed Timing Descriptors:
    DTD 1:  2560x1440   60.004441 Hz  16:9     87.426 kHz    237.800000 MHz (310 mm x 174 mm)
                 Hfront   48 Hsync  32 Hback   80 Hpol P
                 Vfront    2 Vsync   3 Vback   12 Vpol N
    DTD 2:  2560x1440   48.003553 Hz  16:9     69.941 kHz    190.240000 MHz (310 mm x 174 mm)
                 Hfront   48 Hsync  32 Hback   80 Hpol P
                 Vfront    2 Vsync   3 Vback   12 Vpol N
    Alphanumeric Data String: 'TYD2F.140QH1'
    Manufacturer-Specified Display Descriptor (0x00): 00 00 00 02 41 31 9e 00 00 00 00 0b 01 0a 20 20 '....A1........  '
Checksum: 0xd1

----------------

Warnings:

Block 0, Base EDID:
  Alphanumeric Data String: Non-ASCII character 0x80 at position 5, can cause problems.
  Missing Display Product Name.

EDID conformity: PASS
