edid-decode (hex):

00 ff ff ff ff ff ff 00 0d 12 08 06 70 03 00 00
15 15 01 04 a5 34 20 78 ea 80 42 ac 51 30 b4 25
10 50 53 00 00 00 01 01 01 01 01 01 01 01 01 01
01 01 01 01 01 01 9a 38 80 00 71 38 1e 40 2a 54
5a 00 fd 1e 11 00 00 1c 00 00 00 f7 00 0a 00 00
00 00 00 00 00 00 00 00 00 00 00 00 00 fd 00 38
4c 1e 53 11 00 0a 20 20 20 20 20 20 00 00 00 fc
00 32 33 22 20 41 49 4f 0a 20 20 20 20 20 00 e4

00 ff ff ff ff ff ff 00 0d 12 08 06 70 03 00 00
15 15 01 04 a5 34 20 78 ea 80 42 ac 51 30 b4 25
10 50 53 00 00 00 01 01 01 01 01 01 01 01 01 01
01 01 01 01 01 01 9a 38 80 00 71 38 1e 40 2a 54
5a 00 fd 1e 11 00 00 1c 00 00 00 f7 00 0a 00 00
00 00 00 00 00 00 00 00 00 00 00 00 00 fd 00 38
4c 1e 53 11 00 0a 20 20 20 20 20 20 00 00 00 fc
00 32 33 22 20 41 49 4f 0a 20 20 20 20 20 00 e4

----------------

Block 0, Base EDID:
  EDID Structure Version & Revision: 1.4
  Vendor & Product Identification:
    Manufacturer: CHR
    Model: 1544
    Serial Number: ...
    Made in: week 21 of 2011
  Basic Display Parameters & Features:
    Digital display
    Bits per primary color channel: 8
    DisplayPort interface
    Maximum image size: 52 cm x 32 cm
    Gamma: 2.20
    DPMS levels: Standby Suspend Off
    Supported color formats: RGB 4:4:4, YCrCb 4:4:4
    First detailed timing includes the native pixel format and preferred refresh rate
  Color Characteristics:
    Red  : 0.6738, 0.3164
    Green: 0.1875, 0.7031
    Blue : 0.1455, 0.0625
    White: 0.3125, 0.3261
  Established Timings I & II: none
  Standard Timings: none
  Detailed Timing Descriptors:
    DTD 1:  1920x1080   59.991057 Hz  16:9     66.590 kHz    144.900000 MHz (509 mm x 286 mm)
                 Hfront   42 Hsync  84 Hback  130 Hpol N
                 Vfront    5 Vsync  10 Vback   15 Vpol P
    Established timings III:
    Display Range Limits:
      Monitor ranges (GTF): 56-76 Hz V, 30-83 kHz H, max dotclock 170 MHz
    Display Product Name: '23" AIO'
Checksum: 0xe4

----------------

Warnings:

Block 0, Base EDID:
  Display Range Limits: GTF support is deprecated in EDID 1.4.

Failures:

Block 0, Base EDID:
  Detailed Timing Descriptor #1: Mismatch of image size 509x286 mm vs display size 520x320 mm.
  Display Range Limits: GTF is supported, but the display does not support continuous frequencies.
EDID:
  Extension Block 1 started with EDID header, ignoring Extension Blocks >= 1.

EDID conformity: FAIL
