edid-decode (hex):

00 ff ff ff ff ff ff 00 1e 6d 4b 77 a6 1b 00 00
03 1e 01 04 b5 50 21 78 9f f6 75 af 4e 42 ab 26
0e 50 54 21 09 00 71 40 81 80 81 c0 a9 c0 b3 00
d1 c0 81 00 d1 cf 4e d4 70 a0 d0 a0 46 50 30 20
3a 00 20 4f 31 00 00 1a 00 00 00 fd 00 30 a0 fa
fa 5a 01 0a 20 20 20 20 20 20 00 00 00 fc 00 33
34 47 4e 38 35 30 0a 20 20 20 20 20 00 00 00 ff
00 30 30 33 4e 54 53 55 30 37 30 37 38 0a 02 ee

02 03 30 71 23 09 07 07 47 10 04 03 01 1f 13 12
83 01 00 00 e3 05 c0 00 e2 00 6a e6 06 05 01 61
61 3d 6d 1a 00 00 02 05 30 a0 00 04 61 3d 61 3d
da a7 70 50 d5 a0 34 50 90 20 3a 30 20 4f 31 00
00 1a 00 00 00 00 00 00 00 00 00 00 00 00 00 00
00 00 00 00 00 00 00 00 00 00 00 00 00 00 00 00
00 00 00 00 00 00 00 00 00 00 00 00 00 00 00 00
00 00 00 00 00 00 00 00 00 00 00 00 00 00 00 68

70 12 79 00 00 03 01 28 66 38 01 86 6f 0d ef 00
2f 80 1f 00 9f 05 45 00 02 00 09 00 4c 5b 01 06
6f 0d ef 00 8f 80 1f 00 9f 05 45 00 02 00 09 00
00 00 00 00 00 00 00 00 00 00 00 00 00 00 00 00
00 00 00 00 00 00 00 00 00 00 00 00 00 00 00 00
00 00 00 00 00 00 00 00 00 00 00 00 00 00 00 00
00 00 00 00 00 00 00 00 00 00 00 00 00 00 00 00
00 00 00 00 00 00 00 00 00 00 00 00 00 00 bc 90

00 ff ff ff ff ff ff 00 1e 6d 4b 77 a6 1b 00 00
03 1e 01 04 b5 50 21 78 9f f6 75 af 4e 42 ab 26
0e 50 54 21 09 00 71 40 81 80 81 c0 a9 c0 b3 00
d1 c0 81 00 d1 cf 4e d4 70 a0 d0 a0 46 50 30 20
3a 00 20 4f 31 00 00 1a 00 00 00 fd 00 30 a0 fa
fa 5a 01 0a 20 20 20 20 20 20 00 00 00 fc 00 33
34 47 4e 38 35 30 0a 20 20 20 20 20 00 00 00 ff
00 30 30 33 4e 54 53 55 30 37 30 37 38 0a 02 ee

02 03 30 71 23 09 07 07 47 10 04 03 01 1f 13 12
83 01 00 00 e3 05 c0 00 e2 00 6a e6 06 05 01 61
61 3d 6d 1a 00 00 02 05 30 a0 00 04 61 3d 61 3d
da a7 70 50 d5 a0 34 50 90 20 3a 30 20 4f 31 00
00 1a 00 00 00 00 00 00 00 00 00 00 00 00 00 00
00 00 00 00 00 00 00 00 00 00 00 00 00 00 00 00
00 00 00 00 00 00 00 00 00 00 00 00 00 00 00 00
00 00 00 00 00 00 00 00 00 00 00 00 00 00 00 68

70 12 79 00 00 03 01 28 66 38 01 86 6f 0d ef 00
2f 80 1f 00 9f 05 45 00 02 00 09 00 4c 5b 01 06
6f 0d ef 00 8f 80 1f 00 9f 05 45 00 02 00 09 00
00 00 00 00 00 00 00 00 00 00 00 00 00 00 00 00
00 00 00 00 00 00 00 00 00 00 00 00 00 00 00 00
00 00 00 00 00 00 00 00 00 00 00 00 00 00 00 00
00 00 00 00 00 00 00 00 00 00 00 00 00 00 00 00
00 00 00 00 00 00 00 00 00 00 00 00 00 00 bc 90

----------------

Block 0, Base EDID:
  EDID Structure Version & Revision: 1.4
  Vendor & Product Identification:
    Manufacturer: GSM
    Model: 30539
    Serial Number: ...
    Made in: week 3 of 2020
  Basic Display Parameters & Features:
    Digital display
    Bits per primary color channel: 10
    DisplayPort interface
    Maximum image size: 80 cm x 33 cm
    Gamma: 2.20
    DPMS levels: Standby
    Supported color formats: RGB 4:4:4, YCrCb 4:4:4, YCrCb 4:2:2
    Default (sRGB) color space is primary color space
    First detailed timing includes the native pixel format and preferred refresh rate
    Display supports continuous frequencies
  Color Characteristics:
    Red  : 0.6865, 0.3076
    Green: 0.2587, 0.6699
    Blue : 0.1494, 0.0576
    White: 0.3134, 0.3291
  Established Timings I & II:
    DMT 0x04:   640x480    59.940476 Hz   4:3     31.469 kHz     25.175000 MHz
    DMT 0x09:   800x600    60.316541 Hz   4:3     37.879 kHz     40.000000 MHz
    DMT 0x10:  1024x768    60.003840 Hz   4:3     48.363 kHz     65.000000 MHz
    DMT 0x24:  1280x1024   75.024675 Hz   5:4     79.976 kHz    135.000000 MHz
  Standard Timings:
    GTF     :  1152x864    60.000000 Hz   4:3     53.700 kHz     81.624000 MHz
    DMT 0x23:  1280x1024   60.019740 Hz   5:4     63.981 kHz    108.000000 MHz
    DMT 0x55:  1280x720    60.000000 Hz  16:9     45.000 kHz     74.250000 MHz
    DMT 0x53:  1600x900    60.000000 Hz  16:9     60.000 kHz    108.000000 MHz (RB)
    DMT 0x3a:  1680x1050   59.954250 Hz  16:10    65.290 kHz    146.250000 MHz
    DMT 0x52:  1920x1080   60.000000 Hz  16:9     67.500 kHz    148.500000 MHz
    DMT 0x1c:  1280x800    59.810326 Hz  16:10    49.702 kHz     83.500000 MHz
    GTF     :  1920x1080   75.000068 Hz  16:9     84.600 kHz    220.637000 MHz
  Detailed Timing Descriptors:
    DTD 1:  3440x1440   99.981604 Hz  43:18   150.972 kHz    543.500000 MHz (800 mm x 335 mm)
                 Hfront   48 Hsync  32 Hback   80 Hpol P
                 Vfront    3 Vsync  10 Vback   57 Vpol N
    Display Range Limits:
      Monitor ranges (Range Limits Only): 48-160 Hz V, 250-250 kHz H, max dotclock 900 MHz
    Display Product Name: '34GN850'
    Display Product Serial Number: ...
  Extension blocks: 2
Checksum: 0xee

----------------

Block 1, CTA-861 Extension Block:
  Revision: 3
  Basic audio support
  Supports YCbCr 4:4:4
  Supports YCbCr 4:2:2
  Native detailed modes: 1
  Audio Data Block:
    Linear PCM:
      Max channels: 2
      Supported sample rates (kHz): 48 44.1 32
      Supported sample sizes (bits): 24 20 16
  Video Data Block:
    VIC  16:  1920x1080   60.000000 Hz  16:9     67.500 kHz    148.500000 MHz
    VIC   4:  1280x720    60.000000 Hz  16:9     45.000 kHz     74.250000 MHz
    VIC   3:   720x480    59.940060 Hz  16:9     31.469 kHz     27.000000 MHz
    VIC   1:   640x480    59.940476 Hz   4:3     31.469 kHz     25.175000 MHz
    VIC  31:  1920x1080   50.000000 Hz  16:9     56.250 kHz    148.500000 MHz
    VIC  19:  1280x720    50.000000 Hz  16:9     37.500 kHz     74.250000 MHz
    VIC  18:   720x576    50.000000 Hz  16:9     31.250 kHz     27.000000 MHz
  Speaker Allocation Data Block:
    FL/FR - Front Left/Right
  Colorimetry Data Block:
    BT2020YCC
    BT2020RGB
  Video Capability Data Block:
    YCbCr quantization: No Data
    RGB quantization: Selectable (via AVI Q)
    PT scan behavior: Always Underscanned
    IT scan behavior: Always Underscanned
    CE scan behavior: Always Underscanned
  HDR Static Metadata Data Block:
    Electro optical transfer functions:
      Traditional gamma - SDR luminance range
      SMPTE ST2084
    Supported static metadata descriptors:
      Static metadata type 1
    Desired content max luminance: 97 (408.759 cd/m^2)
    Desired content max frame-average luminance: 97 (408.759 cd/m^2)
    Desired content min luminance: 61 (0.234 cd/m^2)
  Vendor-Specific Data Block (AMD), OUI 00-00-1A:
    Version: 2
    Feature Caps: 0x05
      Global Backlight Control Supported
    Minimum Refresh Rate: 48 Hz
    Maximum Refresh Rate: 160 Hz
    Flags 1.x: 0x00
    Flags 2.x: 0x04
  Detailed Timing Descriptors:
    DTD 2:  3440x1440   60.000559 Hz  43:18    89.521 kHz    429.700000 MHz (800 mm x 335 mm)
                 Hfront  144 Hsync 800 Hback  416 Hpol P
                 Vfront    3 Vsync  10 Vback   39 Vpol N
Checksum: 0x68  Unused space in Extension Block: 61 bytes

----------------

Block 2, DisplayID Extension Block:
  Version: 1.2
  Extension Count: 0
  Display Product Type: Extension Section
  Video Timing Modes Type 1 - Detailed Timings Data Block:
    DTD:  3440x1440  143.922761 Hz  64:27   217.323 kHz    799.750000 MHz (aspect 64:27, no 3D stereo, preferred)
               Hfront   48 Hsync  32 Hback  160 Hpol P
               Vfront    3 Vsync  10 Vback   57 Vpol N
    DTD:  3440x1440  160.000360 Hz  64:27   241.601 kHz    889.090000 MHz (aspect 64:27, no 3D stereo)
               Hfront  144 Hsync  32 Hback   64 Hpol P
               Vfront    3 Vsync  10 Vback   57 Vpol N
  Checksum: 0xbc
Checksum: 0x90

----------------

Block 3, Unknown EDID Extension Block 0x00:
  00 ff ff ff ff ff ff 00 1e 6d 4b 77 a6 1b 00 00 '.........mKw....'
  03 1e 01 04 b5 50 21 78 9f f6 75 af 4e 42 ab 26 '.....P!x..u.NB.&'
  0e 50 54 21 09 00 71 40 81 80 81 c0 a9 c0 b3 00 '.PT!..q@........'
  d1 c0 81 00 d1 cf 4e d4 70 a0 d0 a0 46 50 30 20 '......N.p...FP0 '
  3a 00 20 4f 31 00 00 1a 00 00 00 fd 00 30 a0 fa ':. O1........0..'
  fa 5a 01 0a 20 20 20 20 20 20 00 00 00 fc 00 33 '.Z..      .....3'
  34 47 4e 38 35 30 0a 20 20 20 20 20 00 00 00 ff '4GN850.     ....'
  00 30 30 33 4e 54 53 55 30 37 30 37 38 0a 02 ee '.003NTSU07078...'
Checksum: 0xee

----------------

Block 4, CTA-861 Extension Block:
  Revision: 3
  Basic audio support
  Supports YCbCr 4:4:4
  Supports YCbCr 4:2:2
  Native detailed modes: 1
  Audio Data Block:
    Linear PCM:
      Max channels: 2
      Supported sample rates (kHz): 48 44.1 32
      Supported sample sizes (bits): 24 20 16
  Video Data Block:
    VIC  16:  1920x1080   60.000000 Hz  16:9     67.500 kHz    148.500000 MHz
    VIC   4:  1280x720    60.000000 Hz  16:9     45.000 kHz     74.250000 MHz
    VIC   3:   720x480    59.940060 Hz  16:9     31.469 kHz     27.000000 MHz
    VIC   1:   640x480    59.940476 Hz   4:3     31.469 kHz     25.175000 MHz
    VIC  31:  1920x1080   50.000000 Hz  16:9     56.250 kHz    148.500000 MHz
    VIC  19:  1280x720    50.000000 Hz  16:9     37.500 kHz     74.250000 MHz
    VIC  18:   720x576    50.000000 Hz  16:9     31.250 kHz     27.000000 MHz
  Speaker Allocation Data Block:
    FL/FR - Front Left/Right
  Colorimetry Data Block:
    BT2020YCC
    BT2020RGB
  Video Capability Data Block:
    YCbCr quantization: No Data
    RGB quantization: Selectable (via AVI Q)
    PT scan behavior: Always Underscanned
    IT scan behavior: Always Underscanned
    CE scan behavior: Always Underscanned
  HDR Static Metadata Data Block:
    Electro optical transfer functions:
      Traditional gamma - SDR luminance range
      SMPTE ST2084
    Supported static metadata descriptors:
      Static metadata type 1
    Desired content max luminance: 97 (408.759 cd/m^2)
    Desired content max frame-average luminance: 97 (408.759 cd/m^2)
    Desired content min luminance: 61 (0.234 cd/m^2)
  Vendor-Specific Data Block (AMD), OUI 00-00-1A:
    Version: 2
    Feature Caps: 0x05
      Global Backlight Control Supported
    Minimum Refresh Rate: 48 Hz
    Maximum Refresh Rate: 160 Hz
    Flags 1.x: 0x00
    Flags 2.x: 0x04
  Detailed Timing Descriptors:
    DTD 3:  3440x1440   60.000559 Hz  43:18    89.521 kHz    429.700000 MHz (800 mm x 335 mm)
                 Hfront  144 Hsync 800 Hback  416 Hpol P
                 Vfront    3 Vsync  10 Vback   39 Vpol N
Checksum: 0x68  Unused space in Extension Block: 61 bytes

----------------

Block 5, DisplayID Extension Block:
  Version: 1.2
  Extension Count: 0
  Video Timing Modes Type 1 - Detailed Timings Data Block:
    DTD:  3440x1440  143.922761 Hz  64:27   217.323 kHz    799.750000 MHz (aspect 64:27, no 3D stereo, preferred)
               Hfront   48 Hsync  32 Hback  160 Hpol P
               Vfront    3 Vsync  10 Vback   57 Vpol N
    DTD:  3440x1440  160.000360 Hz  64:27   241.601 kHz    889.090000 MHz (aspect 64:27, no 3D stereo)
               Hfront  144 Hsync  32 Hback   64 Hpol P
               Vfront    3 Vsync  10 Vback   57 Vpol N
  Checksum: 0xbc
Checksum: 0x90

----------------

Warnings:

Block 1, CTA-861 Extension Block:
  IT Video Formats are overscanned by default, but normally this should be underscanned.
  Video Data Block: VIC 16 and the first DTD are not identical. Is this intended?
  Video Capability Data Block: Set Selectable YCbCr Quantization to avoid interop issues.
  Video Capability Data Block: S_PT is equal to S_IT and S_CE, so should be set to 0 instead.
  Display Product Serial Number is set, so the Serial Number in the Base EDID should be 0.
Block 4, CTA-861 Extension Block:
  IT Video Formats are overscanned by default, but normally this should be underscanned.
  Video Capability Data Block: Set Selectable YCbCr Quantization to avoid interop issues.
  Video Capability Data Block: S_PT is equal to S_IT and S_CE, so should be set to 0 instead.
EDID:
  Base EDID: Some timings are out of range of the Monitor Ranges:
    Horizontal Freq: 31.250 - 241.600 kHz (Monitor: 250.000 - 250.000 kHz)

Failures:

Block 0, Base EDID:
  Basic Display Parameters & Features: sRGB is signaled, but the chromaticities do not match.
Block 1, CTA-861 Extension Block:
  Video Capability Data Block: IT video formats are always underscanned, but bit 7 of Byte 3 of the CTA-861 Extension header is set to overscanned.
Block 2, DisplayID Extension Block:
  DisplayID Base Block has no product type.
  Expected 0 DisplayID Extension Block, but got 1.
Block 3, Base EDID:
  Unknown Extension Block.
Block 4, CTA-861 Extension Block:
  Video Data Block: Duplicate VIC 16.
  Video Data Block: Duplicate VIC 4.
  Video Data Block: Duplicate VIC 3.
  Video Data Block: Duplicate VIC 1.
  Video Data Block: Duplicate VIC 31.
  Video Data Block: Duplicate VIC 19.
  Video Data Block: Duplicate VIC 18.
  Speaker Allocation Data Block: Only one instance of this Data Block is allowed.
  Colorimetry Data Block: Only one instance of this Data Block is allowed.
  Video Capability Data Block: Only one instance of this Data Block is allowed.
  Video Capability Data Block: IT video formats are always underscanned, but bit 7 of Byte 3 of the CTA-861 Extension header is set to overscanned.
  HDR Static Metadata Data Block: Only one instance of this Data Block is allowed.
EDID:
  Base EDID: EDID specified 2 extension block(s), but found 5 extension block(s).

EDID conformity: FAIL
