edid-decode (hex):

00 ff ff ff ff ff ff 00 09 e5 81 0b 00 00 00 00
1a 20 01 04 a5 24 14 78 03 84 35 a6 52 4a 9b 25
0c 50 54 00 00 00 01 01 01 01 01 01 01 01 01 01
01 01 01 01 01 01 c1 a6 80 18 71 38 60 40 6c 30
aa 00 63 c8 10 00 00 1a a4 3c 80 18 71 38 60 40
6c 30 aa 00 63 c8 10 00 00 1a 00 00 00 00 00 00
00 00 00 00 00 00 00 00 00 00 00 00 00 00 00 02
00 0d 36 ff 0a 3c 96 23 1b 41 96 00 00 00 01 05

70 20 79 02 00 25 01 09 87 83 06 87 83 06 3c a5
80 81 00 13 72 1a 00 00 03 01 3c a5 00 00 53 4a
53 4a a5 00 00 00 00 00 00 00 00 00 00 00 00 00
00 00 00 00 00 00 00 00 00 00 00 00 00 00 00 00
00 00 00 00 00 00 00 00 00 00 00 00 00 00 00 00
00 00 00 00 00 00 00 00 00 00 00 00 00 00 00 00
00 00 00 00 00 00 00 00 00 00 00 00 00 00 00 00
00 00 00 00 00 00 00 00 00 00 00 00 00 00 d1 90

00 ff ff ff ff ff ff 00 09 e5 81 0b 00 00 00 00
1a 20 01 04 a5 24 14 78 03 84 35 a6 52 4a 9b 25
0c 50 54 00 00 00 01 01 01 01 01 01 01 01 01 01
01 01 01 01 01 01 c1 a6 80 18 71 38 60 40 6c 30
aa 00 63 c8 10 00 00 1a a4 3c 80 18 71 38 60 40
6c 30 aa 00 63 c8 10 00 00 1a 00 00 00 00 00 00
00 00 00 00 00 00 00 00 00 00 00 00 00 00 00 02
00 0d 36 ff 0a 3c 96 23 1b 41 96 00 00 00 01 05

70 20 79 02 00 25 01 09 87 83 06 87 83 06 3c a5
80 81 00 13 72 1a 00 00 03 01 3c a5 00 00 53 4a
53 4a a5 00 00 00 00 00 00 00 00 00 00 00 00 00
00 00 00 00 00 00 00 00 00 00 00 00 00 00 00 00
00 00 00 00 00 00 00 00 00 00 00 00 00 00 00 00
00 00 00 00 00 00 00 00 00 00 00 00 00 00 00 00
00 00 00 00 00 00 00 00 00 00 00 00 00 00 00 00
00 00 00 00 00 00 00 00 00 00 00 00 00 00 d1 90

----------------

Block 0, Base EDID:
  EDID Structure Version & Revision: 1.4
  Vendor & Product Identification:
    Manufacturer: BOE
    Model: 2945
    Made in: week 26 of 2022
  Basic Display Parameters & Features:
    Digital display
    Bits per primary color channel: 8
    DisplayPort interface
    Maximum image size: 36 cm x 20 cm
    Gamma: 2.20
    Supported color formats: RGB 4:4:4
    First detailed timing includes the native pixel format and preferred refresh rate
    Display supports continuous frequencies
  Color Characteristics:
    Red  : 0.6503, 0.3203
    Green: 0.2900, 0.6054
    Blue : 0.1445, 0.0498
    White: 0.3134, 0.3291
  Established Timings I & II: none
  Standard Timings: none
  Detailed Timing Descriptors:
    DTD 1:  1920x1080  165.000773 Hz  16:9    194.041 kHz    426.890000 MHz (355 mm x 200 mm)
                 Hfront  108 Hsync  48 Hback  124 Hpol P
                 Vfront   10 Vsync  10 Vback   76 Vpol N
    DTD 2:  1920x1080   60.003092 Hz  16:9     70.564 kHz    155.240000 MHz (355 mm x 200 mm)
                 Hfront  108 Hsync  48 Hback  124 Hpol P
                 Vfront   10 Vsync  10 Vback   76 Vpol N
    Empty Descriptor
    Manufacturer-Specified Display Descriptor (0x02): 00 02 00 0d 36 ff 0a 3c 96 23 1b 41 96 00 00 00 '....6..<.#.A....'
  Extension blocks: 1
Checksum: 0x05

----------------

Block 1, DisplayID Extension Block:
  Version: 2.0
  Extension Count: 0
  Display Product Primary Use Case: None of the listed primary use cases; generic display
  Dynamic Video Timing Range Limits Data Block:
    Minimum Pixel Clock: 426888 kHz
    Maximum Pixel Clock: 426888 kHz
    Minimum Vertical Refresh Rate: 60 Hz
    Maximum Vertical Refresh Rate: 165 Hz
    Seamless Dynamic Video Timing Support: Yes
  CTA-861 DisplayID Data Block:
  Vendor-Specific Data Block (AMD), OUI 00-00-1A:
    Version: 3
    Feature Caps: 0x01
    Minimum Refresh Rate: 60 Hz
    Maximum Refresh Rate: 165 Hz
    Flags 1.x: 0x00
    Flags 2.x: 0x00
    Maximum luminance: 83 (301.833 cd/m^2)
    Minimum luminance: 74 (0.254 cd/m^2)
    Unknown: 0x53 0x4a
  Checksum: 0xd1
Checksum: 0x90

----------------

Block 2, Unknown EDID Extension Block 0x00:
  00 ff ff ff ff ff ff 00 09 e5 81 0b 00 00 00 00 '................'
  1a 20 01 04 a5 24 14 78 03 84 35 a6 52 4a 9b 25 '. ...$.x..5.RJ.%'
  0c 50 54 00 00 00 01 01 01 01 01 01 01 01 01 01 '.PT.............'
  01 01 01 01 01 01 c1 a6 80 18 71 38 60 40 6c 30 '..........q8`@l0'
  aa 00 63 c8 10 00 00 1a a4 3c 80 18 71 38 60 40 '..c......<..q8`@'
  6c 30 aa 00 63 c8 10 00 00 1a 00 00 00 00 00 00 'l0..c...........'
  00 00 00 00 00 00 00 00 00 00 00 00 00 00 00 02 '................'
  00 0d 36 ff 0a 3c 96 23 1b 41 96 00 00 00 01 05 '..6..<.#.A......'
Checksum: 0x05

----------------

Block 3, DisplayID Extension Block:
  Version: 2.0
  Extension Count: 0
  Dynamic Video Timing Range Limits Data Block:
    Minimum Pixel Clock: 426888 kHz
    Maximum Pixel Clock: 426888 kHz
    Minimum Vertical Refresh Rate: 60 Hz
    Maximum Vertical Refresh Rate: 165 Hz
    Seamless Dynamic Video Timing Support: Yes
  CTA-861 DisplayID Data Block:
  Vendor-Specific Data Block (AMD), OUI 00-00-1A:
    Version: 3
    Feature Caps: 0x01
    Minimum Refresh Rate: 60 Hz
    Maximum Refresh Rate: 165 Hz
    Flags 1.x: 0x00
    Flags 2.x: 0x00
    Maximum luminance: 83 (301.833 cd/m^2)
    Minimum luminance: 74 (0.254 cd/m^2)
    Unknown: 0x53 0x4a
  Checksum: 0xd1
Checksum: 0x90

----------------

Warnings:

Block 0, Base EDID:
  Missing Display Product Name.

Failures:

Block 0, Base EDID:
  Empty Descriptor: Use Dummy Descriptor instead of all zeroes.
  Missing Display Range Limits Descriptor.
Block 1, DisplayID Extension Block:
  Expected 0 DisplayID Extension Block, but got 1.
Block 2, Base EDID:
  Unknown Extension Block.
Block 3, DisplayID Extension Block:
  Product Type should be 0 in extension block.
EDID:
  Base EDID: EDID specified 1 extension block(s), but found 3 extension block(s).
  DisplayID: Missing DisplayID Display Parameters Data Block.
  DisplayID: Missing DisplayID Type VII Detailed Timing Data Block.
  DisplayID: DisplayID expects at least one preferred timing.

EDID conformity: FAIL
