edid-decode (hex):

00 ff ff ff ff ff ff 00 4d 10 6b 15 00 00 00 00
20 1f 01 04 a5 1f 11 78 0e de 50 a3 54 4c 99 26
0f 50 54 00 00 00 01 01 01 01 01 01 01 01 01 01
01 01 01 01 01 01 1a 36 80 a0 70 38 1e 40 30 20
35 00 35 ae 10 00 00 18 1a 36 80 a0 70 38 33 41
30 20 35 00 35 ae 10 00 00 18 00 00 00 fe 00 46
4b 34 33 47 80 4c 51 31 34 30 4d 31 00 00 00 00
00 02 41 03 28 00 12 00 00 0a 41 0a 20 20 00 f3

00 ff ff ff ff ff ff 00 4d 10 6b 15 00 00 00 00
20 1f 01 04 a5 1f 11 78 0e de 50 a3 54 4c 99 26
0f 50 54 00 00 00 01 01 01 01 01 01 01 01 01 01
01 01 01 01 01 01 1a 36 80 a0 70 38 1e 40 30 20
35 00 35 ae 10 00 00 18 1a 36 80 a0 70 38 33 41
30 20 35 00 35 ae 10 00 00 18 00 00 00 fe 00 46
4b 34 33 47 80 4c 51 31 34 30 4d 31 00 00 00 00
00 02 41 03 28 00 12 00 00 0a 41 0a 20 20 00 f3

----------------

Block 0, Base EDID:
  EDID Structure Version & Revision: 1.4
  Vendor & Product Identification:
    Manufacturer: SHP
    Model: 5483
    Made in: week 32 of 2021
  Basic Display Parameters & Features:
    Digital display
    Bits per primary color channel: 8
    DisplayPort interface
    Maximum image size: 31 cm x 17 cm
    Gamma: 2.20
    Supported color formats: RGB 4:4:4, YCrCb 4:4:4
    Default (sRGB) color space is primary color space
    First detailed timing includes the native pixel format and preferred refresh rate
  Color Characteristics:
    Red  : 0.6396, 0.3291
    Green: 0.2998, 0.5996
    Blue : 0.1494, 0.0595
    White: 0.3125, 0.3281
  Established Timings I & II: none
  Standard Timings: none
  Detailed Timing Descriptors:
    DTD 1:  1920x1080   59.987872 Hz  16:9     66.587 kHz    138.500000 MHz (309 mm x 174 mm)
                 Hfront   48 Hsync  32 Hback   80 Hpol N
                 Vfront    3 Vsync   5 Vback   22 Vpol N
    DTD 2:  1920x1080   48.007598 Hz  16:9     66.587 kHz    138.500000 MHz (309 mm x 174 mm)
                 Hfront   48 Hsync  32 Hback   80 Hpol N
                 Vfront    3 Vsync   5 Vback  299 Vpol N
    Alphanumeric Data String: 'FK43G.LQ140M1'
    Manufacturer-Specified Display Descriptor (0x00): 00 00 00 02 41 03 28 00 12 00 00 0a 41 0a 20 20 '....A.(.....A.  '
Checksum: 0xf3

----------------

Block 1, Unknown EDID Extension Block 0x00:
  00 ff ff ff ff ff ff 00 4d 10 6b 15 00 00 00 00 '........M.k.....'
  20 1f 01 04 a5 1f 11 78 0e de 50 a3 54 4c 99 26 ' ......x..P.TL.&'
  0f 50 54 00 00 00 01 01 01 01 01 01 01 01 01 01 '.PT.............'
  01 01 01 01 01 01 1a 36 80 a0 70 38 1e 40 30 20 '.......6..p8.@0 '
  35 00 35 ae 10 00 00 18 1a 36 80 a0 70 38 33 41 '5.5......6..p83A'
  30 20 35 00 35 ae 10 00 00 18 00 00 00 fe 00 46 '0 5.5..........F'
  4b 34 33 47 80 4c 51 31 34 30 4d 31 00 00 00 00 'K43G.LQ140M1....'
  00 02 41 03 28 00 12 00 00 0a 41 0a 20 20 00 f3 '..A.(.....A.  ..'
Checksum: 0xf3

----------------

Warnings:

Block 0, Base EDID:
  Alphanumeric Data String: Non-ASCII character 0x80 at position 5, can cause problems.
  Missing Display Product Name.

Failures:

Block 0, Base EDID:
  Basic Display Parameters & Features: sRGB is signaled, but the chromaticities do not match.
Block 1, Base EDID:
  Unknown Extension Block.
EDID:
  Base EDID: EDID specified 0 extension block(s), but found 1 extension block(s).

EDID conformity: FAIL
