edid-decode (hex):

00 ff ff ff ff ff ff 00 0e 14 3c 00 00 00 00 00
01 1c 01 04 95 1f 11 78 0a 33 91 9d 58 51 89 26
2b 50 59 00 00 00 01 01 01 01 01 01 01 01 01 01
01 01 01 01 01 01 d4 1c 56 a6 50 00 23 30 44 2a
ca 00 35 ae 10 00 00 19 00 00 00 fe 00 43 31 34
30 31 20 54 30 20 20 20 20 20 00 00 00 fe 00 43
31 34 30 31 20 54 30 20 20 20 20 20 00 00 00 fe
00 43 31 34 30 31 20 54 30 20 20 20 20 20 00 ee

----------------

Block 0, Base EDID:
  EDID Structure Version & Revision: 1.4
  Vendor & Product Identification:
    Manufacturer: CPT
    Model: 60
    Made in: week 1 of 2018
  Basic Display Parameters & Features:
    Digital display
    Bits per primary color channel: 6
    DisplayPort interface
    Maximum image size: 31 cm x 17 cm
    Gamma: 2.20
    Supported color formats: RGB 4:4:4, YCrCb 4:4:4
    First detailed timing includes the native pixel format and preferred refresh rate
  Color Characteristics:
    Red  : 0.6132, 0.3466
    Green: 0.3164, 0.5380
    Blue : 0.1503, 0.1689
    White: 0.3125, 0.3486
  Established Timings I & II: none
  Standard Timings: none
  Detailed Timing Descriptors:
    DTD 1:  1366x768    59.990441 Hz 683:384   48.172 kHz     73.800000 MHz (309 mm x 174 mm)
                 Hfront   68 Hsync  42 Hback   56 Hpol N
                 Vfront   12 Vsync  10 Vback   13 Vpol N
    Alphanumeric Data String: 'C1401 T0     '
    Alphanumeric Data String: 'C1401 T0     '
    Alphanumeric Data String: 'C1401 T0     '
Checksum: 0xee

----------------

Warnings:

Block 0, Base EDID:
  Missing Display Product Name.

Failures:

Block 0, Base EDID:
  Alphanumeric Data String: No newline, but one or more trailing spaces.
  Alphanumeric Data String: No newline, but one or more trailing spaces.
  Alphanumeric Data String: No newline, but one or more trailing spaces.

EDID conformity: FAIL
