edid-decode (hex):

00 ff ff ff ff ff ff 00 10 ac 1e f1 58 35 50 43
2f 1f 01 04 a5 2b 18 78 e2 69 d5 a2 56 4f a0 28
0f 50 54 a5 4a 00 71 4f 81 c0 81 00 a9 c0 01 01
01 01 01 01 01 01 30 2a 40 c8 60 84 64 30 18 50
13 00 b0 f3 10 00 00 1e 00 00 00 ff 00 31 47 4e
35 4d 4b 33 0a 20 20 20 20 20 00 00 00 fc 00 44
45 4c 4c 20 44 32 30 32 30 48 0a 20 00 00 00 fd
00 38 4c 1e 50 11 00 0a 20 20 20 20 20 20 00 8e

00 ff ff ff ff ff ff 00 10 ac 1e f1 58 35 50 43
2f 1f 01 04 a5 2b 18 78 e2 69 d5 a2 56 4f a0 28
0f 50 54 a5 4a 00 71 4f 81 c0 81 00 a9 c0 01 01
01 01 01 01 01 01 30 2a 40 c8 60 84 64 30 18 50
13 00 b0 f3 10 00 00 1e 00 00 00 ff 00 31 47 4e
35 4d 4b 33 0a 20 20 20 20 20 00 00 00 fc 00 44
45 4c 4c 20 44 32 30 32 30 48 0a 20 00 00 00 fd
00 38 4c 1e 50 11 00 0a 20 20 20 20 20 20 00 8e

----------------

Block 0, Base EDID:
  EDID Structure Version & Revision: 1.4
  Vendor & Product Identification:
    Manufacturer: DEL
    Model: 61726
    Serial Number: ...
    Made in: week 47 of 2021
  Basic Display Parameters & Features:
    Digital display
    Bits per primary color channel: 8
    DisplayPort interface
    Maximum image size: 43 cm x 24 cm
    Gamma: 2.20
    DPMS levels: Standby Suspend Off
    Supported color formats: RGB 4:4:4
    First detailed timing includes the native pixel format and preferred refresh rate
  Color Characteristics:
    Red  : 0.6337, 0.3378
    Green: 0.3105, 0.6259
    Blue : 0.1591, 0.0595
    White: 0.3134, 0.3291
  Established Timings I & II:
    IBM     :   720x400    70.081663 Hz   9:5     31.467 kHz     28.320000 MHz
    DMT 0x04:   640x480    59.940476 Hz   4:3     31.469 kHz     25.175000 MHz
    DMT 0x06:   640x480    75.000000 Hz   4:3     37.500 kHz     31.500000 MHz
    DMT 0x09:   800x600    60.316541 Hz   4:3     37.879 kHz     40.000000 MHz
    DMT 0x0b:   800x600    75.000000 Hz   4:3     46.875 kHz     49.500000 MHz
    DMT 0x10:  1024x768    60.003840 Hz   4:3     48.363 kHz     65.000000 MHz
    DMT 0x12:  1024x768    75.028582 Hz   4:3     60.023 kHz     78.750000 MHz
  Standard Timings:
    DMT 0x15:  1152x864    75.000000 Hz   4:3     67.500 kHz    108.000000 MHz
    DMT 0x55:  1280x720    60.000000 Hz  16:9     45.000 kHz     74.250000 MHz
    DMT 0x1c:  1280x800    59.810326 Hz  16:10    49.702 kHz     83.500000 MHz
    DMT 0x53:  1600x900    60.000000 Hz  16:9     60.000 kHz    108.000000 MHz (RB)
  Detailed Timing Descriptors:
    DTD 1:  1600x900    60.000000 Hz  16:9     60.000 kHz    108.000000 MHz (432 mm x 243 mm)
                 Hfront   24 Hsync  80 Hback   96 Hpol P
                 Vfront    1 Vsync   3 Vback   96 Vpol P
    Display Product Serial Number: ...
    Display Product Name: 'DELL D2020H'
    Display Range Limits:
      Monitor ranges (GTF): 56-76 Hz V, 30-80 kHz H, max dotclock 170 MHz
Checksum: 0x8e

----------------

Block 1, Unknown EDID Extension Block 0x00:
  00 ff ff ff ff ff ff 00 10 ac 1e f1 58 35 50 43 '............X5PC'
  2f 1f 01 04 a5 2b 18 78 e2 69 d5 a2 56 4f a0 28 '/....+.x.i..VO.('
  0f 50 54 a5 4a 00 71 4f 81 c0 81 00 a9 c0 01 01 '.PT.J.qO........'
  01 01 01 01 01 01 30 2a 40 c8 60 84 64 30 18 50 '......0*@.`.d0.P'
  13 00 b0 f3 10 00 00 1e 00 00 00 ff 00 31 47 4e '.............1GN'
  35 4d 4b 33 0a 20 20 20 20 20 00 00 00 fc 00 44 '5MK3.     .....D'
  45 4c 4c 20 44 32 30 32 30 48 0a 20 00 00 00 fd 'ELL D2020H. ....'
  00 38 4c 1e 50 11 00 0a 20 20 20 20 20 20 00 8e '.8L.P...      ..'
Checksum: 0x8e

----------------

Warnings:

Block 0, Base EDID:
  Display Range Limits: GTF support is deprecated in EDID 1.4.

Failures:

Block 0, Base EDID:
  Display Range Limits: GTF is supported, but the display does not support continuous frequencies.
Block 1, Base EDID:
  Unknown Extension Block.
EDID:
  Base EDID: EDID specified 0 extension block(s), but found 1 extension block(s).

EDID conformity: FAIL
