edid-decode (hex):

00 ff ff ff ff ff ff 00 4c 83 ae 41 00 00 00 00
00 21 01 04 b5 22 16 78 03 0c f1 ae 52 3c b9 23
0c 50 54 00 00 00 01 01 01 01 01 01 01 01 01 01
01 01 01 01 01 01 00 00 00 fe 00 20 20 20 20 20
20 20 20 20 20 20 20 20 00 00 00 fd 0c 30 f0 ab
ab 71 01 00 00 00 00 00 00 00 00 00 00 fe 00 53
44 43 0a 20 20 20 20 20 20 20 20 20 00 00 00 fc
00 41 54 4e 41 36 30 44 4c 30 34 2d 30 20 01 5c

70 20 79 02 00 26 00 09 04 00 00 00 00 00 50 00
00 22 00 28 9a 2b 11 85 ff 09 4f 00 07 00 1f 00
3f 06 af 00 9d 00 07 00 9a 2b 11 05 ff 09 4f 00
07 00 1f 00 3f 06 7f 15 6d 15 07 00 81 00 1f 73
1a 00 00 03 0b 30 f0 00 a0 74 02 60 02 f0 00 00
00 00 8d e3 05 80 00 e6 06 05 01 74 60 02 2b 00
0c 27 00 3c ef 00 00 27 00 30 3b 00 00 2e 00 06
00 45 40 5e 40 5e 00 00 00 00 00 00 00 00 1e 90

00 ff ff ff ff ff ff 00 4c 83 ae 41 00 00 00 00
00 21 01 04 b5 22 16 78 03 0c f1 ae 52 3c b9 23
0c 50 54 00 00 00 01 01 01 01 01 01 01 01 01 01
01 01 01 01 01 01 00 00 00 fe 00 20 20 20 20 20
20 20 20 20 20 20 20 20 00 00 00 fd 0c 30 f0 ab
ab 71 01 00 00 00 00 00 00 00 00 00 00 fe 00 53
44 43 0a 20 20 20 20 20 20 20 20 20 00 00 00 fc
00 41 54 4e 41 36 30 44 4c 30 34 2d 30 20 01 5c

70 20 79 02 00 26 00 09 04 00 00 00 00 00 50 00
00 22 00 28 9a 2b 11 85 ff 09 4f 00 07 00 1f 00
3f 06 af 00 9d 00 07 00 9a 2b 11 05 ff 09 4f 00
07 00 1f 00 3f 06 7f 15 6d 15 07 00 81 00 1f 73
1a 00 00 03 0b 30 f0 00 a0 74 02 60 02 f0 00 00
00 00 8d e3 05 80 00 e6 06 05 01 74 60 02 2b 00
0c 27 00 3c ef 00 00 27 00 30 3b 00 00 2e 00 06
00 45 40 5e 40 5e 00 00 00 00 00 00 00 00 1e 90

----------------

Block 0, Base EDID:
  EDID Structure Version & Revision: 1.4
  Vendor & Product Identification:
    Manufacturer: SDC
    Model: 16814
    Made in: 2023
  Basic Display Parameters & Features:
    Digital display
    Bits per primary color channel: 10
    DisplayPort interface
    Maximum image size: 34 cm x 22 cm
    Gamma: 2.20
    Supported color formats: RGB 4:4:4
    First detailed timing includes the native pixel format and preferred refresh rate
    Display supports continuous frequencies
  Color Characteristics:
    Red  : 0.6796, 0.3203
    Green: 0.2373, 0.7226
    Blue : 0.1396, 0.0498
    White: 0.3125, 0.3291
  Established Timings I & II: none
  Standard Timings: none
  Detailed Timing Descriptors:
    Alphanumeric Data String: '             '
    Display Range Limits:
      Monitor ranges (Range Limits Only): 48-240 Hz V, 426-426 kHz H, max dotclock 1130 MHz
    Alphanumeric Data String: 'SDC'
    Display Product Name: 'ATNA60DL04-0 '
  Extension blocks: 1
Checksum: 0x5c

----------------

Block 1, DisplayID Extension Block:
  Version: 2.0
  Extension Count: 0
  Display Product Primary Use Case: None of the listed primary use cases; generic display
  Display Interface Features Data Block:
    Supported bpc for RGB encoding: 10
    Supported color space and EOTF standard combination 1: DCI-P3, BT.2020/SMPTE ST 2084
  Video Timing Modes Type 7 - Detailed Timings Data Block:
    DTD:  2560x1600  240.000299 Hz  16:10   426.241 kHz   1125.275000 MHz (aspect 16:10, no 3D stereo, preferred)
               Hfront    8 Hsync  32 Hback   40 Hpol N
               Vfront  158 Vsync   8 Vback   10 Vpol N
    DTD:  2560x1600   60.000075 Hz  16:10   426.241 kHz   1125.275000 MHz (aspect 16:10, no 3D stereo)
               Hfront    8 Hsync  32 Hback   40 Hpol N
               Vfront 5486 Vsync   8 Vback   10 Vpol N
  CTA-861 DisplayID Data Block:
  Vendor-Specific Data Block (AMD), OUI 00-00-1A:
    Version: 3
    Flags 1: 0x0b
      FreeSync Supported
      FreeSync 2 HDR Supported
      Local Dimming Supported
    Minimum Refresh Rate: 48 Hz
    Maximum Refresh Rate: 240 Hz
    Flags 5: 0xa0
      Display is OLED
      ST 2084 (PQ) EOTF Supported
    Maximum luminance: 116 (616.884 cd/m^2)
    Minimum luminance: 2 (0.000 cd/m^2)
    Maximum luminance (without local dimming): 96 (400.000 cd/m^2)
    Minimum luminance (without local dimming): 2 (0.000 cd/m^2)
    Additional Sink Information Address: 0x410
  Colorimetry Data Block:
    BT2020RGB
  HDR Static Metadata Data Block:
    Electro optical transfer functions:
      Traditional gamma - SDR luminance range
      SMPTE ST2084
    Supported static metadata descriptors:
      Static metadata type 1
    Desired content max luminance: 116 (616.884 cd/m^2)
    Desired content max frame-average luminance: 96 (400.000 cd/m^2)
    Desired content min luminance: 2 (0.000 cd/m^2)
  Adaptive Sync Data Block:
    Descriptor #1:
      Native Panel Range
      Fixed Average V-Total and Adaptive V-Total
      Supports Seamless Transition
      'Max Single Frame Duration Increase' field value without jitter impact
      'Max Single Frame Duration Decrease' field value without jitter impact
      Max Duration Increase: 0.00 ms
      Max Duration Decrease: 0.00 ms
      Min Refresh Rate: 60 Hz
      Max Refresh Rate: 240 Hz
    Descriptor #2:
      Native Panel Range
      Fixed Average V-Total and Adaptive V-Total
      Supports Seamless Transition
      'Max Single Frame Duration Increase' field value without jitter impact
      'Max Single Frame Duration Decrease' field value without jitter impact
      Max Duration Increase: 0.00 ms
      Max Duration Decrease: 0.00 ms
      Min Refresh Rate: 48 Hz
      Max Refresh Rate: 60 Hz
  Brightness Luminance Range Data Block:
    Minimum SDR Luminance (Full Coverage): 5.000000 cd/m^2
    Maximum Suggested SDR Luminance (Full Coverage): 400.000000 cd/m^2
    Maximum Boost SDR Luminance: 400.000000 cd/m^2
  Checksum: 0x1e
Checksum: 0x90

----------------

Warnings:

Block 1, DisplayID Extension Block:
  Colorimetry Data Block: Set the sRGB colorimetry bit to avoid interop issues.
EDID:
  No Native Video Resolution was defined.

Failures:

Block 0, Base EDID:
  Standard Timings: Missing preferred timing.
  Alphanumeric Data String: No newline, but one or more trailing spaces.
  Display Range Limits: Byte 11 is 0x00 instead of 0x0a.
  Display Range Limits: Bytes 12-17 must be 0x20.
  Display Product Name: No newline, but one or more trailing spaces.
EDID:
  Extension Block 2 started with EDID header, ignoring Extension Blocks >= 2.
  DisplayID: Missing DisplayID Display Parameters Data Block.

EDID conformity: FAIL
