edid-decode (hex):

00 ff ff ff ff ff ff 00 06 af ae 35 00 00 00 00
1d 21 01 04 a5 26 16 78 03 67 95 93 58 59 94 29
20 50 54 00 00 00 01 01 01 01 01 01 01 01 01 01
01 01 01 01 01 01 20 37 80 b4 70 38 28 40 6c 30
aa 00 7e d7 10 00 00 18 c0 24 80 b4 70 38 28 40
6c 30 aa 00 7e d7 10 00 00 18 00 00 00 00 00 00
00 00 00 00 00 00 00 00 00 00 00 00 00 00 00 02
00 10 3c ff 0f 3c 96 71 11 2b 96 20 20 20 01 e3

70 20 79 02 00 22 00 14 3f 27 02 84 7f 07 b3 00
6b 80 2f 00 37 04 27 00 09 00 09 00 25 01 09 3f
27 02 3f 27 02 28 3c 80 81 00 10 6f 1a 00 00 03
01 28 3c 00 00 53 53 53 53 3c 00 00 00 00 00 00
00 00 00 00 00 00 00 00 00 00 00 00 00 00 00 00
00 00 00 00 00 00 00 00 00 00 00 00 00 00 00 00
00 00 00 00 00 00 00 00 00 00 00 00 00 00 00 00
00 00 00 00 00 00 00 00 00 00 00 00 00 00 8f 90

00 ff ff ff ff ff ff 00 06 af ae 35 00 00 00 00
1d 21 01 04 a5 26 16 78 03 67 95 93 58 59 94 29
20 50 54 00 00 00 01 01 01 01 01 01 01 01 01 01
01 01 01 01 01 01 20 37 80 b4 70 38 28 40 6c 30
aa 00 7e d7 10 00 00 18 c0 24 80 b4 70 38 28 40
6c 30 aa 00 7e d7 10 00 00 18 00 00 00 00 00 00
00 00 00 00 00 00 00 00 00 00 00 00 00 00 00 02
00 10 3c ff 0f 3c 96 71 11 2b 96 20 20 20 01 e3

70 20 79 02 00 22 00 14 3f 27 02 84 7f 07 b3 00
6b 80 2f 00 37 04 27 00 09 00 09 00 25 01 09 3f
27 02 3f 27 02 28 3c 80 81 00 10 6f 1a 00 00 03
01 28 3c 00 00 53 53 53 53 3c 00 00 00 00 00 00
00 00 00 00 00 00 00 00 00 00 00 00 00 00 00 00
00 00 00 00 00 00 00 00 00 00 00 00 00 00 00 00
00 00 00 00 00 00 00 00 00 00 00 00 00 00 00 00
00 00 00 00 00 00 00 00 00 00 00 00 00 00 8f 90

----------------

Block 0, Base EDID:
  EDID Structure Version & Revision: 1.4
  Vendor & Product Identification:
    Manufacturer: AUO
    Model: 13742
    Made in: week 29 of 2023
  Basic Display Parameters & Features:
    Digital display
    Bits per primary color channel: 8
    DisplayPort interface
    Maximum image size: 38 cm x 22 cm
    Gamma: 2.20
    Supported color formats: RGB 4:4:4
    First detailed timing includes the native pixel format and preferred refresh rate
    Display supports continuous frequencies
  Color Characteristics:
    Red  : 0.5751, 0.3457
    Green: 0.3486, 0.5810
    Blue : 0.1621, 0.1259
    White: 0.3134, 0.3291
  Established Timings I & II: none
  Standard Timings: none
  Detailed Timing Descriptors:
    DTD 1:  1920x1080   60.000000 Hz  16:9     67.200 kHz    141.120000 MHz (382 mm x 215 mm)
                 Hfront  108 Hsync  48 Hback   24 Hpol N
                 Vfront   10 Vsync  10 Vback   20 Vpol N
    DTD 2:  1920x1080   40.000000 Hz  16:9     44.800 kHz     94.080000 MHz (382 mm x 215 mm)
                 Hfront  108 Hsync  48 Hback   24 Hpol N
                 Vfront   10 Vsync  10 Vback   20 Vpol N
    Empty Descriptor
    Manufacturer-Specified Display Descriptor (0x02): 00 02 00 10 3c ff 0f 3c 96 71 11 2b 96 20 20 20 '....<..<.q.+.   '
  Extension blocks: 1
Checksum: 0xe3

----------------

Block 1, DisplayID Extension Block:
  Version: 2.0
  Extension Count: 0
  Display Product Primary Use Case: None of the listed primary use cases; generic display
  Video Timing Modes Type 7 - Detailed Timings Data Block:
    DTD:  1920x1080   60.000000 Hz  16:9     67.200 kHz    141.120000 MHz (aspect 16:9, no 3D stereo, preferred)
               Hfront  108 Hsync  48 Hback   24 Hpol P
               Vfront   10 Vsync  10 Vback   20 Vpol N
  Dynamic Video Timing Range Limits Data Block:
    Minimum Pixel Clock: 141120 kHz
    Maximum Pixel Clock: 141120 kHz
    Minimum Vertical Refresh Rate: 40 Hz
    Maximum Vertical Refresh Rate: 60 Hz
    Seamless Dynamic Video Timing Support: Yes
  CTA-861 DisplayID Data Block:
  Vendor-Specific Data Block (AMD), OUI 00-00-1A:
    Version: 3
    Feature Caps: 0x01
    Minimum Refresh Rate: 40 Hz
    Maximum Refresh Rate: 60 Hz
    Flags 1.x: 0x00
    Flags 2.x: 0x00
    Maximum luminance: 83 (301.833 cd/m^2)
    Minimum luminance: 83 (0.320 cd/m^2)
    Unknown: 0x53 0x53
  Checksum: 0x8f
Checksum: 0x90

----------------

Block 2, Unknown EDID Extension Block 0x00:
  00 ff ff ff ff ff ff 00 06 af ae 35 00 00 00 00 '...........5....'
  1d 21 01 04 a5 26 16 78 03 67 95 93 58 59 94 29 '.!...&.x.g..XY.)'
  20 50 54 00 00 00 01 01 01 01 01 01 01 01 01 01 ' PT.............'
  01 01 01 01 01 01 20 37 80 b4 70 38 28 40 6c 30 '...... 7..p8(@l0'
  aa 00 7e d7 10 00 00 18 c0 24 80 b4 70 38 28 40 '..~......$..p8(@'
  6c 30 aa 00 7e d7 10 00 00 18 00 00 00 00 00 00 'l0..~...........'
  00 00 00 00 00 00 00 00 00 00 00 00 00 00 00 02 '................'
  00 10 3c ff 0f 3c 96 71 11 2b 96 20 20 20 01 e3 '..<..<.q.+.   ..'
Checksum: 0xe3

----------------

Block 3, DisplayID Extension Block:
  Version: 2.0
  Extension Count: 0
  Video Timing Modes Type 7 - Detailed Timings Data Block:
    DTD:  1920x1080   60.000000 Hz  16:9     67.200 kHz    141.120000 MHz (aspect 16:9, no 3D stereo, preferred)
               Hfront  108 Hsync  48 Hback   24 Hpol P
               Vfront   10 Vsync  10 Vback   20 Vpol N
  Dynamic Video Timing Range Limits Data Block:
    Minimum Pixel Clock: 141120 kHz
    Maximum Pixel Clock: 141120 kHz
    Minimum Vertical Refresh Rate: 40 Hz
    Maximum Vertical Refresh Rate: 60 Hz
    Seamless Dynamic Video Timing Support: Yes
  CTA-861 DisplayID Data Block:
  Vendor-Specific Data Block (AMD), OUI 00-00-1A:
    Version: 3
    Feature Caps: 0x01
    Minimum Refresh Rate: 40 Hz
    Maximum Refresh Rate: 60 Hz
    Flags 1.x: 0x00
    Flags 2.x: 0x00
    Maximum luminance: 83 (301.833 cd/m^2)
    Minimum luminance: 83 (0.320 cd/m^2)
    Unknown: 0x53 0x53
  Checksum: 0x8f
Checksum: 0x90

----------------

Warnings:

Block 0, Base EDID:
  Missing Display Product Name.

Failures:

Block 0, Base EDID:
  Empty Descriptor: Use Dummy Descriptor instead of all zeroes.
  Missing Display Range Limits Descriptor.
Block 1, DisplayID Extension Block:
  Expected 0 DisplayID Extension Block, but got 1.
Block 2, Base EDID:
  Unknown Extension Block.
Block 3, DisplayID Extension Block:
  Product Type should be 0 in extension block.
EDID:
  Base EDID: EDID specified 1 extension block(s), but found 3 extension block(s).
  DisplayID: Missing DisplayID Display Parameters Data Block.

EDID conformity: FAIL
