edid-decode (hex):

00 ff ff ff ff ff ff 00 04 72 eb 02 ed 29 60 50
06 19 01 04 a5 33 1d 78 a6 2b 05 a3 57 52 a1 28
0e 50 54 b3 0c 00 71 4f 81 80 81 00 95 00 d1 c0
81 c0 b3 00 01 01 02 3a 80 18 71 38 2d 40 58 2c
45 00 fd 1e 11 00 00 1e 00 00 00 fd 00 37 4b 1e
50 12 00 0a 20 20 20 20 20 20 00 00 00 fc 00 47
32 33 36 48 4c 0a 20 20 20 20 20 20 00 00 00 ff
00 4c 56 4e 41 41 30 30 32 32 34 36 32 0a 00 b5

00 ff ff ff ff ff ff 00 04 72 eb 02 ed 29 60 50
06 19 01 04 a5 33 1d 78 a6 2b 05 a3 57 52 a1 28
0e 50 54 b3 0c 00 71 4f 81 80 81 00 95 00 d1 c0
81 c0 b3 00 01 01 02 3a 80 18 71 38 2d 40 58 2c
45 00 fd 1e 11 00 00 1e 00 00 00 fd 00 37 4b 1e
50 12 00 0a 20 20 20 20 20 20 00 00 00 fc 00 47
32 33 36 48 4c 0a 20 20 20 20 20 20 00 00 00 ff
00 4c 56 4e 41 41 30 30 32 32 34 36 32 0a 00 b5

----------------

Block 0, Base EDID:
  EDID Structure Version & Revision: 1.4
  Vendor & Product Identification:
    Manufacturer: ACR
    Model: 747
    Serial Number: ...
    Made in: week 6 of 2015
  Basic Display Parameters & Features:
    Digital display
    Bits per primary color channel: 8
    DisplayPort interface
    Maximum image size: 51 cm x 29 cm
    Gamma: 2.20
    DPMS levels: Standby Off
    Supported color formats: RGB 4:4:4
    Default (sRGB) color space is primary color space
    First detailed timing includes the native pixel format and preferred refresh rate
  Color Characteristics:
    Red  : 0.6367, 0.3417
    Green: 0.3222, 0.6318
    Blue : 0.1562, 0.0546
    White: 0.3134, 0.3291
  Established Timings I & II:
    IBM     :   720x400    70.081663 Hz   9:5     31.467 kHz     28.320000 MHz
    DMT 0x04:   640x480    59.940476 Hz   4:3     31.469 kHz     25.175000 MHz
    Apple   :   640x480    66.666667 Hz   4:3     35.000 kHz     30.240000 MHz
    DMT 0x08:   800x600    56.250000 Hz   4:3     35.156 kHz     36.000000 MHz
    DMT 0x09:   800x600    60.316541 Hz   4:3     37.879 kHz     40.000000 MHz
    DMT 0x10:  1024x768    60.003840 Hz   4:3     48.363 kHz     65.000000 MHz
    DMT 0x11:  1024x768    70.069359 Hz   4:3     56.476 kHz     75.000000 MHz
  Standard Timings:
    DMT 0x15:  1152x864    75.000000 Hz   4:3     67.500 kHz    108.000000 MHz
    DMT 0x23:  1280x1024   60.019740 Hz   5:4     63.981 kHz    108.000000 MHz
    DMT 0x1c:  1280x800    59.810326 Hz  16:10    49.702 kHz     83.500000 MHz
    DMT 0x2f:  1440x900    59.887445 Hz  16:10    55.935 kHz    106.500000 MHz
    DMT 0x52:  1920x1080   60.000000 Hz  16:9     67.500 kHz    148.500000 MHz
    DMT 0x55:  1280x720    60.000000 Hz  16:9     45.000 kHz     74.250000 MHz
    DMT 0x3a:  1680x1050   59.954250 Hz  16:10    65.290 kHz    146.250000 MHz
  Detailed Timing Descriptors:
    DTD 1:  1920x1080   60.000000 Hz  16:9     67.500 kHz    148.500000 MHz (509 mm x 286 mm)
                 Hfront   88 Hsync  44 Hback  148 Hpol P
                 Vfront    4 Vsync   5 Vback   36 Vpol P
    Display Range Limits:
      Monitor ranges (GTF): 55-75 Hz V, 30-80 kHz H, max dotclock 180 MHz
    Display Product Name: 'G236HL'
    Display Product Serial Number: ...
Checksum: 0xb5

----------------

Warnings:

Block 0, Base EDID:
  Display Range Limits: GTF support is deprecated in EDID 1.4.

Failures:

Block 0, Base EDID:
  Basic Display Parameters & Features: sRGB is signaled, but the chromaticities do not match.
  Display Range Limits: GTF is supported, but the display does not support continuous frequencies.
EDID:
  Extension Block 1 started with EDID header, ignoring Extension Blocks >= 1.

EDID conformity: FAIL
