edid-decode (hex):

00 ff ff ff ff ff ff 00 06 af ad 7e ad 7e 00 00
18 21 01 04 a5 22 13 78 03 4e 35 a6 54 4b a0 27
0f 50 54 00 00 00 01 01 01 01 01 01 01 01 01 01
01 01 01 01 01 01 a6 37 80 b7 70 38 31 40 30 20
a5 00 58 c1 10 00 00 18 00 00 00 fd 00 30 90 a3
a3 22 01 0a 20 20 20 20 20 20 00 00 00 fe 00 41
55 4f 0a 20 20 20 20 20 20 20 20 20 00 00 00 fe
00 42 31 35 36 48 41 4e 31 35 2e 4b 20 0a 01 f9

70 20 79 02 00 22 00 14 8b 37 05 84 7f 07 b6 00
2f 80 1f 00 37 04 30 00 09 00 04 00 2b 00 0c 27
00 3c 8f 00 00 27 00 30 3b 00 00 81 00 10 6f 1a
00 00 03 01 30 90 00 00 53 51 53 51 90 00 00 00
00 00 00 00 00 00 00 00 00 00 00 00 00 00 00 00
00 00 00 00 00 00 00 00 00 00 00 00 00 00 00 00
00 00 00 00 00 00 00 00 00 00 00 00 00 00 00 00
00 00 00 00 00 00 00 00 00 00 00 00 00 00 f1 90

00 ff ff ff ff ff ff 00 06 af ad 7e ad 7e 00 00
18 21 01 04 a5 22 13 78 03 4e 35 a6 54 4b a0 27
0f 50 54 00 00 00 01 01 01 01 01 01 01 01 01 01
01 01 01 01 01 01 a6 37 80 b7 70 38 31 40 30 20
a5 00 58 c1 10 00 00 18 00 00 00 fd 00 30 90 a3
a3 22 01 0a 20 20 20 20 20 20 00 00 00 fe 00 41
55 4f 0a 20 20 20 20 20 20 20 20 20 00 00 00 fe
00 42 31 35 36 48 41 4e 31 35 2e 4b 20 0a 01 f9

70 20 79 02 00 22 00 14 8b 37 05 84 7f 07 b6 00
2f 80 1f 00 37 04 30 00 09 00 04 00 2b 00 0c 27
00 3c 8f 00 00 27 00 30 3b 00 00 81 00 10 6f 1a
00 00 03 01 30 90 00 00 53 51 53 51 90 00 00 00
00 00 00 00 00 00 00 00 00 00 00 00 00 00 00 00
00 00 00 00 00 00 00 00 00 00 00 00 00 00 00 00
00 00 00 00 00 00 00 00 00 00 00 00 00 00 00 00
00 00 00 00 00 00 00 00 00 00 00 00 00 00 f1 90

----------------

Block 0, Base EDID:
  EDID Structure Version & Revision: 1.4
  Vendor & Product Identification:
    Manufacturer: AUO
    Model: 32429
    Serial Number: ...
    Made in: week 24 of 2023
  Basic Display Parameters & Features:
    Digital display
    Bits per primary color channel: 8
    DisplayPort interface
    Maximum image size: 34 cm x 19 cm
    Gamma: 2.20
    Supported color formats: RGB 4:4:4
    First detailed timing includes the native pixel format and preferred refresh rate
    Display supports continuous frequencies
  Color Characteristics:
    Red  : 0.6494, 0.3281
    Green: 0.2958, 0.6269
    Blue : 0.1523, 0.0615
    White: 0.3134, 0.3291
  Established Timings I & II: none
  Standard Timings: none
  Detailed Timing Descriptors:
    DTD 1:  1920x1080   60.001171 Hz  16:9     67.741 kHz    142.460000 MHz (344 mm x 193 mm)
                 Hfront   48 Hsync  32 Hback  103 Hpol N
                 Vfront   10 Vsync   5 Vback   34 Vpol N
    Display Range Limits:
      Monitor ranges (Range Limits Only): 48-144 Hz V, 163-163 kHz H, max dotclock 340 MHz
    Alphanumeric Data String: 'AUO'
    Alphanumeric Data String: 'B156HAN15.K '
  Extension blocks: 1
Checksum: 0xf9

----------------

Block 1, DisplayID Extension Block:
  Version: 2.0
  Extension Count: 0
  Display Product Primary Use Case: None of the listed primary use cases; generic display
  Video Timing Modes Type 7 - Detailed Timings Data Block:
    DTD:  1920x1080  144.001125 Hz  16:9    162.577 kHz    341.900000 MHz (aspect 16:9, no 3D stereo, preferred)
               Hfront   48 Hsync  32 Hback  103 Hpol P
               Vfront   10 Vsync   5 Vback   34 Vpol N
  Adaptive Sync Data Block:
    Descriptor #1:
      Native Panel Range
      Fixed Average V-Total and Adaptive V-Total
      Supports Seamless Transition
      'Max Single Frame Duration Increase' field value without jitter impact
      'Max Single Frame Duration Decrease' field value without jitter impact
      Max Duration Increase: 0.00 ms
      Max Duration Decrease: 0.00 ms
      Min Refresh Rate: 60 Hz
      Max Refresh Rate: 144 Hz
    Descriptor #2:
      Native Panel Range
      Fixed Average V-Total and Adaptive V-Total
      Supports Seamless Transition
      'Max Single Frame Duration Increase' field value without jitter impact
      'Max Single Frame Duration Decrease' field value without jitter impact
      Max Duration Increase: 0.00 ms
      Max Duration Decrease: 0.00 ms
      Min Refresh Rate: 48 Hz
      Max Refresh Rate: 60 Hz
  CTA-861 DisplayID Data Block:
  Vendor-Specific Data Block (AMD), OUI 00-00-1A:
    Version: 3
    Feature Caps: 0x01
    Minimum Refresh Rate: 48 Hz
    Maximum Refresh Rate: 144 Hz
    Flags 1.x: 0x00
    Flags 2.x: 0x00
    Maximum luminance: 83 (301.833 cd/m^2)
    Minimum luminance: 81 (0.305 cd/m^2)
    Unknown: 0x53 0x51
  Checksum: 0xf1
Checksum: 0x90

----------------

Block 2, Unknown EDID Extension Block 0x00:
  00 ff ff ff ff ff ff 00 06 af ad 7e ad 7e 00 00 '...........~.~..'
  18 21 01 04 a5 22 13 78 03 4e 35 a6 54 4b a0 27 '.!...".x.N5.TK.''
  0f 50 54 00 00 00 01 01 01 01 01 01 01 01 01 01 '.PT.............'
  01 01 01 01 01 01 a6 37 80 b7 70 38 31 40 30 20 '.......7..p81@0 '
  a5 00 58 c1 10 00 00 18 00 00 00 fd 00 30 90 a3 '..X..........0..'
  a3 22 01 0a 20 20 20 20 20 20 00 00 00 fe 00 41 '."..      .....A'
  55 4f 0a 20 20 20 20 20 20 20 20 20 00 00 00 fe 'UO.         ....'
  00 42 31 35 36 48 41 4e 31 35 2e 4b 20 0a 01 f9 '.B156HAN15.K ...'
Checksum: 0xf9

----------------

Block 3, DisplayID Extension Block:
  Version: 2.0
  Extension Count: 0
  Video Timing Modes Type 7 - Detailed Timings Data Block:
    DTD:  1920x1080  144.001125 Hz  16:9    162.577 kHz    341.900000 MHz (aspect 16:9, no 3D stereo, preferred)
               Hfront   48 Hsync  32 Hback  103 Hpol P
               Vfront   10 Vsync   5 Vback   34 Vpol N
  Adaptive Sync Data Block:
    Descriptor #1:
      Native Panel Range
      Fixed Average V-Total and Adaptive V-Total
      Supports Seamless Transition
      'Max Single Frame Duration Increase' field value without jitter impact
      'Max Single Frame Duration Decrease' field value without jitter impact
      Max Duration Increase: 0.00 ms
      Max Duration Decrease: 0.00 ms
      Min Refresh Rate: 60 Hz
      Max Refresh Rate: 144 Hz
    Descriptor #2:
      Native Panel Range
      Fixed Average V-Total and Adaptive V-Total
      Supports Seamless Transition
      'Max Single Frame Duration Increase' field value without jitter impact
      'Max Single Frame Duration Decrease' field value without jitter impact
      Max Duration Increase: 0.00 ms
      Max Duration Decrease: 0.00 ms
      Min Refresh Rate: 48 Hz
      Max Refresh Rate: 60 Hz
  CTA-861 DisplayID Data Block:
  Vendor-Specific Data Block (AMD), OUI 00-00-1A:
    Version: 3
    Feature Caps: 0x01
    Minimum Refresh Rate: 48 Hz
    Maximum Refresh Rate: 144 Hz
    Flags 1.x: 0x00
    Flags 2.x: 0x00
    Maximum luminance: 83 (301.833 cd/m^2)
    Minimum luminance: 81 (0.305 cd/m^2)
    Unknown: 0x53 0x51
  Checksum: 0xf1
Checksum: 0x90

----------------

Warnings:

Block 0, Base EDID:
  Missing Display Product Name.
EDID:
  Base EDID: Some timings are out of range of the Monitor Ranges:
    Horizontal Freq: 67.741 - 162.577 kHz (Monitor: 163.000 - 163.000 kHz)
    Maximum Clock: 341.900 MHz (Monitor: 340.000 MHz)

Failures:

Block 0, Base EDID:
  Alphanumeric Data String: One or more trailing spaces before newline.
Block 1, DisplayID Extension Block:
  Expected 0 DisplayID Extension Block, but got 1.
Block 2, Base EDID:
  Unknown Extension Block.
Block 3, DisplayID Extension Block:
  Product Type should be 0 in extension block.
EDID:
  Base EDID: EDID specified 1 extension block(s), but found 3 extension block(s).
  DisplayID: Missing DisplayID Display Parameters Data Block.

EDID conformity: FAIL
