edid-decode (hex):

00 ff ff ff ff ff ff 00 22 70 13 00 a5 02 00 00
33 12 01 03 80 27 20 78 2a cb f5 a3 56 4d 9e 23
12 50 54 21 08 00 81 80 01 01 01 01 01 01 01 01
01 01 01 01 01 01 30 2a 00 98 51 00 2a 40 30 70
13 00 27 20 00 00 00 1a 00 00 00 ff 00 30 36 37
37 0a 20 20 20 20 20 20 20 20 00 00 00 fd 00 31
3d 1f 40 0b 00 0a 20 20 20 20 20 20 00 00 00 fc
00 54 31 39 31 48 0a 20 20 20 20 20 20 20 01 f8

02 03 22 70 23 09 57 01 83 01 00 00 65 03 0c 00
10 00 4f 10 1f 05 14 04 13 12 11 16 15 03 02 01
07 06 02 3a 80 d0 72 38 2d 40 10 2c 45 80 51 72
21 00 00 1e 02 3a 80 18 71 38 2d 40 58 2c 45 00
51 72 21 00 00 1e 01 1d 00 bc 52 d0 1e 20 b8 28
55 40 51 72 21 00 00 1e 01 1d 00 72 51 d0 1e 20
6e 28 55 00 51 72 21 00 00 1e 8c 0a d0 90 20 40
31 20 0c 40 55 00 51 72 21 00 00 1e 00 00 00 9c

00 ff ff ff ff ff ff 00 22 70 13 00 a5 02 00 00
33 12 01 03 80 27 20 78 2a cb f5 a3 56 4d 9e 23
12 50 54 21 08 00 81 80 01 01 01 01 01 01 01 01
01 01 01 01 01 01 30 2a 00 98 51 00 2a 40 30 70
13 00 27 20 00 00 00 1a 00 00 00 ff 00 30 36 37
37 0a 20 20 20 20 20 20 20 20 00 00 00 fd 00 31
3d 1f 40 0b 00 0a 20 20 20 20 20 20 00 00 00 fc
00 54 31 39 31 48 0a 20 20 20 20 20 20 20 01 f8

02 03 22 70 23 09 57 01 83 01 00 00 65 03 0c 00
10 00 4f 10 1f 05 14 04 13 12 11 16 15 03 02 01
07 06 02 3a 80 d0 72 38 2d 40 10 2c 45 80 51 72
21 00 00 1e 02 3a 80 18 71 38 2d 40 58 2c 45 00
51 72 21 00 00 1e 01 1d 00 bc 52 d0 1e 20 b8 28
55 40 51 72 21 00 00 1e 01 1d 00 72 51 d0 1e 20
6e 28 55 00 51 72 21 00 00 1e 8c 0a d0 90 20 40
31 20 0c 40 55 00 51 72 21 00 00 1e 00 00 00 9c

----------------

Block 0, Base EDID:
  EDID Structure Version & Revision: 1.3
  Vendor & Product Identification:
    Manufacturer: HSP
    Model: 19
    Serial Number: ...
    Made in: week 51 of 2008
  Basic Display Parameters & Features:
    Digital display
    Maximum image size: 39 cm x 32 cm
    Gamma: 2.20
    DPMS levels: Off
    RGB color display
    First detailed timing is the preferred timing
  Color Characteristics:
    Red  : 0.6396, 0.3359
    Green: 0.3027, 0.6201
    Blue : 0.1396, 0.0732
    White: 0.3134, 0.3291
  Established Timings I & II:
    DMT 0x04:   640x480    59.940476 Hz   4:3     31.469 kHz     25.175000 MHz
    DMT 0x09:   800x600    60.316541 Hz   4:3     37.879 kHz     40.000000 MHz
    DMT 0x10:  1024x768    60.003840 Hz   4:3     48.363 kHz     65.000000 MHz
  Standard Timings:
    DMT 0x23:  1280x1024   60.019740 Hz   5:4     63.981 kHz    108.000000 MHz
  Detailed Timing Descriptors:
    DTD 1:  1280x1024   60.019740 Hz   5:4     63.981 kHz    108.000000 MHz (39 mm x 32 mm)
                 Hfront   48 Hsync 112 Hback  248 Hpol P
                 Vfront    1 Vsync   3 Vback   38 Vpol N
    Display Product Serial Number: ...
    Display Range Limits:
      Monitor ranges (GTF): 49-61 Hz V, 31-64 kHz H, max dotclock 110 MHz
    Display Product Name: 'T191H'
  Extension blocks: 1
Checksum: 0xf8

----------------

Block 1, CTA-861 Extension Block:
  Revision: 3
  Basic audio support
  Supports YCbCr 4:4:4
  Supports YCbCr 4:2:2
  Native DTDs: 0
  Audio Data Block:
    Linear PCM:
      Max channels: 2
      Supported sample rates (kHz): 192 96 48 44.1 32
      Supported sample sizes (bits): 16
  Speaker Allocation Data Block:
    FL/FR - Front Left/Right
  Vendor-Specific Data Block (HDMI), OUI 00-0C-03:
    Source physical address: 1.0.0.0
  Video Data Block:
    VIC  16:  1920x1080   60.000000 Hz  16:9     67.500 kHz    148.500000 MHz
    VIC  31:  1920x1080   50.000000 Hz  16:9     56.250 kHz    148.500000 MHz
    VIC   5:  1920x1080i  60.000000 Hz  16:9     33.750 kHz     74.250000 MHz
    VIC  20:  1920x1080i  50.000000 Hz  16:9     28.125 kHz     74.250000 MHz
    VIC   4:  1280x720    60.000000 Hz  16:9     45.000 kHz     74.250000 MHz
    VIC  19:  1280x720    50.000000 Hz  16:9     37.500 kHz     74.250000 MHz
    VIC  18:   720x576    50.000000 Hz  16:9     31.250 kHz     27.000000 MHz
    VIC  17:   720x576    50.000000 Hz   4:3     31.250 kHz     27.000000 MHz
    VIC  22:  1440x576i   50.000000 Hz  16:9     15.625 kHz     27.000000 MHz
    VIC  21:  1440x576i   50.000000 Hz   4:3     15.625 kHz     27.000000 MHz
    VIC   3:   720x480    59.940060 Hz  16:9     31.469 kHz     27.000000 MHz
    VIC   2:   720x480    59.940060 Hz   4:3     31.469 kHz     27.000000 MHz
    VIC   1:   640x480    59.940476 Hz   4:3     31.469 kHz     25.175000 MHz
    VIC   7:  1440x480i   59.940060 Hz  16:9     15.734 kHz     27.000000 MHz
    VIC   6:  1440x480i   59.940060 Hz   4:3     15.734 kHz     27.000000 MHz
  Detailed Timing Descriptors:
    DTD 2:  1920x1080   50.000000 Hz  16:9     56.250 kHz    148.500000 MHz (593 mm x 370 mm)
                 Hfront  528 Hsync  44 Hback  148 Hpol P
                 Vfront    4 Vsync   5 Vback   36 Vpol P
    DTD 3:  1920x1080   60.000000 Hz  16:9     67.500 kHz    148.500000 MHz (593 mm x 370 mm)
                 Hfront   88 Hsync  44 Hback  148 Hpol P
                 Vfront    4 Vsync   5 Vback   36 Vpol P
    DTD 4:  1280x720    50.000000 Hz  16:9     37.500 kHz     74.250000 MHz (593 mm x 370 mm)
                 Hfront  440 Hsync  40 Hback  220 Hpol P
                 Vfront    5 Vsync   5 Vback   20 Vpol P
    DTD 5:  1280x720    60.000000 Hz  16:9     45.000 kHz     74.250000 MHz (593 mm x 370 mm)
                 Hfront  110 Hsync  40 Hback  220 Hpol P
                 Vfront    5 Vsync   5 Vback   20 Vpol P
    DTD 6:   720x576    50.000000 Hz   5:4     31.250 kHz     27.000000 MHz (593 mm x 370 mm)
                 Hfront   12 Hsync  64 Hback   68 Hpol P
                 Vfront    5 Vsync   5 Vback   39 Vpol P
Checksum: 0x9c  Unused space in Extension Block: 3 bytes

----------------

Warnings:

Block 0, Base EDID:
  Detailed Timing Descriptor #1: DTD is similar but not identical to DMT 0x23.
  Detailed Timing Descriptor #1: Dubious image size (39x32 mm is smaller than 100x100 mm).
Block 1, CTA-861 Extension Block:
  IT Video Formats are overscanned by default, but normally this should be underscanned.
  Video Data Block: VIC 16 and the first DTD are not identical. Is this intended?
  Detailed Timing Descriptor #2: Image size is 593x370 mm, but based on the picture AR it should be 593x333 mm.
  Detailed Timing Descriptor #3: Image size is 593x370 mm, but based on the picture AR it should be 593x333 mm.
  Detailed Timing Descriptor #4: Image size is 593x370 mm, but based on the picture AR it should be 593x333 mm.
  Detailed Timing Descriptor #5: Image size is 593x370 mm, but based on the picture AR it should be 593x333 mm.
  Detailed Timing Descriptor #6: DTD is similar but not identical to VIC 17.
  Detailed Timing Descriptor #6: Image size is 593x370 mm, but based on the picture AR it should be 462x370 mm.
  Display Product Serial Number is set, so the Serial Number in the Base EDID should be 0.
  Add a Colorimetry Data Block with the sRGB colorimetry bit set to avoid interop issues.
EDID:
  Base EDID: Some timings are out of range of the Monitor Ranges:
    Horizontal Freq: 15.625 - 67.500 kHz (Monitor: 31.000 - 64.000 kHz)
    Maximum Clock: 148.500 MHz (Monitor: 110.000 MHz)

Failures:

Block 0, Base EDID:
  Detailed Timing Descriptor #1: Mismatch of image size 39x32 mm vs display size 390x320 mm.
Block 1, CTA-861 Extension Block:
  Detailed Timing Descriptor #2: Mismatch of image size 593x370 mm vs display size 390x320 mm.
  Detailed Timing Descriptor #3: Mismatch of image size 593x370 mm vs display size 390x320 mm.
  Detailed Timing Descriptor #4: Mismatch of image size 593x370 mm vs display size 390x320 mm.
  Detailed Timing Descriptor #5: Mismatch of image size 593x370 mm vs display size 390x320 mm.
  Detailed Timing Descriptor #6: Mismatch of image size 593x370 mm vs display size 390x320 mm.
  Missing VCDB, needed for Set Selectable RGB Quantization to avoid interop issues.
EDID:
  Extension Block 2 started with EDID header, ignoring Extension Blocks >= 2.
  Base EDID: The DTD max image size is 593x370mm, which is larger than the display size 390.0x320.0mm.

EDID conformity: FAIL
