edid-decode (hex):

00 ff ff ff ff ff ff 00 4c 83 a3 41 00 00 00 00
00 21 01 04 b5 22 16 78 03 0c f1 ae 52 3c b9 23
0c 50 54 00 00 00 01 01 01 01 01 01 01 01 01 01
01 01 01 01 01 01 00 00 00 fe 00 3c 3c 3c 2e 20
20 20 20 20 20 20 20 20 00 00 00 fd 0c 30 f0 ab
ab 71 01 00 00 00 00 00 00 00 00 00 00 fe 00 53
44 43 0a 20 20 20 20 20 20 20 20 20 00 00 00 fc
00 41 54 4e 41 36 30 44 4c 30 31 2d 30 20 01 08

70 20 79 02 00 20 00 0c 4c 83 00 a3 41 00 00 00
00 00 21 00 21 00 1d 74 0d 69 08 00 0a 40 06 00
e1 fa 51 cb 13 b9 3d d2 0c 01 45 54 40 5e d0 60
18 10 23 78 26 00 09 04 00 00 00 00 00 50 00 00
22 00 28 9a 2b 11 85 ff 09 4f 00 07 00 1f 00 3f
06 af 00 9d 00 07 00 9a 2b 11 05 ff 09 4f 00 07
00 1f 00 3f 06 7f 15 6d 15 07 00 2b 00 0c 27 00
3c ef 00 00 27 00 30 3b 00 00 00 00 00 00 ca 90

00 ff ff ff ff ff ff 00 4c 83 a3 41 00 00 00 00
00 21 01 04 b5 22 16 78 03 0c f1 ae 52 3c b9 23
0c 50 54 00 00 00 01 01 01 01 01 01 01 01 01 01
01 01 01 01 01 01 00 00 00 fe 00 3c 3c 3c 2e 20
20 20 20 20 20 20 20 20 00 00 00 fd 0c 30 f0 ab
ab 71 01 00 00 00 00 00 00 00 00 00 00 fe 00 53
44 43 0a 20 20 20 20 20 20 20 20 20 00 00 00 fc
00 41 54 4e 41 36 30 44 4c 30 31 2d 30 20 01 08

70 20 79 02 00 20 00 0c 4c 83 00 a3 41 00 00 00
00 00 21 00 21 00 1d 74 0d 69 08 00 0a 40 06 00
e1 fa 51 cb 13 b9 3d d2 0c 01 45 54 40 5e d0 60
18 10 23 78 26 00 09 04 00 00 00 00 00 50 00 00
22 00 28 9a 2b 11 85 ff 09 4f 00 07 00 1f 00 3f
06 af 00 9d 00 07 00 9a 2b 11 05 ff 09 4f 00 07
00 1f 00 3f 06 7f 15 6d 15 07 00 2b 00 0c 27 00
3c ef 00 00 27 00 30 3b 00 00 00 00 00 00 ca 90

----------------

Block 0, Base EDID:
  EDID Structure Version & Revision: 1.4
  Vendor & Product Identification:
    Manufacturer: SDC
    Model: 16803
    Made in: 2023
  Basic Display Parameters & Features:
    Digital display
    Bits per primary color channel: 10
    DisplayPort interface
    Maximum image size: 34 cm x 22 cm
    Gamma: 2.20
    Supported color formats: RGB 4:4:4
    First detailed timing includes the native pixel format and preferred refresh rate
    Display supports continuous frequencies
  Color Characteristics:
    Red  : 0.6796, 0.3203
    Green: 0.2373, 0.7226
    Blue : 0.1396, 0.0498
    White: 0.3125, 0.3291
  Established Timings I & II: none
  Standard Timings: none
  Detailed Timing Descriptors:
    Alphanumeric Data String: '<<<.         '
    Display Range Limits:
      Monitor ranges (Range Limits Only): 48-240 Hz V, 426-426 kHz H, max dotclock 1130 MHz
    Alphanumeric Data String: 'SDC'
    Display Product Name: 'ATNA60DL01-0 '
  Extension blocks: 1
Checksum: 0x08

----------------

Block 1, DisplayID Extension Block:
  Version: 2.0
  Extension Count: 0
  Display Product Primary Use Case: None of the listed primary use cases; generic display
  Product Identification Data Block (0x20), OUI 4C-83-00:
    Product Code: 16803
    Year of Manufacture: 2033
  Display Parameters Data Block (0x21):
    Image size: 344.4 mm x 215.3 mm
    Display native pixel format: 2560x1600
    Scan Orientation: Left to Right, Top to Bottom
    Luminance Information: Minimum guaranteed value
    Color Information: CIE 1931
    Audio Speaker Information: integrated
    Native Color Chromaticity:
      Primary #1:  (0.679932, 0.320068)
      Primary #2:  (0.237061, 0.722900)
      Primary #3:  (0.139893, 0.050049)
      White Point: (0.312744, 0.329102)
    Native Maximum Luminance (Full Coverage): 400.000000 cd/m^2
    Native Maximum Luminance (10% Rectangular Coverage): 616.000000 cd/m^2
    Native Minimum Luminance: 0.000500 cd/m^2
    Native Color Depth: 10 bpc
    Display Device Technology: Organic LED
    Native Gamma EOTF: 2.20
  Display Interface Features Data Block:
    Supported bpc for RGB encoding: 10
    Supported color space and EOTF standard combination 1: DCI-P3, BT.2020/SMPTE ST 2084
  Video Timing Modes Type 7 - Detailed Timings Data Block:
    DTD:  2560x1600  240.000299 Hz  16:10   426.241 kHz   1125.275000 MHz (aspect 16:10, no 3D stereo, preferred)
               Hfront    8 Hsync  32 Hback   40 Hpol N
               Vfront  158 Vsync   8 Vback   10 Vpol N
    DTD:  2560x1600   60.000075 Hz  16:10   426.241 kHz   1125.275000 MHz (aspect 16:10, no 3D stereo)
               Hfront    8 Hsync  32 Hback   40 Hpol N
               Vfront 5486 Vsync   8 Vback   10 Vpol N
  Adaptive Sync Data Block:
    Descriptor #1:
      Native Panel Range
      Fixed Average V-Total and Adaptive V-Total
      Supports Seamless Transition
      'Max Single Frame Duration Increase' field value without jitter impact
      'Max Single Frame Duration Decrease' field value without jitter impact
      Max Duration Increase: 0.00 ms
      Max Duration Decrease: 0.00 ms
      Min Refresh Rate: 60 Hz
      Max Refresh Rate: 240 Hz
    Descriptor #2:
      Native Panel Range
      Fixed Average V-Total and Adaptive V-Total
      Supports Seamless Transition
      'Max Single Frame Duration Increase' field value without jitter impact
      'Max Single Frame Duration Decrease' field value without jitter impact
      Max Duration Increase: 0.00 ms
      Max Duration Decrease: 0.00 ms
      Min Refresh Rate: 48 Hz
      Max Refresh Rate: 60 Hz
  Checksum: 0xca
Checksum: 0x90

----------------

Failures:

Block 0, Base EDID:
  Standard Timings: Missing preferred timing.
  Alphanumeric Data String: No newline, but one or more trailing spaces.
  Display Range Limits: Byte 11 is 0x00 instead of 0x0a.
  Display Range Limits: Bytes 12-17 must be 0x20.
  Display Product Name: No newline, but one or more trailing spaces.
EDID:
  Extension Block 2 started with EDID header, ignoring Extension Blocks >= 2.

EDID conformity: FAIL
