edid-decode (hex):

00 ff ff ff ff ff ff 00 09 e5 bf 0c 00 00 00 00
03 22 01 04 a5 22 16 78 03 0f 95 ae 52 43 b0 26
0f 50 54 00 00 00 01 01 01 01 01 01 01 01 01 01
01 01 01 01 01 01 c0 72 00 a0 a0 40 c8 60 30 20
f6 0c 59 d7 10 00 00 1a 00 00 00 00 00 00 00 00
00 00 00 00 00 00 00 00 00 00 00 00 00 fe 00 34
52 4b 48 47 80 4e 45 31 36 4e 5a 48 00 00 00 00
00 02 41 1f b2 00 03 00 00 0f 41 0a 20 20 02 4a

70 20 79 02 00 20 00 13 9a 0e 00 bf 0c 00 00 00
00 03 18 07 4e 45 31 36 4e 5a 48 21 01 1d 77 0d
6a 08 00 0a 40 06 88 e1 ea 51 3d a4 b0 66 52 0f
02 35 54 d0 5f d0 5f 00 38 12 78 22 00 14 ff ed
11 85 ff 09 9f 00 2f 00 1f 00 3f 06 c7 00 3e 00
05 00 26 00 09 02 00 00 00 00 00 00 00 00 2b 00
0c 27 00 64 ef 00 00 27 00 30 3b 00 00 2e 00 06
40 4e d0 5f d0 5f 00 00 00 00 00 00 00 00 f7 90

70 20 79 00 00 81 00 15 74 1a 00 00 03 51 30 f0
00 00 6a 51 6a 51 f0 00 00 00 00 00 00 00 00 00
00 00 00 00 00 00 00 00 00 00 00 00 00 00 00 00
00 00 00 00 00 00 00 00 00 00 00 00 00 00 00 00
00 00 00 00 00 00 00 00 00 00 00 00 00 00 00 00
00 00 00 00 00 00 00 00 00 00 00 00 00 00 00 00
00 00 00 00 00 00 00 00 00 00 00 00 00 00 00 00
00 00 00 00 00 00 00 00 00 00 00 00 00 00 69 90

00 ff ff ff ff ff ff 00 09 e5 bf 0c 00 00 00 00
03 22 01 04 a5 22 16 78 03 0f 95 ae 52 43 b0 26
0f 50 54 00 00 00 01 01 01 01 01 01 01 01 01 01
01 01 01 01 01 01 c0 72 00 a0 a0 40 c8 60 30 20
f6 0c 59 d7 10 00 00 1a 00 00 00 00 00 00 00 00
00 00 00 00 00 00 00 00 00 00 00 00 00 fe 00 34
52 4b 48 47 80 4e 45 31 36 4e 5a 48 00 00 00 00
00 02 41 1f b2 00 03 00 00 0f 41 0a 20 20 02 4a

70 20 79 02 00 20 00 13 9a 0e 00 bf 0c 00 00 00
00 03 18 07 4e 45 31 36 4e 5a 48 21 01 1d 77 0d
6a 08 00 0a 40 06 88 e1 ea 51 3d a4 b0 66 52 0f
02 35 54 d0 5f d0 5f 00 38 12 78 22 00 14 ff ed
11 85 ff 09 9f 00 2f 00 1f 00 3f 06 c7 00 3e 00
05 00 26 00 09 02 00 00 00 00 00 00 00 00 2b 00
0c 27 00 64 ef 00 00 27 00 30 3b 00 00 2e 00 06
40 4e d0 5f d0 5f 00 00 00 00 00 00 00 00 f7 90

70 20 79 00 00 81 00 15 74 1a 00 00 03 51 30 f0
00 00 6a 51 6a 51 f0 00 00 00 00 00 00 00 00 00
00 00 00 00 00 00 00 00 00 00 00 00 00 00 00 00
00 00 00 00 00 00 00 00 00 00 00 00 00 00 00 00
00 00 00 00 00 00 00 00 00 00 00 00 00 00 00 00
00 00 00 00 00 00 00 00 00 00 00 00 00 00 00 00
00 00 00 00 00 00 00 00 00 00 00 00 00 00 00 00
00 00 00 00 00 00 00 00 00 00 00 00 00 00 69 90

----------------

Block 0, Base EDID:
  EDID Structure Version & Revision: 1.4
  Vendor & Product Identification:
    Manufacturer: BOE
    Model: 3263
    Made in: week 3 of 2024
  Basic Display Parameters & Features:
    Digital display
    Bits per primary color channel: 8
    DisplayPort interface
    Maximum image size: 34 cm x 22 cm
    Gamma: 2.20
    Supported color formats: RGB 4:4:4
    First detailed timing includes the native pixel format and preferred refresh rate
    Display supports continuous frequencies
  Color Characteristics:
    Red  : 0.6796, 0.3203
    Green: 0.2646, 0.6904
    Blue : 0.1503, 0.0595
    White: 0.3134, 0.3291
  Established Timings I & II: none
  Standard Timings: none
  Detailed Timing Descriptors:
    DTD 1:  2560x1600   60.000000 Hz  16:10   108.000 kHz    293.760000 MHz (345 mm x 215 mm)
                 Hfront   48 Hsync  32 Hback   80 Hpol P
                 Vfront   63 Vsync   6 Vback  131 Vpol N
    Empty Descriptor
    Alphanumeric Data String: '4RKHG.NE16NZH'
    Manufacturer-Specified Display Descriptor (0x00): 00 00 00 02 41 1f b2 00 03 00 00 0f 41 0a 20 20 '....A.......A.  '
  Extension blocks: 2
Checksum: 0x4a

----------------

Block 1, DisplayID Extension Block:
  Version: 2.0
  Extension Count: 0
  Display Product Primary Use Case: None of the listed primary use cases; generic display
  Product Identification Data Block (0x20), OUI 9A-0E-00:
    Product Code: 3263
    Year of Manufacture: 2024, Week 3
    Product ID: NE16NZH
  Display Parameters Data Block (0x21):
    Image size: 344.7 mm x 215.4 mm
    Display native pixel format: 2560x1600
    Scan Orientation: Left to Right, Top to Bottom
    Luminance Information: Guidance for the Source device
    Color Information: CIE 1931
    Audio Speaker Information: not integrated
    Native Color Chromaticity:
      Primary #1:  (0.679932, 0.319824)
      Primary #2:  (0.264893, 0.689941)
      Primary #3:  (0.149902, 0.059814)
      White Point: (0.312988, 0.328857)
    Native Maximum Luminance (Full Coverage): 500.000000 cd/m^2
    Native Maximum Luminance (10% Rectangular Coverage): 500.000000 cd/m^2
    Native Minimum Luminance: 0.500000 cd/m^2
    Native Color Depth: 8 bpc
    Display Device Technology: Active Matrix LCD
    Display Device Theme Preference: No Preference
    Native Gamma EOTF: 2.20
  Video Timing Modes Type 7 - Detailed Timings Data Block:
    DTD:  2560x1600  240.000000 Hz  16:10   432.000 kHz   1175.040000 MHz (aspect 16:10, no 3D stereo, preferred)
               Hfront   48 Hsync  32 Hback   80 Hpol N
               Vfront   63 Vsync   6 Vback  131 Vpol N
  Display Interface Features Data Block:
    Supported bpc for RGB encoding: 8
  Adaptive Sync Data Block:
    Descriptor #1:
      Native Panel Range
      Fixed Average V-Total and Adaptive V-Total
      Supports Seamless Transition
      'Max Single Frame Duration Increase' field value without jitter impact
      'Max Single Frame Duration Decrease' field value without jitter impact
      Max Duration Increase: 0.00 ms
      Max Duration Decrease: 0.00 ms
      Min Refresh Rate: 100 Hz
      Max Refresh Rate: 240 Hz
    Descriptor #2:
      Native Panel Range
      Fixed Average V-Total and Adaptive V-Total
      Supports Seamless Transition
      'Max Single Frame Duration Increase' field value without jitter impact
      'Max Single Frame Duration Decrease' field value without jitter impact
      Max Duration Increase: 0.00 ms
      Max Duration Decrease: 0.00 ms
      Min Refresh Rate: 48 Hz
      Max Refresh Rate: 60 Hz
  Brightness Luminance Range Data Block:
    Minimum SDR Luminance (Full Coverage): 25.000000 cd/m^2
    Maximum Suggested SDR Luminance (Full Coverage): 500.000000 cd/m^2
    Maximum Boost SDR Luminance: 500.000000 cd/m^2
  Checksum: 0xf7
Checksum: 0x90

----------------

Block 2, DisplayID Extension Block:
  Version: 2.0
  Extension Count: 0
  CTA-861 DisplayID Data Block:
  Vendor-Specific Data Block (AMD), OUI 00-00-1A:
    Version: 3
    Flags 1: 0x51
      FreeSync Supported
      Panel Replay/PSR Switch Supported
      Panel Replay Supported
    Minimum Refresh Rate: 48 Hz
    Maximum Refresh Rate: 240 Hz
    Flags 5: 0x00
  Checksum: 0x69
Checksum: 0x90

----------------

Warnings:

Block 0, Base EDID:
  Alphanumeric Data String: Non-ASCII character 0x80 at position 5, can cause problems.
  Missing Display Product Name.

Failures:

Block 0, Base EDID:
  Empty Descriptor: Use Dummy Descriptor instead of all zeroes.
  Missing Display Range Limits Descriptor.
Block 1, DisplayID Extension Block:
  Expected 0 DisplayID Extension Block, but got 1.
EDID:
  Extension Block 3 started with EDID header, ignoring Extension Blocks >= 3.

EDID conformity: FAIL
