edid-decode (hex):

00 ff ff ff ff ff ff 00 10 ac 18 a0 4c 32 32 30
14 10 01 03 0e 2b 1b 78 ee ee 91 a3 54 4c 99 26
0f 50 54 a5 4b 00 81 80 71 4f 01 01 01 01 01 01
01 01 01 01 01 01 21 39 90 30 62 1a 27 40 68 b0
36 00 b2 0e 11 00 00 1c 00 00 00 ff 00 48 46 37
33 32 36 35 46 30 32 32 4c 0a 00 00 00 fc 00 44
45 4c 4c 20 32 30 30 37 57 46 50 0a 00 00 00 fd
00 38 4c 1e 53 0f 00 0a 20 20 20 20 20 20 00 1b

00 ff ff ff ff ff ff 00 10 ac 18 a0 4c 32 32 30
14 10 01 03 0e 2b 1b 78 ee ee 91 a3 54 4c 99 26
0f 50 54 a5 4b 00 81 80 71 4f 01 01 01 01 01 01
01 01 01 01 01 01 21 39 90 30 62 1a 27 40 68 b0
36 00 b2 0e 11 00 00 1c 00 00 00 ff 00 48 46 37
33 32 36 35 46 30 32 32 4c 0a 00 00 00 fc 00 44
45 4c 4c 20 32 30 30 37 57 46 50 0a 00 00 00 fd
00 38 4c 1e 53 0f 00 0a 20 20 20 20 20 20 00 1b

----------------

Block 0, Base EDID:
  EDID Structure Version & Revision: 1.3
  Vendor & Product Identification:
    Manufacturer: DEL
    Model: 40984
    Serial Number: ...
    Made in: week 20 of 2006
  Basic Display Parameters & Features:
    Analog display
    Signal Level Standard: 0.700 : 0.300 : 1.000 V p-p
    Blank level equals black level
    Sync: Separate Composite SyncOnGreen
    Maximum image size: 43 cm x 27 cm
    Gamma: 2.20
    DPMS levels: Standby Suspend Off
    RGB color display
    Default (sRGB) color space is primary color space
    First detailed timing is the preferred timing
  Color Characteristics:
    Red  : 0.6396, 0.3300
    Green: 0.2998, 0.5996
    Blue : 0.1503, 0.0595
    White: 0.3125, 0.3291
  Established Timings I & II:
    IBM     :   720x400    70.081663 Hz   9:5     31.467 kHz     28.320000 MHz
    DMT 0x04:   640x480    59.940476 Hz   4:3     31.469 kHz     25.175000 MHz
    DMT 0x06:   640x480    75.000000 Hz   4:3     37.500 kHz     31.500000 MHz
    DMT 0x09:   800x600    60.316541 Hz   4:3     37.879 kHz     40.000000 MHz
    DMT 0x0b:   800x600    75.000000 Hz   4:3     46.875 kHz     49.500000 MHz
    DMT 0x10:  1024x768    60.003840 Hz   4:3     48.363 kHz     65.000000 MHz
    DMT 0x12:  1024x768    75.028582 Hz   4:3     60.023 kHz     78.750000 MHz
    DMT 0x24:  1280x1024   75.024675 Hz   5:4     79.976 kHz    135.000000 MHz
  Standard Timings:
    DMT 0x23:  1280x1024   60.019740 Hz   5:4     63.981 kHz    108.000000 MHz
    DMT 0x15:  1152x864    75.000000 Hz   4:3     67.500 kHz    108.000000 MHz
  Detailed Timing Descriptors:
    DTD 1:  1680x1050   59.954250 Hz  16:10    65.290 kHz    146.250000 MHz (434 mm x 270 mm)
                 Hfront  104 Hsync 176 Hback  280 Hpol N
                 Vfront    3 Vsync   6 Vback   30 Vpol P
    Display Product Serial Number: ...
    Display Product Name: 'DELL 2007WFP'
    Display Range Limits:
      Monitor ranges (GTF): 56-76 Hz V, 30-83 kHz H, max dotclock 150 MHz
Checksum: 0x1b

----------------

Failures:

EDID:
  Extension Block 1 started with EDID header, ignoring Extension Blocks >= 1.

EDID conformity: FAIL
