edid-decode (hex):

00 ff ff ff ff ff ff 00 06 af 3d 24 00 00 00 00
00 1c 01 04 a5 1f 11 78 02 8d 15 a1 56 52 9d 28
0a 50 54 00 00 00 01 01 01 01 01 01 01 01 01 01
01 01 01 01 01 01 14 37 80 b8 70 38 24 40 10 10
3e 00 35 ae 10 00 00 1a 10 2c 80 b8 70 38 24 40
10 10 3e 00 35 ae 10 00 00 1a 00 00 00 fe 00 39
50 4e 33 52 80 42 31 34 30 48 41 4b 00 00 00 00
00 03 41 02 9e 00 11 00 00 0a 01 0a 20 20 00 5e

----------------

Block 0, Base EDID:
  EDID Structure Version & Revision: 1.4
  Vendor & Product Identification:
    Manufacturer: AUO
    Model: 9277
    Made in: 2018
  Basic Display Parameters & Features:
    Digital display
    Bits per primary color channel: 8
    DisplayPort interface
    Maximum image size: 31 cm x 17 cm
    Gamma: 2.20
    Supported color formats: RGB 4:4:4
    First detailed timing includes the native pixel format and preferred refresh rate
  Color Characteristics:
    Red  : 0.6308, 0.3359
    Green: 0.3232, 0.6142
    Blue : 0.1562, 0.0400
    White: 0.3134, 0.3291
  Established Timings I & II: none
  Standard Timings: none
  Detailed Timing Descriptors:
    DTD 1:  1920x1080   60.049471 Hz  16:9     67.015 kHz    141.000000 MHz (309 mm x 174 mm)
                 Hfront   16 Hsync  16 Hback  152 Hpol P
                 Vfront    3 Vsync  14 Vback   19 Vpol N
    DTD 2:  1920x1080   48.039576 Hz  16:9     53.612 kHz    112.800000 MHz (309 mm x 174 mm)
                 Hfront   16 Hsync  16 Hback  152 Hpol P
                 Vfront    3 Vsync  14 Vback   19 Vpol N
    Alphanumeric Data String: '9PN3R.B140HAK'
    Manufacturer-Specified Display Descriptor (0x00): 00 00 00 03 41 02 9e 00 11 00 00 0a 01 0a 20 20 '....A.........  '
Checksum: 0x5e

----------------

Warnings:

Block 0, Base EDID:
  Alphanumeric Data String: Non-ASCII character 0x80 at position 5, can cause problems.
  Missing Display Product Name.

EDID conformity: PASS
