edid-decode (hex):

00 ff ff ff ff ff ff 00 26 cd 30 66 fc 04 00 00
01 1e 01 03 80 3c 22 78 ea 0c 9d ab 55 4c a0 24
0d 52 54 25 4b 00 95 00 a9 c0 a9 40 b3 00 d1 c0
d1 00 e1 00 01 01 56 5e 00 a0 a0 a0 29 50 30 20
35 00 55 50 21 00 00 1e 00 00 00 ff 00 31 31 35
35 36 30 30 31 30 31 32 37 36 00 00 00 fd 00 32
4c 1e 59 1b 00 0a 20 20 20 20 20 20 00 00 00 fc
00 50 4c 32 37 39 32 51 0a 20 20 20 20 20 01 18

00 ff ff ff ff ff ff 00 26 cd 30 66 fc 04 00 00
01 1e 01 03 80 3c 22 78 ea 0c 9d ab 55 4c a0 24
0d 52 54 25 4b 00 95 00 a9 c0 a9 40 b3 00 d1 c0
d1 00 e1 00 01 01 56 5e 00 a0 a0 a0 29 50 30 20
35 00 55 50 21 00 00 1e 00 00 00 ff 00 31 31 35
35 36 30 30 31 30 31 32 37 36 00 00 00 fd 00 32
4c 1e 59 1b 00 0a 20 20 20 20 20 20 00 00 00 fc
00 50 4c 32 37 39 32 51 0a 20 20 20 20 20 01 18

00 ff ff ff ff ff ff 00 26 cd 30 66 fc 04 00 00
01 1e 01 03 80 3c 22 78 ea 0c 9d ab 55 4c a0 24
0d 52 54 25 4b 00 95 00 a9 c0 a9 40 b3 00 d1 c0
d1 00 e1 00 01 01 56 5e 00 a0 a0 a0 29 50 30 20
35 00 55 50 21 00 00 1e 00 00 00 ff 00 31 31 35
35 36 30 30 31 30 31 32 37 36 00 00 00 fd 00 32
4c 1e 59 1b 00 0a 20 20 20 20 20 20 00 00 00 fc
00 50 4c 32 37 39 32 51 0a 20 20 20 20 20 01 18

00 ff ff ff ff ff ff 00 26 cd 30 66 fc 04 00 00
01 1e 01 03 80 3c 22 78 ea 0c 9d ab 55 4c a0 24
0d 52 54 25 4b 00 95 00 a9 c0 a9 40 b3 00 d1 c0
d1 00 e1 00 01 01 56 5e 00 a0 a0 a0 29 50 30 20
35 00 55 50 21 00 00 1e 00 00 00 ff 00 31 31 35
35 36 30 30 31 30 31 32 37 36 00 00 00 fd 00 32
4c 1e 59 1b 00 0a 20 20 20 20 20 20 00 00 00 fc
00 50 4c 32 37 39 32 51 0a 20 20 20 20 20 01 18

----------------

Block 0, Base EDID:
  EDID Structure Version & Revision: 1.3
  Vendor & Product Identification:
    Manufacturer: IVM
    Model: 26160
    Serial Number: ...
    Made in: week 1 of 2020
  Basic Display Parameters & Features:
    Digital display
    Maximum image size: 60 cm x 34 cm
    Gamma: 2.20
    DPMS levels: Standby Suspend Off
    RGB color display
    First detailed timing is the preferred timing
  Color Characteristics:
    Red  : 0.6679, 0.3320
    Green: 0.2998, 0.6250
    Blue : 0.1425, 0.0517
    White: 0.3232, 0.3291
  Established Timings I & II:
    DMT 0x04:   640x480    59.940476 Hz   4:3     31.469 kHz     25.175000 MHz
    DMT 0x06:   640x480    75.000000 Hz   4:3     37.500 kHz     31.500000 MHz
    DMT 0x09:   800x600    60.316541 Hz   4:3     37.879 kHz     40.000000 MHz
    DMT 0x0b:   800x600    75.000000 Hz   4:3     46.875 kHz     49.500000 MHz
    DMT 0x10:  1024x768    60.003840 Hz   4:3     48.363 kHz     65.000000 MHz
    DMT 0x12:  1024x768    75.028582 Hz   4:3     60.023 kHz     78.750000 MHz
    DMT 0x24:  1280x1024   75.024675 Hz   5:4     79.976 kHz    135.000000 MHz
  Standard Timings:
    DMT 0x2f:  1440x900    59.887445 Hz  16:10    55.935 kHz    106.500000 MHz
    DMT 0x53:  1600x900    60.000000 Hz  16:9     60.000 kHz    108.000000 MHz (RB)
    DMT 0x33:  1600x1200   60.000000 Hz   4:3     75.000 kHz    162.000000 MHz
    DMT 0x3a:  1680x1050   59.954250 Hz  16:10    65.290 kHz    146.250000 MHz
    DMT 0x52:  1920x1080   60.000000 Hz  16:9     67.500 kHz    148.500000 MHz
    DMT 0x45:  1920x1200   59.884600 Hz  16:10    74.556 kHz    193.250000 MHz
    GTF     :  2048x1280   60.000000 Hz  16:10    79.500 kHz    221.328000 MHz
  Detailed Timing Descriptors:
    DTD 1:  2560x1440   59.950550 Hz  16:9     88.787 kHz    241.500000 MHz (597 mm x 336 mm)
                 Hfront   48 Hsync  32 Hback   80 Hpol P
                 Vfront    3 Vsync   5 Vback   33 Vpol P
    Display Product Serial Number: ...
    Display Range Limits:
      Monitor ranges (GTF): 50-76 Hz V, 30-89 kHz H, max dotclock 270 MHz
    Display Product Name: 'PL2792Q'
  Extension blocks: 1
Checksum: 0x18

----------------

Failures:

EDID:
  Extension Block 1 started with EDID header, ignoring Extension Blocks >= 1.
  Base EDID: EDID specified 1 extension block(s), but found 0 extension block(s).

EDID conformity: FAIL
