edid-decode (hex):

00 ff ff ff ff ff ff 00 59 3a 27 00 01 01 01 01
22 11 01 03 3f 46 27 78 ea 33 3b a0 57 4a 9c 25
0f 47 4a 0f ca 00 01 01 01 01 01 01 01 01 01 01
01 01 01 01 01 01 4d 21 56 b0 51 00 1b 30 80 82
26 00 34 cc 31 00 00 1a 00 00 00 fd 00 32 55 1f
46 0b 00 0a 20 20 20 20 20 20 00 00 00 ff 00 53
50 41 4a 42 48 33 34 35 39 32 34 31 00 00 00 fc
00 56 57 33 32 4c 20 48 44 54 56 31 30 41 00 54

00 ff ff ff ff ff ff 00 59 3a 27 00 01 01 01 01
22 11 01 03 3f 46 27 78 ea 33 3b a0 57 4a 9c 25
0f 47 4a 0f ca 00 01 01 01 01 01 01 01 01 01 01
01 01 01 01 01 01 4d 21 56 b0 51 00 1b 30 80 82
26 00 34 cc 31 00 00 1a 00 00 00 fd 00 32 55 1f
46 0b 00 0a 20 20 20 20 20 20 00 00 00 ff 00 53
50 41 4a 42 48 33 34 35 39 32 34 31 00 00 00 fc
00 56 57 33 32 4c 20 48 44 54 56 31 30 41 00 54

----------------

Block 0, Base EDID:
  EDID Structure Version & Revision: 1.3
  Vendor & Product Identification:
    Manufacturer: VIZ
    Model: 39
    Serial Number: ...
    Made in: week 34 of 2007
  Basic Display Parameters & Features:
    Analog display
    Signal Level Standard: 0.714 : 0.286 : 1.000 V p-p
    Blank-to-black setup/pedestal
    Sync: Separate Composite SyncOnGreen Serration
    Maximum image size: 70 cm x 39 cm
    Gamma: 2.20
    DPMS levels: Standby Suspend Off
    RGB color display
    First detailed timing is the preferred timing
  Color Characteristics:
    Red  : 0.6250, 0.3427
    Green: 0.2890, 0.6123
    Blue : 0.1445, 0.0615
    White: 0.2792, 0.2919
  Established Timings I & II:
    DMT 0x05:   640x480    72.808802 Hz   4:3     37.861 kHz     31.500000 MHz
    DMT 0x06:   640x480    75.000000 Hz   4:3     37.500 kHz     31.500000 MHz
    DMT 0x08:   800x600    56.250000 Hz   4:3     35.156 kHz     36.000000 MHz
    DMT 0x09:   800x600    60.316541 Hz   4:3     37.879 kHz     40.000000 MHz
    DMT 0x0a:   800x600    72.187572 Hz   4:3     48.077 kHz     50.000000 MHz
    DMT 0x0b:   800x600    75.000000 Hz   4:3     46.875 kHz     49.500000 MHz
    DMT 0x10:  1024x768    60.003840 Hz   4:3     48.363 kHz     65.000000 MHz
    DMT 0x12:  1024x768    75.028582 Hz   4:3     60.023 kHz     78.750000 MHz
  Standard Timings: none
  Detailed Timing Descriptors:
    DTD 1:  1366x768    59.639991 Hz 683:384   47.414 kHz     85.250000 MHz (820 mm x 460 mm)
                 Hfront  128 Hsync 130 Hback  174 Hpol P
                 Vfront    2 Vsync   6 Vback   19 Vpol N
    Display Range Limits:
      Monitor ranges (GTF): 50-85 Hz V, 31-70 kHz H, max dotclock 110 MHz
    Display Product Serial Number: ...
    Display Product Name: 'VW32L HDTV10A'
Checksum: 0x54

----------------

Warnings:

Block 0, Base EDID:
  Vendor & Product Identification: The serial number is one of the known dummy values, it should probably be set to 0.

Failures:

Block 0, Base EDID:
  Detailed Timing Descriptor #1: Mismatch of image size 820x460 mm vs display size 700x390 mm.
EDID:
  Extension Block 1 started with EDID header, ignoring Extension Blocks >= 1.
  Base EDID: The DTD max image size is 820x460mm, which is larger than the display size 700.0x390.0mm.

EDID conformity: FAIL
