edid-decode (hex):

00 ff ff ff ff ff ff 00 0e 14 ee 13 00 00 00 00
2b 0f 01 03 80 21 15 78 0a 09 2d 9d 56 4f 90 27
21 50 54 00 00 00 01 01 01 01 01 01 01 01 01 01
01 01 01 01 01 01 ea 1a 00 80 50 20 0d 30 18 20
13 00 4b cf 10 00 00 19 00 00 00 0f 00 20 20 20
20 20 20 20 20 20 6e 05 0f 00 00 00 00 fe 00 43
50 54 0a 20 20 20 20 20 20 20 20 20 00 00 00 fe
00 31 35 34 57 41 30 31 41 51 20 20 0a 20 00 5d

00 ff ff ff ff ff ff 00 0e 14 ee 13 00 00 00 00
2b 0f 01 03 80 21 15 78 0a 09 2d 9d 56 4f 90 27
21 50 54 00 00 00 01 01 01 01 01 01 01 01 01 01
01 01 01 01 01 01 ea 1a 00 80 50 20 0d 30 18 20
13 00 4b cf 10 00 00 19 00 00 00 0f 00 20 20 20
20 20 20 20 20 20 6e 05 0f 00 00 00 00 fe 00 43
50 54 0a 20 20 20 20 20 20 20 20 20 00 00 00 fe
00 31 35 34 57 41 30 31 41 51 20 20 0a 20 00 5d

----------------

Block 0, Base EDID:
  EDID Structure Version & Revision: 1.3
  Vendor & Product Identification:
    Manufacturer: CPT
    Model: 5102
    Made in: week 43 of 2005
  Basic Display Parameters & Features:
    Digital display
    Maximum image size: 33 cm x 21 cm
    Gamma: 2.20
    RGB color display
    First detailed timing is the preferred timing
  Color Characteristics:
    Red  : 0.6132, 0.3359
    Green: 0.3105, 0.5634
    Blue : 0.1523, 0.1308
    White: 0.3154, 0.3291
  Established Timings I & II: none
  Standard Timings: none
  Detailed Timing Descriptors:
    DTD 1:  1280x800    60.190233 Hz  16:10    48.935 kHz     68.900000 MHz (331 mm x 207 mm)
                 Hfront   24 Hsync  32 Hback   72 Hpol N
                 Vfront    1 Vsync   3 Vback    9 Vpol N
    Manufacturer-Specified Display Descriptor (0x0f): 00 0f 00 20 20 20 20 20 20 20 20 20 6e 05 0f 00 '...         n...'
    Alphanumeric Data String: 'CPT'
    Alphanumeric Data String: '154WA01AQ  '
Checksum: 0x5d

----------------

Failures:

Block 0, Base EDID:
  Alphanumeric Data String: One or more trailing spaces before newline.
  Missing Display Product Name.
  Missing Display Range Limits Descriptor.
EDID:
  Extension Block 1 started with EDID header, ignoring Extension Blocks >= 1.

EDID conformity: FAIL
