edid-decode (hex):

00 ff ff ff ff ff ff 00 30 f0 1c 9c 00 00 00 00
00 0c 01 03 80 1c 15 78 0a 88 7d 96 56 51 8c 26
21 51 54 00 00 00 01 01 01 01 01 01 01 01 01 01
01 01 01 01 01 01 64 19 00 40 41 00 26 30 18 88
36 00 1d d6 10 00 00 18 00 00 00 0f 00 04 4b 09
9b 01 0c 02 1b 5b aa 06 1f 00 00 00 00 fe 00 32
4b 30 37 37 05 31 34 31 58 31 33 0a 00 00 00 fe
00 e6 d8 ce c5 b2 96 72 00 01 00 0a 20 20 00 b8

----------------

Block 0, Base EDID:
  EDID Structure Version & Revision: 1.3
  Vendor & Product Identification:
    Manufacturer: LGP
    Model: 39964
    Made in: 2002
  Basic Display Parameters & Features:
    Digital display
    Maximum image size: 28 cm x 21 cm
    Gamma: 2.20
    RGB color display
    First detailed timing is the preferred timing
  Color Characteristics:
    Red  : 0.5878, 0.3359
    Green: 0.3183, 0.5468
    Blue : 0.1494, 0.1318
    White: 0.3193, 0.3291
  Established Timings I & II: none
  Standard Timings: none
  Detailed Timing Descriptors:
    DTD 1:  1024x768    60.003840 Hz   4:3     48.363 kHz     65.000000 MHz (285 mm x 214 mm)
                 Hfront   24 Hsync 136 Hback  160 Hpol N
                 Vfront    3 Vsync   6 Vback   29 Vpol N
    Manufacturer-Specified Display Descriptor (0x0f): 00 0f 00 04 4b 09 9b 01 0c 02 1b 5b aa 06 1f 00 '....K......[....'
    Alphanumeric Data String: '2K077.141X13'
    Alphanumeric Data String: '......r'
Checksum: 0xb8

----------------

Warnings:

Block 0, Base EDID:
  Alphanumeric Data String: Non-ASCII character 0x05 at position 5, can cause problems.
  Alphanumeric Data String: Non-ASCII character 0xe6 at position 0, can cause problems.
  Alphanumeric Data String: Non-ASCII character 0xd8 at position 1, can cause problems.
  Alphanumeric Data String: Non-ASCII character 0xce at position 2, can cause problems.
  Alphanumeric Data String: Non-ASCII character 0xc5 at position 3, can cause problems.
  Alphanumeric Data String: Non-ASCII character 0xb2 at position 4, can cause problems.
  Alphanumeric Data String: Non-ASCII character 0x96 at position 5, can cause problems.

Failures:

Block 0, Base EDID:
  Alphanumeric Data String: NUL byte at position 7.
  Missing Display Product Name.
  Missing Display Range Limits Descriptor.

EDID conformity: FAIL
