edid-decode (hex):

00 ff ff ff ff ff ff 00 1c 2d 60 15 01 01 01 01
29 1c 01 03 80 22 13 78 ea de 50 a3 54 4c 99 26
0f 50 54 a5 4b 00 81 80 a9 40 d1 c0 8b 00 01 01
01 01 01 01 01 01 02 3a 80 18 71 38 2d 40 58 2c
45 00 59 c3 10 00 00 1e 00 00 00 ff 00 00 0a 20
20 20 20 20 20 20 20 20 20 20 00 00 00 fc 00 50
44 31 35 36 30 0a 20 20 20 20 20 20 00 00 00 fd
00 31 4c 1e 51 11 00 0a 20 20 20 20 20 20 00 b3

00 ff ff ff ff ff ff 00 1c 2d 60 15 01 01 01 01
29 1c 01 03 80 22 13 78 ea de 50 a3 54 4c 99 26
0f 50 54 a5 4b 00 81 80 a9 40 d1 c0 8b 00 01 01
01 01 01 01 01 01 02 3a 80 18 71 38 2d 40 58 2c
45 00 59 c3 10 00 00 1e 00 00 00 ff 00 00 0a 20
20 20 20 20 20 20 20 20 20 20 00 00 00 fc 00 50
44 31 35 36 30 0a 20 20 20 20 20 20 00 00 00 fd
00 31 4c 1e 51 11 00 0a 20 20 20 20 20 20 00 b3

----------------

Block 0, Base EDID:
  EDID Structure Version & Revision: 1.3
  Vendor & Product Identification:
    Manufacturer: GAM
    Model: 5472
    Serial Number: ...
    Made in: week 41 of 2018
  Basic Display Parameters & Features:
    Digital display
    Maximum image size: 34 cm x 19 cm
    Gamma: 2.20
    DPMS levels: Standby Suspend Off
    RGB color display
    First detailed timing is the preferred timing
  Color Characteristics:
    Red  : 0.6396, 0.3291
    Green: 0.2998, 0.5996
    Blue : 0.1494, 0.0595
    White: 0.3125, 0.3281
  Established Timings I & II:
    IBM     :   720x400    70.081663 Hz   9:5     31.467 kHz     28.320000 MHz
    DMT 0x04:   640x480    59.940476 Hz   4:3     31.469 kHz     25.175000 MHz
    DMT 0x06:   640x480    75.000000 Hz   4:3     37.500 kHz     31.500000 MHz
    DMT 0x09:   800x600    60.316541 Hz   4:3     37.879 kHz     40.000000 MHz
    DMT 0x0b:   800x600    75.000000 Hz   4:3     46.875 kHz     49.500000 MHz
    DMT 0x10:  1024x768    60.003840 Hz   4:3     48.363 kHz     65.000000 MHz
    DMT 0x12:  1024x768    75.028582 Hz   4:3     60.023 kHz     78.750000 MHz
    DMT 0x24:  1280x1024   75.024675 Hz   5:4     79.976 kHz    135.000000 MHz
  Standard Timings:
    DMT 0x23:  1280x1024   60.019740 Hz   5:4     63.981 kHz    108.000000 MHz
    DMT 0x33:  1600x1200   60.000000 Hz   4:3     75.000 kHz    162.000000 MHz
    DMT 0x52:  1920x1080   60.000000 Hz  16:9     67.500 kHz    148.500000 MHz
    GTF     :  1360x850    60.000254 Hz  16:10    52.800 kHz     94.618000 MHz
  Detailed Timing Descriptors:
    DTD 1:  1920x1080   60.000000 Hz  16:9     67.500 kHz    148.500000 MHz (345 mm x 195 mm)
                 Hfront   88 Hsync  44 Hback  148 Hpol P
                 Vfront    4 Vsync   5 Vback   36 Vpol P
    Display Product Serial Number: ...
    Display Product Name: 'PD1560'
    Display Range Limits:
      Monitor ranges (GTF): 49-76 Hz V, 30-81 kHz H, max dotclock 170 MHz
Checksum: 0xb3

----------------

Warnings:

Block 0, Base EDID:
  Vendor & Product Identification: The serial number is one of the known dummy values, it should probably be set to 0.

Failures:

Block 0, Base EDID:
  Display Product Serial Number: ...
EDID:
  Extension Block 1 started with EDID header, ignoring Extension Blocks >= 1.

EDID conformity: FAIL
