edid-decode (hex):

00 ff ff ff ff ff ff 00 06 af a8 87 00 00 00 00
ef 20 01 04 a5 22 16 78 03 0f 95 ae 52 43 b0 26
0f 50 54 00 00 00 01 01 01 01 01 01 01 01 01 01
01 01 01 01 01 01 52 ee 00 a0 f0 60 8e 90 30 20
35 00 58 d7 10 00 00 18 00 00 00 0f 00 00 00 00
00 00 00 00 00 00 00 00 00 20 00 00 00 00 00 00
00 00 00 00 00 00 00 00 00 00 00 00 00 00 00 02
00 0c 24 ff 12 3c fa e2 16 c5 fa 20 20 20 01 4c

70 20 79 02 00 22 00 14 4b 9e 12 84 ff 0e 9f 00
2f 80 1f 00 5f 09 8d 00 09 00 09 00 25 01 09 4b
9e 12 4b 9e 12 30 78 80 81 00 10 72 1a 00 00 03
01 30 78 00 00 6a 48 6a 48 78 00 00 00 00 00 00
00 00 00 00 00 00 00 00 00 00 00 00 00 00 00 00
00 00 00 00 00 00 00 00 00 00 00 00 00 00 00 00
00 00 00 00 00 00 00 00 00 00 00 00 00 00 00 00
00 00 00 00 00 00 00 00 00 00 00 00 00 00 3d 90

00 ff ff ff ff ff ff 00 06 af a8 87 00 00 00 00
ef 20 01 04 a5 22 16 78 03 0f 95 ae 52 43 b0 26
0f 50 54 00 00 00 01 01 01 01 01 01 01 01 01 01
01 01 01 01 01 01 52 ee 00 a0 f0 60 8e 90 30 20
35 00 58 d7 10 00 00 18 00 00 00 0f 00 00 00 00
00 00 00 00 00 00 00 00 00 20 00 00 00 00 00 00
00 00 00 00 00 00 00 00 00 00 00 00 00 00 00 02
00 0c 24 ff 12 3c fa e2 16 c5 fa 20 20 20 01 4c

70 20 79 02 00 22 00 14 4b 9e 12 84 ff 0e 9f 00
2f 80 1f 00 5f 09 8d 00 09 00 09 00 25 01 09 4b
9e 12 4b 9e 12 30 78 80 81 00 10 72 1a 00 00 03
01 30 78 00 00 6a 48 6a 48 78 00 00 00 00 00 00
00 00 00 00 00 00 00 00 00 00 00 00 00 00 00 00
00 00 00 00 00 00 00 00 00 00 00 00 00 00 00 00
00 00 00 00 00 00 00 00 00 00 00 00 00 00 00 00
00 00 00 00 00 00 00 00 00 00 00 00 00 00 3d 90

----------------

Block 0, Base EDID:
  EDID Structure Version & Revision: 1.4
  Vendor & Product Identification:
    Manufacturer: AUO
    Model: 34728
    Made in: week 239 of 2022
  Basic Display Parameters & Features:
    Digital display
    Bits per primary color channel: 8
    DisplayPort interface
    Maximum image size: 34 cm x 22 cm
    Gamma: 2.20
    Supported color formats: RGB 4:4:4
    First detailed timing includes the native pixel format and preferred refresh rate
    Display supports continuous frequencies
  Color Characteristics:
    Red  : 0.6796, 0.3203
    Green: 0.2646, 0.6904
    Blue : 0.1503, 0.0595
    White: 0.3134, 0.3291
  Established Timings I & II: none
  Standard Timings: none
  Detailed Timing Descriptors:
    DTD 1:  3840x2400   60.001967 Hz  16:10   152.525 kHz    610.100000 MHz (344 mm x 215 mm)
                 Hfront   48 Hsync  32 Hback   80 Hpol N
                 Vfront    3 Vsync   5 Vback  134 Vpol N
    Manufacturer-Specified Display Descriptor (0x0f): 00 0f 00 00 00 00 00 00 00 00 00 00 00 00 00 20 '............... '
    Empty Descriptor
    Manufacturer-Specified Display Descriptor (0x02): 00 02 00 0c 24 ff 12 3c fa e2 16 c5 fa 20 20 20 '....$..<.....   '
  Extension blocks: 1
Checksum: 0x4c

----------------

Block 1, DisplayID Extension Block:
  Version: 2.0
  Extension Count: 0
  Display Product Primary Use Case: None of the listed primary use cases; generic display
  Video Timing Modes Type 7 - Detailed Timings Data Block:
    DTD:  3840x2400  120.001180 Hz  16:9    305.043 kHz   1220.172000 MHz (aspect 16:9, no 3D stereo, preferred)
               Hfront   48 Hsync  32 Hback   80 Hpol P
               Vfront   10 Vsync  10 Vback  122 Vpol N
  Dynamic Video Timing Range Limits Data Block:
    Minimum Pixel Clock: 1220172 kHz
    Maximum Pixel Clock: 1220172 kHz
    Minimum Vertical Refresh Rate: 48 Hz
    Maximum Vertical Refresh Rate: 120 Hz
    Seamless Dynamic Video Timing Support: Yes
  CTA-861 DisplayID Data Block:
  Vendor-Specific Data Block (AMD), OUI 00-00-1A:
    Version: 3
    Feature Caps: 0x01
    Minimum Refresh Rate: 48 Hz
    Maximum Refresh Rate: 120 Hz
    Flags 1.x: 0x00
    Flags 2.x: 0x00
    Maximum luminance: 106 (496.743 cd/m^2)
    Minimum luminance: 72 (0.396 cd/m^2)
    Unknown: 0x6a 0x48
  Checksum: 0x3d
Checksum: 0x90

----------------

Block 2, Unknown EDID Extension Block 0x00:
  00 ff ff ff ff ff ff 00 06 af a8 87 00 00 00 00 '................'
  ef 20 01 04 a5 22 16 78 03 0f 95 ae 52 43 b0 26 '. ...".x....RC.&'
  0f 50 54 00 00 00 01 01 01 01 01 01 01 01 01 01 '.PT.............'
  01 01 01 01 01 01 52 ee 00 a0 f0 60 8e 90 30 20 '......R....`..0 '
  35 00 58 d7 10 00 00 18 00 00 00 0f 00 00 00 00 '5.X.............'
  00 00 00 00 00 00 00 00 00 20 00 00 00 00 00 00 '......... ......'
  00 00 00 00 00 00 00 00 00 00 00 00 00 00 00 02 '................'
  00 0c 24 ff 12 3c fa e2 16 c5 fa 20 20 20 01 4c '..$..<.....   .L'
Checksum: 0x4c

----------------

Block 3, DisplayID Extension Block:
  Version: 2.0
  Extension Count: 0
  Video Timing Modes Type 7 - Detailed Timings Data Block:
    DTD:  3840x2400  120.001180 Hz  16:9    305.043 kHz   1220.172000 MHz (aspect 16:9, no 3D stereo, preferred)
               Hfront   48 Hsync  32 Hback   80 Hpol P
               Vfront   10 Vsync  10 Vback  122 Vpol N
  Dynamic Video Timing Range Limits Data Block:
    Minimum Pixel Clock: 1220172 kHz
    Maximum Pixel Clock: 1220172 kHz
    Minimum Vertical Refresh Rate: 48 Hz
    Maximum Vertical Refresh Rate: 120 Hz
    Seamless Dynamic Video Timing Support: Yes
  CTA-861 DisplayID Data Block:
  Vendor-Specific Data Block (AMD), OUI 00-00-1A:
    Version: 3
    Feature Caps: 0x01
    Minimum Refresh Rate: 48 Hz
    Maximum Refresh Rate: 120 Hz
    Flags 1.x: 0x00
    Flags 2.x: 0x00
    Maximum luminance: 106 (496.743 cd/m^2)
    Minimum luminance: 72 (0.396 cd/m^2)
    Unknown: 0x6a 0x48
  Checksum: 0x3d
Checksum: 0x90

----------------

Warnings:

Block 0, Base EDID:
  Missing Display Product Name.

Failures:

Block 0, Base EDID:
  Vendor & Product Identification: Invalid week of manufacture (> 54).
  Empty Descriptor: Use Dummy Descriptor instead of all zeroes.
  Missing Display Range Limits Descriptor.
Block 1, DisplayID Extension Block:
  Expected 0 DisplayID Extension Block, but got 1.
  Vendor-Specific Data Block (AMD), OUI 00-00-1A: Length is 16 instead of 19.
Block 2, Base EDID:
  Unknown Extension Block.
Block 3, DisplayID Extension Block:
  Product Type should be 0 in extension block.
  Vendor-Specific Data Block (AMD), OUI 00-00-1A: Length is 16 instead of 19.
EDID:
  Base EDID: EDID specified 1 extension block(s), but found 3 extension block(s).
  DisplayID: Missing DisplayID Display Parameters Data Block.

EDID conformity: FAIL
