edid-decode (hex):

00 ff ff ff ff ff ff 00 4e 14 4b 60 01 00 00 00
10 1f 01 04 b5 34 1f 78 3b 72 b5 a7 55 52 a0 27
10 50 54 bf ef 80 71 4f 81 c0 81 40 81 80 95 01
a9 c0 b3 00 d1 c0 02 3a 80 18 71 38 2d 40 58 2c
45 00 08 36 21 00 00 1e 00 00 00 fd 00 30 a5 de
de 28 01 0a 20 20 20 20 20 20 00 00 00 fc 00 53
63 65 70 74 72 65 20 4d 32 34 38 0a 00 00 00 ff
00 30 30 30 30 30 30 30 30 30 30 30 30 30 01 dd

02 03 27 f1 4c 90 02 03 04 05 01 11 12 13 14 1f
3f 23 09 07 07 83 01 00 00 6d 1a 00 00 02 01 30
a5 00 00 00 00 00 00 5e 7f 80 78 70 38 1e 40 18
20 35 00 08 36 21 00 00 1e 87 74 80 18 71 38 32
40 30 20 35 00 08 36 21 00 00 1e cf 94 80 a0 70
38 1e 40 30 2c 35 00 08 36 21 00 00 1e 66 21 56
aa 51 00 1e 30 46 8f 33 00 08 36 21 00 00 1e 00
00 00 00 00 00 00 00 00 00 00 00 00 00 00 00 7c

00 ff ff ff ff ff ff 00 4e 14 4b 60 01 00 00 00
10 1f 01 04 b5 34 1f 78 3b 72 b5 a7 55 52 a0 27
10 50 54 bf ef 80 71 4f 81 c0 81 40 81 80 95 01
a9 c0 b3 00 d1 c0 02 3a 80 18 71 38 2d 40 58 2c
45 00 08 36 21 00 00 1e 00 00 00 fd 00 30 a5 de
de 28 01 0a 20 20 20 20 20 20 00 00 00 fc 00 53
63 65 70 74 72 65 20 4d 32 34 38 0a 00 00 00 ff
00 30 30 30 30 30 30 30 30 30 30 30 30 30 01 dd

02 03 27 f1 4c 90 02 03 04 05 01 11 12 13 14 1f
3f 23 09 07 07 83 01 00 00 6d 1a 00 00 02 01 30
a5 00 00 00 00 00 00 5e 7f 80 78 70 38 1e 40 18
20 35 00 08 36 21 00 00 1e 87 74 80 18 71 38 32
40 30 20 35 00 08 36 21 00 00 1e cf 94 80 a0 70
38 1e 40 30 2c 35 00 08 36 21 00 00 1e 66 21 56
aa 51 00 1e 30 46 8f 33 00 08 36 21 00 00 1e 00
00 00 00 00 00 00 00 00 00 00 00 00 00 00 00 7c

----------------

Block 0, Base EDID:
  EDID Structure Version & Revision: 1.4
  Vendor & Product Identification:
    Manufacturer: SPT
    Model: 24651
    Serial Number: ...
    Made in: week 16 of 2021
  Basic Display Parameters & Features:
    Digital display
    Bits per primary color channel: 10
    DisplayPort interface
    Maximum image size: 52 cm x 31 cm
    Gamma: 2.20
    DPMS levels: Off
    Supported color formats: RGB 4:4:4, YCrCb 4:4:4, YCrCb 4:2:2
    First detailed timing includes the native pixel format and preferred refresh rate
    Display supports continuous frequencies
  Color Characteristics:
    Red  : 0.6533, 0.3349
    Green: 0.3203, 0.6269
    Blue : 0.1542, 0.0654
    White: 0.3134, 0.3291
  Established Timings I & II:
    IBM     :   720x400    70.081663 Hz   9:5     31.467 kHz     28.320000 MHz
    DMT 0x04:   640x480    59.940476 Hz   4:3     31.469 kHz     25.175000 MHz
    Apple   :   640x480    66.666667 Hz   4:3     35.000 kHz     30.240000 MHz
    DMT 0x05:   640x480    72.808802 Hz   4:3     37.861 kHz     31.500000 MHz
    DMT 0x06:   640x480    75.000000 Hz   4:3     37.500 kHz     31.500000 MHz
    DMT 0x08:   800x600    56.250000 Hz   4:3     35.156 kHz     36.000000 MHz
    DMT 0x09:   800x600    60.316541 Hz   4:3     37.879 kHz     40.000000 MHz
    DMT 0x0a:   800x600    72.187572 Hz   4:3     48.077 kHz     50.000000 MHz
    DMT 0x0b:   800x600    75.000000 Hz   4:3     46.875 kHz     49.500000 MHz
    Apple   :   832x624    74.551266 Hz   4:3     49.726 kHz     57.284000 MHz
    DMT 0x10:  1024x768    60.003840 Hz   4:3     48.363 kHz     65.000000 MHz
    DMT 0x11:  1024x768    70.069359 Hz   4:3     56.476 kHz     75.000000 MHz
    DMT 0x12:  1024x768    75.028582 Hz   4:3     60.023 kHz     78.750000 MHz
    DMT 0x24:  1280x1024   75.024675 Hz   5:4     79.976 kHz    135.000000 MHz
    Apple   :  1152x870    75.061550 Hz 192:145   68.681 kHz    100.000000 MHz
  Standard Timings:
    DMT 0x15:  1152x864    75.000000 Hz   4:3     67.500 kHz    108.000000 MHz
    DMT 0x55:  1280x720    60.000000 Hz  16:9     45.000 kHz     74.250000 MHz
    DMT 0x20:  1280x960    60.000000 Hz   4:3     60.000 kHz    108.000000 MHz
    DMT 0x23:  1280x1024   60.019740 Hz   5:4     63.981 kHz    108.000000 MHz
    GTF     :  1440x900    61.000089 Hz  16:10    56.852 kHz    109.156000 MHz
    DMT 0x53:  1600x900    60.000000 Hz  16:9     60.000 kHz    108.000000 MHz (RB)
    DMT 0x3a:  1680x1050   59.954250 Hz  16:10    65.290 kHz    146.250000 MHz
    DMT 0x52:  1920x1080   60.000000 Hz  16:9     67.500 kHz    148.500000 MHz
  Detailed Timing Descriptors:
    DTD 1:  1920x1080   60.000000 Hz  16:9     67.500 kHz    148.500000 MHz (520 mm x 310 mm)
                 Hfront   88 Hsync  44 Hback  148 Hpol P
                 Vfront    4 Vsync   5 Vback   36 Vpol P
    Display Range Limits:
      Monitor ranges (Range Limits Only): 48-165 Hz V, 222-222 kHz H, max dotclock 400 MHz
    Display Product Name: 'Sceptre M248'
    Display Product Serial Number: ...
  Extension blocks: 1
Checksum: 0xdd

----------------

Block 1, CTA-861 Extension Block:
  Revision: 3
  Underscans IT Video Formats by default
  Basic audio support
  Supports YCbCr 4:4:4
  Supports YCbCr 4:2:2
  Native DTDs: 1
  Video Data Block:
    VIC  16:  1920x1080   60.000000 Hz  16:9     67.500 kHz    148.500000 MHz (native)
    VIC   2:   720x480    59.940060 Hz   4:3     31.469 kHz     27.000000 MHz
    VIC   3:   720x480    59.940060 Hz  16:9     31.469 kHz     27.000000 MHz
    VIC   4:  1280x720    60.000000 Hz  16:9     45.000 kHz     74.250000 MHz
    VIC   5:  1920x1080i  60.000000 Hz  16:9     33.750 kHz     74.250000 MHz
    VIC   1:   640x480    59.940476 Hz   4:3     31.469 kHz     25.175000 MHz
    VIC  17:   720x576    50.000000 Hz   4:3     31.250 kHz     27.000000 MHz
    VIC  18:   720x576    50.000000 Hz  16:9     31.250 kHz     27.000000 MHz
    VIC  19:  1280x720    50.000000 Hz  16:9     37.500 kHz     74.250000 MHz
    VIC  20:  1920x1080i  50.000000 Hz  16:9     28.125 kHz     74.250000 MHz
    VIC  31:  1920x1080   50.000000 Hz  16:9     56.250 kHz    148.500000 MHz
    VIC  63:  1920x1080  120.000000 Hz  16:9    135.000 kHz    297.000000 MHz
  Audio Data Block:
    Linear PCM:
      Max channels: 2
      Supported sample rates (kHz): 48 44.1 32
      Supported sample sizes (bits): 24 20 16
  Speaker Allocation Data Block:
    FL/FR - Front Left/Right
  Vendor-Specific Data Block (AMD), OUI 00-00-1A:
    Version: 2
    Feature Caps: 0x01
    Minimum Refresh Rate: 48 Hz
    Maximum Refresh Rate: 165 Hz
    Flags 1.x: 0x00
    Flags 2.x: 0x00
  Detailed Timing Descriptors:
    DTD 2:  1920x1080  143.993994 Hz  16:9    159.833 kHz    326.060000 MHz (520 mm x 310 mm)
                 Hfront   24 Hsync  32 Hback   64 Hpol P
                 Vfront    3 Vsync   5 Vback   22 Vpol P
    DTD 3:  1920x1080  119.995977 Hz  16:9    135.595 kHz    298.310000 MHz (520 mm x 310 mm)
                 Hfront   48 Hsync  32 Hback  200 Hpol P
                 Vfront    3 Vsync   5 Vback   42 Vpol P
    DTD 4:  1920x1080  164.999134 Hz  16:9    183.149 kHz    380.950000 MHz (520 mm x 310 mm)
                 Hfront   48 Hsync  44 Hback   68 Hpol P
                 Vfront    3 Vsync   5 Vback   22 Vpol P
    DTD 5:  1366x768    59.789541 Hz 683:384   47.712 kHz     85.500000 MHz (520 mm x 310 mm)
                 Hfront   70 Hsync 143 Hback  213 Hpol P
                 Vfront    3 Vsync   3 Vback   24 Vpol P
Checksum: 0x7c  Unused space in Extension Block: 16 bytes

----------------

Warnings:

Block 0, Base EDID:
  Vendor & Product Identification: The serial number is one of the known dummy values, it should probably be set to 0.
  Detailed Timing Descriptor #1: Image size is 520x310 mm, but based on the picture AR it should be 520x292 mm.
  Display Product Serial Number: ...
Block 1, CTA-861 Extension Block:
  Detailed Timing Descriptor #2: Image size is 520x310 mm, but based on the picture AR it should be 520x292 mm.
  Detailed Timing Descriptor #3: Image size is 520x310 mm, but based on the picture AR it should be 520x292 mm.
  Detailed Timing Descriptor #4: Image size is 520x310 mm, but based on the picture AR it should be 520x292 mm.
  Detailed Timing Descriptor #5: Image size is 520x310 mm, but based on the picture AR it should be 520x292 mm.
  Display Product Serial Number is set, so the Serial Number in the Base EDID should be 0.
  Add a Colorimetry Data Block with the sRGB colorimetry bit set to avoid interop issues.
EDID:
  Base EDID: Some timings are out of range of the Monitor Ranges:
    Horizontal Freq: 28.125 - 183.149 kHz (Monitor: 222.000 - 222.000 kHz)

Failures:

Block 1, CTA-861 Extension Block:
  Missing VCDB, needed for Set Selectable RGB Quantization to avoid interop issues.
EDID:
  Extension Block 2 started with EDID header, ignoring Extension Blocks >= 2.

EDID conformity: FAIL
