edid-decode (hex):

00 ff ff ff ff ff ff 00 4c 23 19 32 03 00 00 00
17 19 01 03 80 29 17 78 2e b1 a5 a1 58 4f 95 26
16 50 54 af ce 00 81 c0 71 40 81 8f 81 40 01 01
01 01 01 01 01 01 34 21 56 b0 51 00 1b 30 40 70
36 00 30 e4 10 00 00 1a a9 1a 00 00 50 00 16 30
30 20 37 00 dd 0c 11 00 00 1a 00 00 00 fd 00 38
4b 1e 51 0e 00 0a 20 20 20 20 20 20 00 00 00 fc
00 43 61 73 70 65 72 0a 20 20 20 20 20 20 00 5a

00 ff ff ff ff ff ff 00 4c 23 19 32 03 00 00 00
17 19 01 03 80 29 17 78 2e b1 a5 a1 58 4f 95 26
16 50 54 af ce 00 81 c0 71 40 81 8f 81 40 01 01
01 01 01 01 01 01 34 21 56 b0 51 00 1b 30 40 70
36 00 30 e4 10 00 00 1a a9 1a 00 00 50 00 16 30
30 20 37 00 dd 0c 11 00 00 1a 00 00 00 fd 00 38
4b 1e 51 0e 00 0a 20 20 20 20 20 20 00 00 00 fc
00 43 61 73 70 65 72 0a 20 20 20 20 20 20 00 5a

----------------

Block 0, Base EDID:
  EDID Structure Version & Revision: 1.3
  Vendor & Product Identification:
    Manufacturer: SAC
    Model: 12825
    Serial Number: ...
    Made in: week 23 of 2015
  Basic Display Parameters & Features:
    Digital display
    Maximum image size: 41 cm x 23 cm
    Gamma: 2.20
    DPMS levels: Off
    RGB color display
    Default (sRGB) color space is primary color space
    First detailed timing is the preferred timing
  Color Characteristics:
    Red  : 0.6308, 0.3466
    Green: 0.3085, 0.5830
    Blue : 0.1503, 0.0878
    White: 0.3134, 0.3291
  Established Timings I & II:
    IBM     :   720x400    70.081663 Hz   9:5     31.467 kHz     28.320000 MHz
    DMT 0x04:   640x480    59.940476 Hz   4:3     31.469 kHz     25.175000 MHz
    DMT 0x05:   640x480    72.808802 Hz   4:3     37.861 kHz     31.500000 MHz
    DMT 0x06:   640x480    75.000000 Hz   4:3     37.500 kHz     31.500000 MHz
    DMT 0x08:   800x600    56.250000 Hz   4:3     35.156 kHz     36.000000 MHz
    DMT 0x09:   800x600    60.316541 Hz   4:3     37.879 kHz     40.000000 MHz
    DMT 0x0a:   800x600    72.187572 Hz   4:3     48.077 kHz     50.000000 MHz
    DMT 0x0b:   800x600    75.000000 Hz   4:3     46.875 kHz     49.500000 MHz
    DMT 0x10:  1024x768    60.003840 Hz   4:3     48.363 kHz     65.000000 MHz
    DMT 0x11:  1024x768    70.069359 Hz   4:3     56.476 kHz     75.000000 MHz
    DMT 0x12:  1024x768    75.028582 Hz   4:3     60.023 kHz     78.750000 MHz
  Standard Timings:
    DMT 0x55:  1280x720    60.000000 Hz  16:9     45.000 kHz     74.250000 MHz
    GTF     :  1152x864    60.000000 Hz   4:3     53.700 kHz     81.624000 MHz
    DMT 0x24:  1280x1024   75.024675 Hz   5:4     79.976 kHz    135.000000 MHz
    DMT 0x20:  1280x960    60.000000 Hz   4:3     60.000 kHz    108.000000 MHz
  Detailed Timing Descriptors:
    DTD 1:  1366x768    59.465094 Hz 683:384   47.275 kHz     85.000000 MHz (304 mm x 228 mm)
                 Hfront   64 Hsync 112 Hback  256 Hpol P
                 Vfront    3 Vsync   6 Vback   18 Vpol N
    DTD 2:  1280x768    67.494066 Hz   5:3     53.320 kHz     68.250000 MHz (477 mm x 268 mm)
                 Hfront   48 Hsync  32 Hback  -80 Hpol P
                 Vfront    3 Vsync   7 Vback   12 Vpol N
                   a9 1a 00 00 50 00 16 30 30 20 37 00 dd 0c 11 00 00 1a '....P..00 7.......'
    Display Range Limits:
      Monitor ranges (GTF): 56-75 Hz V, 30-81 kHz H, max dotclock 140 MHz
    Display Product Name: 'Casper'
Checksum: 0x5a

----------------

Block 1, Unknown EDID Extension Block 0x00:
  00 ff ff ff ff ff ff 00 4c 23 19 32 03 00 00 00 '........L#.2....'
  17 19 01 03 80 29 17 78 2e b1 a5 a1 58 4f 95 26 '.....).x....XO.&'
  16 50 54 af ce 00 81 c0 71 40 81 8f 81 40 01 01 '.PT.....q@...@..'
  01 01 01 01 01 01 34 21 56 b0 51 00 1b 30 40 70 '......4!V.Q..0@p'
  36 00 30 e4 10 00 00 1a a9 1a 00 00 50 00 16 30 '6.0.........P..0'
  30 20 37 00 dd 0c 11 00 00 1a 00 00 00 fd 00 38 '0 7............8'
  4b 1e 51 0e 00 0a 20 20 20 20 20 20 00 00 00 fc 'K.Q...      ....'
  00 43 61 73 70 65 72 0a 20 20 20 20 20 20 00 5a '.Casper.      .Z'
Checksum: 0x5a

----------------

Warnings:

Block 0, Base EDID:
  Detailed Timing Descriptor #1: Image size is 304x228 mm, but based on the picture AR it should be 304x170 mm.
  Detailed Timing Descriptor #2: Image size is 477x268 mm, but based on the picture AR it should be 477x286 mm.

Failures:

Block 0, Base EDID:
  Basic Display Parameters & Features: sRGB is signaled, but the chromaticities do not match.
  Detailed Timing Descriptor #2: 0 values in the video timing:
    Horizontal Active/Blanking 1280/0
    Horizontal Frontporch/Sync Width 48/32
    Vertical Active/Blanking 768/22
    Vertical Frontporch/Sync Width 3/7
  Detailed Timing Descriptor #2: 0 or negative horizontal back porch.
  Detailed Timing Descriptor #2: Mismatch of image size 477x268 mm vs display size 410x230 mm.
Block 1, Base EDID:
  Unknown Extension Block.
EDID:
  Base EDID: The DTD max image size is 477x268mm, which is larger than the display size 410.0x230.0mm.
  Base EDID: EDID specified 0 extension block(s), but found 1 extension block(s).

EDID conformity: FAIL
