edid-decode (hex):

00 ff ff ff ff ff ff 00 49 75 07 05 00 00 00 00
00 1f 01 04 c5 6e 3e 78 3a 3e 21 a4 55 50 9a 26
0e 50 54 ad cf 00 71 4f 81 40 81 80 81 00 95 00
b3 00 d1 c0 81 c0 08 e8 00 30 f2 70 5a 80 b0 58
8a 00 20 c2 31 00 00 1e 02 3a 80 18 71 38 2d 40
58 2c 45 00 20 c2 31 00 00 1e 00 00 00 fd 00 18
4b 0f 87 3c 00 0a 20 20 20 20 20 20 00 00 00 fc
00 31 30 30 30 31 32 35 38 35 0a 20 20 20 01 16

02 03 48 73 4e 61 5f 5d 66 64 62 90 22 20 04 3e
3c 02 01 23 09 07 07 83 01 00 00 e2 00 cf e3 05
c0 00 e3 06 0d 01 e1 0f 01 01 01 01 01 01 01 01
01 01 01 01 01 01 01 01 01 01 01 01 01 01 01 01
01 01 01 01 01 01 01 81 02 3a 80 18 71 38 2d 40
58 2c 45 00 20 c2 31 00 00 1e 04 74 00 30 f2 70
5a 80 b0 58 8a 00 20 c2 31 00 00 1e 66 21 50 b0
51 00 1b 30 40 70 36 00 20 c2 31 00 00 1e 00 f3

00 ff ff ff ff ff ff 00 49 75 07 05 00 00 00 00
00 1f 01 04 c5 6e 3e 78 3a 3e 21 a4 55 50 9a 26
0e 50 54 ad cf 00 71 4f 81 40 81 80 81 00 95 00
b3 00 d1 c0 81 c0 08 e8 00 30 f2 70 5a 80 b0 58
8a 00 20 c2 31 00 00 1e 02 3a 80 18 71 38 2d 40
58 2c 45 00 20 c2 31 00 00 1e 00 00 00 fd 00 18
4b 0f 87 3c 00 0a 20 20 20 20 20 20 00 00 00 fc
00 31 30 30 30 31 32 35 38 35 0a 20 20 20 01 16

02 03 48 73 4e 61 5f 5d 66 64 62 90 22 20 04 3e
3c 02 01 23 09 07 07 83 01 00 00 e2 00 cf e3 05
c0 00 e3 06 0d 01 e1 0f 01 01 01 01 01 01 01 01
01 01 01 01 01 01 01 01 01 01 01 01 01 01 01 01
01 01 01 01 01 01 01 81 02 3a 80 18 71 38 2d 40
58 2c 45 00 20 c2 31 00 00 1e 04 74 00 30 f2 70
5a 80 b0 58 8a 00 20 c2 31 00 00 1e 66 21 50 b0
51 00 1b 30 40 70 36 00 20 c2 31 00 00 1e 00 f3

----------------

Block 0, Base EDID:
  EDID Structure Version & Revision: 1.4
  Vendor & Product Identification:
    Manufacturer: RKU
    Model: 1287
    Made in: 2021
  Basic Display Parameters & Features:
    Digital display
    Bits per primary color channel: 12
    DisplayPort interface
    Maximum image size: 110 cm x 62 cm
    Gamma: 2.20
    DPMS levels: Off
    Supported color formats: RGB 4:4:4, YCrCb 4:4:4, YCrCb 4:2:2
    First detailed timing includes the native pixel format and preferred refresh rate
  Color Characteristics:
    Red  : 0.6406, 0.3349
    Green: 0.3154, 0.6035
    Blue : 0.1484, 0.0566
    White: 0.3125, 0.3291
  Established Timings I & II:
    IBM     :   720x400    70.081663 Hz   9:5     31.467 kHz     28.320000 MHz
    DMT 0x04:   640x480    59.940476 Hz   4:3     31.469 kHz     25.175000 MHz
    DMT 0x05:   640x480    72.808802 Hz   4:3     37.861 kHz     31.500000 MHz
    DMT 0x06:   640x480    75.000000 Hz   4:3     37.500 kHz     31.500000 MHz
    DMT 0x09:   800x600    60.316541 Hz   4:3     37.879 kHz     40.000000 MHz
    DMT 0x0a:   800x600    72.187572 Hz   4:3     48.077 kHz     50.000000 MHz
    DMT 0x0b:   800x600    75.000000 Hz   4:3     46.875 kHz     49.500000 MHz
    DMT 0x10:  1024x768    60.003840 Hz   4:3     48.363 kHz     65.000000 MHz
    DMT 0x11:  1024x768    70.069359 Hz   4:3     56.476 kHz     75.000000 MHz
    DMT 0x12:  1024x768    75.028582 Hz   4:3     60.023 kHz     78.750000 MHz
    DMT 0x24:  1280x1024   75.024675 Hz   5:4     79.976 kHz    135.000000 MHz
  Standard Timings:
    DMT 0x15:  1152x864    75.000000 Hz   4:3     67.500 kHz    108.000000 MHz
    DMT 0x20:  1280x960    60.000000 Hz   4:3     60.000 kHz    108.000000 MHz
    DMT 0x23:  1280x1024   60.019740 Hz   5:4     63.981 kHz    108.000000 MHz
    DMT 0x1c:  1280x800    59.810326 Hz  16:10    49.702 kHz     83.500000 MHz
    DMT 0x2f:  1440x900    59.887445 Hz  16:10    55.935 kHz    106.500000 MHz
    DMT 0x3a:  1680x1050   59.954250 Hz  16:10    65.290 kHz    146.250000 MHz
    DMT 0x52:  1920x1080   60.000000 Hz  16:9     67.500 kHz    148.500000 MHz
    DMT 0x55:  1280x720    60.000000 Hz  16:9     45.000 kHz     74.250000 MHz
  Detailed Timing Descriptors:
    DTD 1:  3840x2160   60.000000 Hz  16:9    135.000 kHz    594.000000 MHz (800 mm x 450 mm)
                 Hfront  176 Hsync  88 Hback  296 Hpol P
                 Vfront    8 Vsync  10 Vback   72 Vpol P
    DTD 2:  1920x1080   60.000000 Hz  16:9     67.500 kHz    148.500000 MHz (800 mm x 450 mm)
                 Hfront   88 Hsync  44 Hback  148 Hpol P
                 Vfront    4 Vsync   5 Vback   36 Vpol P
    Display Range Limits:
      Monitor ranges (GTF): 24-75 Hz V, 15-135 kHz H, max dotclock 600 MHz
    Display Product Name: '100012585'
  Extension blocks: 1
Checksum: 0x16

----------------

Block 1, CTA-861 Extension Block:
  Revision: 3
  Basic audio support
  Supports YCbCr 4:4:4
  Supports YCbCr 4:2:2
  Native DTDs: 3
  Video Data Block:
    VIC  97:  3840x2160   60.000000 Hz  16:9    135.000 kHz    594.000000 MHz
    VIC  95:  3840x2160   30.000000 Hz  16:9     67.500 kHz    297.000000 MHz
    VIC  93:  3840x2160   24.000000 Hz  16:9     54.000 kHz    297.000000 MHz
    VIC 102:  4096x2160   60.000000 Hz 256:135  135.000 kHz    594.000000 MHz
    VIC 100:  4096x2160   30.000000 Hz 256:135   67.500 kHz    297.000000 MHz
    VIC  98:  4096x2160   24.000000 Hz 256:135   54.000 kHz    297.000000 MHz
    VIC  16:  1920x1080   60.000000 Hz  16:9     67.500 kHz    148.500000 MHz (native)
    VIC  34:  1920x1080   30.000000 Hz  16:9     33.750 kHz     74.250000 MHz
    VIC  32:  1920x1080   24.000000 Hz  16:9     27.000 kHz     74.250000 MHz
    VIC   4:  1280x720    60.000000 Hz  16:9     45.000 kHz     74.250000 MHz
    VIC  62:  1280x720    30.000000 Hz  16:9     22.500 kHz     74.250000 MHz
    VIC  60:  1280x720    24.000000 Hz  16:9     18.000 kHz     59.400000 MHz
    VIC   2:   720x480    59.940060 Hz   4:3     31.469 kHz     27.000000 MHz
    VIC   1:   640x480    59.940476 Hz   4:3     31.469 kHz     25.175000 MHz
  Audio Data Block:
    Linear PCM:
      Max channels: 2
      Supported sample rates (kHz): 48 44.1 32
      Supported sample sizes (bits): 24 20 16
  Speaker Allocation Data Block:
    FL/FR - Front Left/Right
  Video Capability Data Block:
    YCbCr quantization: Selectable (via AVI YQ)
    RGB quantization: Selectable (via AVI Q)
    PT scan behavior: No Data
    IT scan behavior: Supports both over- and underscan
    CE scan behavior: Supports both over- and underscan
  Colorimetry Data Block:
    BT2020YCC
    BT2020RGB
  HDR Static Metadata Data Block:
    Electro optical transfer functions:
      Traditional gamma - SDR luminance range
      SMPTE ST2084
      Hybrid Log-Gamma
    Supported static metadata descriptors:
      Static metadata type 1
  YCbCr 4:2:0 Capability Map Data Block:
    All VDB SVDs
  Unknown CTA-861 Data Block (tag 0x00, length 1):
    01                                              '.'
  Unknown CTA-861 Data Block (tag 0x00, length 1):
    01                                              '.'
  Unknown CTA-861 Data Block (tag 0x00, length 1):
    01                                              '.'
  Unknown CTA-861 Data Block (tag 0x00, length 1):
    01                                              '.'
  Unknown CTA-861 Data Block (tag 0x00, length 1):
    01                                              '.'
  Unknown CTA-861 Data Block (tag 0x00, length 1):
    01                                              '.'
  Unknown CTA-861 Data Block (tag 0x00, length 1):
    01                                              '.'
  Unknown CTA-861 Data Block (tag 0x00, length 1):
    01                                              '.'
  Unknown CTA-861 Data Block (tag 0x00, length 1):
    01                                              '.'
  Unknown CTA-861 Data Block (tag 0x00, length 1):
    01                                              '.'
  Unknown CTA-861 Data Block (tag 0x00, length 1):
    01                                              '.'
  Unknown CTA-861 Data Block (tag 0x00, length 1):
    01                                              '.'
  Unknown CTA-861 Data Block (tag 0x00, length 1):
    01                                              '.'
  Unknown CTA-861 Data Block (tag 0x00, length 1):
    01                                              '.'
  Unknown CTA-861 Data Block (tag 0x00, length 1):
    01                                              '.'
  Unknown CTA-861 Data Block (tag 0x00, length 1):
    81                                              '.'
  Detailed Timing Descriptors:
    DTD 3:  1920x1080   60.000000 Hz  16:9     67.500 kHz    148.500000 MHz (800 mm x 450 mm)
                 Hfront   88 Hsync  44 Hback  148 Hpol P
                 Vfront    4 Vsync   5 Vback   36 Vpol P
    DTD 4:  3840x2160   30.000000 Hz  16:9     67.500 kHz    297.000000 MHz (800 mm x 450 mm)
                 Hfront  176 Hsync  88 Hback  296 Hpol P
                 Vfront    8 Vsync  10 Vback   72 Vpol P
    DTD 5:  1360x768    60.015162 Hz  85:48    47.712 kHz     85.500000 MHz (800 mm x 450 mm)
                 Hfront   64 Hsync 112 Hback  256 Hpol P
                 Vfront    3 Vsync   6 Vback   18 Vpol P
Checksum: 0xf3  Unused space in Extension Block: 1 byte

----------------

Warnings:

Block 0, Base EDID:
  Display Range Limits: GTF support is deprecated in EDID 1.4.
Block 1, CTA-861 Extension Block:
  IT Video Formats are overscanned by default, but normally this should be underscanned.
  Colorimetry Data Block: Set the sRGB colorimetry bit to avoid interop issues.
  Unknown CTA-861 Data Block (tag 0x00, length 1).
  Unknown CTA-861 Data Block (tag 0x00, length 1).
  Unknown CTA-861 Data Block (tag 0x00, length 1).
  Unknown CTA-861 Data Block (tag 0x00, length 1).
  Unknown CTA-861 Data Block (tag 0x00, length 1).
  Unknown CTA-861 Data Block (tag 0x00, length 1).
  Unknown CTA-861 Data Block (tag 0x00, length 1).
  Unknown CTA-861 Data Block (tag 0x00, length 1).
  Unknown CTA-861 Data Block (tag 0x00, length 1).
  Unknown CTA-861 Data Block (tag 0x00, length 1).
  Unknown CTA-861 Data Block (tag 0x00, length 1).
  Unknown CTA-861 Data Block (tag 0x00, length 1).
  Unknown CTA-861 Data Block (tag 0x00, length 1).
  Unknown CTA-861 Data Block (tag 0x00, length 1).
  Unknown CTA-861 Data Block (tag 0x00, length 1).
  Unknown CTA-861 Data Block (tag 0x00, length 1).

Failures:

Block 0, Base EDID:
  Detailed Timing Descriptor #1: Mismatch of image size 800x450 mm vs display size 1100x620 mm.
  Detailed Timing Descriptor #2: Mismatch of image size 800x450 mm vs display size 1100x620 mm.
  Display Range Limits: GTF is supported, but the display does not support continuous frequencies.
Block 1, CTA-861 Extension Block:
  Detailed Timing Descriptor #3: Mismatch of image size 800x450 mm vs display size 1100x620 mm.
  Detailed Timing Descriptor #4: Mismatch of image size 800x450 mm vs display size 1100x620 mm.
  Detailed Timing Descriptor #5: Mismatch of image size 800x450 mm vs display size 1100x620 mm.
EDID:
  Extension Block 2 started with EDID header, ignoring Extension Blocks >= 2.
  CTA-861: Native progressive timings are a mix of several resolutions.

EDID conformity: FAIL
