edid-decode (hex):

00 ff ff ff ff ff ff 00 38 a3 d3 61 01 01 01 01
10 0d 01 03 0c 25 1b 78 ea 96 98 a3 53 47 99 24
10 48 4c ff ff 80 31 59 45 59 61 59 71 59 81 59
81 99 a9 4f d1 40 86 3d 00 c0 51 00 30 40 40 a0
13 00 64 0b 11 00 00 1e 00 00 00 fd 00 37 a0 1f
60 18 00 0a 20 20 20 20 20 20 00 00 00 fc 00 4d
75 6c 74 69 53 79 6e 63 20 39 37 46 00 00 00 ff
00 33 34 35 37 34 37 34 59 41 0a 20 20 20 00 38

----------------

Block 0, Base EDID:
  EDID Structure Version & Revision: 1.3
  Vendor & Product Identification:
    Manufacturer: NEC
    Model: 25043
    Serial Number: ...
    Made in: week 16 of 2003
  Basic Display Parameters & Features:
    Analog display
    Signal Level Standard: 0.700 : 0.300 : 1.000 V p-p
    Blank level equals black level
    Sync: Separate Composite
    Maximum image size: 37 cm x 27 cm
    Gamma: 2.20
    DPMS levels: Standby Suspend Off
    RGB color display
    First detailed timing is the preferred timing
  Color Characteristics:
    Red  : 0.6386, 0.3251
    Green: 0.2783, 0.5996
    Blue : 0.1425, 0.0634
    White: 0.2832, 0.2968
  Established Timings I & II:
    IBM     :   720x400    70.081663 Hz   9:5     31.467 kHz     28.320000 MHz
    IBM     :   720x400    87.849542 Hz   9:5     39.444 kHz     35.500000 MHz
    DMT 0x04:   640x480    59.940476 Hz   4:3     31.469 kHz     25.175000 MHz
    Apple   :   640x480    66.666667 Hz   4:3     35.000 kHz     30.240000 MHz
    DMT 0x05:   640x480    72.808802 Hz   4:3     37.861 kHz     31.500000 MHz
    DMT 0x06:   640x480    75.000000 Hz   4:3     37.500 kHz     31.500000 MHz
    DMT 0x08:   800x600    56.250000 Hz   4:3     35.156 kHz     36.000000 MHz
    DMT 0x09:   800x600    60.316541 Hz   4:3     37.879 kHz     40.000000 MHz
    DMT 0x0a:   800x600    72.187572 Hz   4:3     48.077 kHz     50.000000 MHz
    DMT 0x0b:   800x600    75.000000 Hz   4:3     46.875 kHz     49.500000 MHz
    Apple   :   832x624    74.551266 Hz   4:3     49.726 kHz     57.284000 MHz
    DMT 0x0f:  1024x768i   86.957532 Hz   4:3     35.522 kHz     44.900000 MHz
    DMT 0x10:  1024x768    60.003840 Hz   4:3     48.363 kHz     65.000000 MHz
    DMT 0x11:  1024x768    70.069359 Hz   4:3     56.476 kHz     75.000000 MHz
    DMT 0x12:  1024x768    75.028582 Hz   4:3     60.023 kHz     78.750000 MHz
    DMT 0x24:  1280x1024   75.024675 Hz   5:4     79.976 kHz    135.000000 MHz
    Apple   :  1152x870    75.061550 Hz 192:145   68.681 kHz    100.000000 MHz
  Standard Timings:
    DMT 0x07:   640x480    85.008312 Hz   4:3     43.269 kHz     36.000000 MHz
    DMT 0x0c:   800x600    85.061274 Hz   4:3     53.674 kHz     56.250000 MHz
    DMT 0x13:  1024x768    84.996690 Hz   4:3     68.677 kHz     94.500000 MHz
    GTF     :  1152x864    84.999687 Hz   4:3     77.095 kHz    119.651000 MHz
    DMT 0x21:  1280x960    85.002473 Hz   4:3     85.938 kHz    148.500000 MHz
    DMT 0x25:  1280x1024   85.024098 Hz   5:4     91.146 kHz    157.500000 MHz
    DMT 0x36:  1600x1200   75.000000 Hz   4:3     93.750 kHz    202.500000 MHz
    DMT 0x49:  1920x1440   60.000000 Hz   4:3     90.000 kHz    234.000000 MHz
  Detailed Timing Descriptors:
    DTD 1:  1280x1024   85.024098 Hz   5:4     91.146 kHz    157.500000 MHz (356 mm x 267 mm)
                 Hfront   64 Hsync 160 Hback  224 Hpol P
                 Vfront    1 Vsync   3 Vback   44 Vpol P
    Display Range Limits:
      Monitor ranges (GTF): 55-160 Hz V, 31-96 kHz H, max dotclock 240 MHz
    Display Product Name: 'MultiSync 97F'
    Display Product Serial Number: ...
Checksum: 0x38

----------------

Warnings:

Block 0, Base EDID:
  Vendor & Product Identification: The serial number is one of the known dummy values, it should probably be set to 0.
  Detailed Timing Descriptor #1: Image size is 356x267 mm, but based on the picture AR it should be 333x267 mm.

EDID conformity: PASS
