edid-decode (hex):

00 ff ff ff ff ff ff 00 5c 23 55 10 00 00 00 00
0b 1f 01 04 a5 23 13 78 02 ef 05 a3 54 3b 9f 2b
17 50 54 a5 4b 80 d1 c0 81 c0 81 00 81 80 a9 40
b3 00 01 01 01 01 4d d0 00 a0 f0 70 3e 80 30 20
35 00 5a c2 10 00 00 1a 00 00 00 fd 00 3b 4c 1e
87 3c 00 0a 20 20 20 20 20 20 00 00 00 fc 00 43
69 6e 74 69 71 20 50 72 6f 20 31 36 00 00 00 ff
00 31 43 51 30 30 37 31 30 30 30 31 35 36 01 c5

02 03 18 c0 44 e1 10 04 01 23 09 07 07 66 03 0c
00 10 00 00 83 01 00 00 08 e8 00 30 f2 70 5a 80
b0 58 8a 00 5a c2 10 00 00 1e 56 5e 00 a0 a0 a0
29 50 30 20 35 00 5a c2 10 00 00 1a 00 00 00 00
00 00 00 00 00 00 00 00 00 00 00 00 00 00 00 00
00 00 00 00 00 00 00 00 00 00 00 00 00 00 00 00
00 00 00 00 00 00 00 00 00 00 00 00 00 00 00 00
00 00 00 00 00 00 00 00 00 00 00 00 00 00 00 96

00 ff ff ff ff ff ff 00 5c 23 55 10 00 00 00 00
0b 1f 01 04 a5 23 13 78 02 ef 05 a3 54 3b 9f 2b
17 50 54 a5 4b 80 d1 c0 81 c0 81 00 81 80 a9 40
b3 00 01 01 01 01 4d d0 00 a0 f0 70 3e 80 30 20
35 00 5a c2 10 00 00 1a 00 00 00 fd 00 3b 4c 1e
87 3c 00 0a 20 20 20 20 20 20 00 00 00 fc 00 43
69 6e 74 69 71 20 50 72 6f 20 31 36 00 00 00 ff
00 31 43 51 30 30 37 31 30 30 30 31 35 36 01 c5

02 03 18 c0 44 e1 10 04 01 23 09 07 07 66 03 0c
00 10 00 00 83 01 00 00 08 e8 00 30 f2 70 5a 80
b0 58 8a 00 5a c2 10 00 00 1e 56 5e 00 a0 a0 a0
29 50 30 20 35 00 5a c2 10 00 00 1a 00 00 00 00
00 00 00 00 00 00 00 00 00 00 00 00 00 00 00 00
00 00 00 00 00 00 00 00 00 00 00 00 00 00 00 00
00 00 00 00 00 00 00 00 00 00 00 00 00 00 00 00
00 00 00 00 00 00 00 00 00 00 00 00 00 00 00 96

----------------

Block 0, Base EDID:
  EDID Structure Version & Revision: 1.4
  Vendor & Product Identification:
    Manufacturer: WAC
    Model: 4181
    Made in: week 11 of 2021
  Basic Display Parameters & Features:
    Digital display
    Bits per primary color channel: 8
    DisplayPort interface
    Maximum image size: 35 cm x 19 cm
    Gamma: 2.20
    Supported color formats: RGB 4:4:4
    First detailed timing includes the native pixel format and preferred refresh rate
  Color Characteristics:
    Red  : 0.6396, 0.3300
    Green: 0.2333, 0.6240
    Blue : 0.1679, 0.0898
    White: 0.3134, 0.3291
  Established Timings I & II:
    IBM     :   720x400    70.081663 Hz   9:5     31.467 kHz     28.320000 MHz
    DMT 0x04:   640x480    59.940476 Hz   4:3     31.469 kHz     25.175000 MHz
    DMT 0x06:   640x480    75.000000 Hz   4:3     37.500 kHz     31.500000 MHz
    DMT 0x09:   800x600    60.316541 Hz   4:3     37.879 kHz     40.000000 MHz
    DMT 0x0b:   800x600    75.000000 Hz   4:3     46.875 kHz     49.500000 MHz
    DMT 0x10:  1024x768    60.003840 Hz   4:3     48.363 kHz     65.000000 MHz
    DMT 0x12:  1024x768    75.028582 Hz   4:3     60.023 kHz     78.750000 MHz
    DMT 0x24:  1280x1024   75.024675 Hz   5:4     79.976 kHz    135.000000 MHz
    Apple   :  1152x870    75.061550 Hz 192:145   68.681 kHz    100.000000 MHz
  Standard Timings:
    DMT 0x52:  1920x1080   60.000000 Hz  16:9     67.500 kHz    148.500000 MHz
    DMT 0x55:  1280x720    60.000000 Hz  16:9     45.000 kHz     74.250000 MHz
    DMT 0x1c:  1280x800    59.810326 Hz  16:10    49.702 kHz     83.500000 MHz
    DMT 0x23:  1280x1024   60.019740 Hz   5:4     63.981 kHz    108.000000 MHz
    DMT 0x33:  1600x1200   60.000000 Hz   4:3     75.000 kHz    162.000000 MHz
    DMT 0x3a:  1680x1050   59.954250 Hz  16:10    65.290 kHz    146.250000 MHz
  Detailed Timing Descriptors:
    DTD 1:  3840x2160   59.996625 Hz  16:9    133.312 kHz    533.250000 MHz (346 mm x 194 mm)
                 Hfront   48 Hsync  32 Hback   80 Hpol P
                 Vfront    3 Vsync   5 Vback   54 Vpol N
    Display Range Limits:
      Monitor ranges (GTF): 59-76 Hz V, 30-135 kHz H, max dotclock 600 MHz
    Display Product Name: 'Cintiq Pro 16'
    Display Product Serial Number: ...
  Extension blocks: 1
Checksum: 0xc5

----------------

Block 1, CTA-861 Extension Block:
  Revision: 3
  Underscans IT Video Formats by default
  Basic audio support
  Native DTDs: 0
  Video Data Block:
    Unknown (VIC 225)
    VIC  16:  1920x1080   60.000000 Hz  16:9     67.500 kHz    148.500000 MHz
    VIC   4:  1280x720    60.000000 Hz  16:9     45.000 kHz     74.250000 MHz
    VIC   1:   640x480    59.940476 Hz   4:3     31.469 kHz     25.175000 MHz
  Audio Data Block:
    Linear PCM:
      Max channels: 2
      Supported sample rates (kHz): 48 44.1 32
      Supported sample sizes (bits): 24 20 16
  Vendor-Specific Data Block (HDMI), OUI 00-0C-03:
    Source physical address: 1.0.0.0
  Speaker Allocation Data Block:
    FL/FR - Front Left/Right
  Detailed Timing Descriptors:
    DTD 2:  3840x2160   60.000000 Hz  16:9    135.000 kHz    594.000000 MHz (346 mm x 194 mm)
                 Hfront  176 Hsync  88 Hback  296 Hpol P
                 Vfront    8 Vsync  10 Vback   72 Vpol P
    DTD 3:  2560x1440   59.950550 Hz  16:9     88.787 kHz    241.500000 MHz (346 mm x 194 mm)
                 Hfront   48 Hsync  32 Hback   80 Hpol P
                 Vfront    3 Vsync   5 Vback   33 Vpol N
Checksum: 0x96  Unused space in Extension Block: 67 bytes

----------------

Warnings:

Block 0, Base EDID:
  Display Range Limits: GTF support is deprecated in EDID 1.4.
Block 1, CTA-861 Extension Block:
  Video Data Block: VIC 16 and the first DTD are not identical. Is this intended?
  Detailed Timing Descriptor #2: DTD is identical to VIC 97, which is not present in the CTA Ext Block.
  Add a Colorimetry Data Block with the sRGB colorimetry bit set to avoid interop issues.
EDID:
  CTA-861: DTD pixelclock indicates HDMI 2.x support, VICs indicate HDMI 1.x.

Failures:

Block 0, Base EDID:
  Display Range Limits: GTF is supported, but the display does not support continuous frequencies.
Block 1, CTA-861 Extension Block:
  Video Data Block: Unknown VIC 225.
  Vendor-Specific Data Block (HDMI), OUI 00-0C-03: The HDMI Specification requires EDID 1.3 instead of 1.4.
  Missing VCDB, needed for Set Selectable RGB Quantization to avoid interop issues.
EDID:
  Extension Block 2 started with EDID header, ignoring Extension Blocks >= 2.

EDID conformity: FAIL
