edid-decode (hex):

00 ff ff ff ff ff ff 00 30 e4 90 01 00 00 00 00
00 12 01 03 80 1e 13 78 0a 1e 35 94 59 54 8a 28
23 50 54 00 00 00 01 01 01 01 01 01 01 01 01 01
01 01 01 01 01 01 12 1b 00 7e 50 20 16 30 30 20
36 00 30 be 10 00 00 18 00 00 00 00 00 00 00 00
00 00 00 00 00 00 00 00 00 00 00 00 00 fe 00 4c
47 20 44 69 73 70 6c 61 79 0a 20 20 00 00 00 fc
00 4c 50 31 34 31 57 58 35 2d 54 4c 43 31 00 da

00 ff ff ff ff ff ff 00 30 e4 90 01 00 00 00 00
00 12 01 03 80 1e 13 78 0a 1e 35 94 59 54 8a 28
23 50 54 00 00 00 01 01 01 01 01 01 01 01 01 01
01 01 01 01 01 01 12 1b 00 7e 50 20 16 30 30 20
36 00 30 be 10 00 00 18 00 00 00 00 00 00 00 00
00 00 00 00 00 00 00 00 00 00 00 00 00 fe 00 4c
47 20 44 69 73 70 6c 61 79 0a 20 20 00 00 00 fc
00 4c 50 31 34 31 57 58 35 2d 54 4c 43 31 00 da

----------------

Block 0, Base EDID:
  EDID Structure Version & Revision: 1.3
  Vendor & Product Identification:
    Manufacturer: LGD
    Model: 400
    Made in: 2008
  Basic Display Parameters & Features:
    Digital display
    Maximum image size: 30 cm x 19 cm
    Gamma: 2.20
    RGB color display
    First detailed timing is the preferred timing
  Color Characteristics:
    Red  : 0.5781, 0.3486
    Green: 0.3310, 0.5410
    Blue : 0.1562, 0.1396
    White: 0.3134, 0.3291
  Established Timings I & II: none
  Standard Timings: none
  Detailed Timing Descriptors:
    DTD 1:  1280x800    59.961998 Hz  16:10    49.289 kHz     69.300000 MHz (304 mm x 190 mm)
                 Hfront   48 Hsync  32 Hback   46 Hpol N
                 Vfront    3 Vsync   6 Vback   13 Vpol N
    Empty Descriptor
    Alphanumeric Data String: 'LG Display'
    Display Product Name: 'LP141WX5-TLC1'
Checksum: 0xda

----------------

Failures:

Block 0, Base EDID:
  Empty Descriptor: Use Dummy Descriptor instead of all zeroes.
  Missing Display Range Limits Descriptor.
EDID:
  Extension Block 1 started with EDID header, ignoring Extension Blocks >= 1.

EDID conformity: FAIL
