edid-decode (hex):

00 ff ff ff ff ff ff 00 22 64 f1 03 69 26 00 00
06 17 01 03 80 16 0d 78 0a 28 e5 94 57 52 8e 28
19 50 54 00 00 00 01 01 01 01 01 01 01 01 01 01
01 01 01 01 01 01 12 1b 56 5a 50 00 19 30 0e 2e
23 00 df 7d 00 00 00 19 00 00 00 fe 00 00 00 00
00 00 00 00 00 00 00 00 00 00 00 00 00 fc 00 48
53 44 31 30 31 50 48 57 31 41 0a 20 00 00 00 10
00 0a 20 20 20 20 20 20 20 20 20 20 20 20 00 10

00 ff ff ff ff ff ff 00 22 64 f1 03 69 26 00 00
06 17 01 03 80 16 0d 78 0a 28 e5 94 57 52 8e 28
19 50 54 00 00 00 01 01 01 01 01 01 01 01 01 01
01 01 01 01 01 01 12 1b 56 5a 50 00 19 30 0e 2e
23 00 df 7d 00 00 00 19 00 00 00 fe 00 00 00 00
00 00 00 00 00 00 00 00 00 00 00 00 00 fc 00 48
53 44 31 30 31 50 48 57 31 41 0a 20 00 00 00 10
00 0a 20 20 20 20 20 20 20 20 20 20 20 20 00 10

----------------

Block 0, Base EDID:
  EDID Structure Version & Revision: 1.3
  Vendor & Product Identification:
    Manufacturer: HSD
    Model: 1009
    Serial Number: ...
    Made in: week 6 of 2013
  Basic Display Parameters & Features:
    Digital display
    Maximum image size: 22 cm x 13 cm
    Gamma: 2.20
    RGB color display
    First detailed timing is the preferred timing
  Color Characteristics:
    Red  : 0.5781, 0.3417
    Green: 0.3222, 0.5546
    Blue : 0.1591, 0.0996
    White: 0.3134, 0.3291
  Established Timings I & II: none
  Standard Timings: none
  Detailed Timing Descriptors:
    DTD 1:  1366x768    60.020371 Hz 683:384   47.596 kHz     69.300000 MHz (223 mm x 125 mm)
                 Hfront   14 Hsync  46 Hback   30 Hpol N
                 Vfront    2 Vsync   3 Vback   20 Vpol N
    Alphanumeric Data String: ''
    Display Product Name: 'HSD101PHW1A'
    Dummy Descriptor:
Checksum: 0x10

----------------

Block 1, Unknown EDID Extension Block 0x00:
  00 ff ff ff ff ff ff 00 22 64 f1 03 69 26 00 00 '........"d..i&..'
  06 17 01 03 80 16 0d 78 0a 28 e5 94 57 52 8e 28 '.......x.(..WR.('
  19 50 54 00 00 00 01 01 01 01 01 01 01 01 01 01 '.PT.............'
  01 01 01 01 01 01 12 1b 56 5a 50 00 19 30 0e 2e '........VZP..0..'
  23 00 df 7d 00 00 00 19 00 00 00 fe 00 00 00 00 '#..}............'
  00 00 00 00 00 00 00 00 00 00 00 00 00 fc 00 48 '...............H'
  53 44 31 30 31 50 48 57 31 41 0a 20 00 00 00 10 'SD101PHW1A. ....'
  00 0a 20 20 20 20 20 20 20 20 20 20 20 20 00 10 '..            ..'
Checksum: 0x10

----------------

Failures:

Block 0, Base EDID:
  Alphanumeric Data String: NUL byte at position 0.
  Dummy Descriptor: Dummy block filled with garbage.
  Missing Display Range Limits Descriptor.
Block 1, Base EDID:
  Unknown Extension Block.
EDID:
  Base EDID: EDID specified 0 extension block(s), but found 1 extension block(s).

EDID conformity: FAIL
