edid-decode (hex):

00 ff ff ff ff ff ff 00 09 e5 82 0c 00 00 00 00
24 21 01 04 a5 22 13 78 02 02 45 94 5c 58 92 29
21 50 54 00 00 00 01 01 01 01 01 01 01 01 01 01
01 01 01 01 01 01 c7 1d 56 e2 50 00 1e 30 30 20
35 00 58 c2 10 00 00 1a 00 00 00 00 00 00 00 00
00 00 00 00 00 00 00 00 00 00 00 00 00 fe 00 42
4f 45 20 43 51 0a 20 20 20 20 20 20 00 00 00 fe
00 4e 54 31 35 36 57 48 4d 2d 4e 34 34 0a 00 e3

00 ff ff ff ff ff ff 00 09 e5 82 0c 00 00 00 00
24 21 01 04 a5 22 13 78 02 02 45 94 5c 58 92 29
21 50 54 00 00 00 01 01 01 01 01 01 01 01 01 01
01 01 01 01 01 01 c7 1d 56 e2 50 00 1e 30 30 20
35 00 58 c2 10 00 00 1a 00 00 00 00 00 00 00 00
00 00 00 00 00 00 00 00 00 00 00 00 00 fe 00 42
4f 45 20 43 51 0a 20 20 20 20 20 20 00 00 00 fe
00 4e 54 31 35 36 57 48 4d 2d 4e 34 34 0a 00 e3

----------------

Block 0, Base EDID:
  EDID Structure Version & Revision: 1.4
  Vendor & Product Identification:
    Manufacturer: BOE
    Model: 3202
    Made in: week 36 of 2023
  Basic Display Parameters & Features:
    Digital display
    Bits per primary color channel: 8
    DisplayPort interface
    Maximum image size: 34 cm x 19 cm
    Gamma: 2.20
    Supported color formats: RGB 4:4:4
    First detailed timing includes the native pixel format and preferred refresh rate
  Color Characteristics:
    Red  : 0.5781, 0.3593
    Green: 0.3437, 0.5722
    Blue : 0.1611, 0.1289
    White: 0.3134, 0.3291
  Established Timings I & II: none
  Standard Timings: none
  Detailed Timing Descriptors:
    DTD 1:  1366x768    60.003967 Hz 683:384   47.883 kHz     76.230000 MHz (344 mm x 194 mm)
                 Hfront   48 Hsync  32 Hback  146 Hpol P
                 Vfront    3 Vsync   5 Vback   22 Vpol N
    Empty Descriptor
    Alphanumeric Data String: 'BOE CQ'
    Alphanumeric Data String: 'NT156WHM-N44'
Checksum: 0xe3

----------------

Warnings:

Block 0, Base EDID:
  Missing Display Product Name.

Failures:

Block 0, Base EDID:
  Empty Descriptor: Use Dummy Descriptor instead of all zeroes.
EDID:
  Extension Block 1 started with EDID header, ignoring Extension Blocks >= 1.

EDID conformity: FAIL
