edid-decode (hex):

00 ff ff ff ff ff ff 00 06 b3 a0 28 01 01 01 01
04 1f 01 04 b5 3e 22 78 3b 69 95 ad 52 46 a1 27
0f 50 54 bf cf 00 81 40 81 80 95 00 71 4f 81 c0
b3 00 d1 c0 01 01 4d d0 00 a0 f0 70 3e 80 30 20
35 00 6d 55 21 00 00 1a 00 00 00 fd 0c 30 90 55
55 8a 01 0a 20 20 20 20 20 20 00 00 00 fc 00 56
47 32 38 55 51 4c 31 41 0a 20 20 20 00 00 00 ff
00 53 32 4c 4d 54 46 30 38 37 34 32 36 0a 02 b3

02 03 3c f1 50 04 13 1f 10 0e 0f 1d 1e 3f 47 5d
5e 5f 60 61 76 23 09 07 07 83 01 00 00 65 03 0c
00 10 00 6d 1a 00 00 02 01 30 90 00 00 00 00 00
00 e3 05 c0 00 e6 06 05 01 60 60 12 6f c2 00 a0
a0 a0 55 50 30 20 35 00 6d 55 21 00 00 1a 14 ec
00 a0 a0 a0 67 50 20 30 35 00 6d 55 21 00 00 1a
36 6c 80 a0 70 70 3e 80 30 20 08 0c 6d 55 21 00
00 1a 00 00 00 00 00 00 00 00 00 00 00 00 00 ff

70 12 79 00 00 03 01 3c 7f f3 01 84 ff 0e 9f 00
6f 80 1f 00 6f 08 3b 00 31 00 04 00 a4 81 01 06
ff 0e 9f 00 6f 80 1f 00 3f 06 71 00 64 00 04 00
e7 61 01 04 ff 0e 9f 00 6f 80 1f 00 6f 08 68 00
60 00 04 00 00 00 00 00 00 00 00 00 00 00 00 00
00 00 00 00 00 00 00 00 00 00 00 00 00 00 00 00
00 00 00 00 00 00 00 00 00 00 00 00 00 00 00 00
00 00 00 00 00 00 00 00 00 00 00 00 00 00 4f 90

00 ff ff ff ff ff ff 00 06 b3 a0 28 01 01 01 01
04 1f 01 04 b5 3e 22 78 3b 69 95 ad 52 46 a1 27
0f 50 54 bf cf 00 81 40 81 80 95 00 71 4f 81 c0
b3 00 d1 c0 01 01 4d d0 00 a0 f0 70 3e 80 30 20
35 00 6d 55 21 00 00 1a 00 00 00 fd 0c 30 90 55
55 8a 01 0a 20 20 20 20 20 20 00 00 00 fc 00 56
47 32 38 55 51 4c 31 41 0a 20 20 20 00 00 00 ff
00 53 32 4c 4d 54 46 30 38 37 34 32 36 0a 02 b3

02 03 3c f1 50 04 13 1f 10 0e 0f 1d 1e 3f 47 5d
5e 5f 60 61 76 23 09 07 07 83 01 00 00 65 03 0c
00 10 00 6d 1a 00 00 02 01 30 90 00 00 00 00 00
00 e3 05 c0 00 e6 06 05 01 60 60 12 6f c2 00 a0
a0 a0 55 50 30 20 35 00 6d 55 21 00 00 1a 14 ec
00 a0 a0 a0 67 50 20 30 35 00 6d 55 21 00 00 1a
36 6c 80 a0 70 70 3e 80 30 20 08 0c 6d 55 21 00
00 1a 00 00 00 00 00 00 00 00 00 00 00 00 00 ff

70 12 79 00 00 03 01 3c 7f f3 01 84 ff 0e 9f 00
6f 80 1f 00 6f 08 3b 00 31 00 04 00 a4 81 01 06
ff 0e 9f 00 6f 80 1f 00 3f 06 71 00 64 00 04 00
e7 61 01 04 ff 0e 9f 00 6f 80 1f 00 6f 08 68 00
60 00 04 00 00 00 00 00 00 00 00 00 00 00 00 00
00 00 00 00 00 00 00 00 00 00 00 00 00 00 00 00
00 00 00 00 00 00 00 00 00 00 00 00 00 00 00 00
00 00 00 00 00 00 00 00 00 00 00 00 00 00 4f 90

----------------

Block 0, Base EDID:
  EDID Structure Version & Revision: 1.4
  Vendor & Product Identification:
    Manufacturer: AUS
    Model: 10400
    Serial Number: ...
    Made in: week 4 of 2021
  Basic Display Parameters & Features:
    Digital display
    Bits per primary color channel: 10
    DisplayPort interface
    Maximum image size: 62 cm x 34 cm
    Gamma: 2.20
    DPMS levels: Off
    Supported color formats: RGB 4:4:4, YCrCb 4:4:4, YCrCb 4:2:2
    First detailed timing includes the native pixel format and preferred refresh rate
    Display supports continuous frequencies
  Color Characteristics:
    Red  : 0.6767, 0.3222
    Green: 0.2753, 0.6298
    Blue : 0.1542, 0.0595
    White: 0.3134, 0.3291
  Established Timings I & II:
    IBM     :   720x400    70.081663 Hz   9:5     31.467 kHz     28.320000 MHz
    DMT 0x04:   640x480    59.940476 Hz   4:3     31.469 kHz     25.175000 MHz
    Apple   :   640x480    66.666667 Hz   4:3     35.000 kHz     30.240000 MHz
    DMT 0x05:   640x480    72.808802 Hz   4:3     37.861 kHz     31.500000 MHz
    DMT 0x06:   640x480    75.000000 Hz   4:3     37.500 kHz     31.500000 MHz
    DMT 0x08:   800x600    56.250000 Hz   4:3     35.156 kHz     36.000000 MHz
    DMT 0x09:   800x600    60.316541 Hz   4:3     37.879 kHz     40.000000 MHz
    DMT 0x0a:   800x600    72.187572 Hz   4:3     48.077 kHz     50.000000 MHz
    DMT 0x0b:   800x600    75.000000 Hz   4:3     46.875 kHz     49.500000 MHz
    DMT 0x10:  1024x768    60.003840 Hz   4:3     48.363 kHz     65.000000 MHz
    DMT 0x11:  1024x768    70.069359 Hz   4:3     56.476 kHz     75.000000 MHz
    DMT 0x12:  1024x768    75.028582 Hz   4:3     60.023 kHz     78.750000 MHz
    DMT 0x24:  1280x1024   75.024675 Hz   5:4     79.976 kHz    135.000000 MHz
  Standard Timings:
    DMT 0x20:  1280x960    60.000000 Hz   4:3     60.000 kHz    108.000000 MHz
    DMT 0x23:  1280x1024   60.019740 Hz   5:4     63.981 kHz    108.000000 MHz
    DMT 0x2f:  1440x900    59.887445 Hz  16:10    55.935 kHz    106.500000 MHz
    DMT 0x15:  1152x864    75.000000 Hz   4:3     67.500 kHz    108.000000 MHz
    DMT 0x55:  1280x720    60.000000 Hz  16:9     45.000 kHz     74.250000 MHz
    DMT 0x3a:  1680x1050   59.954250 Hz  16:10    65.290 kHz    146.250000 MHz
    DMT 0x52:  1920x1080   60.000000 Hz  16:9     67.500 kHz    148.500000 MHz
  Detailed Timing Descriptors:
    DTD 1:  3840x2160   59.996625 Hz  16:9    133.312 kHz    533.250000 MHz (621 mm x 341 mm)
                 Hfront   48 Hsync  32 Hback   80 Hpol P
                 Vfront    3 Vsync   5 Vback   54 Vpol N
    Display Range Limits:
      Monitor ranges (Range Limits Only): 48-144 Hz V, 340-340 kHz H, max dotclock 1380 MHz
    Display Product Name: 'VG28UQL1A'
    Display Product Serial Number: ...
  Extension blocks: 2
Checksum: 0xb3

----------------

Block 1, CTA-861 Extension Block:
  Revision: 3
  Underscans IT Video Formats by default
  Basic audio support
  Supports YCbCr 4:4:4
  Supports YCbCr 4:2:2
  Native DTDs: 1
  Video Data Block:
    VIC   4:  1280x720    60.000000 Hz  16:9     45.000 kHz     74.250000 MHz
    VIC  19:  1280x720    50.000000 Hz  16:9     37.500 kHz     74.250000 MHz
    VIC  31:  1920x1080   50.000000 Hz  16:9     56.250 kHz    148.500000 MHz
    VIC  16:  1920x1080   60.000000 Hz  16:9     67.500 kHz    148.500000 MHz
    VIC  14:  1440x480    59.940060 Hz   4:3     31.469 kHz     54.000000 MHz
    VIC  15:  1440x480    59.940060 Hz  16:9     31.469 kHz     54.000000 MHz
    VIC  29:  1440x576    50.000000 Hz   4:3     31.250 kHz     54.000000 MHz
    VIC  30:  1440x576    50.000000 Hz  16:9     31.250 kHz     54.000000 MHz
    VIC  63:  1920x1080  120.000000 Hz  16:9    135.000 kHz    297.000000 MHz
    VIC  71:  1280x720   120.000000 Hz  64:27    90.000 kHz    148.500000 MHz
    VIC  93:  3840x2160   24.000000 Hz  16:9     54.000 kHz    297.000000 MHz
    VIC  94:  3840x2160   25.000000 Hz  16:9     56.250 kHz    297.000000 MHz
    VIC  95:  3840x2160   30.000000 Hz  16:9     67.500 kHz    297.000000 MHz
    VIC  96:  3840x2160   50.000000 Hz  16:9    112.500 kHz    594.000000 MHz
    VIC  97:  3840x2160   60.000000 Hz  16:9    135.000 kHz    594.000000 MHz
    VIC 118:  3840x2160  120.000000 Hz  16:9    270.000 kHz   1188.000000 MHz
  Audio Data Block:
    Linear PCM:
      Max channels: 2
      Supported sample rates (kHz): 48 44.1 32
      Supported sample sizes (bits): 24 20 16
  Speaker Allocation Data Block:
    FL/FR - Front Left/Right
  Vendor-Specific Data Block (HDMI), OUI 00-0C-03:
    Source physical address: 1.0.0.0
  Vendor-Specific Data Block (AMD), OUI 00-00-1A:
    Version: 2
    Flags 1: 0x01
      FreeSync Supported
    Minimum Refresh Rate: 48 Hz
    Maximum Refresh Rate: 144 Hz
    Flags 5: 0x00
  Colorimetry Data Block:
    BT2020YCC
    BT2020RGB
  HDR Static Metadata Data Block:
    Electro optical transfer functions:
      Traditional gamma - SDR luminance range
      SMPTE ST2084
    Supported static metadata descriptors:
      Static metadata type 1
    Desired content max luminance: 96 (400.000 cd/m^2)
    Desired content max frame-average luminance: 96 (400.000 cd/m^2)
    Desired content min luminance: 18 (0.020 cd/m^2)
  Detailed Timing Descriptors:
    DTD 2:  2560x1440  119.997589 Hz  16:9    182.996 kHz    497.750000 MHz (621 mm x 341 mm)
                 Hfront   48 Hsync  32 Hback   80 Hpol P
                 Vfront    3 Vsync   5 Vback   77 Vpol N
    DTD 3:  2560x1440  143.999466 Hz  16:9    222.191 kHz    604.360000 MHz (621 mm x 341 mm)
                 Hfront   32 Hsync  48 Hback   80 Hpol P
                 Vfront    3 Vsync   5 Vback   95 Vpol N
    DTD 4:  1920x2160   59.938205 Hz   8:9    133.183 kHz    277.020000 MHz (621 mm x 341 mm)
                 Hfront   48 Hsync  32 Hback   80 Hpol P
                 Vfront   48 Vsync   8 Vback    6 Vpol N
Checksum: 0xff  Unused space in Extension Block: 13 bytes

----------------

Block 2, DisplayID Extension Block:
  Version: 1.2
  Extension Count: 0
  Display Product Type: Extension Section
  Video Timing Modes Type 1 - Detailed Timings Data Block:
    DTD:  3840x2160  144.000000 Hz  16:9    319.680 kHz   1278.720000 MHz (aspect 16:9, no 3D stereo, preferred)
               Hfront  112 Hsync  32 Hback   16 Hpol P
               Vfront   50 Vsync   5 Vback    5 Vpol N
    DTD:  3840x1600  143.997958 Hz  64:27   246.812 kHz    987.250000 MHz (aspect 64:27, no 3D stereo)
               Hfront  112 Hsync  32 Hback   16 Hpol P
               Vfront  101 Vsync   5 Vback    8 Vpol N
    DTD:  3840x2160  100.000000 Hz  16:9    226.500 kHz    906.000000 MHz (aspect 16:9, no 3D stereo)
               Hfront  112 Hsync  32 Hback   16 Hpol P
               Vfront   97 Vsync   5 Vback    3 Vpol N
  Checksum: 0x4f
Checksum: 0x90

----------------

Warnings:

Block 0, Base EDID:
  Vendor & Product Identification: The serial number is one of the known dummy values, it should probably be set to 0.
Block 1, CTA-861 Extension Block:
  Video Data Block: VIC 4 and the first DTD are not identical. Is this intended?
  Colorimetry Data Block: Set the sRGB colorimetry bit to avoid interop issues.
  Detailed Timing Descriptor #4: Image size is 621x341 mm, but based on the picture AR it should be 303x341 mm.
  Display Product Serial Number is set, so the Serial Number in the Base EDID should be 0.
EDID:
  Base EDID: Some timings are out of range of the Monitor Ranges:
    Vertical Freq: 24.000 - 144.000 Hz (Monitor: 48.000 - 144.000 Hz)
    Horizontal Freq: 31.250 - 319.680 kHz (Monitor: 340.000 - 340.000 kHz)

Failures:

Block 1, CTA-861 Extension Block:
  Vendor-Specific Data Block (HDMI), OUI 00-0C-03: The HDMI Specification requires EDID 1.3 instead of 1.4.
  Missing VCDB, needed for Set Selectable RGB Quantization to avoid interop issues.
Block 2, DisplayID Extension Block:
  DisplayID Base Block has no product type.
EDID:
  Extension Block 3 started with EDID header, ignoring Extension Blocks >= 3.

EDID conformity: FAIL
