edid-decode (hex):

00 ff ff ff ff ff ff 00 22 64 5b 02 80 00 00 00
2f 0c 01 01 08 1e 17 78 ea a1 d6 95 59 4b 94 24
17 4c 52 bf ee 00 61 59 61 4f 61 4a 61 40 45 59
45 4f 31 59 31 40 64 19 00 40 41 00 26 30 18 88
36 00 2c e6 10 00 00 18 00 00 00 fc 00 48 61 6e
6e 53 74 61 72 20 58 35 30 30 00 00 00 ff 00 32
34 37 41 46 30 34 4b 42 30 31 32 38 d6 09 80 a0
20 5e 63 10 10 60 52 08 2c e6 10 00 00 1a 00 b9

00 ff ff ff ff ff ff 00 22 64 5b 02 80 00 00 00
2f 0c 01 01 08 1e 17 78 ea a1 d6 95 59 4b 94 24
17 4c 52 bf ee 00 61 59 61 4f 61 4a 61 40 45 59
45 4f 31 59 31 40 64 19 00 40 41 00 26 30 18 88
36 00 2c e6 10 00 00 18 00 00 00 fc 00 48 61 6e
6e 53 74 61 72 20 58 35 30 30 00 00 00 ff 00 32
34 37 41 46 30 34 4b 42 30 31 32 38 d6 09 80 a0
20 5e 63 10 10 60 52 08 2c e6 10 00 00 1a 00 b9

----------------

Block 0, Base EDID:
  EDID Structure Version & Revision: 1.1
  Vendor & Product Identification:
    Manufacturer: HSD
    Model: 603
    Serial Number: ...
    Made in: week 47 of 2002
  Basic Display Parameters & Features:
    Analog display
    Signal Level Standard: 0.700 : 0.300 : 1.000 V p-p
    Blank level equals black level
    Sync: Separate
    Maximum image size: 30 cm x 23 cm
    Gamma: 2.20
    DPMS levels: Standby Suspend Off
    RGB color display
    First detailed timing is the preferred timing
  Color Characteristics:
    Red  : 0.5839, 0.3496
    Green: 0.2929, 0.5791
    Blue : 0.1435, 0.0908
    White: 0.2978, 0.3222
  Established Timings I & II:
    IBM     :   720x400    70.081663 Hz   9:5     31.467 kHz     28.320000 MHz
    DMT 0x04:   640x480    59.940476 Hz   4:3     31.469 kHz     25.175000 MHz
    Apple   :   640x480    66.666667 Hz   4:3     35.000 kHz     30.240000 MHz
    DMT 0x05:   640x480    72.808802 Hz   4:3     37.861 kHz     31.500000 MHz
    DMT 0x06:   640x480    75.000000 Hz   4:3     37.500 kHz     31.500000 MHz
    DMT 0x08:   800x600    56.250000 Hz   4:3     35.156 kHz     36.000000 MHz
    DMT 0x09:   800x600    60.316541 Hz   4:3     37.879 kHz     40.000000 MHz
    DMT 0x0a:   800x600    72.187572 Hz   4:3     48.077 kHz     50.000000 MHz
    DMT 0x0b:   800x600    75.000000 Hz   4:3     46.875 kHz     49.500000 MHz
    Apple   :   832x624    74.551266 Hz   4:3     49.726 kHz     57.284000 MHz
    DMT 0x10:  1024x768    60.003840 Hz   4:3     48.363 kHz     65.000000 MHz
    DMT 0x11:  1024x768    70.069359 Hz   4:3     56.476 kHz     75.000000 MHz
    DMT 0x12:  1024x768    75.028582 Hz   4:3     60.023 kHz     78.750000 MHz
  Standard Timings:
    DMT 0x13:  1024x768    84.996690 Hz   4:3     68.677 kHz     94.500000 MHz
    DMT 0x12:  1024x768    75.028582 Hz   4:3     60.023 kHz     78.750000 MHz
    DMT 0x11:  1024x768    70.069359 Hz   4:3     56.476 kHz     75.000000 MHz
    DMT 0x10:  1024x768    60.003840 Hz   4:3     48.363 kHz     65.000000 MHz
    DMT 0x0c:   800x600    85.061274 Hz   4:3     53.674 kHz     56.250000 MHz
    DMT 0x0b:   800x600    75.000000 Hz   4:3     46.875 kHz     49.500000 MHz
    DMT 0x07:   640x480    85.008312 Hz   4:3     43.269 kHz     36.000000 MHz
    DMT 0x04:   640x480    59.940476 Hz   4:3     31.469 kHz     25.175000 MHz
  Detailed Timing Descriptors:
    DTD 1:  1024x768    60.003840 Hz   4:3     48.363 kHz     65.000000 MHz (300 mm x 230 mm)
                 Hfront   24 Hsync 136 Hback  160 Hpol N
                 Vfront    3 Vsync   6 Vback   29 Vpol N
    Display Product Name: 'HannStar X500'
    Display Product Serial Number: ...
    DTD 2:   640x350    70.100223 Hz  64:35    31.475 kHz     25.180000 MHz (300 mm x 230 mm)
                 Hfront   16 Hsync  96 Hback   48 Hpol P
                 Vfront   37 Vsync   2 Vback   60 Vpol N
Checksum: 0xb9

----------------

Warnings:

Block 0, Base EDID:
  EDID Structure Version & Revision: EDID 1.1 is deprecated, do not use.
  Detailed Timing Descriptor #2: Image size is 300x230 mm, but based on the picture AR it should be 300x164 mm.

Failures:

Block 0, Base EDID:
  Detailed Timing Descriptor #2: Invalid detailed timing descriptor ordering.
EDID:
  Extension Block 1 started with EDID header, ignoring Extension Blocks >= 1.

EDID conformity: FAIL
